diario,fecha,titulo noticia,contenido,link
Clarín,2025-04-26,La sorpresa del dólar flotante avala el principal objetivo del Gobierno,"Una catarata de definiciones caracterizan el arranque del nuevo esquema aplicado para el dólar de la mano de un amplio respaldo a la gestión  de Javier Milei por parte del gobierno de los Estados Unidos y del Fondo Monetario Internacional.
La primera sorpresa llegó con los US$ 12.000 millones del desembolso inicial del préstamo del FMI que puso al ministroLuis Caputoy al presidente del Banco Central,Santiago Bausili, en una situación de fortaleza efectiva frente a un mercado que esperaba un salto del tipo de cambio que no sucedió.
El dólar mayorista de $1.180 se ubicaba el viernes más cerca del piso de la banda ($ 1.000) que del techo de los $ 1.400 y sin la intervención del Banco Central.
Ese dólar estaba solo 4,4% por encima de los $ 1.130 (oficial más blend) del fin del esquema decrawling peganterior cuando el tipo de cambio oficial crecía a razón de 1% mensual.
Sin salto cambiario de consideración, y sin compra de dólares por parte del Banco Central, el Gobierno festeja porque cree que en el arranque del nuevo esquema elefecto sobre los precios, a diferencia de lo que dicen estar viviendo los consumidores, será moderado.
Entre las definiciones destacadas de los últimos días sigue resonando la delPresidente Javier Mileireferida a que el Banco Central no comprará divisashasta que el dólar cueste $1.000 o menos.
Esa premisa choca con lameta de aumento de reservasque le exige el FMI de US$ 3.700 millones hasta junio, US$ 4.100 millones adicionales hasta septiembre y de US$ 6.900 millones en el último trimestre del año.
Según una versión que trascendió de una reunión organizada por el JP Morgan en Washington y frente a unos 500 representantes de la banca internacional, el ministroCaputo habría relativizado el grado de exigenciapara el cumplimiento de la primera meta de acumulación de reservas acordada con el Fondo.
Sea como fuere, tanto los marcados elogios de la titular del organismo (Kristalina Georgievajugó políticamente al pedir que en octubre""que no descarrile la voluntad de cambio""aunque al día siguiente salió a aclarar que""las elecciones son para los argentinos, no para nosotros"") y más aún el fuerte apoyo del Secretario del Tesoro de los EE:UU, Scott Bessent generan un paraguas financieramente sólido del que los mercados tomaron nota.
La suba de los bonos y la baja de la tasa de riesgo país (en 692 puntos el nivel más bajo desde comienzos de marzo) apuntalan la posibilidad deque el Gobierno pueda lograr estabilizar al tipo de cambio aún manteniendo la decisión presidencial de no intervenirdentro de la banda $1.000/$1.400.
La apuesta oficial es a que en mayo, cuando lasliquidaciones de las exportaciones de soja y maíz son 40% mayores al del resto de los meses, aparezcan dólares suficientes para apuntalar el deseo del Presidente de que el   dólar baje de los $1.000.
""Estamos saliendo del tipo de cambio como ancla nominal pero la pregunta escómo se adaptará la gente a eso""dijo Santiago Bausili en otra reunión en Washington organizada por el FMI.
Por lo que se vio hasta ahora ""la gente"" apunta a un tipo de cambio 18/20% mayor al piso de la banda (MEP de $ 1.187, contado con liquidación $ 1.200) y con ese nivel un interrogante clave es cuán acelerado resultará el traslado a los precios suponiendo que el dólar se estabilice en ese nivel.
El 40% de amplitud de la ""banda"" y el compromiso el ""techo"" suba 1% y el ""piso"" baje también 1% cada mes constituye un elemento nuevo en el marco de un mercado caracterizado por el elevado grado de dolarización de los jugadores.
También ante el círculo cerrado de la charla con los clientes del JP Morgan, Bausili habría ratificado que el Gobierno decidió no luchar contra el carácter bimonetario de la Argentina caracterizado por destinar los dólares al ahorro y los pesos a los gastos cotidianos, sino todo lo contrario.
Tanto el ministro como el presidente del Central insisten con su idea de trasfondo que más cerca que lejos, y ante la escasez de pesos, los argentinos deberán optar por sacar los dólares del colchón (Bausili estima que hay unosUS$ 170.000 millones) para poder vivir.
Editor Jefe y columnista de Economía.dfcanedo@clarin.com
Newsletter Clarín
Recibí en tu email todas las noticias, coberturas, historias y análisis de la mano de nuestros periodistas especializados",https://www.clarin.com/economia/sorpresa-dolar-flotante-avala-principal-objetivo-gobierno_0_8h1ZGH48gI.html
Clarín,2025-04-26,Caputo en Washington: clima de fiesta en el FMI y cauteloso entusiasmo de los inversionistas,"No hubo champán, pero sí chocolatines con el logo azul del Fondo Monetario Internacional que se repartieron en un clima de festejo en el salón del inmenso edificio vidriado del organismo en Washington: era la primera vez que el ministro Luis Caputose encontraba cara a cara con Kristalina Georgievadesde que vio la luz el trabajoso acuerdo el 11 de abril y la sensación de la reunión el miércoles era que ya estaba todo dicho y que lo único que tenía sentido era celebrar tras haber sellado el nuevo programa.
“Espectacular”,dijo Caputo exultante tras el encuentro, con cálidos elogios a la jefa del Fondo, con quien tiene gran sintonía.Y así fue el clima en la delegación argentina durante toda la Asamblea de Primavera,que se extendió por varios días hasta este sábado en Washington, que los funcionarios partieron de regreso a Buenos Aires.
La propia Georgieva dio un enorme protagonismoa la Argentina, a la que la calificó públicamente de “ejemplo” por su firme política de ajuste macroeconómico que le permite crecer (proyectaron 5,5% para este año) y estar más protegida ante las turbulencias globales.
Y además, como sólo se veía en los inicios del gobierno de Mauricio Macri, en la Asamblea se organizaron varios paneles con funcionarios argentinos que colmaron los auditorios para contar la experiencia del país. Se presentaron en distintos eventos el secretario de Finanzas Pablo Quirno, el presidente del Banco Central Santiago Bausili y el ministro de Desregulación y Transformación del Estado Federico Sturzenegger.
Muchos querían escuchar de primera mano el modelo del presidente Javier Milei.Georgieva se colocó orgullosa el pin de una motosierra en la solapa de su saco verde (obsequio de Sturzenegger) y hastallegó a recomendar a la audiencia comprar pesos. Este sábado por la mañana, Caputo cerró su visita en una conferencia ante los ministros de América y la propia Georgieva, en un discurso en el queexplicó cómo poner “la casa en orden”.
El interés también se palpó en hoteles cercanos al edificio del Fondo, donde importantes bancos de inversión comoJP Morgan e Itaúy centros de análisis como elInternational Institute of Finance(IIF) organizaron distintos eventos donde se habló del caso argentino. En ellos expusieron Caputo, Bausili y Vladimir Werning, vicepresidente del Banco Central.
El clima era de fiesta hasta que una declaración de Georgievacausó momentos de zozobra en el FMI. Ante una pregunta deClarín, la directora gerente dijo el jueves que era importante que “la voluntad de cambio no se descarrile” antes de las elecciones de octubre, palabras que provocaron fuerte rechazo entre la oposición argentina (con Cristina y Kicillof a la cabeza), que denunció una“intromisión electoral”del FMI.
Ante el revuelo en Buenos Aires, Georgieva salió aclarar: “Las elecciones son para los argentinos, no para nosotros. Lo que hemos aprendido de la experiencia es que muy a menudo, antes de las elecciones, los gobiernos debilitan su determinación de hacer reformas, por lo quemi mensaje fue para el Gobierno”.
No se supo si la funcionaria había tropezado sin querer con sus palabras iniciales o le salió del alma su respaldo a Milei.Pero enseguida encauzó su mensaje y la advertencia fue para el Gobierno. En definitiva, en el Fondo todos recuerdan la ""traición"" del exministro Sergio Massa, que les prometió ajuste y antes de las elecciones pasadas abrió una canilla descontrolada con el ""plan Platita"".

En el ambiente de negocios convocado en Washington había expectativa.Alberto Ades,director ejecutivo de NWI Management, que asistió estos días varios de los encuentros organizados por los bancos, dijo aClarínque “el entusiasmo en las reuniones es creciente. En estas fue mayor a las de octubre, que a su vez fue mayor a las de abril del año pasado. Es porque el programa de Gobierno viene funcionando y obviamente falta menos para las elecciones de medio término y las encuestas muestran que La Libertad Avanza podría tener un buen desempeño”.
Sin embargo, señaló que“si bien el tono con Argentina es positivo, es cautamente positivo”. Apunta que el plan de Milei “genera mucho entusiasmo, porque hay un cambio muy dramático en la política fiscal, monetaria, de reforma, apertura, etc.Lo que genera cautela es el tema político, particularmente si crecerá la representación de La Libertad Avanza en el Congresopara poder hacer las reformas estructuralesque todos consideran indispensables para que este nuevo ciclo se sostenga, en especial unareforma impositiva, laboral y de pensiones”.
“La gente está cautamente optimista y entusiasmada, pero yo creo que, con la historia que tiene Argentina, con los vaivenes que hemos tenido, con los sucesivos defaults,va a llevar un tiempo para que los inversores se sientan realmente cómodos con Argentina”,advirtió.
ParaJavier Timerman,managing partner de AdCap, que también participó de varias reuniones de bancos, “el programa y la apertura del cepo entusiasmó mucho a los inversionistas por el tema cambiario y por la voluntad del Gobierno de tener la audacia de hacerlo antes de las elecciones”, según dijo aClarín.
“Creo que recibieron más de lo que esperaban y entre los inversionistas hay cierta preocupación a mediano plazo por saber si este dólar les va a permitir al Gobierno cumplir con lasmetas de reservascon el Fondo, sobre todo en un año electoral”, agregó. Caputo buscó brindar tranquilidad y dijo que el objetivo de reservas no era un problema.
Martín Castellanoes líder del departamento de investigaciones de América latina en el Instituto of International Finance (IIF), que organizó estos días un evento con distintos invitados. En uno de los paneles, el secretario del Tesoro Scott Bessent dijo que Argentina podría recibir un préstamo especial de Estados Unidos si fuera afectada por un shock externo, un respaldo que provocó la suba de los mercados.
“Percibimos un renovado entusiasmo por Argentina”, dijo Castellano a esta corresponsal. “Claramenteel apoyo explícito y contundente del Tesoro norteamericano fue la gran novedad, ya queno tiene muchos precedentes. En la práctica, esto contribuye al manejo de la política monetaria al aumentar la oferta potencial de dólares, desalentando presiones en el mercado cambiario. Es decir que posiciona al país en mejores condiciones para enfrentar choques externos, un flanco en el cual Argentina aún se encuentra en desventaja frente a otros países de la región.”
El experto agregó: “Un tema que me sorprendió es que el manejo de la política fiscal de Argentina se está tomando como ejemplo en la discusión sobre otros países”.
“Todo el mundo parece estar obsesionado por Argentina”, dijo aClarínotro inversionista que transitó algunas de esas reuniones y que no quiso que se publicara su nombre. Sin embargo, resaltó algunas alertas: dijo que entre sus colegas escuchó alguna preocupación porque el equipo económico parece“está celebrando antes de tiempo”.
Incluso señaló que hay quien se quedó con la sensación de que“había mucha arrogancia”entre los funcionarios de Milei. Mencionaronen forma negativa los “modales” del equipo económico, como la descalificación y las peleas con economistas en las redes, como por ejemplo la que sostuvo Caputo con Hernán Lacunza. Muchos de los hombres y mujeres de negocios ya conocen al equipo económico desde la época de Macri y les notan un estilo distinto, señalan.
Algunos comentan que hay cierto malestar dentro del FMI por la forma en que Kristalina Georgieva empujó el acuerdoy creen que se jugó demasiado a favor de Milei. Una nota deBloombergpublicada el viernes señalaba que la mitad de los 24 directores ejecutivos tenían""serias dudas sobre el acuerdo""por el abultado monto de US$ 20.000 millones y el desembolso inicial de 12.000 millones y el precedente que sentaba en el organismo y que los directores se sintieron presionados para apoyarlo.
El FMI salió a decir el programa para Argentina fue aprobado por el Directorio Ejecutivo, “luego de una muy buena colaboración, mucho compromiso”.
“Entre los inversores hay consenso de que el Fondo abrió las arcas a Milei por temor a que pierda en las elecciones (y reavive al kirchnerismo)y por eso son más permisivos”, dijo la fuente. En una de las reuniones organizadas por el banco Itaú, el ex jefe del Hemisferio Occidental del FMI, Alejandro Werner, dijo que el acuerdo fue mejor de lo que esperaba, pero que le hubiese gustado que el Fondo lo forzara a tener un dólar más competitivo. “Pero con el dólar muy barato la inflación baja y eso hace que Milei gane las elecciones y que no vuelva el kirchnerismo.Por eso parece que se le perdona todo”, señaló.
En distintos vuelos comerciales, la delegación regresó el sábado a Buenos Aires y dejó atrás en Washington el clima celebratorio, aunque con cautela de los inversionistas, para enfrentarse a la pelea económica de todos los días.
Periodista, corresponsal en Estados Unidos.plugones@clarin.com
Newsletter Clarín
Recibí en tu email todas las noticias, coberturas, historias y análisis de la mano de nuestros periodistas especializados",https://www.clarin.com/economia/caputo-washington-clima-fiesta-fmi-cauteloso-entusiasmo-inversionistas_0_CfjVy9XqZi.html
Clarín,2025-04-26,Déficit cambiario: se fueron US$ 11.656 millones en 10 meses y marzo fue récord,"Desde junio del año pasado, el balance cambiario del Banco Central arroja resultados negativos, acumulando en10 meses un déficit de cuenta corriente de US$ 11.656 millones.Con dos agregados: en marzo 2025 se sumó al déficit la balanza comercial (exportaciones menos importaciones) con un “rojo” de US$ 456 millones yel déficit de la cuenta corriente de marzo (US$ 1.674 millones) fue el más elevado de esta gestión, de acuerdo a los movimientos cambiarios informados por el BCRA..
En marzo, los pagos de importaciones sumaron US$ 5.752 millones y los cobros de exportaciones fueron de US$ 5.296 millones. Por segunda vez en la actual gestión,el resultado del comercio exterior de bienes fue negativoen esos US$ 456 millones. En diciembre 2024 había sido negativo en US$ 39 millones.
La cuenta “Servicios” registró un déficit de US$ 799 millones en marzo, muy superior al de marzo de 2024 (US$ 111 millones). Ese déficit se explicó por los egresos netos en concepto de“Viajes, pasajes y otros pagos con tarjeta” (US$ 698 millones),de “Otros servicios” ( US$ 181 millones) y de “Fletes y seguros” por US$ 134 millones, parcialmente compensados por los ingresos netos en concepto de “Servicios empresariales profesionales y técnicos” por US$ 214 millones.
Por otro lado, la intervención del Banco Central para “controlar” la brecha cambiaria entre el oficial y el dólar MEP fue de US$ 202 millones en marzo.
Si se suma que en marzo la cuenta financiera cambiaria del Gobierno General y BCRA fue deficitaria en US$ 1.053 millones, se explica la fuerte pérdida de reservas del mes: disminuyeron US$ 3.131 millones en marzo.
En los primeros tres meses de este año, el comercio exterior dejó un saldo positivo de US$ 838 millones, pero los servicios insumieron US$ 3.024 millones, los intereses otros US$ 1.974 millones y hubo giro de utilidades por US$ 38 millones.
Los pagos de intereses entre enero y marzo fueron: al FMI (US$ 593 millones), al resto de los organismos internacionales (US$ 513 millones), cancelaciones de deuda pública (US$ 506 millones) y sectores privados pagaron US$ 850 millones. Hubo ingresos por US$ 488 millones.
La cuenta viajes, pasajes y pagos con tarjeta arrojó egresos en el primer trimestre por US$ 3.706 millonescompensados parcialmente por ingresos por US$ 956 millones, quedando undéficit de US$ 2.750 millones.
Esta permanente pérdida de reservas era ya notable cuando, a principios de abril, el acuerdo con FMI introdujo una modificación cambiaria pasando a un esquema de flotación con bandas móviles, eliminación del dólar blend y las restricciones cambiarias a las personas humanas, y se flexibilizaron tanto la distribución de utilidades a accionistas del exterior a partir de los ejercicios financieros que comienzan en 2025 como los plazos para el pago de operaciones de comercio exterior.
Si bien el acuerdo con el FMI reforzó las reservas del Banco Central,el desequilibrio externo hasta podría acentuarsepor la mayor apreciación del peso y su contrapartida, elencarecimiento en dólares de la producción interna.Como señala la Consultora LCG, “la entrada de capitales para financiar déficits de comercio externo no suele durar mucho”.
Redactor de la sección Economíaibermudez@clarin.com
Newsletter Clarín
Recibí en tu email todas las noticias, coberturas, historias y análisis de la mano de nuestros periodistas especializados",https://www.clarin.com/economia/balance-cambiario-marzo-deficit-llego-1674-millones-mayor-gestion-milei_0_Ws9DPZznBg.html
Clarín,2025-04-26,Dólar CCL hoy: a cuánto cotiza este sábado 26 de abril,"La cotización deldólar CCLes de$1190para la compra y de$1202,10para la venta, este sábado 26 de abril de 2025.
El dólar CCL sube2%respecto al mismo día de la semana anterior.
En lo que va de abril de 2025, el dólar CCL baja respecto al mes anterior: la diferencia es de8%.
En comparación con el año pasado, el dólar CCL sube un11%. A esta altura del año anterior, el CCL cotizaba a$1075.8.
El valor deldólar CCLtiene una diferencia con eldólar MEP. Mientras que el primero está$1190, el MEP cotiza hoy a$1184,50, lo que marca una brecha de0%.
Eldólar CCL o dólar contado con liquidaciónes uno de los tipos de cambio financieros más usados en el país, junto con el dólar MEP (o dólar bolsa). Se trata de una herramienta financiera que permite cambiar pesos por dólares en el exterior. Muchas empresas e inversionistas usan este método para adquirir divisas y sacarlas del país legalmente.
Eldólar CCL o dólar contado con liquidaciónconsiste en la compra de un bono en pesos (AL30) o en dólares (AL30D) para venderlo en especie C (AL30C). Mediante estas 2 simples operaciones podés ingresar dinero a cuentas de inversión en Estados Unidos.
La cotización del dólar CCL funciona en el mismo horario del mercado de cotizaciones:hasta las 16:30 horas, de lunes a viernes.
Estas operaciones reciben el nombre de “operaciones de liquidación con cable”. Para identificarlas se agrega una C al final del código de negociación de la especie. Así se diferencian de aquellas que se liquidan en pesos o dólares en cuentas radicadas en el mercado local.
Newsletter Clarín
Recibí en tu email todas las noticias, coberturas, historias y análisis de la mano de nuestros periodistas especializados",https://www.clarin.com/economia/dolar-ccl-hoy-cotiza-sabado-26-abril_0_GzaxgFDSEH.html
Clarín,2025-04-26,Dólar ahorro hoy: a cuánto cotiza este sábado 26 de abril,"La cotización deldólar ahorroes de$1547para la venta este sábado 26 de abril de 2025.
El dólar ahorro sube3%respecto al mismo día de la semana anterior.
En lo que va de abril de 2025, el dólar ahorro sube respecto al mes anterior: la diferencia es de9%.
En comparación con el año pasado, el dólar ahorro sube un8%. A esta altura del año anterior, el ahorro cotizaba a$1430.4.
El valor deldólar ahorrotiene una diferencia con eldólar MEP. Mientras que el primero está$1547, el MEP cotiza hoy a$1184,50, lo que marca una brecha de31%.
Eldólar ahorroes un tipo de cambio mayor al dólar oficial, que se muestra como la opción más barata para comprar a modo de atesoramiento.
La compra deldólar ahorrohoy en Argentina se maneja bajo la siguiente cotización: el 30% del impuesto país se mantiene y el 35% del impuesto a las ganancias pasa a ser de un 45%, igualando la cotización del dólar tarjeta.
La cotización del dólar ahorro funciona en el mismo horario del mercado de cotizaciones:hasta las 16:30 horas, de lunes a viernes.
Estas operaciones reciben el nombre de “operaciones de liquidación con cable”. Para identificarlas se agrega una C al final del código de negociación de la especie. Así se diferencian de aquellas que se liquidan en pesos o dólares en cuentas radicadas en el mercado local.
Newsletter Clarín
Recibí en tu email todas las noticias, coberturas, historias y análisis de la mano de nuestros periodistas especializados",https://www.clarin.com/economia/dolar-ahorro-hoy-cotiza-sabado-26-abril_0_Ok379PEDy4.html
Clarín,2025-04-26,Dólar tarjeta hoy: a cuánto cotiza este sábado 26 de abril,"La cotización deldólar tarjetaes de$1547, este sábado 26 de abril de 2025.
El dólar tarjeta sube3%respecto al mismo día de la semana anterior.
En lo que va de abril de 2025, el dólar tarjeta sube respecto al mes anterior: la diferencia es de9%.
En comparación con el año pasado, el dólar tarjeta sube un8%. A esta altura del año anterior, el dólar tarjeta cotizaba a$1430.4.
El valor deldólar tarjetatiene una diferencia con eldólar blue. Mientras que el primero está$1547, el blue cotiza hoy a$1190, lo que marca una brecha de30%.
Eldólar tarjetaes el tipo de cambio que se emplea para el pago de consumos con tarjeta de débito y crédito en el exterior así como para la compra, también en dólares, de pasajes y paquetes turísticos hacia destinos fuera de la Argentina.
El valor deldólar tarjetase conforma de la siguiente manera: al dólar oficial se le añade un 30% de impuesto país y un 30% de ganancias. Se trata de una carga impositiva total del 60%, frente al 155% que existía en la gestión anterior.
La cotización del dólar tarjeta funciona en el mismo horario del mercado de cotizaciones:hasta las 16:30 horas, de lunes a viernes.
Newsletter Clarín
Recibí en tu email todas las noticias, coberturas, historias y análisis de la mano de nuestros periodistas especializados",https://www.clarin.com/economia/dolar-tarjeta-hoy-cotiza-sabado-26-abril_0_qBN8r77p9T.html
Clarín,2025-04-26,Dólar MEP hoy: a cuánto cotiza este sábado 26 de abril,"La cotización deldólar MEPes de$1184,50para la compra y de$1186,30para la venta, estesábado 26 de abril de 2025.
Eldólar MEPsube2%respecto al mismo día de la semana anterior.
En lo que va deabril de 2025, el dólar MEPbajarespecto al mes anterior: la diferencia es de8%.
En comparación con el año pasado, el dólar MEPsubeun15%. A esta altura del año anterior, el MEP cotizaba a$1033.6.
El valor del dólar MEP tiene una diferencia con el dólar blue. Mientras que el primero está a$1184,50, el blue cotiza hoy a$1190, lo que marca una brecha de0.46%.
Eldólar MEPes un tipo de cambio mayor al dólar oficial, que se muestra como la opción más barata para comprar a modo de atesoramiento.
El dólar MEP consiste en la compra de un bono en pesos y su venta en dólares. Este tipo de cambio se calcula a partir de la división entre el precio en pesos y la cotización en dólares.
La cotización del dólar MEP funciona en el mismo horario del mercado de cotizaciones: hasta las 16:30 horas, de lunes a viernes.
Su nombre deriva de la sigla 'MEP', que significa Mercado Electrónico de Pagos. Es una variante al dólar ahorro, ya que presenta menos restricciones como se mencionó anteriormente.
Newsletter Clarín
Recibí en tu email todas las noticias, coberturas, historias y análisis de la mano de nuestros periodistas especializados",https://www.clarin.com/economia/dolar-mep-hoy-cotiza-sabado-26-abril_0_useAq4Jkt9.html
Clarín,2025-04-26,Real hoy y real blue hoy: a cuánto cotiza y cuál es el precio de la moneda brasileña este sábado 26 de abril,"Elrealcotiza a $205,30 para lacompray a $205,58 para laventaeste sábado 26 de abril de 2025, de acuerdo con la información que proporciona el sitio del Banco Nación.
Con respecto a la divisa en el mercado paralelo, elreal blue hoytiene un precio de $199,75 para la compra y de $217,75 para la venta, una información que muchos argentinos consultan antes de viajar aBrasilpor turismo o negocios.
De este modo,la brecha entre el real blue y el real oficiales de 3%.
De acuerdo con la variación de la divisa brasileña en el mercado informal, un dólar equivale a R$5.96 reales, por lo quecon 100 dólares se pueden comprar R$595.74 reales.
El real es la moneda de curso legal deBrasildesde 1994, cuando reemplazó al cruzeiro real. Es la vigésima moneda más negociada en el mundo y la primera en Sudamérica. Su símbolo esR$y cuenta conbilletesde hasta 200 reales de denominación.
Eldólar oficialcotiza este sábado 26 de abril de 2025 a $1140 para la compra y $1190 para la venta en las entidades bancarias.
En tanto, eldólar bluese consigue a $1190 y se vende a $1210 en el mercado paralelo.
Newsletter Clarín
Recibí en tu email todas las noticias, coberturas, historias y análisis de la mano de nuestros periodistas especializados",https://www.clarin.com/economia/real-hoy-real-blue-hoy-cotiza-precio-moneda-brasilena-sabado-26-abril_0_pbSCS0zF3l.html
