diario,fecha,titulo noticia,contenido,link
Clarín,2025-03-27,Dólar cripto hoy: a cuánto cotiza este jueves 27 de marzo,"La cotización deldólar criptoes de$1312,01para la compra y de$1318para la venta, estejueves 27 de marzo.
El dólar criptosube2%respecto al mismo día de la semana anterior.
En lo que va demarzo 2025, el dólar criptosuberespecto al mes anterior: la diferencia es de7%.
En comparación con el año pasado, el dólar criptosubeun33%. A esta altura del año anterior, el dólar cripto cotizaba a$990.
El valor deldólar criptotiene una diferencia con eldólar blue. Mientras que el primero está a$1312,01, el blue cotiza hoy a$1290, lo que marca una brecha de2%.
Eldólar criptoes una cotización que se define en función de la compraventa de “stablecoins”, es decir, criptomonedas atadas a un activo estable, en este caso al dólar estadounidense.
Para operar con eldólar criptoes necesario tener una cuenta en alguna billetera virtual o una exchange. Se define su cotización en función de la compra y venta de criptomonedas ancladas al dólar estadounidense.
Newsletter Clarín
Recibí en tu email todas las noticias, coberturas, historias y análisis de la mano de nuestros periodistas especializados",https://www.clarin.com/economia/dolar-cripto-hoy-cotiza-jueves-27-marzo_0_9PY1NxLBxF.html
Clarín,2025-03-27,Dólar MEP hoy: a cuánto cotiza este jueves 27 de marzo,"La cotización deldólar MEPes de$1292,70para la compra y de$1297,20para la venta, estejueves 27 de marzo de 2025.
Eldólar MEPsube1%respecto al mismo día de la semana anterior.
En lo que va demarzo de 2025, el dólar MEPsuberespecto al mes anterior: la diferencia es de7%.
En comparación con el año pasado, el dólar MEPsubeun27%. A esta altura del año anterior, el MEP cotizaba a$1015.1.
El valor del dólar MEP tiene una diferencia con el dólar blue. Mientras que el primero está a$1292,70, el blue cotiza hoy a$1290, lo que marca una brecha de0.21%.
Eldólar MEPes un tipo de cambio mayor al dólar oficial, que se muestra como la opción más barata para comprar a modo de atesoramiento.
El dólar MEP consiste en la compra de un bono en pesos y su venta en dólares. Este tipo de cambio se calcula a partir de la división entre el precio en pesos y la cotización en dólares.
La cotización del dólar MEP funciona en el mismo horario del mercado de cotizaciones: hasta las 16:30 horas, de lunes a viernes.
Su nombre deriva de la sigla 'MEP', que significa Mercado Electrónico de Pagos. Es una variante al dólar ahorro, ya que presenta menos restricciones como se mencionó anteriormente.
Newsletter Clarín
Recibí en tu email todas las noticias, coberturas, historias y análisis de la mano de nuestros periodistas especializados",https://www.clarin.com/economia/dolar-mep-hoy-cotiza-jueves-27-marzo_0_uG71Y16zUW.html
Clarín,2025-03-27,Euro hoy: a cuánto cotiza este jueves 27 de marzo,"Eleurocotiza estejueves 27 de marzoa $1.154,22 para la compra y $1.154,54 para la venta, por lo que se mantiene estable respecto a la última cotización.
En cuanto a la divisa en el mercado paralelo, eleuro blue hoycotiza a 1391.65 para la compra y 1413.23 para la venta. De este modo, su precio sube en relación al último informado.
Con estos valores, labrechaentre el euro blue y el euro oficial​ es de 120494%.
Elvalor del euro bluetiene una diferencia sustancial más alta con el euro oficial ya que este último es el que se adquiere en los bancos y que posee una cotización establecida.
Al igual que el dólar blue, eleuro bluees el que circula en el mercado negro y suele tener un valor más alto que el oficial. Una explicación sobre su denominación señala que se llama así porque en inglés, ""blue"", además de nombrar al color azul, remite a algo ""oscuro"". De esta manera, se reconoce al cambio de la divisa por fuera del sistema cambiario.
El término euro blue se empezó a utilizar a partir del 2011, como consecuencia de lasrestriccionespara la adquisición de moneda extranjera que comenzaron a aplicar la Administración Federal de Ingresos Públicos (AFIP) y el Banco Central de la República Argentina bajo el gobierno de Cristina Fernández de Kirchner.
Estaslimitacionescobraron un nuevo impulso en diciembre de 2019, luego de los anuncios de presidente Alberto Fernández sobre la Ley de Emergencia económica y que se profundizaron a lo largo del 2020 con el cepo cambiario. Esto genera que los sectores que viajen al exterior opten por la compra de euros en elmercado negro, generando así un aumento en el precio del euro blue.
El nombre del Euro paralelo
El euro se lanzó el 1° de enero de 1999, cuando 10 países fijaron sus tipos de cambio y entregaron las decisiones sobre las tasas de interés al recién creado Banco Central Europeo. Los billetes y monedas de euro entraron en circulación tres años después.
La moneda compartida se vio como una solución a las constantes disputas por los tipos de cambio que habían marcado la política europea después de la Segunda Guerra Mundial y como una extensión lógica de la zona de libre comercio de aranceles de la Unión Europea. Gran Bretaña, en particular, optó por no participar, pero 19 de los 27 países de la UE utilizan el euro como moneda nacional. Quienes componen la zona del euro, también denominada ""eurozona"" son:AustriaBélgicaChipreEstoniaFinlandiaFranciaAlemaniaGreciaIrlandaItaliaLetoniaLituaniaLuxemburgoMaltaPaíses BajosPortugalEslovaquiaEsloveniaEspaña
Newsletter Clarín
Recibí en tu email todas las noticias, coberturas, historias y análisis de la mano de nuestros periodistas especializados",https://www.clarin.com/economia/euro-hoy-cotiza-jueves-27-marzo_0_JtPe2F4id8.html
Clarín,2025-03-27,Real hoy y real blue hoy: a cuánto cotiza y cuál es el precio de la moneda brasileña este jueves 27 de marzo,"Elrealcotiza a $186,77 para lacompray a $186,80 para laventaeste jueves 27 de marzo de 2025, de acuerdo con la información que proporciona el sitio del Banco Nación.
Con respecto a la divisa en el mercado paralelo, elreal blue hoytiene un precio de $212,75 para la compra y de $230,75 para la venta, una información que muchos argentinos consultan antes de viajar aBrasilpor turismo o negocios.
De este modo,la brecha entre el real blue y el real oficiales de 12.21%.
De acuerdo con la variación de la divisa brasileña en el mercado informal, un dólar equivale a R$6.06 reales, por lo quecon 100 dólares se pueden comprar R$606.35 reales.
El real es la moneda de curso legal deBrasildesde 1994, cuando reemplazó al cruzeiro real. Es la vigésima moneda más negociada en el mundo y la primera en Sudamérica. Su símbolo esR$y cuenta conbilletesde hasta 200 reales de denominación.
Eldólar oficialcotiza este jueves 27 de marzo de 2025 a $1051.5 para la compra y $1091.5 para la venta en las entidades bancarias.
En tanto, eldólar bluese consigue a $1290 y se vende a $1310 en el mercado paralelo.
Newsletter Clarín
Recibí en tu email todas las noticias, coberturas, historias y análisis de la mano de nuestros periodistas especializados",https://www.clarin.com/economia/real-hoy-real-blue-hoy-cotiza-precio-moneda-brasilena-jueves-27-marzo_0_IZ3Do9Arf1.html
Clarín,2025-03-27,Dólar blue hoy: a cuánto cotiza este jueves 27 de marzo,"La cotización deldólar bluees de $1290 para la compra y de $1310 para la venta, estejueves 27 de marzo de 2025.
En lo que va de marzo de 2025, el dólar blue sube respecto al mes anterior: la diferencia es de 6%.
En lo que va de este 2025, el dólar blue sube respecto al 2024: la diferencia es de 30%.
El valor del dólar blue tiene una diferencia sustancial con el dólar oficial, que se adquiere en los bancos y que posee una cotización establecida. La brecha entre el dólar oficial y el dólar blue es de 23%.
Eldólar bluees el que circula en el mercado negro y suele tener un valor más alto que el oficial. Este dólar no se compra en bancos o casas de cambio oficiales.
La cotización del dólar blue cierra junto con la del dólar oficial: a las 15 horas, de lunes a viernes.
Una explicación sobre su denominación señala que se llama así porque ""blue"", en inglés, además de nombrar al color azul, remite a algo ""oscuro"". Otra teoría lo relaciona con las operaciones de compra a través de bonos o acciones de compañías conocidas como""blue chips"". Y también se lo vincula con el color aproximado que aparece cuando se aplica un fibrón para detectar billetes falsos.
La cotización deldólar oficiales de $1051,50 para la compra y de $1091,50 para la venta, este jueves 27 de marzo de 2025, según el Banco Nación.
La cotización deldólar bolsaes de $1292,70 para la compra y de $1297,20 para la venta, este jueves 27 de marzo de 2025.
La cotización deldólar CCLes de $1338,50 para la compra y de $1297,50 para la venta, este jueves 27 de marzo de 2025.
Newsletter Clarín
Recibí en tu email todas las noticias, coberturas, historias y análisis de la mano de nuestros periodistas especializados",https://www.clarin.com/economia/dolar-blue-hoy-cotiza-jueves-27-marzo_0_7hWuE4DAon.html
Clarín,2025-03-27,Asignaciones familiares: cuáles son los nuevos montos y límites de ingresos desde abril 2025,"Luego de oficializar elaumento del 2,4% a jubilados y pensionadosjunto con el bono de $70 mil, el Gobierno anunció el mismo ajuste para las distintasasignaciones familiares, desde abril de este año. Lo hizo a través de la Resolución 186/2025 de la Administración Nacional de la Seguridad Social (ANSeS), publicada este jueves en el Boletín Oficial.
En específico, el documento estableció un ""incremento de los límites y rangos de ingresos del grupo familiar y de los montos de las asignaciones familiares previstas en la Ley N° 24.714"".
La medida fijó que los trabajadores en relación de dependencia, titulares de la prestación por desempleo, monotributistas, veteranos de guerra, jubilados y pensionados con hijos de hasta 18 años, cobrarán desde el mes próximo por asignación familiar los siguientes montos, según el ingreso del grupo familiar, teniendo en cuenta que las mismas cifras y topes se aplican en la Asignación Familiar Prenatal.
Por su parte, pornacimiento, ANSeS abonará$59.860; poradopción,$357.924; pormatrimonio,$89.633; por aayuda escolar anual $42.039, con tope de ingreso familiar de $4.210.876; mismo monto que otorgará por ayuda escolar anual para hijo con discapacidad, pero sin tope de Ingreso Grupo Familiar (IGF).
En paralelo, ese organismo determinó que laAsignación Universal por Hijo (AUH), que beneficia a aproximadamente 4,3 millones de niños y adolescentes, llegará a$102.705, mientras que laAUH por Hijo con Discapacidadtrepará a$334.426.
El artículo 4° de la Resolución firmada por el titular de ANSeS, Fernando Omar Bearzi, establece también que a partir del próximo mes la percepción de un ingreso superior a $2.105.438 por parte de una de las personas integrantes del grupo familiar, excluye a dicho grupo del cobro de las asignaciones familiares, aun cuando la suma de sus ingresos (IGF) no supere el límite máximo de ingresos establecido en sus anexos, que es de $4.210.876.
ES
Newsletter Clarín
Recibí en tu email todas las noticias, coberturas, historias y análisis de la mano de nuestros periodistas especializados",https://www.clarin.com/economia/asignaciones-familiares-nuevos-montos-limites-ingresos-abril-2025_0_Mc29hSfYd9.html
Clarín,2025-03-26,Mensaje de exportadores al Gobierno: “Se puede trabajar en acuerdos de libre comercio sin sacrificar el Mercosur”,"El creciente protagonismo de China en el comercio internacional sumado a las nuevas aspiraciones arancelarias del presidente norteamericano Donald Trump, entre otros factores, están instalandoun escenario inédito en el mapa del comercio global.
Precisamente, sobre las decisiones de las grandes potencias comerciales y su impacto en la Argentina se habló, ayer, un encuentro que tuvo lugar en la Cámara de Exportadores de la República Argentina (CERA). Allí, su presidente, Fernando Landa , analizó los principales desafíos y oportunidades en el comercio internacional.
Entre los impactos a nivel local, figura la posibilidad de que la Argentina firme un Tratado de Libre Comercio con los Estados Unidos, según la voluntad manifestada por los mandatarios liberales y amigos de ambos países. Claro que, esta posibilidad requiere que la Argentina resuelva un requisito que funciona como límite para este tipo de pacto bilateral:abandonar su participación en el Mercosur,ya que esta agrupación establece un arancel común para la política comercial de todos los países del bloque. Al respecto, Landa señaló que “si bien se pueden hacer acuerdos particulares de facilitación del comercio”,lo que no sería conveniente es “sacrificar el Mercosur”,advirtió el directivo.
La razón es que Brasil, el principal socio comercial de la Argentina""es clave para los sectores industriales y agropecuarios argentinos.“Argentina no puede perder a Brasil como mercado”,insistió el titular de la CERA, aunque admitió que también el Mercosur amerita un cambio de reglas, asi como también las necesita la Organización Mundial de Comercio (OMC).
“En este contexto internacional incierto, con final abierto, hoy el foco de EEUU está puesto en China, la Unión Europea, (UE), y los países vecinos (Canadá y México) e India. En cambio,la Argentina es un actor no significativoque debe salir de su posición de “stand-alone” es decir, de mantenerse solo. Con cautela puede ganar espacio en la turbulencia. Puede ganar espacio como un aliado estratégico en América del Sur para EEUU."", según la cámara.
Por otro lado, los aranceles que hoy paga la Argentina son bajos: el 58% ya ingresa a Arancel 0% - El 20% ingresa con un Arancel del 1%. Con lo cual, ""no nos motiva lo arancelario"", señala Lenda.
Según el directivo, la Argentina perdió participación en los mercados globales yrecuperarla depende de su competitividad. Para lograrla deberá eludir las barreras que enfrenta actualmente, como el relacionamiento externo, los impuestos y restricciones, la facilitación del comercio, las cuestiones logísticas y la falta de financiamiento, entre otras cosas.
""“Las exportaciones argentinas tienen un piso consolidado, pero cuesta avanzar. El país logró ingresar en los mercados agroindustriales a pesar de los altos niveles de protección (a partir de cuotas, productos diferenciales, etc.) y consiguió una cierta integración regional en algunas cadenas industriales. No debiéramos plantearnos un mejor acceso a EEUUa costa de perder las preferencias en el mercado regional, especialmente en Brasil.Según los exportadores,el costo de salir del Mercosur es perder los acuerdos comerciales logrados(símil Brexit), incluyendo eventualmente Unión Europea (UE)-MERCOSUR.
Finalmente, en el encuentro que tuvo lugar en la sede porteña de la cámara de exportadores, se planteó: que ""con Estados Unidosse puede trabajar una agenda de cooperación económica que no colisione con el Mercosur.También profundizar acuerdos sectoriales en materia de inversión, regularizar la remisión de utilidades, atraer nuevas inversiones a partir del RIGI (el régimen para las grandes inversiones) e implementar el RIMI (un régimen similar para proyectos de mediana envergadura) e insistir con la solución de los problemas no arancelarios"".
Redactora de la sección Economía/Pyme.nmuscatelli@clarin.com
Newsletter Clarín
Recibí en tu email todas las noticias, coberturas, historias y análisis de la mano de nuestros periodistas especializados",https://www.clarin.com/economia/mensaje-exportadores-gobierno-puede-trabajar-acuerdos-libre-comercio-sacrificar-mercosur_0_OuHUvBLJMQ.html
Clarín,2025-03-26,Ajuste en la ex AFIP: ya hubo 820 retiros voluntarios y hay vacantes en áreas estratégicas,"La motosierra y el plan de retiros voluntarios provocó un éxodo de empleados en la ex AFIP.Se trata de 821 bajas entre enero y febrero, incluyendo decenas de jefes y directores de áreas sensiblescon más de 20 años de antiguedad, debido al programa implementado para reducir la plantilla del organismo, según un listado al que pudo accederClarínen forma exclusiva.
""Son cerca de 800 empleados"", confirmaron en ARCA. Según cálculos oficiales, elorganismo gastará US$ 115 millones en premios, mientras los gremios estiman que quedarían unas 650 vacantes. El listado se conoce en medio de protestas desde ayer en reclamo de un aumento salarial y luego de medidas a principios de marzo en rechazo alcierre de 100 agencias del interiory la eliminación de 695 cargos.
Las planillas revelan una sangría de cargos jerárquicos que suelen ser buscados por estudios y empresas privadas por su formación. Ese es el caso deldirector de Prevención de Lavado de Activos, Iván Gabriel Ochoa, un técnico que hizo carrera en la DGI en 1991, fue asesor legal en 1996 bajo la AFIP, y luego ascendió en la división de Lavado, donde se convirtió en jefe desde 2002.
También se retiró eldirector técnico de la parte legal de la Seguridad Social, Fernando Mario Cao, el jefe del departamento técnico jurídico del departamento de coordinación judicial, Fernando Sanchez Lorences, el jefe de la sección de fiscalización y operativa aduanera, Daniel Enrique Caorsi, y el jefe de departamento de Contencioso Administrativo, Marcelo Malagón.
Otro funcionario que fue de la partida esHoracio Curien, exsubdirector general de fiscalización de Ricardo Echegaray, el titular de AFIP en la gestión de Cristina Kirchner. Curien fue asesor de la presidencia de la Auditoría General de la Nación en 2016, asesor de la Cámara de Diputados hasta 2018 y ese año volvió a la AFIP como asesor mayor de la DGI hasta la actualidad.
El listado de retiros incluye aljefe de fiscalización, Héctor Abaca, el jefe de capacitación, Fernando Aparicio, la jefa de división en revisión y recursos, Inés Battan, la directora de juicios, Gabriela Femia, los funcionarios del área de fiscalización, Fernández de Ciesa y Gabriel Fernández Gambarruta, y los abogados Alejandro Jurin, Omar Loto y Alis Pini.
El Gobierno puso la mira en el organismo desde octubre, cuando anunció la disolución de AFIP y la creación de ARCA junto con más de 3.000 despidos. Luego, en diciembre, la titular, Florencia Misrahi fue desvinculada y reemplazada por Juan Pazo, hombre de estrecha confianza de Luis Caputo. Y en enero se oficializóuna rebaja del 80% en los sueldos de los altos mandos.
Después de una primera tanda de jubilaciones en octubre, el organismo dispuso elSistema de Retiro Anticipado con el objetivo de alcanzar 1.500 bajas. Entre los requisitos se exigía tener una edad igual o mayor a 58 años con una prestación mínima de 15 años, para poder cobrar el premio de 20 sueldos brutos, que reciben quienes se jubilan a la edad de reglamentaria de 65 años.
En cuanto a las vacantes,el Gobierno viene ocupando con delfines de su riñón algunas áreas clave. En octubre, Santiago Caputo trajo al director de Aduanas, José Andrés Velis, y al titular de la DGI, Andrés Vásquez. Y en diciembre, Pazo arrimó a Sergio Rufail en Fiscalización, un exfuncionario K que terminó en la AFIP de Alberto Abad y Leandro Cuccioli, bajo la gestión de Mauricio Macri.
""El gobierno con su violencia y modalesarrastró a los mejores y más capacitados hombres y mujeres de la ex AFIP a servir al sector privadoa los grandes evasores, dejando ver que el ARCA, hoy sin recursos humanos debidamente calificados no podrá hacer frente a ninguna futura deuda a contraer con el FMI”, dijo el titular de la Unión del Personal Superior de la AFIP, Julio Estévez.
Según el último dato oficial, la planta del organismo es de 20.642 personas.La expectativa es que la plantilla se reduzca en 2.815 personasdesde el inicio de la gestión hasta el 31 de marzo, por la efectivización de retiros voluntarios y ""desvinculaciones"", según el cálculo que hizo el vocero presidencial Manuel Adorni el mes pasado durante una conferencia de prensa.
Redactor de la sección Economíajbarca@clarin.com
Newsletter Clarín
Recibí en tu email todas las noticias, coberturas, historias y análisis de la mano de nuestros periodistas especializados",https://www.clarin.com/economia/ajuste-ex-afip-820-retiros-voluntarios-vacantes-areas-estrategicas_0_DZ0s7k4zB0.html
Clarín,2025-03-26,"Por los créditos, la compra-venta de inmuebles tuvo el mejor febrero de los últimos 15 años","El mercado inmobiliario sigue su tendencia al alza a juzgar por las operaciones de compra-venta. En febrero, la cantidad total de las escrituras registró unasuba de 94%respecto del nivel de un año atras, al sumar 4293 registros.Se trató del mejor febrero de los últimos 15 años. Así lo relevó el Colegio de Escribanos de la Ciudad Autónoma de Buenos Aires sobre los inmuebles vendidos dentro de este ámbito.
En comparación conenero de 2025,cuando se concretaron 3465 escrituras,las escrituras escalaron un 17,8%y el monto total de las transacciones realizadas en el período analizado aumentó un 219,2%, con $541.490 millones. Así, el monto medio de las operaciones fue de $126.133.341 (US$116.057de acuerdo al tipo de cambio oficial promedio): creció 64,5% en un año en pesos, yen moneda estadounidense trepó 33,3%.
Parte del crecimiento de las ventas están atadas al impulso del crédito hipotecario. En febrero, hubo965 escrituras formalizadas con hipoteca.Por lo que la suba en ese sentido fue del1.121%respecto al mismo mes del año pasado.
Sobre los últimos datos recabados, el presidente Colegio Escribanos Jorge De Bártolo reflexionó: “tenemosprácticamente el doble de operaciones que en el primer bimestre de 2024y con un importantísimo empuje de los créditos hipotecarios"", dijo.
""Es un muy buen arranque de año y ojalá éstas mil hipotecas mensuales sean el piso de esta nueva realidad inmobiliaria”, agregó el directivo. El Colegio de Escribanos insiste en que es necesario ""ganar tiempo en las gestiones de compra que se dan con crédito bancario: tenemos que articularcada vez mejor con bancos y organismospara llegar rápido a la operación. Ganar tiempo también es ganar dinero”, según Di Bártolo.
También en la provincia de Buenos Aires, la cantidad de operaciones registró -en febrero- el mejor número en los últimos seis meses: Se firmaron 7.952 compraventas, según datos del Colegio de Escribanos de ese distrito. Esta cifra representó unaumento interanual de 73,13%frente a las 4.593 operaciones concretadas en el mismo mes del año pasado. Y de un 38% respecto del mes anterior.
Según Ariel Champanier, CEO de RE/MAX Premium Argentina, opina que ""en un contexto donde la inflación muestra signos de desaceleración, la estabilidad económica generó un impacto positivo en el mercado inmobiliario. Le dio mayor previsibilidad en cuanto a la renta, para quienes buscan comprar un inmueble para alquilar. ""Eso se vuelve un factor clave para los compradores"", asegura el empresario.
Además, el directivo indicó quela estabilidad cambiaria genera mayor dinamismo en el sector, ya que “muchos ahorristas buscan desprenderse de los dólares en efectivo, dado que su rendimiento es menor en comparación con la revalorización del metro cuadrado en bienes raíces”, opinó.
Desde la experiencia del sector, las zonas más buscadas son los barrios del norte de la Ciudad de Buenos Aires, como Belgrano, Palermo y Núñez. Son las zonas donde más sube el precio del metro cuadrado..
En términos de unidades, los departamentos de 2 y 3 ambientes son los más demandados; y en especial los de 3, ya que la diferencia de precio con respecto a los de 2 ambientes no es tan significativa. Los PH y las casas también siguen siendo un mercado importante, particularmente en áreas suburbanas..
Si bien, las inmobiliarias se mantienen entusiasmadas con las estadísticas en suba, el primer bimestre de este 2025 (con 7938 escrituras)aún está por debajo de los niveles del 2018,por ejemplo, cuando el mismo periodo sumó 8592 operaciones, también según los datos del Colegio de notarios porteño.
Redactora de la sección Economía/Pyme.nmuscatelli@clarin.com
Newsletter Clarín
Recibí en tu email todas las noticias, coberturas, historias y análisis de la mano de nuestros periodistas especializados",https://www.clarin.com/economia/creditos-compra-venta-inmuebles-mejor-febrero-ultimos-15-anos_0_NDbkIw5uCE.html
