diario,fecha,titulo noticia,contenido,link
Clarín,2025-03-26,Carlos Melconian advirtió que el régimen cambiario “está en rojo” y cuestionó que el Banco Central venda dólares para mantener acotada la brecha,"Luego de una jornada en la queel dólar blue quedó al borde de los $ 1.300y el Banco Central vendió US$ 109 millones,Carlos Melconianadvirtió queel régimen cambiario está en rojoy que el Gobierno pone demasiado optimismo en el acuerdo con el Fondo Monetario Internacional.
""No estoy esperando algo que haga estallar en forma positiva a los mercados. Va a ser algo que va a salir,el Gobierno se ha concentrado innecesariamente a ver cuanta plata fresca es, el cambio irrelevante de cambiar plata fresca por papelitos que no sirven para nada. Todo bienvenido, pero no cambia el panorama, el fondo de lo que tenemos que hablar"", analizó en diálogo con radio Rivadavia.
El economista jefe de la consultora Equis sostuvo que el superávit fiscal, algo que el presidente Javier Milei siempre destaca de su gestión, tapó otras discusiones.
""Siempre pensamos que el régimen cambiario era transitorio, y cuando salga el acuerdo con el Fondo va a cambiar, esto que tiene Argentina hoy no va a continuar, tampoco va a ser definitivo. Va a ser un régimen cambiario con fecha de vencimiento"", manifestó.
En ese sentido, expresó que existe mucha confusión respecto al levantamiento del cepo y la política cambiaria de la gestión libertaria.
""Está en rojo el régimen cambiario"",expresó el economista. Advirtió que la cuestión de fondo es la modificación de ese régimen y sostuvo que el Gobierno postergó ""innecesariamente"" la actualización de la brecha por el oxígeno que le dio la entrada de dólares por el blanqueo.
En ese sentido, señaló que la brecha del 14% entre el dólar oficial y el blue no existeen la historia argentina. ""El acuerdo con el Fondo debiera hacer un torniquete. Que el Banco Central deje de vender dolares,no puede continuar vendiendo dólares que no son de él"", manifestó.
Melconian habló de la necesidad de realizar reformas estructurales para dar certidumbre y evitar las consecuencias económicas que padecieron las gestiones de Mauricio Macri, Alberto Fernández y a Cristina Kirchner en su último mandato.
""El shock de programa de estabilidad tiene que llevar la inflación a un dígito anual, eso está por venir"", sentenció.
Finalmente, señaló que el ministro de Economía, Luis Caputo, tiene que tener un programa económico con eje en el superávit fiscal.
""Los programas fondomonetaristas son una cabalgata en el desierto. Argentina va a necesitar un programa de shock para la estabilidad. En algún momento va a haber que tener una política monetaria seria, un régimen cambiario que deje de ser transitorio y reformas"", concluyó.
D.D.
Newsletter Clarín
Recibí en tu email todas las noticias, coberturas, historias y análisis de la mano de nuestros periodistas especializados",https://www.clarin.com/economia/carlos-melconian-advirtio-regimen-cambiario-rojo-cuestiono-banco-central-venda-dolares-mantener-acotada-brecha_0_KFfS5pVwks.html
Clarín,2025-03-26,Una empresa concursada realizó un acuerdo comercial con un gigante de Brasil para la campaña de girasol,"Con más de 3.700 acreedores y una deuda que araña los US$ 300 millones,  Los Grobo Agropecuaria (que entró formalmente en concurso preventivo de acreedores hace 35 días) cerró unacuerdo comercialcon Amaggi Argentina  para la campaña de girasol 2025.
Según consta en la presentación judicial, se trata de un ""acuerdo de cooperación"" en la cual ""Amaggi garantizará, mediante el otorgamiento de fianza, las obligaciones del pago del precio a cargo de Los Grobo Agropecuaria emergentes de aquellos contratos de compra de compra de girasol de la campaña 2025 en curso"".
Continuando con el documento, el acuerdo establece que Amaggi analizará caso por caso los contratos de compra de girasol suscriptos por Los Grobo y decidirá si otorga la garantía de pago. A cambio,percibirá  US$ 5 más IVA por tonelada de grano garantizada"",
El convenio entre ambas firmas fija un límite en las fianzas a otorgar, que ""no superarán el 85% del precio pendiente de pago por parte de Amaggi a LGA en virtud de los boletos de compra de granos"".
A su vez, la empresa concursada ""compromete sus mejores esfuerzos para vender a Amaggi puestos en puertos"" unas 2.500 toneladas de soja, 3.500 toneladas de cebada, 28.000 toneladas de trigo y 3.000 toneladas de maíz.
El primer relevamiento del pasivo concursal de Los Grobo Agropecuaria se extiende a3.740 acreedores por un valor de $ 320.508 millones(US$ 293  millones al tipo de cambio del Banco Nación).
Amaggi Argentina es la filial local de la gigante del agro brasileña, que siembra alrededor de 350.000 hectáreas por año, y la soja representa el 70% del total. Amaggi también está presente en Argentina, Países Bajos, Paraguay, Noruega, Suiza y China,.
Este acuerdo fue celebrado por la firma concursada, ya que permitirá que ""concrete operaciones de compra de girasol, sumamente relevantes en su operatoria en estos meses, dotando a los productores de mayor tranquilidad respecto de su cumplimiento al encontrarse involucrada una compañía de la talla de Amaggi"".
""Este acuerdo no solo beneficia a los productores que entreguen girasol a Los Grobo Agroepcuaria en la campaña en curso sino también al propio concurso preventivo por cuanto colabora con la actividad propia de la concursada, el mantenimiento de la empresa en marcha y la salvaguarda de las fuentes de trabajo"", remarcaron desde la empresa.
Newsletter Clarín
Recibí en tu email todas las noticias, coberturas, historias y análisis de la mano de nuestros periodistas especializados",https://www.clarin.com/rural/empresa-concursada-realizo-acuerdo-comercial-gigante-brasil-campana-girasol_0_nPSBGDcuWf.html
Clarín,2025-03-26,De no fabricar autos a exportar partes de motos por US$ 10 millones al año: la historia de Honda y su crecimiento en Brasil,"MANAOS, BRASIL (Enviado especial).- No hay forma de llegar a Manaos en auto o camión, dicen sus habitantes, que aseguran que no hay caminos preparados para poder irse o llegar de esta ciudad de 2,2 millones de habitantes por vía terrestre. La única alternativa es el avión. Pero como Manaos es una de las ciudades más antiguas del continente (fue fundada en 1669), sus habitantes saben de parte de sus ancestros que el Río Negro es la forma de llegar y también de irse. Y el río sigue siendo la principal vía de conexión para las cargas de sus más de 600 industrias, ya que la zona franca de Manaos es una de las más antiguas e importantes del mundo.
Alejada del resto del mundo,a cuatro horas y media de avión de San Pabloy con un casco urbano que exhibe su impronta colonial y a la vez un diseño moderno (está surcada por túneles para favorecer el tránsito por sus calles), la ciudad también replicaescenarios de pobreza como los de San Pablo, a una escala más reducida.
La empresa más importante de esta ciudad que desafía a la naturaleza es una multinacional de origen japonés:Honda, que tiene en Manaossu principal fábrica de motos de todo el mundo.
El predio de Honda Motos ocupa 750 hectáreas completamente selváticas y montañosas: si no fuera porque desde aquísalen cada día 6.500 motosque abastece a 75% del gigantesco mercado de Brasil (1,4 millones de motos al año, 75% de participación del mercado), de todas maneras esta fábrica podría ser una atracción turística en sí, con naves industriales instaladas en distintas alturas de los cerros.Son 350.000 metros cuadrados, el equivalente a 350 hipermercadosubicados, uno al lado del otro, en plena montaña.
El ritmo de producción es deuna moto cada 19 segundos. En esta fábrica se producen 18 modelos, que van desde la cilindrada más chica hasta versiones de más de 300 cc. La fabricación comenzó de manera modesta en 1976, hace 49 años, y se fue incrementando hasta alcanzar la cifra de 1,8 millones de unidades en 2011. Hoy trabajan a un ritmo de 1,4 millones de motos por año, más de tres veces todo el mercado de motos de la Argentina.  Desde 1976 hasta fines del año pasado, Honda Motos de Brasil fabricó30 millones de motos.
Se trata de una fábrica con un importante grado de integración, ya que aquí haydesde fundición hasta producción de motores. Aun así, cuentan con un importante entramado de proveedores, más de 110, incluidas 15 empresas japonesas.
Una de las proveedoras que llegó hace poco menos de un año esHonda de Argentina, que replica a una escala diez veces más chica la producción de motos en su fábrica de Campana: allí trabajan900 operarios(en Manaos son 9.000) y el año pasado despacharon110.000 motos.
Como marca, Honda es la número uno de Argentina, con 21% de participación de mercado. Para este año, prevé un importante incremento de su producción, ya que se estima que el mercado de motos en el paíspodría rondar las 600.000 unidadesy en Honda se preparan para captar 23% de ese mercado.
Pero una pata importante de la producción de Honda en Campana es una división de producción de partes plásticas, producto de una inversión de 15 millones de dólares concretada en 2024,a partir de la cual el año pasado despacharon a la fábrica de Manaos un millón de piezas plásticas, cifra que este año va a crecer a 1,3 millones de piezas. Abastecen a los modelosTornado y Pop, dos de los más demandados en la región.
Medidas en divisas, esa exportación fue de 4,5 millones de dólares en 2024 y este añorondará los US$ 10 millones, según estimóViviana Daleoso,directora de Relaciones Corporativas y Sustentabilidad de Honda Argentina, en Manaos.
“Los planes de inversión no se agotan en este proyecto, tenemos nuevos planes para avanzar con la producción de piezas e inversiones queestimamos anunciar para mediados de año”, anticipó la ejecutiva argentina.
Honda instaló su primera fábrica en Argentina en 2006, en Florencio Varela, donde inició la producción de motos que continúa hasta hoy. Pero en el medio hubo una importante inversión en la compra e instalación de una nueva fábrica en Campana, sobre la ruta 9, que le demandó 250 millones de dólares y donde durante casi una década produjo dos modelos de autos: el Honda City y el Honda HRV.
Esa historia se interrumpió abruptamente en agosto de 2019, cuando la multinacionaldecidió cerrar las fábricas de autos con menor producción en varios puntos del planeta, incluida su fábrica bonaerense.
Si bien la producción de la HRV se mantuvo hasta principios de 2020, el anuncio de Honda sonó a final de ciclo: fue en el mismo mes en que Alberto Fernández y Cristina Kirchner ganaron las PASO, en un contexto de fuerte caída de la producción automotriz en el país.
Aun así, en Campana siguen a la expectativa de reactivar la producción de autos. ""Honda hoy no tiene previsto reanudar su producción de vehículos,pero siempre se puede llegar a tener algún proyecto"", agregó Daleoso.
Editor del Suplemento Económico y de Pymeslceriotto@clarin.com
Newsletter Clarín
Recibí en tu email todas las noticias, coberturas, historias y análisis de la mano de nuestros periodistas especializados",https://www.clarin.com/economia/automotriz-hoy-fabrica-autos-argentina-exporta-partes-motos-brasil-us-10-millones-ano_0_USKyLnAcgM.html
Clarín,2025-03-26,Ya no somos todos de clase media: cómo se perciben hoy los argentinos en la pirámide social,"Lahistórica clase media, que por décadas fue un rasgo distintivo del país, actualmente enfrenta unacrisis de identidad y pertenencia.Sucede que los cambios económicos y sociales que se fueron dando en la Argentina impactaron en la percepción de los ciudadanos sobre su nivel de vida yhoy mucha menos gente se percibe de clase media.
Esta es una de las conclusiones del último estudio de la consultoraYouniversal,especialista en investigación y tendencias, que reveló nuevos datos acerca decómo los argentinos perciben hoy su posición socioeconómica.
""Históricamente,entre el 80 y el 85% de los argentinos se identificaban como clase media.Hoy,esa percepciónha cambiado radicalmente"", asegura Ximena Díaz Alarcón, Co-Fundadora & CEO de Youniversal.
Detalla que “apenas el 28% de los encuestados se considera hoy de clase media, mientras que un 39% se identifica con la clase media baja y un 27% con la clase baja”.
Este estudio alude a cómo se perciben los consultados en una encuesta y en distintosfocus groups. Pero teniendo en cuenta la distribución de la población,se estima que el 53% de la población es de clase baja, el 42% es de clase media y el 5% es de clase alta.
Para ser considerada de clase media una familia tipo (dos adultos y dos niños menores)necesitó ingresos de al menos $ 1.713.065,96en febrero pasado en la Ciudad de Buenos Aires, según el INDEC porteño.
A pesar de los cambios en la autoidentificación, algunos pilares siguen siendo fundamentales para definir a la clase media argentina, recuerda el informe.La saludes un aspecto clave, donde los sectores de menores ingresos dependen de la atención pública, mientras queen los sectores medios y altos las prepagas siguen siendo un estándar.
La educacióncontinúa siendo unsímbolo de progreso, con una fuerte presencia de laeducación privada en los niveles socioeconómicos más altos,mientras que la universidad pública mantiene su valor como motor de movilidad social.
A su vez, laconectividad, a través de Internet y celulares, es percibida como esencial para la inclusión social y el desarrollo cotidiano. Además, la posibilidad de disfrutar de pequeñas experiencias, comosalidas, viajes, recitales y clubes, sigue siendo un signo de bienestar y pertenencia.
“Por último, laidentidad y el cuidado personaljuegan un rol central:la moda, el deporte y la estéticafuncionan como barreras frente a la percepción de caída social, reforzando la autoestima y la imagen”, detalló el trabajo.
El estudio confirma una sensación extendida: la clase media fue considerada el motor del progreso en Argentina, pero, al mismo tiempo,la mayoría de la población siente que ya no alcanza los niveles de consumo asociados a este segmento social.
Un 36% de los encuestados se mostró “de acuerdo” y un 51% “muy de acuerdo” con la afirmación ""la clase media argentina ha sido históricamente el motor de progreso del país"".
Sin embargo, al responder ""siento que no puedo mantener el consumo que correspondería a una persona de clase media"", el32% dijo estar “de acuerdo”yel 46% “muy de acuerdo” con esta sensación.
Además, el 34% de los encuestados estuvo de acuerdo y el 39% muy de acuerdo con la afirmación""la clase media argentina está en vías de extinción"".
Algunos datos de la economía avalan la percepción de la población. Por caso, el consumo masivo (alimentos, cosmética y limpieza), sigue con números negativos. Desde enero del 2024, en todos los meses hubocaídas:inició con una retracción del 3,5% interanual en enero del 2024 ylleva 15 períodos consecutivos, hasta el 9,8% del pasado febrero, según datos de la consultora Scentia.
Aunque las compras de bienes durables están un poco mejor posicionadas, precisamente por la dispar recuperación de los salarios,las operaciones con tarjeta de crédito tampoco repuntan: crecieron en febrero un 1% nominal respecto de enero, lo que implicó una caída del 0,9% en términos reales frente a una inflación estimada de 2%, según el último informe de First Capital Group.
Otro análisis que permite evaluar las divergencias entre la evolución macro yel ""feeling"" de la calle, es el índice de confianza de los consumidores.Según el relevamiento de la Universidad Torcuato Di Tella, este indicador viene mostrandocaídas en los últimos dos meses: en febrero disminuyó 0,3% versus el mes anterior y en marzo, la tendencia se profundizó: se desplomó un 6,7%.
Según los analistas de Youniversal, el estudio de la consultora evidenciauna transformación profunda en la percepción de los argentinos sobre su posición en la sociedad y los desafíos que enfrenta la clase media en el país.
""Repensar la clase media, o más bien si somos de clase media o de media clase, es clave para entender las aspiraciones, frustraciones y motivaciones de la gente"", concluyó Díaz Alarcón.
NE
Redactora de la sección Economía/Pyme.nmuscatelli@clarin.com
Newsletter Clarín
Recibí en tu email todas las noticias, coberturas, historias y análisis de la mano de nuestros periodistas especializados",https://www.clarin.com/economia/clase-media-perciben-hoy-argentinos-piramide-social_0_3KurfCsETV.html
Clarín,2025-03-26,Dólar hoy: a cuánto cotizan el oficial y sus diferentes tipos de cambio este miércoles 26 de marzo,"Eldólar oficialcotiza estemiércoles 26 de marzoa $1051,25 para la compra y $1091,25 para la venta en las entidades bancarias.
En cuanto aldólar blue, esta jornada cotiza a $1275 para la compra y $1295 para la venta. Así, marca una brecha de 21% con respecto al dólar oficial. Elvalor del dólar bluetiene una diferencia sustancial con el dólar oficial, que se adquiere en los bancos y que posee una cotización establecida.
Por otro lado, eldólar turista(también conocido comodólar solidario) cotiza a $1418,63. Este valor es el que se utiliza al momento de comprar dólar para ahorro o de realizar transacciones en el exterior y surge de la suma de un 30% al valor del dólar oficial del día.
Otro de los tipos de cambio es eldólar mayorista, el cual inicia el día a $1308,15 para la compra y $1312,90 para la venta.
En relación alContado con liqui(CCL), el precio de referencia es de $1293,90. El CCL es la operatoria que permite a las empresas comprar papeles argentinos en el mercado local y venderlos en el exterior para lograr así girar divisas para ""atesoramiento"".
Hoy en Argentina conviven al menos seis tipos de cotizaciones distintas para la moneda estadounidense, algunas más usadas que otras.
Dólar ahorro/tarjeta o dólar turista/solidario: tiene el recargo del 30% dispuesto por el Gobierno sobre las compras realizadas con tarjeta en moneda extranjera y sobre la adquisición de divisas para atesoramiento dentro del circuito oficial.
Dólar blue: es el billete que se vende en el mercado informal, a través de cuevas o “arbolitos” en la calle.
Contado con Liqui: es una operación legal para conseguir dólares en el exterior. Se convirtió en el camino preferido de las empresas. Se compran títulos o acciones argentinas en pesos y luego se venden en el exterior en dólares.
Dólar oficial o minorista: es el precio al que pueden acceder los particulares pero siempre dentro del cerco de US$200 establecido por el cepo.
Dólar mayorista: es el que se usa para el comercio exterior, el pago de deudas dolarizadas y de dividendos. Teóricamente es el que incide en la fijación de los precios de los productos importados.
Dólar para industria y servicios: por el efecto de las retenciones, los exportadores de manufacturas y de servicios reciben en realidad un dólar a un valor más bajo que el oficial, y mucho más bajo que el blue. Dentro de esta categoría, hay distintos valores para quienes exportan carne y lácteos, para trigo, maíz y girasol y para la soja.
Newsletter Clarín
Recibí en tu email todas las noticias, coberturas, historias y análisis de la mano de nuestros periodistas especializados",https://www.clarin.com/economia/dolar-hoy-cotizan-oficial-diferentes-tipos-cambio-miercoles-26-marzo_0_qQaMjUkc2u.html
Clarín,2025-03-26,El Gobierno oficializó la desregulación del turismo en los Parques Nacionales,"El Gobierno de Javier Milei oficializó este miércoles ladesregulación del turismo en los 39 parques nacionales del país. La decisión, publicada en el Boletín Oficial y anunciada por el ministro de Desregulación del Estado, Federico Sturzenegger, busca, según el funcionario, ""eliminar las barreras que impedían al sector turístico moverse con libertad, competir e innovar"".
Se trata de las resoluciones 61/25 y 62/25, que llevan las firmas del presidente de Parques Nacionales, Cristian Larsen, y el directorio del organismo que los administra. La medida, según explicó Sturzenegger, en extensos posteos en redes sociales, busca abrir ""el juego para la prestación de servicios turísticos en los Parques Nacionales"".
""Mientras que antes la oferta estaba limitada y monopolizada en algunos prestadores,ahora cualquier prestador podrá ofrecer excursiones y actividadessin necesidad de superar inmensos escollos ni tener que contratar a ciertas personas"", sostuvo el funcionario que está al frente de las desregulaciones.
En ese sentido, Sturzenegger precisó que, gracias a esas dos resoluciones, ""quienes quieran ofrecer actividades en los parques podránsolicitar la autorización de forma digital, con silencio positivo"", que supone que si quien solicita permiso no recibe respuesta puede darse por aprobado.
También destacó el funcionario que ""en cuanto a la infraestructura, se simplifica drásticamente la documentación requerida y se autoriza la instalación de estructura efímera con requisitos mínimos"" y también, por caso, se elimina la obligatoriedad de contar con guías habilitados (sólo sería necesario ese requisito en actividades de riesgo).
Las Resoluciones 61/25 y 62/25, firmadas por@CristianGLarseny el Directorio de@ParquesOficial,  todos de la Jefatura de Gabinete de@GAFrancosOk, implementan una de las transformaciones más profundas en la historia del sistema de Parques Nacionales. Nunca, desde su creación,…pic.twitter.com/9b4EgJt3AG
De todas maneras, enfatizó Sturzenegger que las reformas que buscan liberar la participación de las distintas empresas turísticas, ""no implica renunciar al control de las actividadesni abandonar los principios de conservación ambiental"".
Con críticas a gestiones pasadas, consideró el funcionario que ""aunque son bienes públicos por excelencia, el modelo del 'Estado presente' fue tan letal, que transformó a algunos de estos tesoros naturales enespacios inaccesibles para la mayoría"".
Al insistir con esas críticas, Sturzenegger puso como ejemplo el ""minitrekking sobre el Glaciar Perito Moreno"" donde, según precisó, una sola empresa ""sin competencia, cobra hoy casi USD 400 por una caminata de 4 horas"". ""Esto que no se entienda como una crítica a las personas de esa empresa, sino al sistema que lo permite: una combinación de concesiones exclusivas con una burocracia kafkiana que durante años impidió que nuevos actores pudieran competir. Resultado: una familia de 5 termina gastando 2000 dólares para una excursión que no debiera salir más de 50 o 60 dólares por persona. Un verdadero atentado a la racionalidad y una catástrofe para el turismo en el país"", señaló en X.
BUROCRACIA 0 EN LOS PARQUES NACIONALESSimplificamos la normativa para disminuir trámites burocráticos inútiles. Queremos nuevos prestadores turísticos que ofrezcan mejores servicios y prestaciones en los Parques Nacionales. Aspiramos a que cada vez más argentinos visiten…pic.twitter.com/bUWJ7ljyN8
Sturzenegger elogió el trabajo de Larsen, presidente de Parques Nacionales. ""Simplificamos la normativa para disminuir trámites burocráticos inútiles. Queremos nuevos prestadores turísticos que ofrezcan mejores servicios y prestaciones en los Parques Nacionales. Aspiramos a que cada vez más argentinos visiten nuestras maravillas naturales"", destacó Larsen, con un video en X.
En ese sentido, en línea con lo que expresó Sturzenegger, el funcionario aseguró que ""esta reforma mantiene los estándares de protección ambiental necesarios para el desarrollo de actividades dentro de los Parques Nacionales"".
El presidente Javier Milei se hizo eco de esas resoluciones y compartió, además, el mensaje del secretario de Turismo, Ambiente y Deportes, Daniel Scioli, quien destacó que se trata de ""más facilidad para que los turistas visiten los parques en Argentina"".
""Una desregulación que genere más competitividad y oportunidades con precios accesibles para los turistas de nuestro país, y los viajeros del mundo"", sostuvo Scioli.
Newsletter Clarín
Recibí en tu email todas las noticias, coberturas, historias y análisis de la mano de nuestros periodistas especializados",https://www.clarin.com/economia/gobierno-oficializo-desregulacion-turismo-parques-nacionales_0_62gCSmcyum.html
