diario,fecha,titulo noticia,contenido,link
Clarín,2025-04-28,Aumentan las jubilaciones en mayo 2025: cuánto cobrarán los de la mínima con el ajuste del mes y el bono de $ 70.000,"El Gobierno oficializó este lunes loshaberes mínimo y máximo que percibirán los jubilados en mayo de 2025, con unincremento del 3,73%, en sintonía con el índice de inflación de marzo que informó el INDEC. El mismo aumento tendrán lasAsignaciones Universales por Hijo (AUH)y lasasignaciones familiaresque perciben asalariados registrados y monotributistas.
El artículo 1° de la Resolución 211/2025 de laAdministración Nacional de la Seguridad Social (Anses), publicada en el Boletín Oficial con la firma del director ejecutivo de ese organismo, Fernando Omar Bearzi, estableció que elhaber mínimode los jubilados quedará en $296.481,74, mientras que elmáximoescalará a$1.995.041,47, tal como lo especifica el artículo 2° de esa misma normativa.
En paralelo, el organismo que gestiona las políticas de seguridad social de Argentina fijó que lasbases imponibles mínima y máxima quedaran establecidas en $99.855 y $3.245.240,49, respectivamente, a partir del período devengado mayo de 2025.
El artículo 4°, además, dispuso que el importe de laPrestación Básica Universal (PBU)prevista en el artículo 19 de la Ley N° 24.241 a partir de aquel mismo messerá de $135.626,86, mientras que laPensión Universal al Adulto Mayor (PUAM)escalará a$37.185,39.
El haber mínimo pasará será de $ 307.431,93 más el bono de $ 70.000. De esta manera, el ingreso total en mayo será de$366.481,75. Por su parte, el haber máximo ascenderá a$ 1.995.041,46.
La Pensión Universal para el Adulto Mayor (PUAM), por su parte, se ajustará a $246.527,76. Con el agregado del bono extraordinario, alcanzará un total de $307.185,40​.
El Gobierno dictaminó también un incremento del 3,73% en el próximo mes a los beneficiarios de la Asignación Universal por Hijo y Asignaciones Familiares, por intermedio de laResolución 212/2025, también publicada en el Boletín Oficial de este lunes.
Según uno de los anexos de la normativa, desde mayo loshaberes correspondientes a la AUH se irán a $106.536, mientras que el importe para quienes residan en los distritos de la Zona 1 del país alcanzará los $138.497. Estos mismos montos regirán para la asignación por embarazo para protección social.
En esa línea, los titulares de asignaciones para protección social que tienen hijos con discapacidad recibirán ahora $346.901 y $450.972 para los residentes en la Zona 1, mientras que la Ayuda Escolar Anual será de $42.039, el pago por nacimiento $62.093 y por adopción $371.275 para todos los beneficiarios.
En cuanto a lostrabajadores en relación de dependencia, titulares de la prestación por desempleo, monotributistas, veteranos de guerra, jubilados y pensionados con hijos de hasta 18 años cobrarán por asignación familiar desde el mes próximo, los siguientes montos, según el ingreso del grupo familiar:
Los mismos montos y topes se aplican en la Asignación Familiar Prenatal.
Además, para este grupo se estipuló que la Asignación por Nacimiento será de 62.093, la Asignación por Adopción se elevará a $371.275 y la Asignación por Matrimonio se irá a $92.977, siempre que el Ingreso General Familiar (IGF) no supere los $4.367.942.
El artículo 4° de este documento aclaró que “la percepción de un ingreso superior a $2.183.971 por parte de una de las personas integrantes del grupo familiar referido en el artículo 1° del Decreto N° 1667/12, excluye a dicho grupo del cobro de las asignaciones familiares, aun cuando la suma de sus ingresos no supere el límite máximo de ingresos establecido en los anexos de la presente”.
ES
Newsletter Clarín
Recibí en tu email todas las noticias, coberturas, historias y análisis de la mano de nuestros periodistas especializados",https://www.clarin.com/economia/jubilaciones-gobierno-oficializo-valores-minimos-maximos-mayo-2025_0_XN0fHPxApl.html
Clarín,2025-04-27,Se duplicó la entrada de zapatillas importadas y llegan marcas deportivas extranjeras a la Argentina,"Se duplicó la entrada de zapatillas importadasyllegan marcas deportivas extranjeras al paísde la mano de socios locales. Influyen factores como la apertura comercial, la mayor venta de indumentariafitnesstras la pandemia, fenómenos en auge como elrunningy la caída de la producción nacional.
El negocio mueve US$ 233,86 millones en la Argentina, según la firma de investigación de mercadoClaight Corporation, y se espera una tasa de crecimiento anual compuesto de6,3%a 2034, hasta alcanzar un valor deUS$ 405,28 millonesese año.
De acuerdo a laCámara de la Industria del Calzado,la importación de este calzado terminadosubió un 60%en 2024por la apertura de la economía. Con las recientes medidas de flexibilización que tomó el Gobierno, el ingresose aceleró en el primer trimestre de 2025,con un aumento del 135%.
Cálculos del sector estiman que en Argentinase venden alrededor de 30 millones de pares de zapatillas deportivasal año, de los cuales aproximadamentela mitad son importados.
Como contracara, el rubro enfrentó en los últimos años desafíos comorecesión, alta inflación, devaluación y problemas de abastecimientopor el cepo, que elevaron los costos operativos y llevaron a fabricantes a recortar su producción.
Por caso, el año pasadose produjeron 19 millones de pares menosconsiderando todo tipo de calzado terminado, según la Cámara, yla actividadindustrial manufacturera cayó un 12,9%, de acuerdo al Indec.
Este panorama refleja unatendencia a la mayor presencia de productos importados, lo que plantea un reto en términos de competitividad y sostenibilidad para las firmas nacionales.​ Hacia fin de año, hubomás de 500 empleados afectadospor suspensiones y despidos en fábricas comoDassyTopper.
En este escenario local y en un contexto global en que se diversifica la industria, históricamente dominada por unos pocos gigantes −Nike, AdidasyPumaconcentran más del80%de las ventas en la Argentina−, las marcasempiezan a mirar al país como un destino atractivoen sus planes de expansión, frente a unademanda contenida que identifican que existepor la mayor cantidad de habitantes que usan ropa deportiva a diario y que reconocen que se evidencia en los tours de compra de los argentinos que viajan al exterior.
Skechers abrió en Unicentersu primer local. Tiene 115 metros cuadrados y está ubicado en el nivel 2. La empresa estadounidense está presente en más de180 paísescon más de5.200 tiendas, entre propias y de terceros. Según su último balance, 2024 fue unaño récord de ingresos, con un crecimiento del12,1%hasta losUS$ 8.970 millones. Y en el primer trimestre de 2025, tuvo una facturación deUS$ 2.411 millones, un7,1%más que entre enero y marzo de 2024.
Su llegada se concretó por medio de Grupo Blanco, que ya vendía online la marca y en cadenas como Dexter, Open Sports y Sportline, y tiene la representación en el país deDiadora, Athix, Alpine SkateyHavaianas.
Entre las que prevén desembarcar está ON Running, marca suiza especializada enrunningque tiene como inversor al tenistaRoger Federer. La traeGrupo Bisa, con la intención de abrir en 2026 dos locales, uno a la calle y otro en un centro comercial. Su portafolio ya incluye a la japonesaMizunoy la estadounidenseChampiony quiere pasar de un4%de participación que hoy tiene en el mercado a un8%.
También prevé volver la francesa Decathlon, de la mano deGrupo One, del empresarioManuel Antelo. Se fue en 2002 y tiene la idea de abrir 20 tiendas en 2026 en ciudades de más de 300.000 habitantes y dos antes de fin de año, una en la Ciudad y la otra en la zona norte de la Provincia.
Redactora de la sección Economíaagdevincenzi@clarin.com
Newsletter Clarín
Recibí en tu email todas las noticias, coberturas, historias y análisis de la mano de nuestros periodistas especializados",https://www.clarin.com/economia/duplico-entrada-zapatillas-importadas-llegan-marcas-deportivas-extranjeras-argentina_0_OUQxApBlu3.html
Clarín,2025-04-27,El dólar se acerca al medio de la banda sin que el Banco Central compre reservas,"Dos semanas después de la salida parcial del cepo, el dólar sigue sin encontrar el piso de $ 1.000 de las bandas cambiarias. El Gobierno cumplió así8 ruedas del nuevo esquema de flotación sin poder acercarse a su objetivodeclarado y sin que el Banco Central comprara reservas, una meta que no solo exige cumplir el Fondo Monetario para liberar desembolsos sino que es clave para bajar el riesgo país y volver a los mercados de deuda.
Desde el abandono abrupto del tipo de cambio fijo con una suba mensual del 1%, la cotización oficial del mayorista se movió en una montaña rusa: osciló entre $ 1.070 y $ 1.200 para cerrar el viernes en$ 1.169.Esto es un 9% por encima del valor previo al acuerdo con el FMI yun escalón más cerca del centro de la bandacambiaria de $ 1.200 que del piso al que apuesta el gobierno, pese a la resistencia que parece mostrar el mercado.
""Es normal que pase eso pero la tendencia es bajista"", insistió el equipo de Luis Caputo el viernes en una reunión con la Mesa de Enlace y las cerealeras. El titular de ARCA, José Luis Pazo, junto a los asesores del ministrodesembarcó en la Bolsa de Rosariopara ratificar que el 30 de junio subirán las retenciones, que el objetivo es bajar la inflación y que el modelo funciona con ""apreciación cambiaria"", por lo queno debían esperar una devaluación.
Los hombres de Caputo dicen inspirarse en el ""modelo japonés"" de apreciación cambiaria posguerra. ""Es mejor vender granos ahora que aún la rentabilidad da"", afirman. Pazo ya había aconsejado a los productores que hagan ""carry trade"" e inviertan en pesos, una recomendación que ahora el JP Morgan y elBank of Americahicieron a sus clientes.""No van aflojar, es una decisión cerrada e inalterable"", reconoció un exportador.
Así todo, algunos jugadores de la city ven difícil que se pueda sostener el tipo de cambio en $ 1.000 dado que los incentivos a mantener posiciones en pesos desde ahí con las tasas de interés serían muy bajos. ""Es esperable que el mercado se acomode por encima rápidamente, a pesar de que quizás por algunos pocos días los flujos puedan llevar la paridad a coquetear cerca del piso en forma excepcional"", señalaron en un banco extranjero.
Su expectativa es que el dólar se operemás ""en torno de $ 1.200-1.300""y que haya volatilidad (dado el margen de movimiento del 40% entre el piso y el techo de las bandas). Esos valores se aproximan al tipo de cambio de equilibrio de $ 1.360-1.400 estimado por los técnicos del FMI, según un informe de Equilibra, y a los $ 1.350 que cotizaba el MEP antes del golpe de timón. ""Están explorando el mercado, ya les va a salir bien"", dijo un banquero.
Los inversores externos y analistas en Estados Unidos mantienen reservas sobre el nuevo esquema cambiario. En un informe para el think tank Global Source Partners, el exviceministro de Economía,Joaquín Cottani, vinculado a Domingo Cavallo, advirtió que la anunciada ""Fase 3"" en realidad era un ""nuevo plan""a falta de uno previo, que las intervenciones serán la regla antes que la excepción y que el dólar ""flotará poco o nada"".
""Dada la preferencia del gobierno por mantener la inflación baja hasta las elecciones,es probable que el tipo de cambio nominal (TCN) se mantenga muy por debajo de $ 1.400, salvo que ocurra una crisis de confianza. Esto, combinado con una tasa de inflación de aproximadamente 3% mensual, implica que el tipo de cambio real (TCR) se depreciará muy poco, si es que lo hace, antes de las elecciones"", dijo el exfuncionario de Caputo
También surgen interrogantes sobre las reservas. Caputo minimizó la urgencia de utilizarlas para el pago de deuda durante una reunión con inversores en Washington, y se mostró optimista en cumplir la meta con el Fondo a partir de un superávit comercial proyectado de US$ 15.000 millones. Pero Cottani proyectó queel BCRA debe acumular US$ 4.600 millones de reservas netas antes del 30 de junioy un monto equivalente antes de fin de año.
Pese al apoyo que recibió el ministro de parte del FMI, el Tesoro de Estados Unidos y algunos bancos,la preguntaque circula en Wall Street es si el nuevo esquema""genera verdes o no"". ""Si el campo argentino no hace guita a este tipo de cambio y con estas retenciones…¿quién?"", deslizaron en un banco de Nueva York. ""No creo que haya sido sensación Argentina, es más lo que se vende acá que lo que pasa allá"", dijeron en una sociedad de bolsa.
Redactor de la sección Economíajbarca@clarin.com
Newsletter Clarín
Recibí en tu email todas las noticias, coberturas, historias y análisis de la mano de nuestros periodistas especializados",https://www.clarin.com/economia/dolar-acerca-medio-banda-banco-central-compre-reservas_0_i5jXnlUWnt.html
Clarín,2025-04-27,Jubilados: otro fallo ordena reajustar por inflación los haberes entre enero 2021 y marzo 2024,"La Cámara Federal de Mar del Plata declaró la""inconstitucionalidad e inaplicabilidad""del art. 1º de la ley 27.609, aprobada en diciembre de 2020 y resolvió quela movilidad jubilatoria debe calcularse en base al Índice de Precios al Consumidor que publica el INDEC, lo que arroja un haber sustancialmente mayor.
En la sentencia (“Gimenez Mirta Noemí c/ ANSES s/ reajustes varios) - que se suma a las de otros jueces y Cámarasreforzando la jurisprudencia favorable a los jubilados- los jueces Eduardo P. Jiménez y Alejandro O. Tazza sostienen que “transcurridos ya más de cuatro años desde la entrada en vigencia de la ley y frente al proceso inflacionario que azotó a la economía de nuestro país en estos últimos años, es que cabe examinar nuevamente el planteo ya sí, en esta instancia del proceso"".
Asi, la sentencia señala que “en el año 2021, losjubiladosobtuvieron un incremento total por aplicación de la ley n° 27.609 del 52,67% contra una inflación del 50,79%, es decir, se apreciaron sus haberes en términos reales en un 0,82 %. A su vez, en el año 2022, el incremento alcanzado por la citada normativa fue del 72,45% contra un aumento del IPC del 94,75%, lo que implica una pérdida del 11,6% contra la inflación. Asimismo, en el año 2023, los haberes previsionales subieron un 110,95% contra una inflación del 211,4%, lo que provoca una pérdida del 33,5%. Por último, en el periodo comprendido entre diciembre del 2023 y marzo de 2024, el aumento fue del 27,18% y la inflación del 51,62 %, es decir, una depreciación del 16,1%.La pérdida total del poder adquisitivo de los haberes acumulada en el período de vigencia de la Ley 27.609 es del 50,3%”.
Los jueces sostienen que el actual Gobierno reconoció que la fórmula establecida en la ley 27.609 había “arrojadoresultados desastrosospara los jubilados y pensionados del país, quienes han sufrido una notoria pérdida del poder adquisitivo.”. Pero, agregan, “tal reconocimiento solo ha considerado períodos futuros, sin que se elabore una fórmula compensando los “resultados desastrosos” obtenidos hasta entonces.”
Con relación a los bonos otorgados de refuerzo, la sentencia señala que los distintos decretos sancionados por el Poder Ejecutivo Nacional reconocieron la insuficiencia de la fórmula de movilidad y con ello eleva en definitiva los montos del haber mínimo, claro está quelo hace de manera solapada a través de los llamados “bonos” o “Subsidios extraordinarios”, ysólo a un grupo de jubilados y pensionados, aclara la sentencia.
Luego de señalar ""la notable pérdida del poder adquisitivo que ha sufrido el haber de la actora, el que no ha sido subsanado por ninguna clase de “subsidio extraordinario” ello en razón del monto de la prestación que percibe, el cual supera los haberes que han sido considerados “bajos” por parte del Poder Ejecutivo Nacional,"", la sentencia  declara la inconstitucionalidad del art. 1º de la ley 27.609 y en consecuencia disponer la inaplicabilidad de la fórmula allí establecida al caso de Autos.”.
""En su lugardeberá estarse al Índice de Precios al Consumidor que publica el INDEC, no obstante la solución aquí dispuesta solo se aplicará si el cálculo supone una mejora en la prestación que percibió la Sra. Giménez, debiendo estar a las disposiciones de la ley 27.609 en aquel período que eventualmente ésta resulte más favorable al haber de la actora.”
El abogado Adrián Tróccolil destaca que el fallo ""considera que los decretos de Alberto Fernández que otorgaron ""refuerzos extraordinarios""afectaron el derecho al igual tratamiento ante la Ley(no fueron generales sino a los de haberes mínimos). Y cuestiona que si bien el actual Gobierno (decreto 274/2024) reconoció los ""resultados desastrosos"" de la ley 27.609no implementó ninguna reparación ante la enorme pérdida de las jubilaciones y pensiones.
Redactor de la sección Economíaibermudez@clarin.com
Newsletter Clarín
Recibí en tu email todas las noticias, coberturas, historias y análisis de la mano de nuestros periodistas especializados",https://www.clarin.com/economia/jubilados-fallo-ordena-reajustar-inflacion-haberes-enero-2021-marzo-2024_0_8xcxH4X0Hz.html
Clarín,2025-04-27,"Supermercados mayoristas lanzan 'Black Week', una semana de ofertas para incentivar las ventas","Conun consumo que aún no repunta−cayó5,4%en marzo− y mientrassiguen negociando aumentos de precioscon las empresas tras la polémica que se generó luego de la salida del cepo,más de 200 supermercados mayoristas y sus proveedores preparan el primer evento de ofertasdel sector de 2025 con el objetivo de apuntalar las ventas.
Es la segunda edición de esta estrategia conjunta, que se estrenó en noviembre, cuando la industria se unió paralanzar la iniciativa antes de las Fiestas de fin de año.Tras meses de caídas, el sector tuvo en marzo unrepunte de ventas del 0,3%, según datos de la consultoraScentia.
Entre el 19 y el 25 de mayo, se desarrollará'Black Week Nacional Mayorista', una semana de rebajas en alimentos, bebidas, artículos de higiene, perfumería y limpieza y que permitirá tambiénhacer compras al por menor.Habrá descuentos de hasta el 40%.
Participarán empresas asociadas a laCámara Argentina de Distribuidores y Autoservicios Mayoristas (Cadam), que agrupa a los principales mayoristas del país. Entre las cadenas ya confirmadas, se encuentranMaxiconsumo–compañía del empresarioVíctor Fera, dueño también de la marcaMarolio– yNini Mayorista, fundada por el empresarioCarmelo Nini.
Se espera que en los próximos días confirmen su participación más sociosde la entidad que participaron de la primera edición, comoMakro, cadena que estaba en manos de capitales neerlandeses yla compró en eneroCencosud, el grupo chileno dueño deJumbo,DiscoyVea. En total, fueron 150 negocios los que se sumaron.
Según la cámara,el 60% de la compra de productos de primera necesidad se hace por medio del canal mayorista. Además del público directo, la acción apunta especialmente a consumidores de menores recursos −que suelen hacer las compras del día a día en estos comercios− y a que negocios minoristas accedan a stock especial a valores promocionales, en un contexto en el quese intensificó la competencia por quién ofrece el mejor precio.
El evento se decidió tras días de incertidumbrepor las subas que alimenticias y fabricantes de productos de consumo masivo intentaron aplicar en las góndolas a partir del nuevo esquema cambiario y quequedaron en suspenso tras la tensión que se generócon los supermercados y el Gobierno.
“Será un esfuerzo conjunto de toda la cadena tradicional del comercio”, adelantóJuan Castro, presidente de Cadam, y agregó: “Comenzará desde el origen, con las industrias que apoyan la iniciativa de los mayoristas, que abastecen a los almacenes y supermercados de barrio, unos 140.000 comercios de cercanía en todo el país, llegando a los consumidores en todo el país”.
Además, la industria se sumará aexponer sus “costos ocultos”:normativas, aportes, contribuciones obligatorias, promocionales o solidarias que se trasladan a precios.
Ante el subsecretario de Defensa del Consumidor y Lealtad Comercial,Fernando Blanco Muiño, en un evento del sector que tuvo lugar la semana pasada, los empresariosvolvieron a apuntar contra la carga impositiva, especialmente Ingresos Brutos y tasas municipales como los responsables de la distorsión de los precios ypidieron se sancione urgente una ley.
Y señalaron: “Cuando un consumidor compra, por ejemplo, una botella de vino o carne en un almacén o supermercado de cercanía,el precio final incluye una serie de aportes y contribuciones obligatorias y 'solidarias'que se han venido recaudando desde hace más de 20 o 30 años. Muchos de estos cargos se acumulan a lo largo de toda la cadena comercial, desde el productor hasta el punto de venta”.
Al respecto, Blanco Muiño destacó la decisión del ministro de Desregulación y Transformación del Estado,Federico Sturzeneggery la diputada nacional de La Libertad AvanzaMarcela Paganoporexponer el INACAP, el aporte obligatorio quedebían hacer mensualmente los comercios por capacitación de cada empleado.
Newsletter Clarín
Recibí en tu email todas las noticias, coberturas, historias y análisis de la mano de nuestros periodistas especializados",https://www.clarin.com/economia/supermercados-mayoristas-lanzan-black-week-semana-ofertas-incentivar-ventas_0_L7h7gtD6YI.html
Clarín,2025-04-27,El boleto de colectivo aumentará un 6% en mayo en la Ciudad y Provincia de Buenos Aires: así quedarán las tarifas,"El boleto de colectivo aumentará casi un 6%en la Ciudad y la Provincia de Buenos Aires el 1° de mayo y ejercerá presión sobre la inflación del mes entrante, trasla baja que se espera del IPC en abril respecto de marzo.
En las 31 líneas que prestan servicio dentro deCapital Federal, el pasaje subirá un5,7%; mientras que enterritorio bonaerenselo hará un5,9%, conforme a los ajustes establecidos por las autoridades locales de ambas jurisdicciones.
En el caso de las103 líneas sobre las que tiene injerencia el Gobierno Nacionalno incrementan sus pasajes desde agosto de 2024 yse mantendrán sin cambiosel mes próximo.
En abril, las tarifas de colectivos, subtes y peajes subieron un4,4%, luego del ajuste del10%de marzo. Las actualizaciones se dan tras la implementación deun sistema de indexación mensualbasado en la evolución de la inflación y otros parámetros, por lo que están previstos nuevos incrementos periódicos.
Las nuevas tarifas de los colectivos variarán según la jurisdicción:
Provincia de Buenos Aires:
Ciudad Autónoma de Buenos Aires:
El Gobierno mantendrá el subsidio a los 5,3 millones de beneficiarios dela Tarifa Social Federal mediante el pago con el sistema SUBE, lo que implica más de$ 25.000 millones mensuales. Registrar la SUBE abarata los costos de viajar en colectivo. Para registrar la tarjeta, hace falta crear una cuenta en el sitio oficial online y completar el formulario con el número de la SUBE y los datos personales del usuario.
Newsletter Clarín
Recibí en tu email todas las noticias, coberturas, historias y análisis de la mano de nuestros periodistas especializados",https://www.clarin.com/economia/boleto-colectivo-aumentara-6-mayo-ciudad-provincia-buenos-aires-quedaran-tarifas_0_A9LDMkqhuQ.html
Clarín,2025-04-27,Dólar ahorro hoy: a cuánto cotiza este domingo 27 de abril,"La cotización deldólar ahorroes de$1547para la venta este domingo 27 de abril de 2025.
El dólar ahorro sube3%respecto al mismo día de la semana anterior.
En lo que va de abril de 2025, el dólar ahorro sube respecto al mes anterior: la diferencia es de9%.
En comparación con el año pasado, el dólar ahorro sube un8%. A esta altura del año anterior, el ahorro cotizaba a$1430.4.
El valor deldólar ahorrotiene una diferencia con eldólar MEP. Mientras que el primero está$1547, el MEP cotiza hoy a$1184,50, lo que marca una brecha de31%.
Eldólar ahorroes un tipo de cambio mayor al dólar oficial, que se muestra como la opción más barata para comprar a modo de atesoramiento.
La compra deldólar ahorrohoy en Argentina se maneja bajo la siguiente cotización: el 30% del impuesto país se mantiene y el 35% del impuesto a las ganancias pasa a ser de un 45%, igualando la cotización del dólar tarjeta.
La cotización del dólar ahorro funciona en el mismo horario del mercado de cotizaciones:hasta las 16:30 horas, de lunes a viernes.
Estas operaciones reciben el nombre de “operaciones de liquidación con cable”. Para identificarlas se agrega una C al final del código de negociación de la especie. Así se diferencian de aquellas que se liquidan en pesos o dólares en cuentas radicadas en el mercado local.
Newsletter Clarín
Recibí en tu email todas las noticias, coberturas, historias y análisis de la mano de nuestros periodistas especializados",https://www.clarin.com/economia/dolar-ahorro-hoy-cotiza-domingo-27-abril_0_Mq9PcV4b7v.html
