diario,fecha,titulo noticia,contenido,link
Clarín,2025-03-26,Reconocen a emprendimientos de mujeres que “transforman la realidad”,"En su cuarta edición, la Iniciativa Pollera Pantalón reconoció ayer la labor de mujeres sobresalientes que generan un impacto positivo en sus comunidades y sectores. El galardón, que celebrala diversidad y la inclusión,se otorgó en cuatro categorías:Educación e Inclusión, Formación Ciudadana, Tecnología e Innovación, y Tolerancia y Respeto.
La Iniciativa Pollera Pantalón (PoPa), creada en 2018 para fomentar el liderazgo femenino y la inclusión en la toma de decisiones, entregó los premios Mujeres por Más, un evento que reúne a las emprendedoras, empresarias y lideresas más destacadas de diversas áreas.
La ceremonia, celebrada en el MALBA, reunió a más de 300 invitados, incluyendo líderes empresariales, funcionarios de los distintos niveles de gobierno, y representantes de la sociedad civil.
“Hoy celebramos el talento y el impacto de las mujeres en diferentes ámbitos. Este reconocimiento es un esfuerzo colectivo porvisibilizar y alentar la transformación sociala través de la acción femenina,” destacó Marina Rosso Siverino, presidenta de Pollera Pantalón, durante la apertura del evento. “Queremos ser un catalizador para que más mujeres ingresen en espacios de liderazgo donde sus voces son esenciales.”
En la categoría Tolerancia y Respeto,Carolina Zangfue reconocida por su labor al frente de JAEEE, una red quecombate el antisemitismoy promueve la educación y sensibilidad en el ámbito profesional. Su compromiso por la diversidad la ha posicionado como una figura inspiradora en el ámbito legal y empresarial.
El premio Educación e Inclusión fue otorgado aAlejandra Ferrari, quien lidera ALAMESA,un restaurante que brinda oportunidades de empleo a jóvenes con neurodiversidad. Ferrari utiliza la gastronomía como un medio para fomentar la inclusión y el crecimiento personal.
Formación Ciudadana premió a las fundadoras de Construyendo, Mariana Apella, Nathalie Sielecki y Silvina Pueyrredón. A través de su emprendimiento, acompañan proyectos socio-productivos en barrios vulnerables de Buenos Aires, generando trabajo y desarrollo.
Por último, enTecnología e Innovación, Elvira Muserifue reconocida por su labor en cofundar Antom.la, fondo que invierte en startups y emprendimientos que utilizan la tecnología para aportar soluciones a la crisis climática. Están totalmente comprometidos con el desarrollo del ecosistema de emprendimiento climáticos “climatech” en Latino-América.
El momento especial de la noche fue la entrega del Premio a la Trayectoria, que este año reconoció a laabogada, empresaria y fundadora de Pollera Pantalón, Fabiana Ricagno.La entrega fue una sorpresa para todos los asistentes, incluyendo para la propia Ricagno. “Para mi es una gran emoción, una alegría inmensa este reconocimiento de quienes han sido mis compañeras en este viaje hermoso que es el trabajo de Pollera Pantalón. Gracias al esfuerzo de todas nuestra iniciativa es la expresión de un profundo compromiso con la equidad de género, con la búsqueda de una mayor inclusión de las mujeres en la toma de decisiones y en puestos de liderazgo”, destacó.
Newsletter Clarín
Recibí en tu email todas las noticias, coberturas, historias y análisis de la mano de nuestros periodistas especializados",https://www.clarin.com/economia/reconocen-emprendimientos-mujeres-transforman-realidad_0_xXWGUGOkwB.html
Clarín,2025-03-26,El dólar blue superó los $ 1.300 y los financieros quedaron al borde: las cinco razones del salto,"Los dólares alternativos cruzaron la barrera de los $ 1.300, un límite que no traspasaban desde septiembre del año pasado. Después del mediodía el dólar blue marcó$ 1.310, un alza de quince pesos respecto del cierre de ayer.
El dólar contado con liqui, la vía de dolarización que utilizan las empresas, escaló a la mañana a$ 1.303, y finalmente cerró en$ 1.299,63,mientras el MEP pasó de$ 1.301 a $ 1.295,un nivel al que no se aproximaba desde comienzos de agosto del 2024.
Esta escalada está basada en la incertidumbre que atraviesa el mercado y que puede resumirse encinco razones concretas.
Si bien tanto desde el organismo como desde el Gobierno se esfuerzan por decir por vías oficiales y extraoficiales que se está progresando en las negociaciones y quepronto habrá ""fumata blanca"", aún no hay certezas sobre cuál será el monto final del acuerdo y cuáles serán las condiciones.
Se viene hablando de un monto deUS$ 20.000 millones, de los cuales la mayor parte será para repagarle vencimientos al propio Fondo y otra porción -¿US$ 6.000 millones?- para reconstituir las arcas delBanco Central.
En cuanto a las condiciones, la incertidumbre se centra en si habrá una exigencia para dejar de lado la actualización cambiario o crawling peg del 1% mensual ypasar a un esquema de flotación entre bandas.
Si la condición delFMIes abandonar el crawling peg e ir a bandas cambiarias para evitar que se repite la experiencia del 2018 y se dilapiden las reservas del Central en mantener un tipo de cambio ficticio,la pregunta que surge es cuál será el nuevo valor del dólar.
Sin una respuesta fácil, los inversoresprefieren atesorar billetesen caso de que el salto de la cotización sea marcado. Esto se potenció hace dos semanas, cuando el ministro Luis Caputo deslizó que se iría a un nuevo esquema cambiario.
""Los comentarios del ministro Caputodesanclaron las expectativashasta ahora alineadas con un esquema cambiario que fijaba el precio del dólar en el mercado oficial (crawl al 1% desde febrero)"", apuntó la consultora EcoGo.
El final del cepo también podría integrar las condiciones del acuerdo.Aunque el consenso del mercado apunta a que esto ocurrirá después de las elecciones legislativas de octubre, la falta de progresos concretos con el FMI alimenta los rumores de que esto podría ocurrir antes, por lo que nadie quiere que lo agarre desprevenido.
En medio de la tensión, día a díacrece la cantidad de inversores que abandonan las operaciones en pesos para apostar a la moneda dura. Esto implica ir desarmando el carry trade, la operatoria basada en invertir en pesos para aprovechar la tasa mientras el dólar está quieto.
Los movimientos en el mercado de los últimos días marcarían que el desarme de posiciones se está acelerando.
""El cambio abrupto en la narrativa oficial sobre el tipo de cambio impactó en las expectativas del mercado, llevando a los actores financieros aabandonar el carry y cerrar posiciones. Las liquidaciones de exportadores cayeron significativamente mientras que los importadores aceleraron pagos de deudas"", agregaron desde EcoGo.
En los últimos ocho días el Central vendióUS$ 1.361 millones, incluyendo los US$ 48 millones de este miércoles,para abastecer la demanda y las reservas brutas se achicaron aUS$ 26.246 millones. Es el nivel más bajo en seis meses.
La incapacidad del Central de atesorar divisas refuerza el temor de queno esté en condiciones de defender el tipo de cambioque pretende el Gobierno y que esto termine forzando una devaluación antes de lo deseado y mayor a la esperada.
Esto también se refleja en los activos argentinos. En esta rueda volvieron a caer las acciones y los bonos yel riesgo país se ubicó en 769 puntos básicos.
Redactora de la sección Economía, especializada en negociosaquiroga@clarin.com
Newsletter Clarín
Recibí en tu email todas las noticias, coberturas, historias y análisis de la mano de nuestros periodistas especializados",https://www.clarin.com/economia/dolar-blue-financieros-arriba-1300-razones-salto_0_SUqyxopaub.html
Clarín,2025-03-26,"Prueba de fuego para Luis Caputo: en medio de dudas por una devaluación, ofrecerá al mercado bonos atados al dólar","En medio de las tensiones cambiarias, conun Banco Central que no deja de vender dólaresy con el mercado atento a los detalles que puedan surgir dela negociación entre el Gobierno y el Fondo Monetario Internacional,el Ministerio de Economía busca despejar las dudas respecto a un posible salto cambiariocon un menú debonos atados al dólar,en una licitación clave que se hará este jueves.
El lunes próximo el Gobierno tiene vencimientos por $ 9,2 billones.Para cubrirlos, ofrecerá a los inversores una serie de bonos, entre los que se destacandos opciones de títulos atados al dólar.
La mirada del mercado está puesta en esos bonos. Son los mismos que en febrero y marzo el ministerio de Economía declaró desiertos por falta de interés.
En ese momento, tanto Luis Caputo como el secretario de Finanzas, Pablo Quirno, leyeron en la falta de demanda elaval del mercado a sus declaraciones de que no iba a haber una devaluación.“Ofrecimos un dólar link para los que veían atraso cambiario, pero no tuvo demanda”, había escrito Caputo en la red social X, mientras que Quirno avaló:“Una cosa son los que opinan, otra el mercado”.
Para la consultora Outlier, de Gabriel Caamaño, Economía está mandando un mensaje con la licitación de uno de los dos bonos dollar linked, que vence el 30 de junio. “Es un refuerzo de las declaraciones de varias figuras del Gobierno acerca de que al menosno se planea un salto cambiario en el corto plazo.Es una declaración del Tesoro de que, si elige subir abruptamente el tipo de cambio,pagará costos”.
Sin embargo, no creen que esa señal solucione lo que se está viendo estos días en el mercado. “Consideramos que, de no haber habido este tipo de instrumentos, los inversores lo hubiesen tomado como una'confirmación' de un salto por venir”.
En Cohen coincidieron: “Lo llamativo de esta licitación es la reapertura del dollar-linked a junio de este año, ofrecida en medio de unamarcada demanda de coberturaobservada en las últimas semanas”, dijeron y alertaron: ""Será clave monitorear las tasas que convalidará el Tesoro, dado que vencen $ 9,2 billones –un monto elevado en comparación con meses anteriores–, sumado a la volatilidad cambiaria y la presión al alza en las tasas que se vio en las últimas semanas”.
Para Cohen,la licitación “luce desafiante”,aunque destacaron que “el Tesoro cuenta con $ 6,1 billones depositados en la cuenta del Banco Central, lo que podría cubrir hasta un 66,4% de las obligaciones de este mes si la licitación no resultara exitosa”.
""A pesar de haberse moderado la volatilidad, el renovado apetito por cobertura cambiaria contra el dólar oficial sigue vigente. El mercado continúa asignandocierta probabilidad a que haya una modificación al esquema cambiario,principalmente del crawling peg del 1% mensual, que puede ir desde bandas a un deslizamiento del tipo de cambio oficial"", reconocieron en PPI.
Los analistas de PPI sumaron que con esta estrategia, Caputo ""no sólo busca descomprimir los futuros de dólar, amainando la demanda por cobertura cambiaria, sino tambiénanclar las expectativas devaluatoriaspara encausar el esquema cambiario a lo que supo ser hasta hace apenas un par de semanas. Es decir,que el crawling peg de 1% vuelva a creerse sostenible hasta las elecciones de medio término,lo que volvería a incentivar las estrategias decarry tradede exportadores e importadores y la toma de préstamos en dólares"".
Este miércoles, el mercado de futuros opera en baja y todos los contratos para este año presentan caídas. Los inversores ahora esperan que el dólar oficial estépor debajo de los $ .1400 en diciembre.Este desarme de las posiciones en futuros puede ser una pista de cuál será la reacción del mercado a la licitación de deuda del Tesoro.
NE
Newsletter Clarín
Recibí en tu email todas las noticias, coberturas, historias y análisis de la mano de nuestros periodistas especializados",https://www.clarin.com/economia/prueba-fuego-luis-caputo-medio-dudas-devaluacion-ofrecera-mercado-bonos-atados-dolar_0_7Z6sa3mR0G.html
Clarín,2025-03-26,La industria aumentó el precio por la yerba y los productores levantaron los piquetes,"La zafra yerbatera en Misiones comenzó a tomar velocidad esta semana, luego que los molinos cedieran ypropusieran abonar 300 pesos por kilo de hoja verde y en plazos que no superen los 60 días. El valor representa una mejora sustancial pero está todavía por debajo de los costos de producción.
La decisión del sector industrial dividió a los productores. En algunos lugares, como San Pedro, se levantaron los piquetes instalados a la vera de la ruta nacional 14, pero en otros lugares, como San Vicente, Campo Grande y Cruce Karaben, se mantenían.
“Había presiones de todos lados: de los tareferos (cosecheros), de los que hacen servicios de cosecha, porque están sin trabajar desde octubre del año pasado”, sostiene uno de los referentes de San Pedro que ya comienza a planificar la zafra 2025.
La situación se descomprimió de la forma menos pensada.Ocurrió cuando el molino Don Omar, de Andresito, en el extremo nordeste de Misiones, anunció que pagaría 300.5 pesos por kilo de hoja puesta en el establecimiento elaborador. La otra carta que jugaron fue acortar los plazos de pago: ahora no pasarán de 45 días, a partir de la entrega de la hoja verde.
Ese anuncio tuvo un efecto cascada, ya que rápidamente salieron otros establecimientos a ofrecer el mismo valor o muy similar.Si se tiene en cuenta que en enero en algunos lugares los productores recibían en promedio 200 pesos por kilo, la mejora es sustancial pero no suficiente para que el cultivo vuelva a ser rentable para el chacarero.
“En Andresito nos pidieron que entreguemos yerba de buena calidad porque ellos tienen un mercado exigente. La idea es que en los próximos meses se siga mejorando el precio y llegar al mes de julio con un valor de 350 pesos, que se acerca a los costos de producción que tenemos ahora”, sostuvo un productor de San Pedro, uno de los lugares donde más firme se mantuvo el paro yerbatero desde el mes de enero.
Desde Impulso Yerbatero, otras de las organizaciones de productores, Jorge Skripczuk, sostuvo que “no estamos conformes con el precio que están anunciando los industriales. Es una mejora pero no alcanza. Es por eso que nosotros apuntamos a que los productores cosechen lo mínimo para pagar las cuentas hasta que lleguemos a los 460 pesos por kilo, que no es un valor caprichoso, sino que surge del costo de producción más un margen de rentabilidad del 30 por ciento”.
Algunas de las cooperativas yerbateras adelantaron que pagarán valores más elevados a sus socios: entre 380 y 400 pesos por kilo de materia prima.
La mejora en el precio llegó después de varias semanas de acampe al costado de las rutas y la amenaza de frenar los camiones que transportaran hoja verde o yerba canchada (seca, sin molienda) y una toma pacífica de las instalaciones que la Agencia Tributaria de Misiones tiene en el paraje Centinela, límite con Corrientes.
El proceso de desregulación de la actividad yerbatera que impulsó el Gobierno Nacional por pedido de los molineros,generó un desplome de los precios de la materia prima.En 2023 la zafra terminó con las industrias abonando cerca de 400 pesos por kilo de materia prima. Un año después había bajado a la mitad porque el Gobierno le quitó al Instituto Nacional de la Yerba Mate (INYM) la facultad de fijar valores de referencia para la hoja verde y la yerba canchada. El resultado fue catastrófico: en pocos meses el precio se desplomó hasta los 200 pesos promedio pese al proceso inflacionario.
Mientras, en góndola, los precios al público no dejaron de incrementarse, privando al sector productivo yerbatero de ingresos por más de 200.000 millones de pesos sólo en 2024.
Corresponsal en Misionesmisiones@clarin.com
Newsletter Clarín
Recibí en tu email todas las noticias, coberturas, historias y análisis de la mano de nuestros periodistas especializados",https://www.clarin.com/rural/industria-aumento-precio-yerba-productores-levantaron-piquetes_0_052rSYcNdw.html
Clarín,2025-03-26,Consumos restringidos: los 10 gastos del día a día que se limitaron en el último año,"Pese ala desaceleración de la inflación,en el último año,la clase mediarestringió consumos cotidianos,gastos en servicios y“gustos” que antes se daba. El slogan de Milei “no hay plata” se siente en bolsillos aún impactados por la pérdida de poder adquisitivo.
La situación excede al gobierno actual. En los últimos cinco años,el poder de compra de los trabajadores con empleo estable sufrió unacaída del 10,6%,lo que refleja lafalta de actualización de los salariosen relación con el costo de vida. Los datos surgen de comparar la evolución del Índice de Precios al Consumidor (IPC) que mide el INDEC con la evolución de la Remuneración Imponible Promedio de los Trabajadores Estables (Ripte).
Un informe deBain & Company, que analizó los cambios de hábitos en el último año, habla deun “consumidor equilibrado”. Según el relevamiento ‘Consumer Pulse’ –que se realiza también en Chile, Colombia, México y Perú, y ya lleva seis ediciones–, los mayores recortes a nivel local se dieron encomida, ropa y salidas gastronómicas. En siete de las 10 categorías analizadas, la Argentina supera el porcentaje promedio de la región.
Un48%limitó las compras dealimentos, un39%lo hizo enindumentaria y accesorios; y un32%, en salidas arestaurantes y cafeterías.
Le siguen reducciones de un28%en aplicaciones deentregas a domicilio, un21%enbebidas con alcohol, un20%entransporte, un17%enelectricidad, otro17%en productos decuidado personal, un16%enentretenimiento y suscripcionesen el hogar y un13%enproductos de belleza.
Los datos reflejan queelconsumo masivo sigue sin recuperarsedespués del retroceso del13,9%de 2024,una de las peores marcas desde la crisis de 2001:fue el tercer peor registro de los últimos 22 años, luego de 2002 y 2003, segúnScentia.
Febrero fue el 14º mes de caída consecutiva,aunque con una dualidad. Por un lado,una baja generalizada en la compra de productos esenciales, luego de que 2025 arrancó con una merma del10,6%en enero.
En contraposición, con el dólar estable y la vuelta de las cuotas sin interés,creció la venta de bienes durablescomo electrodomésticos y tecnología, al igual que deautos y viajes al exterior.
Mientras que el último evento de ofertas del sector electrotuvo ventas superiores al 130%comparado a días de habituales, creció más de un70%interanualel número de patentamientos de vehículos 0 kilómetroen febrero yse aceleró la salida de argentinos al exterior:saltó más de74%el mes pasado, impulsado porel boom de viajes a Brasil.
Actualmente, reinaun estado de ánimo pesimista en los argentinos, según Bain & Company, perohay optimismo de cara al futuro. Hoy, solo un17%tiene un estado de ánimo positivo, de acuerdo al informe. De todos modos, el58%cree que el país estará enuna mejor situación en cinco años.
Un relevamiento deShopAppde mitad de 2024 ya había advertido quenueve de cada 10 cambiaron hábitosydejaron de consumir productos por su “precio excesivo”.Quienes másabandonaron las primeras marcasson compradores de nivel socioeconómico alto y mayores de 50 años. Un 43% va a los comerciossolo los días de promocionesy un 21% lo hace cuando combina las ofertas propias de los supermercados con las bancarias.
En ese sentido,seis de cada 10 encuestados migró a segundas marcasy casi la totalidad considera comprar lasmarcas propiasde las cadenas de supermercados. En productos de almacén, falta conquistar a un 11% que no se animan a elegirlos. En lácteos, a un 10%.
NE
Redactora de la sección Economíaagdevincenzi@clarin.com
Newsletter Clarín
Recibí en tu email todas las noticias, coberturas, historias y análisis de la mano de nuestros periodistas especializados",https://www.clarin.com/economia/consumos-restringidos-10-gastos-dia-dia-limitaron-ultimo-ano_0_Bg8dZIfoBP.html
Clarín,2025-03-26,De las ciencias políticas al pádel: la start up argentina que puso de moda ese deporte en la Bahía de San Francisco,"Lucas Tepman se considera unprivilegiadopor algo que muchos no reconocen: estudió Ciencias Políticas en la UBA que fue un trampolín para ganar la beca Fulbright en Estados Unidos. Al margen de sus horas como consultor en tiempos de Mauricio Macri, llegar a San Francisco, lo impulsó a otras actividades en esa tierra donde se multiplican las start up.
Con la beca se dedicó a unamaestría en desarrollo económico sustentableen la Universidad de California, en Berkeley. Así descubrió al pádel, un deporte que según la leyenda se originó en las playas mexicanas de Acapulco en los años 60. Se trata de un deporte que se juega por parejas, similar al tenis, pero con otras reglas.
En EE.UU. no tenía competencia y nació la oportunidad. Puso manos a la obra y junto  con su socio, elingeniero mecánico, Matías Gandulfo, crearon Baypadel que cobija a clubes de ese deporteen canchas con paredes especiales de un vidrio flexible e irrompible y un piso de caucho que permite el rebote de los jugadores y evita las consecuencias de caídas.
A estos emprendedores les sobran esperanzas, al descubrir una actividad“fácil de aprender y dominar”, le cuenta Tepman aClarín.Claro que el negocio no son solo las canchas sino los clubes de pádel que permiten generar redes de contacto y amistades entre sus socios, algo muy valorado en el país del Norte.
En la primera ronda de inversión participaron Tamar Capital, con base en Londres, un “family office” argentino cuyo nombre no pueden revelar y EEP Capital.Sumaron US$ 3 millones en el arranque de un negocio con una suculenta tasa de retorno del 35%.
Contabilizan tres clubes de Padel y prevén llegar a los siete este año y saltar a 30 en poco tiempo. Cuentan con el espaldarazo de David Nalbandian que los ayuda en la promoción. También, el tenistaMarcel Felder, reconocido como la “primera raqueta de Uruguay”y Guga Vázquez, un jugador de pádel de la Argentina, campeón del último torneo internacional. Por cierto, el pádel ya es un deporte que está ganando fans entre las celebridades comoDavid Beckham, Serena Williams y Lionel Messi.
Los clubes, que se inauguraron en 2023, funcionan bajo la marca Bay Padel. El primero se ubica en unhangar de la Segunda Guerra Mundialen Treasure Island. Y dada la altura de sus techos, el lugar fue elegido además como escenario de la final del torneo de la US Padel Association. También lograron una alianza con Googley otro club se ubicó en Palo Alto, sede de la líder de los buscadores.
El efecto imitación, que en EE.UU. se conoce como me too, está haciendo del pádel el deporte de mayor crecimiento y “se abrieron inclusofondos de capital de riesgo específicos. Las personas quieren otro deporte de raqueta y están abiertas a probar cosas nuevas”, se ilusiona Tepman que tiene entre sus planes llevar los clubes a Canadá.
Editora de la sección Economíasnaishtat@clarin.com
Newsletter Clarín
Recibí en tu email todas las noticias, coberturas, historias y análisis de la mano de nuestros periodistas especializados",https://www.clarin.com/economia/ciencias-politicas-padel-start-up-argentina-puso-moda-deporte-bahia-san-francisco_0_wq7e6FpEpp.html
