diario,fecha,titulo noticia,contenido,link
Clarín,2025-03-27,Dólar hoy: a cuánto cotizan el oficial y sus diferentes tipos de cambio este jueves 27 de marzo,"Eldólar oficialcotiza estejueves 27 de marzoa $1051,50 para la compra y $1091,50 para la venta en las entidades bancarias.
En cuanto aldólar blue, esta jornada cotiza a $1290 para la compra y $1310 para la venta. Así, marca una brecha de 23% con respecto al dólar oficial. Elvalor del dólar bluetiene una diferencia sustancial con el dólar oficial, que se adquiere en los bancos y que posee una cotización establecida.
Por otro lado, eldólar turista(también conocido comodólar solidario) cotiza a $1418,95. Este valor es el que se utiliza al momento de comprar dólar para ahorro o de realizar transacciones en el exterior y surge de la suma de un 30% al valor del dólar oficial del día.
Otro de los tipos de cambio es eldólar mayorista, el cual inicia el día a $1318 para la compra y $1320 para la venta.
En relación alContado con liqui(CCL), el precio de referencia es de $1338,50. El CCL es la operatoria que permite a las empresas comprar papeles argentinos en el mercado local y venderlos en el exterior para lograr así girar divisas para ""atesoramiento"".
Hoy en Argentina conviven al menos seis tipos de cotizaciones distintas para la moneda estadounidense, algunas más usadas que otras.
Dólar ahorro/tarjeta o dólar turista/solidario: tiene el recargo del 30% dispuesto por el Gobierno sobre las compras realizadas con tarjeta en moneda extranjera y sobre la adquisición de divisas para atesoramiento dentro del circuito oficial.
Dólar blue: es el billete que se vende en el mercado informal, a través de cuevas o “arbolitos” en la calle.
Contado con Liqui: es una operación legal para conseguir dólares en el exterior. Se convirtió en el camino preferido de las empresas. Se compran títulos o acciones argentinas en pesos y luego se venden en el exterior en dólares.
Dólar oficial o minorista: es el precio al que pueden acceder los particulares pero siempre dentro del cerco de US$200 establecido por el cepo.
Dólar mayorista: es el que se usa para el comercio exterior, el pago de deudas dolarizadas y de dividendos. Teóricamente es el que incide en la fijación de los precios de los productos importados.
Dólar para industria y servicios: por el efecto de las retenciones, los exportadores de manufacturas y de servicios reciben en realidad un dólar a un valor más bajo que el oficial, y mucho más bajo que el blue. Dentro de esta categoría, hay distintos valores para quienes exportan carne y lácteos, para trigo, maíz y girasol y para la soja.
Newsletter Clarín
Recibí en tu email todas las noticias, coberturas, historias y análisis de la mano de nuestros periodistas especializados",https://www.clarin.com/economia/dolar-hoy-cotizan-oficial-diferentes-tipos-cambio-jueves-27-marzo_0_BJax2J3mUP.html
Clarín,2025-03-27,Nueva medida de fuerza en las fábricas de neumáticos: el gremio Sutna pide un “bono extraordinario” mientras siguen los despidos,"Las tres fábricas de neumáticos que funcionan en el país están atravesadas desde el mediodía del miércoles hasta mitad de este jueves porun paro de 24 horasque dispuso el Sindicato del Neumático (Sutna). La protesta, según difundió el gremio, es para reclamar por una mejora de los haberes salariales de enero y febrero y por la negativa de las empresas de sumar un ""bono extraordinario"" a los haberes.
En el caso deBridgestone, que tiene su planta en Llavallol, la convocatoria al paro acusa a esta empresa de capitales japoneses de haber concretado “despidos ilegales”.
Las otras dos fábricas sonPirelli, en Merlo, yFate, en San Fernando. El gremio, cuyo secretario general esAlejandro Crespo, acusó a Pirelli de “violencia y acoso en el mundo del trabajo” y a Fate, la única de las tres empresas que es de capitales nacionales, por “su forma ilícita de otorgar vacaciones”.
La adhesión al paro fueimportantee, según fuentes del sector,pero no generalizada.Mientras el propio Sutna difundió en sus redes un video donde se ve una columna encabezada por el gremialista Crespo marchando dentro de las instalaciones de Pirelli, cantando “Pirelli ya paró”, en Bridgestone la adhesión fue dispar según los turnos (las fábricas trabajan las 24 horas).
Si bien el escenarioremite de manera inmediata a las protestas de mediados de 2022,cuando el Sutna paralizó durante varios meses la producción de neumáticos en el país en reclamo de mejoras salariales y del convenio colectivo de trabajo, ahora el contexto cambió drásticamente con la apertura importadora del gobierno de Milei.
Según denunció ayer el sindicalista opositor a Crespo y ex titular del Sutna,Pedro Wasiejko, desde que asumió el gobierno libertario las tres empresas fabricantes concretaron1.400 despidosde operarios y actualmente entre las tres suman4.000 puestos de trabajo.
La principal diferencia con la crisis de 2022es la drástica caída de las ventas.Además de la mayor oferta a causa de las importaciones, la venta de neumáticos se contrajo fuertemente desde comienzos de 2024 y todavía no se recuperó, según fuentes del sector. “Tenemos inventarios de producto sin venderpara varios meses”, graficó un directivo.
Según el Sutna, el paro de 24 horas apunta a forzar a las tres fábricas a “generar las condiciones para que las patronalesabandonen su posición de importar neumáticosreemplazando mano de obra nacional y tengan que producir en el país, en vez de desvincular trabajadores y pretender flexibilizar las ya difíciles condiciones laborales”.
La semana pasada, Bridgestonecesanteó a casi 70 operarios, según confirmaron fuentes del sector, que se suman a las450 despidosque concretó el año pasado. Los despidos del año pasado fueron en el marco del Procedimiento Preventivo de Crisis (PPC) que la empresa solicitó a la Secretaría de Trabajo para poder ajustar su dotaciónpor fuera de lo establecido por el convenio colectivo de trabajo.
Aquellos despidos fueron finalmentecon una indemnización del 100%(el PPC habilita a las empresas a una reducción de hasta 50% de las indemnizaciones), pero aun así Bridgestone solicitó extender su procedimiento de crisis durante este año, paraforzar una renegociación del convenio colectivo de trabajo con el gremio,con el cual tiene vigentes cláusulas que establecen el pago dedos bonos extra por año, uno por “productividad” y el otro por “participación en las ganancias” de la compañía.
Los despidos de la semana pasada habrían sido en las mismas condiciones (indemnización al 100%) pero aun así Bridgestone mantiene ante Trabajo su reclamo de forzar una mesa de negociación con el gremio que encabeza Crespo, para flexibilizar el convenio colectivo de trabajo. El gremio, cuya Lista Negra viene ganando las elecciones internas y responde políticamente al Polo Obrero, respondió doblando la apuesta.
En el caso de Pirelli, la empresa de capitales italianos se retiró de las negociaciones convocadas por el ministerio de Trabajo de la Provincia de Buenos Aires. Y en Fate, según un comunicado que ayer difundió el ex titular del Sutna, Wasiejko, la empresa de la familia Madanes también “anunció despidos”. Fuentes del sector empresario afirmaron que se trata de una versión aun no confirmada.
Las mismas fuentes señalaron que la situación general de las tres fábricas está comprometida por las condiciones macroeconómicas, principalmente por el tipo de cambio que impide competir contra Brasil. Pero también apuntaron a la intransigencia del gremio. ""Hoy con la misma máquina y la misma dotación somos 30% a 40% menos competitivos que la misma planta en Brasil. Más allá de ajustar la dotación de operarios,no se puede ser competitivos a nivel internacional con estos costos laborales"", agregaron.
Editor del Suplemento Económico y de Pymeslceriotto@clarin.com
Newsletter Clarín
Recibí en tu email todas las noticias, coberturas, historias y análisis de la mano de nuestros periodistas especializados",https://www.clarin.com/economia/nueva-medida-fuerza-fabricas-neumaticos-gremio-sutna-pide-bono-extraordinario-siguen-despidos_0_al6myqKWkS.html
Clarín,2025-03-27,Reservas en rojo: por qué el Banco Central pasó de comprar dólares a tener que salir a venderlos,"En marzo el Banco Central interrumpió una racha de siete meses de compra de divisas. En pocas semanas y con las negociaciones con el Fondo Monetario todavía sin definirse, el escenario se dio vuelta y pasó a enfrentar un saldo vendedor, que ya se llevóUS$ 737 millonescuando faltan dos ruedas para que termine el mes.
Este miércoles vendió otrosUS$ 48 millonesy así se desprendió deUS$ 1.361 millonesen las últimas ocho ruedas, la peor performance desde octubre 2019.
Pese a estos números negativos de marzo, el saldo del primer trimestre el saldo es positivo enUS$ 2.496 millonesdebido a las compras netas de enero y febrero. Desde el inicio de la actual gestión del gobierno el BCRA ha adquirido unosUS$ 24.525 millonesen el Mercado Unico y Libre de Cambios (MULC).
Ese volumen de compra fue posible porque a lo largo del 2024 el Gobierno logró convencer al mercado de quecumpliría su promesa de no devaluar más allá del 2% mensual. Y así lo hizo.
Además, creció la oferta de dólares con el efecto de la cosecha y de las exportaciones de energía y se expandió con el blanqueo que acercómás de US$ 20.000 millones a los bancos, lo que llevó a que los depósitos en moneda dura fueran los más altos en cinco años.
Pero esto empezó a cambiar en el 2025, cuando aumentó elgoteode la salida de dólares. La decisión del Gobierno de llevar el crawling peg del 2% al 1% no llego a despertar confianza yaumentó la ansiedad por el cierre del acuerdo con el Fondo Monetario, que se viene dilatando pese a que desde el final del 2024 los funcionarios dicen que ya está casi listo.
¿Cuáles fueron las razones que hicieron que el Central dejara de comprar y tuviera que salir a vender?
Pablo Repetto, economista de Aurum Valores, apunta que, en el marco de las negociaciones con el Fondo Monetario, ""el primer factor es la incertidumbre que se generó a partir de las declaraciones del ministroLuis Caputoacerca de que se iba haciaun nuevo esquema cambiario"".
""Este fue el disparador para la búsqueda de algún grado de cobertura"", señala.
A esto se agregó un cambio en las condiciones del mercado, ya que el Central durante varios meses compró divisas a partir del crecimiento del crédito en dólares potenciado por el blanqueo de capitales. La razón es que las empresas están obligadas a liquidar esos créditos en el Mercado Unico y Libre de Cambios (MULC), lo que aumentaba la oferta por esa vía.
""Ese esquema llegó a un cierto agotamiento. Las empresas al ver que no estaba claro el esquema cambiario que sobrevendría al acuerdo con el FMI dejaron de tomar crédito al ritmo al que venían y el BCRA perdió una fuente de divisas"", sostiene Repetto.
El otro cambio que se produjo fue que los importadores, que venían postergando la decisión de pedirle divisas al Central para aprovechar la ganancia que ofrecían las tasas en pesos,empezaron a pedirle dólares para cancelar sus deudas.
Un factor adicional que ve Repetto es que ""los exportadores ya liquidan menos"". Hoy las exportaciones se canalizan a través del dólar blend, formado en un 80% por el tipo de cambio oficial y un 20% por el contado con liqui.
""Hay menos oferta en el dólar blend esperando que tal vez les convenga liquidar más adelante"", dice Repetto. A su vez, la menor oferta en el blend tambiénachica la oferta en el contado con liqui,que tiende a subir de precio y esto lleva al Central a tener que intervenir en este segmento para que la brecha cambiaria no se escape.
Desde el Gobierno apuestan a que el acuerdo con el Fondo Monetario y la llegada de la cosecha gruesa cambien el panorama y le permitan al Central volver a comprar divisas.
Para los analistas no está claro que esto ocurra en medio de la incertidumbre cambiaria. Una muestra de esto es que subió la tasa de devaluación esperada que muestra el dólar futuro. ""Si la expectativa sigue siendo esta va a ser difícil que el Central pueda acumular reservas de manera persistente por más que esté por llegar la cosecha.Algo más debería pasar y ese algo más debería ser que se defina de manera contundentecuál será el esquema cambiario,cosa que veo difícil que puedan hacer"".
Redactora de la sección Economía, especializada en negociosaquiroga@clarin.com
Newsletter Clarín
Recibí en tu email todas las noticias, coberturas, historias y análisis de la mano de nuestros periodistas especializados",https://www.clarin.com/economia/reservas-rojo-banco-central-paso-comprar-dolares-tener-salir-venderlos_0_UlCCemTQT0.html
Clarín,2025-03-27,"Dólar hoy y dólar blue, EN VIVO: a cuánto cotizó y cuál fue su precio este jueves 27 de marzo, minuto a minuto","Eldólar bluebajó diez pesos y cotizó este jueves 27 de marzo a $1.300.En tanto, eldólar oficialse ubicó en $1.091,75para la venta en la pizarra del Banco Nación. Seguí todas las instancias de la jornada cambiaria en la cobertura minuto a minuto deClarín.
La cotización paralela de la divisa norteamericana se ubicó en los $1.300 para la venta y $1.280 para la compra, lo que significó una variación negativa del 0.76% respecto a la rueda del miércoles.
El precio oficial para la venta cerró en $1.091,75, mientras que el riesgo país bajó 3 puntos básicos y finalizó la jornada en 759.
El mercado está atento a las novedades del Fondo, mientras se mantienen las dudas sobre el frente cambiario. La autoridad monetaria se desprendió de US$ 84 millones.Leer más.
DOLOR INFINITO EN MANDRILANDIALa economía subiendo muy fuerte...CIAO MANDRILES...!!!https://t.co/Ogvp4ejAAU
""La economía subiendo muy fuerte... CIAO MANDRILES...!!!"", escribió el Presidente junto a la publicación del INDEC que refleja el dato económico.
🇦🇷🇦🇷🇦🇷https://t.co/wFyL8LIdOw
El ministro de Economía publicó en redes tres emojis de banderas argentinas junto a la información publicada en la misma plataforma por la cartera que él conduce.
Así lo arrojó la comparación interanual del Estimador Mensual de Actividad Económica (EMAE).Leer más.
Es porque en CABA sobresalen las actividades de servicios públicos y privados, comercio y construcción. Y no hay actividad agropecuaria ni minera, rubros que registraron el año pasado una importante expansión.Leer más.
El precio oficial de la divisa norteamericana cerró con un alza del 0,02% y se ubicó en los $1.091,75 para la venta y $1.051,75 para la compra.
Lo dijo el vocero Manuel Adorni, en una conferencia de prensa realizada luego de que el ministro Caputo revelara que el monto será de 20 mil millones de dólares. Negó que el organismo exija devaluar y aseguró que ""el programa es nuestro y el Fondo se acopla"".Leer más.
El índice elaborado por JP Morgan disminuye 3 puntos básicos respecto al cierre de este miércoles y se ubica en 759 puntos básicos.
El presidente de la Nación brindó una entrevista tras el anunció del ministro Caputo sobre el monto acordado con el FMI para un nuevo préstamo.Leer más
Se trata de Alejandro Werner, quien comandó el préstamo que el organismo negoció con la gestión de Mauricio Macri. “Va a ser importante saber cuál es el plazo del acuerdo"", señaló.Leer más.
En lo que va del día desciende 10 pesos. Para la compra se ubica en $ 1.280.
En medio de la sangría del Banco Central y en el inicio de una rueda clave, donde el Tesoro busca, por un lado, renovar vencimientos en pesos y, por otro, desterrar temores de una devaluación, Luis Caputo apuró un anuncio sobre el monto acordado con el Fondo Monetario para el acuerdo que terminará de firmarse el mes que viene. El frente cambiario respondió con cautela: si bien las cotizaciones financieras caen, el dólar blue todavía se consigue en la calle por encima de los $ 1.300, a $ 1.305.
En la apertura de la rueda de este jueves, el dólar financiero retrocede levemente: el dólar MEP baja 0,2% a $ 1.293,40; mientras que el CCL cae 0,8% y opera a $ 1.289,70.
De esta manera, borran parte de la suba que habían registrado el miércoles, en una jornada que estuvo marcada por la caída del dólar futuro y la expectativa por la licitación de deuda de este jueves.Leer más.
Baja cinco pesos y se vende a $ 1.305. Para la compra se ubica en $ 1.285.
El ministro de Economía, Luis Caputo, formalizó el monto involucrado en el acuerdo que se discute con el Fondo Monetario Internacional horas después de haber hablado con la titular de ese organismo, Kristalina Georgieva.
Fuentes cercanas al ministro comentaron que Caputo tomó contacto con Georgieva el miércoles por la tarde-noche para sugerirle que sería conveniente echar algo de luz sobre lo que se está negociando para, dicen en Hacienda, calmar las expectativas del mercado, que en los últimos días empezó a especular sobre el contenido del acuerdo y, en esas especulaciones, aparecieron como posibles ciertas exigencias que, para Economía, llevaron turbulencias injustificadas a la operatoria diaria. La palabra ""devaluación"" empezó a sonar con fuerza, sin ir más lejos. También al de bandas cambiarias que sustituyan al crawling-peg del 1% mensual.Leer más.
Aumenta 25 centavos con respecto al cierre del miércoles.
Los bonos de la deuda argentina empezaron el día cotizando en rojo en el llamado ""premarket"", las operaciones previas a la apertura.
Pero, tras el anuncio que realizó este jueves a la mañana el ministro de Economía Luis Caputo, que reveló que el monto que el Gobierno negoció con el staff técnico del Fondo Monetario Internacional es de US$ 20.000 millones, los títulos se dieron vuelta.
En Wall Street, los bonos avanzan casi 1%, con el mayor incremento en el Global 2035.Leer más.
En medio de las tensiones cambiarias, con un Banco Central que no deja de vender dólares, el ministro de Economía, Luis Caputo, confirmó este jueves que el acuerdo con FMI será por 20.000 millones de dólares y acusó a la oposición de querer desestabilizar al gobierno de Javier Milei.
""El monto que nosotros acordamos con el staff, que iban a someter a aprobación del board, que es en definitiva el que decide si se aprueba esto o no. Ese monto es de 20 mil millones de dólares"", enfatizó Caputo.Leer más.
Luego de oficializar el aumento del 2,4% a jubilados y pensionados junto con el bono de $70 mil, el Gobierno anunció el mismo ajuste para las distintas asignaciones familiares, desde abril de este año. Lo hizo a través de la Resolución 186/2025 de la Administración Nacional de la Seguridad Social (ANSeS), publicada este jueves en el Boletín Oficial.
En específico, el documento estableció un ""incremento de los límites y rangos de ingresos del grupo familiar y de los montos de las asignaciones familiares previstas en la Ley N° 24.714"".
La medida fijó que los trabajadores en relación de dependencia, titulares de la prestación por desempleo, monotributistas, veteranos de guerra, jubilados y pensionados con hijos de hasta 18 años, cobrarán desde el mes próximo por asignación familiar los siguientes montos, según el ingreso del grupo familiar, teniendo en cuenta que las mismas cifras y topes se aplican en la Asignación Familiar Prenatal.Leer más.
En marzo el Banco Central interrumpió una racha de siete meses de compra de divisas. En pocas semanas y con las negociaciones con el Fondo Monetario todavía sin definirse, el escenario se dio vuelta y pasó a enfrentar un saldo vendedor, que ya se llevó US$ 737 millones cuando faltan dos ruedas para que termine el mes.
Este miércoles vendió otros US$ 48 millones y así se desprendió de US$ 1.361 millones en las últimas ocho ruedas, la peor performance desde octubre 2019.
Pese a estos números negativos de marzo, el saldo del primer trimestre el saldo es positivo en US$ 2.496 millones debido a las compras netas de enero y febrero. Desde el inicio de la actual gestión del gobierno el BCRA ha adquirido unos US$ 24.525 millones en el Mercado Unico y Libre de Cambios (MULC).Leer más.
La cotización de la divisa de Estados Unidos en las pizarras del Banco Nación cotiza estable este jueves.
La autoridad monetaria realizó ayer una fuerte venta de divisas.
La divisa se consigue en el mercado paralelo a $ 1310, tras haber subido ayer $ 15.
Newsletter Clarín
Recibí en tu email todas las noticias, coberturas, historias y análisis de la mano de nuestros periodistas especializados",https://www.clarin.com/economia/dolar-hoy-dolar-blue-vivo-cotiza-precio-jueves-27-marzo-minuto-minuto_0_PwbK0747Uy.html
Clarín,2025-03-27,Dólar ahorro hoy: a cuánto cotiza este jueves 27 de marzo,"La cotización deldólar ahorroes de$1418,95para la venta este jueves 27 de marzo de 2025.
El dólar ahorro sube0%respecto al mismo día de la semana anterior.
En lo que va de marzo de 2025, el dólar ahorro sube respecto al mes anterior: la diferencia es de1%.
En comparación con el año pasado, el dólar ahorro sube un1%. A esta altura del año anterior, el ahorro cotizaba a$1401.6.
El valor deldólar ahorrotiene una diferencia con eldólar MEP. Mientras que el primero está$1418,95, el MEP cotiza hoy a$1292,70, lo que marca una brecha de10%.
Eldólar ahorroes un tipo de cambio mayor al dólar oficial, que se muestra como la opción más barata para comprar a modo de atesoramiento.
La compra deldólar ahorrohoy en Argentina se maneja bajo la siguiente cotización: el 30% del impuesto país se mantiene y el 35% del impuesto a las ganancias pasa a ser de un 45%, igualando la cotización del dólar tarjeta.
La cotización del dólar ahorro funciona en el mismo horario del mercado de cotizaciones:hasta las 16:30 horas, de lunes a viernes.
Estas operaciones reciben el nombre de “operaciones de liquidación con cable”. Para identificarlas se agrega una C al final del código de negociación de la especie. Así se diferencian de aquellas que se liquidan en pesos o dólares en cuentas radicadas en el mercado local.
Newsletter Clarín
Recibí en tu email todas las noticias, coberturas, historias y análisis de la mano de nuestros periodistas especializados",https://www.clarin.com/economia/dolar-ahorro-hoy-cotiza-jueves-27-marzo_0_4u9FFYhydH.html
Clarín,2025-03-27,Dólar tarjeta hoy: a cuánto cotiza este jueves 27 de marzo,"La cotización deldólar tarjetaes de$1418,95, este jueves 27 de marzo de 2025.
El dólar tarjeta sube0%respecto al mismo día de la semana anterior.
En lo que va de marzo de 2025, el dólar tarjeta sube respecto al mes anterior: la diferencia es de1%.
En comparación con el año pasado, el dólar tarjeta sube un1%. A esta altura del año anterior, el dólar tarjeta cotizaba a$1401.6.
El valor deldólar tarjetatiene una diferencia con eldólar blue. Mientras que el primero está$1418,95, el blue cotiza hoy a$1290, lo que marca una brecha de10%.
Eldólar tarjetaes el tipo de cambio que se emplea para el pago de consumos con tarjeta de débito y crédito en el exterior así como para la compra, también en dólares, de pasajes y paquetes turísticos hacia destinos fuera de la Argentina.
El valor deldólar tarjetase conforma de la siguiente manera: al dólar oficial se le añade un 30% de impuesto país y un 30% de ganancias. Se trata de una carga impositiva total del 60%, frente al 155% que existía en la gestión anterior.
La cotización del dólar tarjeta funciona en el mismo horario del mercado de cotizaciones:hasta las 16:30 horas, de lunes a viernes.
Newsletter Clarín
Recibí en tu email todas las noticias, coberturas, historias y análisis de la mano de nuestros periodistas especializados",https://www.clarin.com/economia/dolar-tarjeta-hoy-cotiza-jueves-27-marzo_0_Uc4KbLSi6C.html
Clarín,2025-03-27,Dólar CCL hoy: a cuánto cotiza este jueves 27 de marzo,"La cotización deldólar CCLes de$1338,50para la compra y de$1297,50para la venta, este jueves 27 de marzo de 2025.
El dólar CCL sube4%respecto al mismo día de la semana anterior.
En lo que va de marzo de 2025, el dólar CCL sube respecto al mes anterior: la diferencia es de11%.
En comparación con el año pasado, el dólar CCL sube un28%. A esta altura del año anterior, el CCL cotizaba a$1048.9.
El valor deldólar CCLtiene una diferencia con eldólar MEP. Mientras que el primero está$1338,50, el MEP cotiza hoy a$1292,70, lo que marca una brecha de4%.
Eldólar CCL o dólar contado con liquidaciónes uno de los tipos de cambio financieros más usados en el país, junto con el dólar MEP (o dólar bolsa). Se trata de una herramienta financiera que permite cambiar pesos por dólares en el exterior. Muchas empresas e inversionistas usan este método para adquirir divisas y sacarlas del país legalmente.
Eldólar CCL o dólar contado con liquidaciónconsiste en la compra de un bono en pesos (AL30) o en dólares (AL30D) para venderlo en especie C (AL30C). Mediante estas 2 simples operaciones podés ingresar dinero a cuentas de inversión en Estados Unidos.
La cotización del dólar CCL funciona en el mismo horario del mercado de cotizaciones:hasta las 16:30 horas, de lunes a viernes.
Estas operaciones reciben el nombre de “operaciones de liquidación con cable”. Para identificarlas se agrega una C al final del código de negociación de la especie. Así se diferencian de aquellas que se liquidan en pesos o dólares en cuentas radicadas en el mercado local.
Newsletter Clarín
Recibí en tu email todas las noticias, coberturas, historias y análisis de la mano de nuestros periodistas especializados",https://www.clarin.com/economia/dolar-ccl-hoy-cotiza-jueves-27-marzo_0_ogov5Z1LCJ.html
