diario,fecha,titulo noticia,contenido,link
Clarín,2025-03-25,Real hoy y real blue hoy: a cuánto cotiza y cuál es el precio de la moneda brasileña este martes 25 de marzo,"Elrealcotiza a $185,44 para lacompray a $185,52 para laventaeste martes 25 de marzo de 2025, de acuerdo con la información que proporciona el sitio del Banco Nación.
Con respecto a la divisa en el mercado paralelo, elreal blue hoytiene un precio de $208,75 para la compra y de $226,75 para la venta, una información que muchos argentinos consultan antes de viajar aBrasilpor turismo o negocios.
De este modo,la brecha entre el real blue y el real oficiales de 11.17%.
De acuerdo con la variación de la divisa brasileña en el mercado informal, un dólar equivale a R$6.04 reales, por lo quecon 100 dólares se pueden comprar R$603.59 reales.
El real es la moneda de curso legal deBrasildesde 1994, cuando reemplazó al cruzeiro real. Es la vigésima moneda más negociada en el mundo y la primera en Sudamérica. Su símbolo esR$y cuenta conbilletesde hasta 200 reales de denominación.
Eldólar oficialcotiza este martes 25 de marzo de 2025 a $1051 para la compra y $1091 para la venta en las entidades bancarias.
En tanto, eldólar bluese consigue a $1260 y se vende a $1280 en el mercado paralelo.
Newsletter Clarín
Recibí en tu email todas las noticias, coberturas, historias y análisis de la mano de nuestros periodistas especializados",https://www.clarin.com/economia/real-hoy-real-blue-hoy-cotiza-precio-moneda-brasilena-martes-25-marzo_0_lyW2gBjOmn.html
Clarín,2025-03-25,Dólar blue hoy: a cuánto cotiza este martes 25 de marzo,"La cotización deldólar bluees de $1260 para la compra y de $1280 para la venta, estemartes 25 de marzo de 2025.
En lo que va de marzo de 2025, el dólar blue sube respecto al mes anterior: la diferencia es de 4%.
En lo que va de este 2025, el dólar blue sube respecto al 2024: la diferencia es de 26%.
El valor del dólar blue tiene una diferencia sustancial con el dólar oficial, que se adquiere en los bancos y que posee una cotización establecida. La brecha entre el dólar oficial y el dólar blue es de 20%.
Eldólar bluees el que circula en el mercado negro y suele tener un valor más alto que el oficial. Este dólar no se compra en bancos o casas de cambio oficiales.
La cotización del dólar blue cierra junto con la del dólar oficial: a las 15 horas, de lunes a viernes.
Una explicación sobre su denominación señala que se llama así porque ""blue"", en inglés, además de nombrar al color azul, remite a algo ""oscuro"". Otra teoría lo relaciona con las operaciones de compra a través de bonos o acciones de compañías conocidas como""blue chips"". Y también se lo vincula con el color aproximado que aparece cuando se aplica un fibrón para detectar billetes falsos.
La cotización deldólar oficiales de $1051 para la compra y de $1091 para la venta, este martes 25 de marzo de 2025, según el Banco Nación.
La cotización deldólar bolsaes de $1284,80 para la compra y de $1290,70 para la venta, este martes 25 de marzo de 2025.
La cotización deldólar CCLes de $1281,30 para la compra y de $1300,70 para la venta, este martes 25 de marzo de 2025.
Newsletter Clarín
Recibí en tu email todas las noticias, coberturas, historias y análisis de la mano de nuestros periodistas especializados",https://www.clarin.com/economia/dolar-blue-hoy-cotiza-martes-25-marzo_0_i0WsSzaaIM.html
Clarín,2025-03-25,Los bancos aumentan las comisiones y extraer plata del cajero puede costar $5.000,"Aún cuando el mercado apuesta a una inflación a la baja para este año, varios bancos ajustaron nuevamente el costo de las comisiones que cobran a sus clientes para operar con ellos. Los últimos en informar nuevos costos fueron los bancosProvincia, Galicia y Santander, que desde el1 de mayo elevarán los precios de los paquetes de cuenta,el costo de mantenimiento de las tarjetas de crédito y también de extracción de dinero en efectivo en cajeros automáticos.
Por normativa del Banco Central, las entidades están obligadas a informarles a sus clientes de este tipo de cambios con 60 días de anticipación, por lo que desde comienzos de mes los usuarios de Banco Provincia, Galicia y Santander comenzaron a recibir notificaciones con los nuevos costos. Esta nueva ronda de aumentos se suman a la queya hicieron anteriormente entidades como ICBC o BBVA.
El primero en informar de estos movimientos fue el Banco Provincia. A fines del mes pasado, la entidad bonaerense comunicó a sus clientes que desde el 1 de mayo aplicará unincremento del 33% para la reposición de los plásticos de tarjeta de débito por deterioro, pérdida o hurto,que pasará de los $7.500 actuales a los $10.000. Al mismo tiempo, elevará el costo de extraer dinero en efectivo en los cajeros automáticos cuando se trate de otra entidad: si es dentro de la red Link este pasará a los $2.280, lo que implica unasuba de 20%, y si se hace con un banco opera en la Red Banelco este llegará a los $2.640, lo que implica un ajuste del 14%.
Por su parte, el Banco Galicia le informó a sus clientes de los nuevos costos y de las opciones que tiene para bonificar los precios de los paquetes de productos con la entidad. La última vez que este banco había aumentado sus comisiones había sido en noviembre del año pasado. Ahora, por ejemplo el paquete básico, Classic Internacional, pasará a costar $27.000 al mes ; mientras que un paquete Gold llegará a los $43.000 y el llamado Black ( destinado al segmento ABC1)trepará a los $70.000 mensuales. Se trata de un aumento del 22,7% para cada uno de estos segmentos.
La entidad aclaró los distintos requisitos para conseguir la bonificación de estos precios, sobre todo para quienes acrediten sus haberes o jubilaciones en el banco. Al mismo tiempo, elBanco mantiene sin costo las extracciones en su red de ATM, pero elevó a $5.000la comisión por retirar dinero en cajeros automáticos de otras entidades, independientemente de la red en la que operen.
Casi al mismo tiempo informó de las nuevas comisiones el Banco Santander. Los nuevos precios de los paquetes oscilarán entre los $9.900, en el caso de una ""super cuenta"", y los $73.900en el caso de los paquetes ""black"". Al igual que el Galicia, esta entidad ofrece alternativas para poder bonificar estos costos, pero en este caso excluyen a trabajadores y profesionales independientes.
""Para honorarios únicamente válido si el empleador es cliente del banco y paga desde una cuenta en Santander a través del módulo de pago de sueldos/honorarios y no como concepto transferencias/honorarios. Promoción válida hasta el 30/06/2025 o hasta el cese de acreditaciones de haberes u honorarios en el Banco, lo que suceda primero"", aclaró la entidad en esta comunicación.
""Te recordamos que la cuenta en que se acreditan haberes (Cuenta Sueldo) no tiene costo alguno en cuanto a su constitución, mantenimiento o extracción de fondos en todo el sistema bancario, hasta el monto derivado de las remuneraciones y/u otros conceptos derivados de naturaleza laboral, cualquiera fuera la modalidad extractiva empleada, mientras se verifique el cobro de sueldo, u honorarios y en la medida que perdure la relación laboral con el empleador, de corresponder"", sumó el Santander a sus clientes.
Muchos clientes del sistema bancario local destacaron que estos nuevos aumentos reflejan un cambio en la tendencia reciente. ""Antes los bancos bonificaban buena parte de sus productos por tiempo indefinido, según un acuerdo inicial.Ahora esas bonificaciones son por dos o tres meses y con requerimientos cada vez más altos"", se quejaron.
Redactora de la sección Economía/Pyme.apedotti@clarin.com
Newsletter Clarín
Recibí en tu email todas las noticias, coberturas, historias y análisis de la mano de nuestros periodistas especializados",https://www.clarin.com/economia/bancos-aumentan-comisiones-extraer-plata-cajero-puede-costar-5000_0_IgHDZCR8SA.html
Clarín,2025-03-24,"Pagos en dólares: se utilizan para el turismo, inmuebles o autos y se dejan de lado en otros consumos","Pese al bimonetarismo que el Gobierno impulsa con el objetivo de que convivan los pagos en dólares y en pesos en los gastos del día a día, los argentinosprefieren usar sus dólares para bienes durables que para consumos cotidianos.
Así lo muestra una encuesta que realizóNaranja X, a casi un mes dela habilitación del cobro en esta moneda con tarjeta de débito,opción que, pese al entusiasmo que generó inicialmente, por el momentollegó a pocos comercios, al ser de adhesión voluntaria.
Turismoes el rubro en el que más predisposición hay a abonar con esta modalidad, con el41%de las respuestas. El resultado tiene lógica. El pago en efectivo en dólares ya le representa al sectorun 70% de las ventas de viajes al exterior, según laAsociación Internacional de Transporte Aéreo (IATA).
Así es queaumentó la cantidad de los que pagan en dólar billeteparaevitar los impuestos del dólar tarjeta,el tipo de cambio más alto del mercado hoy y que surge de agregarle al dólar oficial del Banco Nación ($ 1.091) un recargo del 30% por anticipo de Ganancias, por lo que cotiza a$ 1.418,30.
El propio ministro de Economía,Luis Caputo,reconoció que creció esta alternativayprácticamente todas las agencias ya tomandólar cash o por depósito o transferencia. Con tarjeta de débito,Despegar se lanzó el viernes como la primera.
Tampoco sorprende que un18%esté dispuesto a pagarinmueblesy un15%,vehículos, dos rubros dolarizados históricamente. En elColegio Único de Corredores Inmobiliarios (Cucicba), apuntaron que en las grandes ciudades del paíslas propiedades se pagan en dólar billetey reconocieron como positiva la medida del Gobierno, aunque advirtieron sobre su complejidad: las inmobiliarias deben abrir una cuenta recaudadora −por las complicaciones que generaría la rendición de los fondos ante ARCA, la exAFIP− y percibir los ingresos como cancelación de saldo de precio.
En laCámara Inmobiliaria Argentina,agregaron que la tarjeta de débito ahora bimonetaria se suma como una opción que agilizaría pagos que se hacen en transferencias, comoalquileres en dólares, reservas o parte de operaciones de compraventa(esto último evitaría el traslado del dinero a la escritura).
En la industria automotriz, aunque el pago en dólares también es una práctica recurrente, se da en menor proporción y compite con el financiamiento en moneda local, comocréditos a tasa 0 que lanzaron las terminales.En laAsociación de Concesionarios de Automotores de la República Argentina (Acara)explicaron que, si bien varía según los concesionarios,la mayoría de los autos se abonan en pesos, especialmente los nacionales, pick-ups y de entrada de gama; mientras quelos importados y los de gama alta se pagan en dólares.
Hernán Dietrich, CEO deGrupo Dietrich−queacaba de sumar el pago en dólares con tarjeta de débito﻿−,consideró que “las ventas en dólar billete no superan el 9%”, pero anticipó que probablemente “ese porcentajeaumentará”.﻿“El cliente puede optar por cómo más le convenga: pesos, dolares, tarjetas”, destacó.
En el medio del relevamiento se sitúanelectrodomésticos y electrónica, con un10%de las respuestas.FrávegayMegatone.net se lanzaron con tarjeta de débito, pero el sector compite con las cuotas, clave para impulsar el consumo. Cerca del45%de las ventas se financian, segúnVectorial, consultora que tiene como socios aHaroldo Montagu, exviceministro de Economía, yEduardo Hecker, expresidente del Banco Nación.
Le siguen los rubros demateriales para la construcción, con un6%; yartículos para el hogar, con un4%. En estos sectores, ya se sumaron cadenas comoPatagonia Flooring, de pisos y revestimientos de madera; yBarugel, de diseño e interiorismo, aunqueel interés de los clientes es incipiente.
Al final del listado, se ubicanropa, con3%de las respuestas;alimentos y bebidas, con2%; yfarmacia, con1%. Aunque algunas marcas de indumentaria en shoppingstoman dólares en efectivo a un valor incluso más alto que el bluepara atraer a consumidores y público turista,por ahora no ofrecen pagos con dólares en tarjeta de débito. Lo mismo ocurre con supermercados y cadenas de farmacias, que en caso de hacerlo en efectivo,mayormente toman el oficial.
Redactora de la sección Economíaagdevincenzi@clarin.com
Newsletter Clarín
Recibí en tu email todas las noticias, coberturas, historias y análisis de la mano de nuestros periodistas especializados",https://www.clarin.com/economia/pagos-dolares-utilizan-turismo-inmuebles-autos-deja-lado-consumos_0_4P1TcZ90Rj.html
Clarín,2025-03-24,Tramo final en las negociaciones con el FMI: este martes se reuniría informalmente el directorio por el caso argentino,"El Gobierno enfrentará una semana clave con posibles definiciones sobre el acuerdo con el Fondo Monetario Internacional (FMI) para obtener un préstamo de hasta US$ 20.000 millones. En medio de las tensiones por las dudas sobre el esquema cambiario,se espera una reunión informal el martes entre el staff técnico y los directores para analizar el nuevo programasegún informó la agencia Bloomberg la semana pasada. El encuentro informal también fue confirmado hoy a Clarín por fuentes con llegada a Washington.
Por otra parte,la vocera del Fondo,Julie Kozack, brindará el jueves su habitual conferencia desde Washington a las 11.30 de la mañana. En la última rueda de prensa, la funcionaria dijo que un ""amplio apoyo social y político"" al programa era clave, pero que era una decisión de las autoridades. En contexto, el Ejecutivo envió el DNU que fue aprobado el miércoles por la Cámara de Diputados con apoyo del peronismo, pese a desconocer el monto del crédito y la política cambiaria, entre otros detalles.
Según Bloomberg, la Argentina podría recibir US$ 20.000 millones. Yde ese total, según informó Clarín el domingo,US$ 12.000 millones serían para refinanciar los vencimientos de capital hasta el 2029 y US$ 8.000 millones para fortalecer reservas, aunque se desconoce el monto para intervenir en el mercado de cambios. Asimismo,se espera un esquema de bandas cambiarias o flotación administrada, la liquidación de un 10% de las exportaciones en el CCL (en lugar del 20% actual) y la apertura gradual del cepo.
Después de pelearse con el Fondo y celebrar la compra de divisas el año pasado, el Gobierno ahora necesita dólares del organismo para pagar la deuda, estabilizar la economía y llegar en calma a las elecciones de octubre. ""El monto no es una cuestión de capricho, es una cuestión que no está definido, lo define el Board...la situación de urgencia es la situación del Banco Central después de 20 años de ver dilapidadas sus reservas, esa es la razón de urgencia"", dijo el secretario de Finanzas, Pablo Quirno, ante el Congreso.
Si bien el Banco Central acordó unplan con los bancos para calmar el dólarmediante la suba de tasas de los plazos fijos,lo que ocurra en las próximas horas será determinante después de la ""mini corrida""de la semana pasada. Algunasacciones y los bonos argentinos comenzaron a operar este lunes en verde en Wall Street, en medio del feriado en el mercado local por el feriado del Día de la Memoria. Pero en la city consideran que son movimientos ""poco relevantes"" dado que el el S&P500 subía con fuerza.
""Tras la publicación del DNU que aprobaba un nuevo acuerdo con el FMI, en el mercado se desató un manto de incertidumbre no sólo por la factibilidad del acuerdo (mantenga su fuerza de Ley), situación que finalmente sucedió; sino también por las condicionalidades que imponga el Fondo o por las metas que el gobierno nacional deba cumplir. Particularmente,la forma y la velocidad de la salida del cepo cambiario fue el elemento depositario de todas las expectativas"", dijo Lambda, la consultora del exviceministro de Economía, Fernando Morra.
Según la consultora, el Banco Central cortó en marzo la racha compradora que sostenía desde inicios de año, tras acumular compras netas por US$ 3.361 millones en el primer bimestre. ""De hecho,en las últimas seis jornadas la autoridad monetaria realizó ventas netas por US$ 1.204 millones. Si con ese nivel de compras las reservas brutas aún se reducían en casi US$ 6.277 millones desde el pico del 07/01, la merma en el ritmo de adquisiciones puede hacer más desafiante al esquema cambiario post acuerdo con el FMI"", advirtió.
Por las turbulencias, los dólares financieros aumentaron 5%, la brecha cambiaria superó el 20% y el riesgo país subió a 760 puntos, mientraslas consultoras estiman que las reservas netas son negativas en entre US$ 8.500 y US$ 9.500 millones. ""La debilidad en la posición de reservas influyó fuertemente sobre las expectativas sobre el tipo de cambio, tal como se observaba en la trayectoria ascendente en las tasas implícitas en la curva de dólar futuro (ROFEX)"", señaló.
El mercado mira con atención los próximos pasos del gobierno, ya queel sacudón de la semana pasada dejó herido al esquema que había dispuesto Luis Caputo para acumular reservasy apostar a un ""peso fuerte"". Esto es el famoso ""carry trade"", por el cual el Banco Central devaluaba el tipo de cambio oficial al 1% mensual por debajo de una inflación del 2,4% en febrero, incentivando a que los exportadores liquiden sus dólares e inviertan en bonos, acciones o plazos fijos en pesos.
""Rompió el mecanismo de acumulación de reservas, cuando a Caputo le preguntan qué va a pasar con el dólar al 1% mensual y dice que no lo puede decir, estaban haciendo carry y esa mañana Caputo no lo convalida, no te está garantizando nada, y los futuros esa mañana empiezan a picar en punto, eso ya es irreversible"", advirtió Emiliano Anselmi, economista de PPI en Ahora Play, donde aseguró que para revertir la expectativa de devaluación, ""la única forma ahora es con una devaluación"".
Respecto el acuerdo con el FMI, afirmó que ""va a haber una flexibilización cambiaria, y cuanto más alta sea, el gobierno llegará mejor parado a octubre"". ""Tiene que armar un nuevo carry para comprar reservas, el 1% no existe más y cuanto más tiempo se pierda, más reservas se van a perder, la posición de liquidez es muy débil...no hay chances de que la liquidación de los exportadores sea masiva"", sostuvo. Y sugirió que el dólar podría superar el valor actual del CCL, cercano a $ 1.300, si se liberaran las restricciones.
Redactor de la sección Economíajbarca@clarin.com
Newsletter Clarín
Recibí en tu email todas las noticias, coberturas, historias y análisis de la mano de nuestros periodistas especializados",https://www.clarin.com/economia/tramo-final-negociaciones-fmi-manana-reuniria-informalmente-directorio-caso-argentino_0_MoKqs2JsuD.html
Clarín,2025-03-24,Las reservas netas negativas del Banco Central escalan a US$ 8.500 millones y aumenta la incertidumbre cambiaria,"La semana pasada, las reservas brutas del Banco Central perforaron losUS$ 27.000 millones, algo que no ocurría desde septiembre. Los analistas del mercado miran con preocupación las ventas de dólares que viene realizando la autoridad monetaria, que solo en las últimas seis ruedas se desprendió deUS$ 1.200 millones.
En medio de las turbulencia que hicieron que en lo que va de marzolos dólares financieros aumentarán 5%,contra una actualización del dólar oficial del 1% y una inflación estimada para el mes en 2,5%, las dificultades del Central para hacerse de dólares encienden las alarmas.
Y en las últimas horas se sumó otro dato preocupante: las reservas netas, las que deberían estar disponibles para que elCentralintervenga en el mercado,ya son negativas por US$ 8.500 millones, según datos de la consultora LCG.
Las reservas brutas están compuestas por el swap de monedas con China, el oro, los dólares propios, los encajes de los depósitos en dólares, los préstamos del Banco Internacional de Pagos Garantía de los depósitos en dólares administrada por SEDESA y los Derechos Especiales de Giro (DEGs) del FMI. Para llegar a las reservas netas, hay que limpiar de esta cuenta los encajes, el swap y los préstamos.
A diferencia del monto de reservas brutas, que es anunciado cada día por el Central,no hay información oficial sobre las reservas netas,por lo que las consultoras usan diferentes metodologías para estimarlas.
En el comienzo de este gobierno,las reservas netas eran negativas en US$ 10.500 millones.Desde ese piso se fueron reduciendo hasta tocar los US$ 4.500 millones, -siempre negativos- hace un año. Y desde allí empezaron a a escalar nuevamente hasta los -US$ 8.500 millones de hoy.
Este cambio de tendencia se relaciona con las dificultades del Central para conservar los dólares que fue adquiriendo en el mercado. Si bien desde que asumió Javier Milei la autoridad monetarialogró comprar casi US$ 25.000 millones, la mayor parte de ese monto se le fue en pago de deudas e intervenciones para tener al dólar oficial pisado y sostenerlo como ancla cambiaria para que baje la inflación.
Desde GMA Capital apuntan que ""las compras del Centralvenían siendo el pilar del incremento en las reservas brutas"".
""Frente al reciente nivel de ventas, no sorprende que el stock marcara un fuerte retroceso hasta los US$ 26.783 millones, mínimo desde septiembre de 2024. En tanto, las reservas netas se aproximan a los US$ 8.000 millones en negativo.A la luz de un escenario externo poco alentador, el tipo de cambio vuelve a quedar en el centro del debate"", agregan. ""En esta coyuntura, el nerviosismo puede persistir, principalmente si la racha vendedora del BCRA se mantiene"".
El problema de las reservas está en el centro de la negociación del gobierno con elFondo Monetario.Tal como publicóClarín, el Fondo no quiere que el Gobierno gaste los desembolsos que traerá el nuevo acuerdo en mantener el tipo de cambio.Y abre la puerta para que el esquema del crawling peg del 1% mensual se cambie por uno de flotación cambiaria,al que el gobierno se resiste por temor a que esto interrumpa la baja de la inflación.
""Al acuerdo con el FMI falta ponerle el moño, pero no hay intersección entre el gobierno quiere y lo que el FMI quiere. El gobierno quiere que se inyecte dólares al BCRA con el esquema actual. Están remonetizando.El FMI dice 'acumulá las reservas'. En el medio, un discurso que dice no hay pesos. Argentina no puede flotar con este balance del Banco Central"", señaló la economista Marina Dal Poggetto en una entrevista radial en FM Milenium.
Para el economista Juan Carlos De Pablo hay que ir hacia la flotación. ""Un día vamos a salir del cepo y nos vamos a encontrar con que tenemos mucho dólares en blanco y pocos pesos. ¿Cuál es el temor de la corrida cambiaria?Yo soy de los que piensan que este gobierno tiene que dejar flotar el tipo de cambio, porque el centro de la política económica es el equilibrio fiscal"", sostuvo en una entrevista en Radio con Vos. ""Si vos pensás intervenir en el mercado cambiario necesitas muchas reservas.Si vos estás pensando que terminas flotando no necesitas reservas"".
Redactora de la sección Economía, especializada en negociosaquiroga@clarin.com
Newsletter Clarín
Recibí en tu email todas las noticias, coberturas, historias y análisis de la mano de nuestros periodistas especializados",https://www.clarin.com/economia/reservas-netas-negativas-banco-central-escalan-us-8500-millones-aumenta-incertidumbre-cambiaria_0_SPG25amhDh.html
