diario,fecha,titulo noticia,contenido,link
Clarín,2025-03-24,Wall Street repuntó pero las acciones argentinas no siguieron el ritmo y volvieron a cerrar en rojo,"Luego de una semana de turbulencia en el frente financiero,el mercado seguirá de cerca las novedades en la negociación entre el Gobierno de Javier Milei y el Fondo Monetario Internacional.Sin actividad en el mercado local por el feriado del Día de la Memoria, este lunes ni siquiera un fuerte rebote de Wall Street logró revertir la tendencia negativa en los precios de las acciones argentinas que cotizan en esa plaza. En tanto, los bonos mejoraron levemente, pero el riesgo país subió hasta las 769 unidades.
La Bolsa de Nueva York ganó impulso el lunes gracias a laposibilidad de una política comercial estadounidense más flexible de lo esperado,al tiempo que el mercado estadounidense se benefició tras la divulgación de indicadores económicos alentadores. Al final de la sesión en Wall Street, el índice estrella, el industrialDow Jones, ganó 1,42%, en tanto el tecnológico Nasdaq subió 2,27% , y el índice ampliado S&P 500 -de las 500 empresas principales- avanzó 1,76%.A pesar de este rebote, la bolsa neoyorkinaacumula una baja de más de 3% en lo que va de marzo,en un mes impregnado por la volatilidad.
Pese a este mejor humor global, los papeles argentinos no lograron capitalizar un rebote. Las acciones argentinas que cotizan en Wall Street habían empezado el día con mayoría de subas, pero sobre el final de la ruedacambiaron la tendencia y finalmente terminaron con bajas que superaron el 7%en el caso de Telecom.
En el mercado de deuda, los títulos globales en dólares rebotaron levemente, después de haber cerrado el viernes con mayoría de rojos. Con todo,el riesgo país sube siete unidades hasta los 769 puntos.En los últimos 30 días este indicador empeora más del 5% con el mercado atento a las novedades del acuerdo con el FMI y afectado por el viento de frente global.
""En lo que va del año,el conjunto de la curva soberana promedió una caída del 3,99%,a pesar de lo cual sigue manteniendo un rendimiento más que considerable en los últimos doce meses (+51.97%)"", comentó Nicolás Khnon, del equipo de research de Balanz. ""En ese sentido, seguimos considerando que un nuevo acuerdo con el FMI junto con el sostenimiento del ancla fiscal, el crecimiento económico y la reducción de la inflación impulsarían nuevamente a la curva soberana, con la consecuente baja en el riesgo país"", añadió.
El mercadoespera atento más definiciones sobre el acuerdo con el Fondo.Este martes, se esperan reuniones informales entre el staff técnico y los directores para analizar el nuevo programa con Argentina y el próximo jueves , la vocera del Fondo, Julie Kozack, realizará su conferencia habitual. ""El foco de los inversores sigue concentrado en loseventuales cambios en el régimen monetario y cambiario,dado que se coincide que cualquier estrategia debería apuntar principalmente a acumular reservas a fin de brindar sustentabilidad al exitoso plan económico., comentó el economista Gustavo Ber.
Aunque las perspectivas de la City se mantienen positivas, el nerviosismo persistirá sobre todo hasta que se defina el nuevo esquema cambiario. ""La ratificación en la Cámara de Diputados del DNU que aprueba el acuerdo con el FMI es una gran noticia para los mercados,disipando la incertidumbre política y acercando al gobierno a la salida del cepo. De todas formas, la firma del acuerdo es condición necesaria pero no suficiente para remover los controles de capitales, y la acumulación de reservas deberá continuar a lo largo del año"", señalaron en el Grupo IEB.
Además de los detalles formales sobre el nuevo acuerdo, el mercado seguirá de cerca las intervenciones del BCRA en el mercado de cambios, que desde el viernes 14 de marzo se desprendió de más de US$ 1.200 millones en el Mercado Libre de Cambios.
Newsletter Clarín
Recibí en tu email todas las noticias, coberturas, historias y análisis de la mano de nuestros periodistas especializados",https://www.clarin.com/economia/wall-street-repunta-bonos-acciones-argentinos-comienzan-semana-alza_0_1Dm7w2f3JK.html
Clarín,2025-03-24,Agenda económica: reunión en el FMI por el acuerdo y cómo viene la actividad en el arranque del año para la semana del 24 al 28 de marzo,"En esta semana más corta, con ellunes feriado, se espera algunaseñal desde el Fondo Monetario, tras los trascendidos sobreuna posible reunión informaleste martes entre el equipo técnico y miembros del board sobre el caso argentino. Más concreto, sobre el fin de la semana se conocerán losdatos de la evolución de la economía en enero (EMAE) y el balance cambiario.Aquí, día por día, la información que se conocerá en los próximos días:
Martes 25:
Jueves 27:
Viernes 28:
Lunes 24:salen datos de órdenes de compras de gerentes de marzo para el sector manufacturero, de servicios y compuesto en Europa y EE.UU. En China, se define la tasa de préstamos a 1 año;  inflación de la primera quincena de marzo y de actividad económica de enero en México.
Martes 25:en EE.UU. se publican datos de confianza del consumidor, situación actual y expectativas económicas.
Jueves 26:nueva revisión del PBI del cuarto trimestre de 2024 y reclamos de desempleo al 22 de marzo en EE.UU.; inflación quincenal en Brasil.
Viernes 28:en Estados Unidos, se publica el PCE, la medida de inflación que mira la FED.
Con información de Balanz, INDEC, BCRA y Bloomberg.
Newsletter Clarín
Recibí en tu email todas las noticias, coberturas, historias y análisis de la mano de nuestros periodistas especializados",https://www.clarin.com/economia/agenda-economica-reunion-fmi-acuerdo-viene-actividad-arranque-ano-semana-24-28-marzo_0_5K3ssmhGJE.html
Clarín,2025-03-24,El boom de la alimentación saludable potencia el negocio de nuevos fabricantes “sugar free” y “sin TACC”,"La preocupación creciente por la alimentación saludable abre un nicho de mercado con oportunidades para los negocios vinculados. Al amplio sector de la población que hoy -por diversas razones- prioriza la ingesta de alimentos menos ultraprocesados, se suman los segmentos que no tienen otra opción: comoquienes no pueden consumir azúcar o gluten,por ejemplo, por padecer diabetes,obesidadoceliaquía.
A escala global se estima que un 38% de los consumidores se muestra más propenso a los hábitos saludables y el bienestar, según datos de la consultora GFK. Y, en relación a la alimentación como factor fundamental para la salud''se consolida la tendencia de cuidar más lo que comemos'',según el informe 'La alimentación consciente"", de este mismo organismo.
En este contexto, la proliferación tanto locales de venta (dietéticas) como deempresas fabricantes de estos alimentos viene en franco crecimiento. En esta franja se alinea Célula Cocina, una marca de alimentos saludables que, con una una inversión inicial deUS$ 200.000en febrero del 2024, este año proyecta alcanzar una facturación deUS$ 1.500.000. El ""core"" del negocio es ofrecerproductos 100% libres de azúcar y sin TACC (trigo, avena, cebada y centeno).
En cuanto al azúcar, la decisión estratégica de la firma fue reemplazarla porun endulzante natural, vegetal y sin calorías, derivado de las fibras de las plantas.Este endulzante es apto para diabéticos y veganos, y tiene un índice glucémico muy bajo y “no sacrifica el sabor”, según la empresa. Su creador, Martín Ferraro, cuenta que la clave ""es crear opciones con un alto valor nutricional"". ""Fue un trabajo duro a nivel producción y fórmulas, pero esto nos genera un valor como marca y refuerza la cultura de los alimentos que generamos para el consumidor, que es lo más importante"", dice.
Actualmente, Célula Cocinaestá evaluando inversiones en maquinaria para aumentar la produccióny expandirse a otras provincias a través de distribuidores. En Buenos Aires, sus productos se venden en comercios de cercanía, tiendas especializadas, supermercados y a través de su tienda online.
La marca creció rápidamente desde sus inicios en Palermo, donde comenzó produciendo para un pequeño local de pastelería. Pronto, las cookies de avellanas y chocolate amargo se convirtieron en las más demandadas, y eso llevó a la marca a desarrollar su propio modelo de negocio, buscando abastecer dietéticas y comercios.
Luego, con la necesidad de expandir su capacidad, Célula Cocinamudó su planta de producción a Chacabuco,y hoy tiene una plataforma de 14 productos, que incluyen una línea convencional (alta en proteínas y grasas) y una línea keto (alta en proteínas y grasas y baja en carbohidratos), elaborados con harinas propias de almendras, avellanas, lino y psyllium.
Otra empresa enfocada en el rubro de alimentos sin gluten es SMAMS, fabricante de productos de diferentes categorías, comopanes, galletitas y alfajores, también elaborados sin azúcar y a base de plantas.
Esta firma nació en el 2012 cuando el negocio de alimentos sin gluten todavía era un terreno muy poco explorado. Al principio fabricaba polvorones, galletitas y budines en una planta de 600m2 en Mataderos, y ofrecía sus productos a dietéticas. Hoy, tiene dos sitios de producción de más de 5 000 m2 y un equipo de más de 100 personas. Tiene un portfolio de más de 88 productos y distribución nacional a todos los puntos de venta; dietéticas y supermercados.
También la firmaexporta a Paraguay, Uruguay, Chile y Panamá(próximamente llegará a Estados Unidos). Produce para sus marcas y también le fabrica a algunas de las principales compañías multinacionales alimenticias. Desde el 2015 el volumen de producción de la compañía creció de 18 toneladas mensuales a 280 toneladas. Este año, planea lanzar seis nuevos productos, salados y dulces, para acompañar diferentes ocasiones de consumo.
Con todo, aclaran los dueños de SMAMS, Norberto Varas y Lucas Cubero, ""estees un negocio de nicho, con un mercado muy chico, que alcanza a menos del 5% del mercado.Es altamente competitivo por decenas de empresas pequeñas, en muchos casos emprendimientos familiares, donde la estructura de costos laborales se confunde con el retorno del capital"", dicen.
Redactora de la sección Economía/Pyme.nmuscatelli@clarin.com
Newsletter Clarín
Recibí en tu email todas las noticias, coberturas, historias y análisis de la mano de nuestros periodistas especializados",https://www.clarin.com/economia/boom-alimentacion-saludable-potencia-negocio-nuevos-fabricantes-sugar-free-tacc_0_w4NrLgKcUQ.html
Clarín,2025-03-24,Dólar CCL hoy: a cuánto cotiza este lunes 24 de marzo,"La cotización deldólar CCLes de$1281,30para la compra y de$1300,70para la venta, este lunes 24 de marzo de 2025.
El dólar CCL sube2%respecto al mismo día de la semana anterior.
En lo que va de marzo de 2025, el dólar CCL sube respecto al mes anterior: la diferencia es de6%.
En comparación con el año pasado, el dólar CCL sube un18%. A esta altura del año anterior, el CCL cotizaba a$1084.
El valor deldólar CCLtiene una diferencia con eldólar MEP. Mientras que el primero está$1281,30, el MEP cotiza hoy a$1284,80, lo que marca una brecha de2%.
Eldólar CCL o dólar contado con liquidaciónes uno de los tipos de cambio financieros más usados en el país, junto con el dólar MEP (o dólar bolsa). Se trata de una herramienta financiera que permite cambiar pesos por dólares en el exterior. Muchas empresas e inversionistas usan este método para adquirir divisas y sacarlas del país legalmente.
Eldólar CCL o dólar contado con liquidaciónconsiste en la compra de un bono en pesos (AL30) o en dólares (AL30D) para venderlo en especie C (AL30C). Mediante estas 2 simples operaciones podés ingresar dinero a cuentas de inversión en Estados Unidos.
La cotización del dólar CCL funciona en el mismo horario del mercado de cotizaciones:hasta las 16:30 horas, de lunes a viernes.
Estas operaciones reciben el nombre de “operaciones de liquidación con cable”. Para identificarlas se agrega una C al final del código de negociación de la especie. Así se diferencian de aquellas que se liquidan en pesos o dólares en cuentas radicadas en el mercado local.
Newsletter Clarín
Recibí en tu email todas las noticias, coberturas, historias y análisis de la mano de nuestros periodistas especializados",https://www.clarin.com/economia/dolar-ccl-hoy-cotiza-lunes-24-marzo_0_j4mjjl4dUz.html
Clarín,2025-03-24,Dólar ahorro hoy: a cuánto cotiza este lunes 24 de marzo,"La cotización deldólar ahorroes de$1418,30para la venta este lunes 24 de marzo de 2025.
El dólar ahorro sube0%respecto al mismo día de la semana anterior.
En lo que va de marzo de 2025, el dólar ahorro sube respecto al mes anterior: la diferencia es de1%.
En comparación con el año pasado, el dólar ahorro sube un1%. A esta altura del año anterior, el ahorro cotizaba a$1397.6.
El valor deldólar ahorrotiene una diferencia con eldólar MEP. Mientras que el primero está$1418,30, el MEP cotiza hoy a$1284,80, lo que marca una brecha de10%.
Eldólar ahorroes un tipo de cambio mayor al dólar oficial, que se muestra como la opción más barata para comprar a modo de atesoramiento.
La compra deldólar ahorrohoy en Argentina se maneja bajo la siguiente cotización: el 30% del impuesto país se mantiene y el 35% del impuesto a las ganancias pasa a ser de un 45%, igualando la cotización del dólar tarjeta.
La cotización del dólar ahorro funciona en el mismo horario del mercado de cotizaciones:hasta las 16:30 horas, de lunes a viernes.
Estas operaciones reciben el nombre de “operaciones de liquidación con cable”. Para identificarlas se agrega una C al final del código de negociación de la especie. Así se diferencian de aquellas que se liquidan en pesos o dólares en cuentas radicadas en el mercado local.
Newsletter Clarín
Recibí en tu email todas las noticias, coberturas, historias y análisis de la mano de nuestros periodistas especializados",https://www.clarin.com/economia/dolar-ahorro-hoy-cotiza-lunes-24-marzo_0_r3zpQmSTgT.html
Clarín,2025-03-24,Dólar tarjeta hoy: a cuánto cotiza este lunes 24 de marzo,"La cotización deldólar tarjetaes de$1418,30, este lunes 24 de marzo de 2025.
El dólar tarjeta sube0%respecto al mismo día de la semana anterior.
En lo que va de marzo de 2025, el dólar tarjeta sube respecto al mes anterior: la diferencia es de1%.
En comparación con el año pasado, el dólar tarjeta sube un1%. A esta altura del año anterior, el dólar tarjeta cotizaba a$1397.6.
El valor deldólar tarjetatiene una diferencia con eldólar blue. Mientras que el primero está$1418,30, el blue cotiza hoy a$1260, lo que marca una brecha de13%.
Eldólar tarjetaes el tipo de cambio que se emplea para el pago de consumos con tarjeta de débito y crédito en el exterior así como para la compra, también en dólares, de pasajes y paquetes turísticos hacia destinos fuera de la Argentina.
El valor deldólar tarjetase conforma de la siguiente manera: al dólar oficial se le añade un 30% de impuesto país y un 30% de ganancias. Se trata de una carga impositiva total del 60%, frente al 155% que existía en la gestión anterior.
La cotización del dólar tarjeta funciona en el mismo horario del mercado de cotizaciones:hasta las 16:30 horas, de lunes a viernes.
Newsletter Clarín
Recibí en tu email todas las noticias, coberturas, historias y análisis de la mano de nuestros periodistas especializados",https://www.clarin.com/economia/dolar-tarjeta-hoy-cotiza-lunes-24-marzo_0_E0JrTy23wd.html
Clarín,2025-03-24,Dólar cripto hoy: a cuánto cotiza este lunes 24 de marzo,"La cotización deldólar criptoes de$1311,60para la compra y de$1317,99para la venta, estelunes 24 de marzo.
El dólar criptosube3%respecto al mismo día de la semana anterior.
En lo que va demarzo 2025, el dólar criptosuberespecto al mes anterior: la diferencia es de6%.
En comparación con el año pasado, el dólar criptosubeun31%. A esta altura del año anterior, el dólar cripto cotizaba a$1000.
El valor deldólar criptotiene una diferencia con eldólar blue. Mientras que el primero está a$1311,60, el blue cotiza hoy a$1260, lo que marca una brecha de4%.
Eldólar criptoes una cotización que se define en función de la compraventa de “stablecoins”, es decir, criptomonedas atadas a un activo estable, en este caso al dólar estadounidense.
Para operar con eldólar criptoes necesario tener una cuenta en alguna billetera virtual o una exchange. Se define su cotización en función de la compra y venta de criptomonedas ancladas al dólar estadounidense.
Newsletter Clarín
Recibí en tu email todas las noticias, coberturas, historias y análisis de la mano de nuestros periodistas especializados",https://www.clarin.com/economia/dolar-cripto-hoy-cotiza-lunes-24-marzo_0_456xSlrERv.html
Clarín,2025-03-24,Dólar MEP hoy: a cuánto cotiza este lunes 24 de marzo,"La cotización deldólar MEPes de$1284,80para la compra y de$1290,70para la venta, estelunes 24 de marzo de 2025.
Eldólar MEPsube3%respecto al mismo día de la semana anterior.
En lo que va demarzo de 2025, el dólar MEPsuberespecto al mes anterior: la diferencia es de7%.
En comparación con el año pasado, el dólar MEPsubeun24%. A esta altura del año anterior, el MEP cotizaba a$1039.
El valor del dólar MEP tiene una diferencia con el dólar blue. Mientras que el primero está a$1284,80, el blue cotiza hoy a$1260, lo que marca una brecha de2%.
Eldólar MEPes un tipo de cambio mayor al dólar oficial, que se muestra como la opción más barata para comprar a modo de atesoramiento.
El dólar MEP consiste en la compra de un bono en pesos y su venta en dólares. Este tipo de cambio se calcula a partir de la división entre el precio en pesos y la cotización en dólares.
La cotización del dólar MEP funciona en el mismo horario del mercado de cotizaciones: hasta las 16:30 horas, de lunes a viernes.
Su nombre deriva de la sigla 'MEP', que significa Mercado Electrónico de Pagos. Es una variante al dólar ahorro, ya que presenta menos restricciones como se mencionó anteriormente.
Newsletter Clarín
Recibí en tu email todas las noticias, coberturas, historias y análisis de la mano de nuestros periodistas especializados",https://www.clarin.com/economia/dolar-mep-hoy-cotiza-lunes-24-marzo_0_OO596SCJVe.html
Clarín,2025-03-24,Real hoy y real blue hoy: a cuánto cotiza y cuál es el precio de la moneda brasileña este lunes 24 de marzo,"Elrealcotiza a $186,47 para lacompray a $186,58 para laventaeste lunes 24 de marzo de 2025, de acuerdo con la información que proporciona el sitio del Banco Nación.
Con respecto a la divisa en el mercado paralelo, elreal blue hoytiene un precio de $208,75 para la compra y de $226,75 para la venta, una información que muchos argentinos consultan antes de viajar aBrasilpor turismo o negocios.
De este modo,la brecha entre el real blue y el real oficiales de 10.67%.
De acuerdo con la variación de la divisa brasileña en el mercado informal, un dólar equivale a R$6.04 reales, por lo quecon 100 dólares se pueden comprar R$603.59 reales.
El real es la moneda de curso legal deBrasildesde 1994, cuando reemplazó al cruzeiro real. Es la vigésima moneda más negociada en el mundo y la primera en Sudamérica. Su símbolo esR$y cuenta conbilletesde hasta 200 reales de denominación.
Eldólar oficialcotiza este lunes 24 de marzo de 2025 a $1051 para la compra y $1091 para la venta en las entidades bancarias.
En tanto, eldólar bluese consigue a $1260 y se vende a $1280 en el mercado paralelo.
Newsletter Clarín
Recibí en tu email todas las noticias, coberturas, historias y análisis de la mano de nuestros periodistas especializados",https://www.clarin.com/economia/real-hoy-real-blue-hoy-cotiza-precio-moneda-brasilena-lunes-24-marzo_0_1fBLirUFXt.html
Clarín,2025-03-24,Euro hoy: a cuánto cotiza este lunes 24 de marzo,"Eleurocotiza estelunes 24 de marzoa $1.156,54 para la compra y $1.157,19 para la venta, por lo que se mantiene estable respecto a la última cotización.
En cuanto a la divisa en el mercado paralelo, eleuro blue hoycotiza a 1364.20 para la compra y 1385.86 para la venta. De este modo, su precio sube en relación al último informado.
Con estos valores, labrechaentre el euro blue y el euro oficial​ es de 117910%.
Elvalor del euro bluetiene una diferencia sustancial más alta con el euro oficial ya que este último es el que se adquiere en los bancos y que posee una cotización establecida.
Al igual que el dólar blue, eleuro bluees el que circula en el mercado negro y suele tener un valor más alto que el oficial. Una explicación sobre su denominación señala que se llama así porque en inglés, ""blue"", además de nombrar al color azul, remite a algo ""oscuro"". De esta manera, se reconoce al cambio de la divisa por fuera del sistema cambiario.
El término euro blue se empezó a utilizar a partir del 2011, como consecuencia de lasrestriccionespara la adquisición de moneda extranjera que comenzaron a aplicar la Administración Federal de Ingresos Públicos (AFIP) y el Banco Central de la República Argentina bajo el gobierno de Cristina Fernández de Kirchner.
Estaslimitacionescobraron un nuevo impulso en diciembre de 2019, luego de los anuncios de presidente Alberto Fernández sobre la Ley de Emergencia económica y que se profundizaron a lo largo del 2020 con el cepo cambiario. Esto genera que los sectores que viajen al exterior opten por la compra de euros en elmercado negro, generando así un aumento en el precio del euro blue.
El nombre del Euro paralelo
El euro se lanzó el 1° de enero de 1999, cuando 10 países fijaron sus tipos de cambio y entregaron las decisiones sobre las tasas de interés al recién creado Banco Central Europeo. Los billetes y monedas de euro entraron en circulación tres años después.
La moneda compartida se vio como una solución a las constantes disputas por los tipos de cambio que habían marcado la política europea después de la Segunda Guerra Mundial y como una extensión lógica de la zona de libre comercio de aranceles de la Unión Europea. Gran Bretaña, en particular, optó por no participar, pero 19 de los 27 países de la UE utilizan el euro como moneda nacional. Quienes componen la zona del euro, también denominada ""eurozona"" son:AustriaBélgicaChipreEstoniaFinlandiaFranciaAlemaniaGreciaIrlandaItaliaLetoniaLituaniaLuxemburgoMaltaPaíses BajosPortugalEslovaquiaEsloveniaEspaña
Newsletter Clarín
Recibí en tu email todas las noticias, coberturas, historias y análisis de la mano de nuestros periodistas especializados",https://www.clarin.com/economia/euro-hoy-cotiza-lunes-24-marzo_0_QVGEd6lBfk.html
Clarín,2025-03-24,Dólar blue hoy: a cuánto cotiza este lunes 24 de marzo,"La cotización deldólar bluees de $1260 para la compra y de $1280 para la venta, estelunes 24 de marzo de 2025.
En lo que va de marzo de 2025, el dólar blue sube respecto al mes anterior: la diferencia es de 4%.
En lo que va de este 2025, el dólar blue sube respecto al 2024: la diferencia es de 26%.
El valor del dólar blue tiene una diferencia sustancial con el dólar oficial, que se adquiere en los bancos y que posee una cotización establecida. La brecha entre el dólar oficial y el dólar blue es de 20%.
Eldólar bluees el que circula en el mercado negro y suele tener un valor más alto que el oficial. Este dólar no se compra en bancos o casas de cambio oficiales.
La cotización del dólar blue cierra junto con la del dólar oficial: a las 15 horas, de lunes a viernes.
Una explicación sobre su denominación señala que se llama así porque ""blue"", en inglés, además de nombrar al color azul, remite a algo ""oscuro"". Otra teoría lo relaciona con las operaciones de compra a través de bonos o acciones de compañías conocidas como""blue chips"". Y también se lo vincula con el color aproximado que aparece cuando se aplica un fibrón para detectar billetes falsos.
La cotización deldólar oficiales de $1051 para la compra y de $1091 para la venta, este lunes 24 de marzo de 2025, según el Banco Nación.
La cotización deldólar bolsaes de $1284,80 para la compra y de $1290,70 para la venta, este lunes 24 de marzo de 2025.
La cotización deldólar CCLes de $1281,30 para la compra y de $1300,70 para la venta, este lunes 24 de marzo de 2025.
Newsletter Clarín
Recibí en tu email todas las noticias, coberturas, historias y análisis de la mano de nuestros periodistas especializados",https://www.clarin.com/economia/dolar-blue-hoy-cotiza-lunes-24-marzo_0_MFZyeLJ51h.html
