diario,fecha,titulo noticia,contenido,link
Clarín,2025-03-24,Jubilaciones especiales: son el 4% de los beneficiarios pero se llevan el 12% del gasto total,"El sistema previsional está en el centro de la agenda y no solo por los reclamos de los jubilados. También por lanegociación de un nuevo acuerdo con el FMI.
Puestos a proponer cambios en el sistema actual, el Cippec, el think tank de políticas públicas, observó la existencia de regímenes especiales que son el4% en términos de número de beneficiarios pero se llevan el 12% del gasto total.
Esos regímenes abarcan a docentes, Luz y Fuerza, Poder Judicial, diplomáticos, por citar algunos.
Las cifras oficiales de ANSES indican que hay 6.909.648 jubilados y que 253.748 cobran por régimen especial.
Cippec sostiene que además de ese régimen especial hay otros que suman unos200 sistemas y que llevan a destinar a esos beneficiarios el 50% del gasto.
“La existencia de regímenes de excepción de jubilaciones pone en evidencia la necesidad de un reordenamiento previsional”, sostiene el Cippec.
El Gobierno  resolvió tomar cartas en el asunto con el fin de la moratoria como primer paso para intentar resolver la crisis del sistema que representa el 88% del gasto presupuestario.
Los  6,9 millones de jubilados que están dentro del régimen general cobran un haber promedio mensual de $ 406.861, según los datos a diciembre del Sistema Integrado Previsional Argentino (SIPA), dependiente de la Anses.
El número está por encima de la mínima, que con el bono bono extraordinario de $ 70.000, llega actualmente a $ 343.087, que representa un tercio de la canasta básica de $ 1,2 millones que necesitará en abril un jubilado, según la Defensoría de la Tercera Edad.
Estas 6,9 millones de personas representan al96% del total de los beneficiarios y le demandan al Estado un presupuesto por mes de $ 2,8 billones, un 88% de una partida de $ 3,2 billones.
En tanto, unos 253.748 beneficiarios están incluidos en regímenes de excepción, con jubilaciones promedio mensuales de $ 1,56 millones. Esto significa que el 4% se llevan el12% del gasto total. Es decir, insumen $ 397.250 millones.
Entre ellos, se encuentran 189.041 docentes no universitarios, con un haber promedio mensual de $ 1,4 millones; 32.500 exempleados del Sindicato de Luz y Fuerza, con $ 1,1 millones promedio mensuales; 12.385 docentes universitarios nacionales con $ 1,8 millones; 10.606 investigadores científicos y tecnológicos, con $ 2,1 millones; 7.829 ex miembros del Poder Judicial, con $ 5,2 millones; 604 prestadores de servicio exterior de la Nación (cuerpo diplomático), con $ 8,5 millones; y 723 extrabajadores del Yacimiento Carbonífero Río Turbio, con $ 1,4 millones.
En este escenario, un documento de Cippec argumentó que “ordenar el sistema previsional para hacerlo más equitativo e igualitario implica, entre otras cuestiones, revisar beneficios excepcionales. Es necesario discutir cuáles requieren de un régimen de jubilación especial y cuáles deben reintegrarse al general. Hoy existen cerca de 200 regímenes de excepción”, explicaron.
En ese sentido, según el centro que promueve la implementación de políticas públicas en distintos ámbitos, los beneficiarios de los regímenes de excepción que en la Argentina están muy por encima de cualquier comparación internacional,“tienen haberes un 65% superiores al promedio del régimen general”. Todo el gasto jubilatorio, de acuerdo a Cippec implican un gasto público de alrededor de un 10% del PBI, cuando en otros países no supera el 6% o 7%.
La entidad clasifica a losregímenes excepcionales en cinco categorías:
1. Diferenciales: destinados a quienes tuvieron trabajos arduos o peligrosos, que podrían causar envejecimiento prematuro.
2. Especiales: otorgados por méritos extraordinarios.
3. Para Fuerzas Armadas y de Seguridad: administrados por entidades independientes y justificados por mérito y especificidad del trabajo.
4. Provinciales y cajas profesionales independientes: con fundamento en diferencias históricas y legales.
5. Pensiones no contributivas: dirigidas a personas en situación de vulnerabilidad (invalidez, madres de siete hijos), por mérito (expresidentes, jueces de la Corte Suprema, ganadores de medallas olímpicas y premios Nobel) o en compensación (excombatientes de Malvinas, víctimas de terrorismo de Estado), entre otros.
Dado que estos regímenes generan problemas de equidad, ya que implican privilegios en relación a quienes están en el régimen general, la sostenibilidad del sistema se ve afectada, ya que “los recursos destinados a estos regímenes no pueden ser usados para otros finessociales”, apuntó Cippec, que propone una reforma integral que contemple reducir los regímenes de excepción y quela mayor parte de la ciudadanía participe en el régimen general, “asegurando mecanismos de financiamiento transparentes”.
Newsletter Clarín
Recibí en tu email todas las noticias, coberturas, historias y análisis de la mano de nuestros periodistas especializados",https://www.clarin.com/economia/regimenes-especiales-4-jubilados-lleva-12-gasto-total_0_wN1KR3MtRm.html
Clarín,2025-03-23,Finalizó este domingo la moratoria previsional y medio millón de personas solo podrán acceder a una Pensión Universal,"Desde este domingo, cerca de medio millón de personas en edad de jubilarse pero que no poseen los años de aporte necesarios para hacer este trámite,sólo podrán acceder a la Pensión Universal para el Adulto Mayor (PUAM) a los 65 años,tanto varones como mujeres, sin derecho a la pensión por fallecimiento del cónyuge o conviviente. El Gobierno finalizó para siempre la moratoria previsional y, tal como había anunciado, este no volverá a prorrogarse.
Aquellos queno tengan los 30 años de aporte que pide la ley jubilatoria,solo podrán acceder a una PUAM, que representa80% del haber mínimo- lo que equivale a unos $223.297,77 al mes. Esta estará disponiblerecién a partir de los 65 años, tanto para hombres como para mujeres, lo que al fin de cuentas implica una suba de la edad jubilatoria para las mujeres, que pasaría de los 60 a los 65 años.
Además, Seguridad Social aclara que accederían a la PUAM “si es que logran cumplir con los requisitos socioeconómicos y patrimoniales” (vulnerabilidad social) al margen de la cantidad de años aportados al sistema.
La falta de aportes de los trabajadores a la Seguridad se debea la enorme informalidad laboral.Las causas son variadas: trabajadores en relación de dependencia no registrados por sus empleadores (empleo ""en negro""), trabajadores registrados que tuvieron descuento jubilatorio pero los empleadores no depositaron esos aportes en la Seguridad Social o cuentapropistas que trabajadores, pero no hicieron aportes.
""Aproximadamentedos tercios de quienes llegan a la edad de jubilarse apelan a la moratoria porque no cumplen con el mínimo de 30 añosde aportes. Según la Subsecretaría de Seguridad Social entre estas personas, para el 2024, se observa que: el 52% tiene menos de 10 años de aportes; el 30% tiene entre 10 y 25 años de aportes. Y sólo el 18% restante junta entre 25 y 30 años de aportes"", según un Informe de Idesa.
Aquellas personas que llegaron a sacar turno hasta este domingo podrán realizar el trámite de moratoria. ""No importa si el turno es para después de esa fecha, tener turno hace que conserves el derecho a tramitar la jubilación con moratoria. Además, si al momento de sacar el turno, no hay disponibles, el sistema te deriva automáticamente a una atención virtual donde te registran y listo, después te otorgarán un turno cuando haya, pero ya quedas registrada y no perdés el derecho a tramitar"", explicaron desde Anses.
Un informe de la Seguridad Social (“Densidad de aportes al Sistema Previsional administrado por la ANSES, 1994-2024"") asegura que sin la moratoria previsional, el 50% de los varones -que cumplen 65 años- y el 69% de las mujeres – que cumplen 60 años – este año, no podrán acceder a la jubilación contributiva.En total son 150.000 mujeres y 93.000 varones: un total de 243.000 personas.No obstante, como también pueden jubilarse a través de la moratoria las mujeres de más de 60 años y varones de más de 65 años aunque no tengan los 30 años de aportes, se estima que esa cifra podría hasta duplicarse.
Newsletter Clarín
Recibí en tu email todas las noticias, coberturas, historias y análisis de la mano de nuestros periodistas especializados",https://www.clarin.com/economia/finalizo-domingo-moratoria-previsional-medio-millon-personas-solo-podran-acceder-pension-universal_0_FHMRYktU4E.html
Clarín,2025-03-23,Negociación con el FMI: el Gobierno podría recibir hasta US$ 8 mil millones en fondos frescos,"Después de la semana más turbulenta desde la corrida cambiaria de junio del año pasado, el Gobierno sigue negociando lo que podrían ser los últimos detalles del acuerdo con el Fondo Monetario Internacional (FMI). El equipo económico liderado por Luis Caputo ya tendría definido el monto total del crédito que le otorgará el organismo yestaría por estas horas definiendo el primer desembolso que recibirá la Argentina así como los últimos retoques del nuevo esquema cambiarioque desvela al mercado.
La gestión de Javier Milei necesita dólares para pagar la deuda, estabilizar la economía y llegar con calma a las elecciones de octubre. Pese a que la Cámara de Diputados le aprobó el DNU para avanzar en un nuevo endeudamiento con el organismo, la Libertad Avanza cerró unasemana de alta tensión con ventas del Banco Central por US$ 1.148 millones, caída de reservas, baja del Merval y los bonos en dólares, suba de los dólares financieros y los contratos de futuros, y un incremento del riesgo país.
En ese marco y al igual que las últimas dos gestiones,el Gobierno recurrió a la ""rueda de auxilio"" del FMI, como dijo el vocero presidencial Manuel Adorni, y Milei dijo a Bloomberg en Línea que el acuerdo técnico estaría listo para""mitad de abril"".Se trata de un programa de Facilidades Extendidas por 10 años con un plazo de gracia de 4 años y medio -en los que no habrá pagos de capital- y fondos para refinanciar los vencimientos pendientes de 2022 y cancelar letras intransferibles en poder del Banco Central
Si bien Caputo mantiene los detalles del acuerdo bajo un fuerte hermetismo y aseguró que faltaba definir el monto, Bloomberg informó días atrás que el préstamo podría alcanzar los US$ 20.000 millones y que habría una ""reunión informal"" este el martes entre staff y el directorio del FMI. A su vez, fuentes al tanto de las conversaciones informaron aClarínque, de ese total,US$ 12.000 millones irían a refinanciar pagos de capital hasta 2029 y los US$ 8.000 restantes serían fondos frescos.
Ese reparto le permitiría a la Argentina renovar buena parte de losvencimientos de deuda por $ 14.000 millones con el Fondoen los próximos 4 años y los US$ 2.000 millones faltantes debería cubrirlos con fondos privados. Justamente,la expectativa de Caputo es volver a los mercados voluntarios de deuda en 2026, todo un desafío considerando que el riesgo país subió la semana pasada a 760 puntos básicos, lo que equivale a una tasa de interés para tomar deuda de dos dígitos (11,85%).
Pero lo que el mercado aguarda con más atención es el destino que tendrán los fondos frescos -principalmente, si se podrán utilizar o no para intervenir en el mercado cambiario- y la magnitud del primer desembolso, conocido como ""front loading"". El Bank of America ya proyectó en eneroun desembolso inicial de entre US$ 5.000 y 10.000 millonesy fondos frescos por hasta US$ 8.000 millones, casi la mitad de los US$ 15.000 millones que esperaba Caputo el año pasado.
El otro punto por definir son los trazos finales del esquema cambiario y la salida del cepo, que tienen en vilo a bancos, inversores y ahorristas. Clarín anticipó en enero que se conversabaun régimen de bandas cambiarias de flotación, entre otras opciones. Y el ministro de Economía no negó esa posibilidad cuando le preguntaron la semana pasada si pensaba abandonar el deslizamiento del dólar del 1% mensual por un régimen de flotación. ""Eso es parte del acuerdo y no lo puedo decir"", respondió.
Según fuentes con conocimiento del asunto,lo que faltaría cerrar es el ""ancho"" de dichas bandas, es decir, la zona entre el piso y el techo del dólardentro de la cual el BCRA no podrá intervenir y, por lo tanto, el tipo de cambio podrá flotar. Ricardo Arriazu, uno de los economistas más escuchados por el gobierno, dijo hace más de una semana que temía que el acuerdo incluyera bandas de flotación como las que dispuso Caputo en 2018, lo cual calificó comoun ""peligro"", y que habría una apertura del cepo mayor a lo previsto.
No es lo mismo que el Central sea vea impedido de intervenir si se fijara como límite superior un dólar a $ 1.390 -como se desprende de los contratos de futuro a diciembre- o un valor superior. Las bandas, a su vez, podrían ser móviles: el ex ministro de Economía,Nicolás Dujovne, espera que se vayan ampliandocon el correr de los meses. Por último,también podría flexibilizarse el dólar blend, de modo que los exportadores liquiden el 90% al tipo de cambio oficial y el 10% al CCL, en lugar del régimen actual de 80-20.
Redactor de la sección Economíajbarca@clarin.com
Newsletter Clarín
Recibí en tu email todas las noticias, coberturas, historias y análisis de la mano de nuestros periodistas especializados",https://www.clarin.com/economia/negociacion-fmi-gobierno-podria-recibir-us-8-mil-millones-fondos-frescos_0_OTUqHuSVCW.html
Clarín,2025-03-23,El Banco Central se desprendió de US$1.200 millones en seis ruedas: ¿se revierte la racha vendedora?,"La aprobación del DNU por el acuerdo con el Fondo en el Congreso yla expectativa del mercado de que este traiga aparejado un desembolso de unos US$ 20.000 millonesbuscarán disipar la creciente incertidumbre en el frente financiero argentino.La volatilidad del frente cambiario obligó al Banco Central a desembolsar más de US$ 1.200 millones en las últimas seis ruedas,en una seguidilla de ventas netas que no se veía desde la previa de las elecciones en 2019. Aunque el viernes el dólar financiero terminó por debajo del techo simbólico de los $1.300, y la brecha se mantiene en torno al 20%el nerviosismo de la City marcará el pulso las próximas semanas.
La presión en el tipo de cambio también se sintió en el precio de acciones y bonos.La semana pasada, el riesgo país subió 25 puntos básicos y finalizó en las 762 unidades. Por eso, el feriado de este lunes por el Día de la Memoria servirá como ""test"" para ver cómo reacciona el mercado internacional a las novedades del acuerdo con el Fondo, el principal factor que explica la volatilidad de las últimos días y el principal driver para una mejora del escenario cuando logre concretarse.
""La turbulencia parece haber amainado al menos, pero con indicadores de riesgo en niveles más altos respecto de la semana anterior, lo cual indica que persiste una expectativa difusa y dudas respecto del futuro inmediato"", comentaron en la consultora LCG y alertaron: ""Hasta tanto se llegue a un acuerdo, consideramos que veremos días de alta volatilidad, con cambios de humor repentinos, en un contexto en dondelas ayudas para mantener las reservas más o menos en línea (blanqueo, préstamos en dólares, emisión de ONs, carry, etc) se irán apagando"".
En este sentido, en la consultora Outlier afirmaron: ""Consideramos positiva la noticia de que el Staff y el Board del FMI avancen en reuniones informales para evaluar un nuevo PFE( Programa de Facilidades Extendidas) con Argentina por US$20.000 millones, y que la mismadebería tener impacto positivo en los activos locales, pero pareciera que aun faltan definiciones para terminar de desactivar las dudas del mercado sobre los cambios en el régimen monetario-cambiario en el marco de dicho acuerdo"",
La nueva suba del tipo de cambio, tanto del financiero como de las opciones de cobertura en el mercado de futuros, le quitan atractivo a la ""bicicleta financiera"" ocarry tradey esto a su vez puedesumar presión extra al dólar y la brecha en un momento donde el mercado aún espera conocer definiciones. ""Si el costo de cobertura cambiaria se incrementa, el equilibrio para las tasas en pesos se ve afectado. Se necesita un rendimiento nominal y real mayor para convencer a los tenedores de pesos. Eso se dio con un fuerte desplazamiento de la curva de pesos. Pasó de tener pendiente negativa a pendiente claramente positiva. Todo esto en un nivel de tasas mucho más alto que el que estaba vigente 30 días atrás, aún sin que se haya modificado la tasa de política monetaria"", explicaron en el consultora Mega QM.
""La manera en que se acomodaron los costos de cobertura y las tasas de interés llevan a pensar quese necesitan definiciones en el corto plazo.Los incentivos con estos niveles de tasas son negativos para la compra de dólares del BCRA y por lo tanto no lucen sostenibles. Por eso todo lleva a pensar que se van a buscar definiciones lo más rápido posible. Esas definiciones, que seguramente vengan con el entendimiento técnico con el FMI, deben dar certeza sobre el camino elegido para la política cambiaria y la monetaria"", agregaron y sumaron: ""Lo que queda claro es que cuando el mercado adquiere esta dinámica de corto plazo, los costos de demorar las decisiones pueden ser altos. Por eso esperamos que exista un esfuerzo adicional por avanzar con el acuerdo técnico lo antes posible y generar definiciones que ayuden a alinear expectativas del mercado"", añadieron.
Redactora de la sección Economía/Pyme.apedotti@clarin.com
Newsletter Clarín
Recibí en tu email todas las noticias, coberturas, historias y análisis de la mano de nuestros periodistas especializados",https://www.clarin.com/economia/banco-central-desprendio-us1200-millones-ruedas-revierte-racha-vendedora_0_mGAXDwvt6t.html
Clarín,2025-03-23,Los albergues transitorios apelan a la pasión futbolera para ganar clientes,"En “fecha FIFA, se fifa”. Este es el insólito slogan que propuso la Cámara que agrupa a los albergues transitorios de todo el pais, para impulsar un negocio que no escapa a los embates de la volatilidad económica de la Argentina.
Para eso, los comúnmente llamados  “telos” idearon una vuelta marketinera ocurrente: enuna campaña gráfica, vincularon la pasión que los amantes suelen desplegar en esos escenarios clandestinos con la que despierta el futbol en buena parte de la población.
La propuesta figura en numerosos carteles que aparecieron en los últimos dias, en todas las provincias. Se trata de una iniciativa de la Federación Argentina de Alojamientos por Horas (FADAPH). que pensó enatraer mayor cantidad de huéspedes ocasionales a los hoteles, apelando a sus deseos de no perderse las fechas en las que juega la Selección argentina de Futbol: como la que se jugó el viernes pasado y la que se espera para el próximo 25 de marzo.
“La idea es que este fin de semana no juega tu club; Argentina juega pero no todos los días, entonces esos días en los que no hay fútbol relevante para ver,tengas donde llevar tu pasión.Y en fecha FIFA se fifa”, explican los artífices de la campaña.
La Federación agrupa a unos 700 hoteles a nivel nacional , de los cuales, 100 están en distintos barrios de la Capital Federal yemplean, en forma directa, a unas 1.500 personas.
Al ser consultado sobre la situación actual de los albergues transitorios como negocio, su titular José Manuel Capelo Eiroa, responde: ""el rubro funciona bien más allá de que estamos con las generales de la ley y eso afecta o disminuye el trabajo; el interés de la gente siempre está presente,lo que está faltando es la mejora económica”, resume.
El sector, tal como sucedió con muchos otros rubros e industrias sufrió mucho durante la pandemia y la postpandemia. Inclusive, varios hoteles tuvieron que cerrar por la inviabilidad del negocio. A esto se sumó otra tendencia que creció en los últimos años:la compra de este tipo de terrenos ubicados en lugares estratégicospara construir nuevos proyectos inmobiliarios. Con todo, según Capelo Eiroa, “como actividad estamos en una recuperación lenta pero continua. describe.
Los recursos que son capaces de generar los albergues para sostenerse en el mercado varían según distintos factores. Los precios “dependen mucho de la ubicación geográfica y los servicios que ofrece cada establecimiento, como también al sector que apunta.Los valores pueden estar entre $25.000 y $100.000según las características de las habitaciones y del albergue transitorio"", detalló el titular de FADAPH.
Redactora de la sección Economía/Pyme.nmuscatelli@clarin.com
Newsletter Clarín
Recibí en tu email todas las noticias, coberturas, historias y análisis de la mano de nuestros periodistas especializados",https://www.clarin.com/economia/albergues-transitorios-apelan-pasion-futbolera-ganar-clientes_0_tm1I7qDjr9.html
