diario,fecha,titulo noticia,contenido,link
Clarín,2025-01-26,"La pesca, en el fondo del mar: precios bajos, costos altos y con retenciones","Para el Gobierno la pesca es un tema arduo de tratar, muchas veces indescifrable en la complejidad de una cadena que arranca en el fondo del mar. ¿Será por eso quese olvidaron de incorporarla en la lista de las retenciones a eliminar?
En este caso los castiga en un rango quellega al 9%. Hay también prejuicios sobre una industria que abarca a unas500 empresasque comunican poco e impiden ver sus negocios a la luz.
Curioso. El mundo considera al caladero argentino o su inmenso litoral marítimo comouno de los más sanos y de mayor potencial,pero las principales empresas, de capitales locales y españoles, dicen que de seguir así se ahogarán a gran velocidad.
De acuerdo a Agustín de la Fuente, presidente de CAPIP, que aglutina a la industria pesquera de la Patagonia, la situación ha empeorado por la suba de insumos, mano de obra que sepaga en dólarescon básicos de los marineros de US$ 20.000, una carga tributaria elevada quellega al 40%y el precio del langostino que sepulverizó de US$ 15 el kilo a los US$ 5 actuales.
La actividad se divide en una etapa extractiva de captura y una de procesamiento que se realiza en plantas en tierra o a bordo de los buques congeladores. Y se reconoce un aumento de los controles satelitales y zonas de veda para proteger los recursos.
El subsecretario del área, Juan Antonio López Cazorla es un veterinario que integró por 13 años el Consejo Federal Pesquero.
Por cierto, la captura marítima explica alrededor del 98% de la producción pesquera nacional.En 2024 exportaron por US$ 1.981 millones,13,1% más pese a que los precios se derrumbaron. La pescatiene una participación en el complejo exportador de 4,2%.
Las tres especies principales fueron el langostino, calamar y  merluza hubbsi que en un 46% se destinaron a España e Italia. También, a Estados Unidos con 8% y a Brasil, 4%.
Los desembarques durante 2024 se concentraron en los puertos de Mar del Plata (45%), donde opera una importante flota fresquera, Puerto Madryn (19%), Rawson (12%), Puerto Deseado (9%) y Ushuaia (4%), donde reina casi exclusivamente la flota congeladora.
El consumo internosigue bajo, en torno a de 5 a 6 kilos por habitante por año,mientras que a nivel mundial es de 19 kilos.
En cuanto a la carga tributaria que los desvela, ronda 35% de lo exportado. Pero en algunas especies como la merluza hubbsi puede llegar al 40% del valor capturado, según las cámaras del sector.
La actividad paga unDerecho Unico de Extracción (DEU)que en promedio es entre 1,3% y 0,45 % del valor del producto desembarcado. Al DEU lo fija el Estado a través del Consejo Federal Pesquero para financiar los gastos de administración del recurso (INIDEP, CFP, Escuela de Pesca, etc) y se calcula en una denominada Unidad Pesca atada al litro de gas-oil.
“Además, parte de esos gastos de la administración los vuelve a pagar el empresario por otras vías, financiando las campañas de investigación y pagando las tasas de inspectores y observadores”, señalan.
También pesan las retenciones, Impuesto a las Ganancias, Ingresos Brutos, Cargas Sociales, Tasas Municipales, Tasas de Senasa, Tasas de Prefectura, Canon Portuario, Tasas Aduaneras, Impuesto al débito e IVA que“no se puede recuperar o que se recupera tarde y devaluado”, acotan para resaltar lo que consideran una carga extrema.
Solo 3 países en el mundo cobran regalías pesquerasy ninguno de ellos posee Derechos de Exportación ni la carga tributaria de Argentina. Y solo en 13 países se cobra un canon como el DUE y en ese caso Argentina paga lo mismo que Canada, Noruega y Paises Bajos y4 veces más que lo que se paga en EE.UU.
La industria opera en 800 buques con permiso nacional y otros 200 artesanales. Y contabiliza 377 establecimientos fabriles. Nadie duda que desde hace 150 años reman mucho para poder salir a pescar. Hoy emplean a 46.000 personas.
Editora de la sección Economíasnaishtat@clarin.com
Newsletter Clarín
Recibí en tu email todas las noticias, coberturas, historias y análisis de la mano de nuestros periodistas especializados",https://www.clarin.com/economia/pesca-fondo-mar-precios-bajos-costos-altos-retenciones_0_2dkoTljV2x.html
Clarín,2025-01-26,Dólar ahorro hoy: a cuánto cotiza este domingo 26 de enero,"La cotización deldólar ahorroes de$1389,70para la venta este domingo 26 de enero de 2025.
El dólar ahorro sube1%respecto al mismo día de la semana anterior.
En lo que va de enero de 2025, el dólar ahorro sube respecto al mes anterior: la diferencia es de15%.
En comparación con el año pasado, el dólar ahorro sube un3%. A esta altura del año anterior, el ahorro cotizaba a$1348.4.
El valor deldólar ahorrotiene una diferencia con eldólar MEP. Mientras que el primero está$1389,70, el MEP cotiza hoy a$1153,40, lo que marca una brecha de20%.
Eldólar ahorroes un tipo de cambio mayor al dólar oficial, que se muestra como la opción más barata para comprar a modo de atesoramiento.
La compra deldólar ahorrohoy en Argentina se maneja bajo la siguiente cotización: el 30% del impuesto país se mantiene y el 35% del impuesto a las ganancias pasa a ser de un 45%, igualando la cotización del dólar tarjeta.
La cotización del dólar ahorro funciona en el mismo horario del mercado de cotizaciones:hasta las 16:30 horas, de lunes a viernes.
Estas operaciones reciben el nombre de “operaciones de liquidación con cable”. Para identificarlas se agrega una C al final del código de negociación de la especie. Así se diferencian de aquellas que se liquidan en pesos o dólares en cuentas radicadas en el mercado local.
Newsletter Clarín
Recibí en tu email todas las noticias, coberturas, historias y análisis de la mano de nuestros periodistas especializados",https://www.clarin.com/economia/dolar-ahorro-hoy-cotiza-domingo-26-enero_0_Su5UXihIyu.html
Clarín,2025-01-26,Dólar CCL hoy: a cuánto cotiza este domingo 26 de enero,"La cotización deldólar CCLes de$1163,80para la compra y de$1168,20para la venta, este domingo 26 de enero de 2025.
El dólar CCL baja2%respecto al mismo día de la semana anterior.
En lo que va de enero de 2025, el dólar CCL sube respecto al mes anterior: la diferencia es de0%.
En comparación con el año pasado, el dólar CCL baja un3%. A esta altura del año anterior, el CCL cotizaba a$1202.1.
El valor deldólar CCLtiene una diferencia con eldólar MEP. Mientras que el primero está$1163,80, el MEP cotiza hoy a$1153,40, lo que marca una brecha de3%.
Eldólar CCL o dólar contado con liquidaciónes uno de los tipos de cambio financieros más usados en el país, junto con el dólar MEP (o dólar bolsa). Se trata de una herramienta financiera que permite cambiar pesos por dólares en el exterior. Muchas empresas e inversionistas usan este método para adquirir divisas y sacarlas del país legalmente.
Eldólar CCL o dólar contado con liquidaciónconsiste en la compra de un bono en pesos (AL30) o en dólares (AL30D) para venderlo en especie C (AL30C). Mediante estas 2 simples operaciones podés ingresar dinero a cuentas de inversión en Estados Unidos.
La cotización del dólar CCL funciona en el mismo horario del mercado de cotizaciones:hasta las 16:30 horas, de lunes a viernes.
Estas operaciones reciben el nombre de “operaciones de liquidación con cable”. Para identificarlas se agrega una C al final del código de negociación de la especie. Así se diferencian de aquellas que se liquidan en pesos o dólares en cuentas radicadas en el mercado local.
Newsletter Clarín
Recibí en tu email todas las noticias, coberturas, historias y análisis de la mano de nuestros periodistas especializados",https://www.clarin.com/economia/dolar-ccl-hoy-cotiza-domingo-26-enero_0_M6hyi3vCDP.html
Clarín,2025-01-26,Dólar tarjeta hoy: a cuánto cotiza este domingo 26 de enero,"La cotización deldólar tarjetaes de$1389,70, este domingo 26 de enero de 2025.
El dólar tarjeta sube1%respecto al mismo día de la semana anterior.
En lo que va de enero de 2025, el dólar tarjeta sube respecto al mes anterior: la diferencia es de15%.
En comparación con el año pasado, el dólar tarjeta sube un3%. A esta altura del año anterior, el dólar tarjeta cotizaba a$1348.4.
El valor deldólar tarjetatiene una diferencia con eldólar blue. Mientras que el primero está$1389,70, el blue cotiza hoy a$1205, lo que marca una brecha de15%.
Eldólar tarjetaes el tipo de cambio que se emplea para el pago de consumos con tarjeta de débito y crédito en el exterior así como para la compra, también en dólares, de pasajes y paquetes turísticos hacia destinos fuera de la Argentina.
El valor deldólar tarjetase conforma de la siguiente manera: al dólar oficial se le añade un 30% de impuesto país y un 30% de ganancias. Se trata de una carga impositiva total del 60%, frente al 155% que existía en la gestión anterior.
La cotización del dólar tarjeta funciona en el mismo horario del mercado de cotizaciones:hasta las 16:30 horas, de lunes a viernes.
Newsletter Clarín
Recibí en tu email todas las noticias, coberturas, historias y análisis de la mano de nuestros periodistas especializados",https://www.clarin.com/economia/dolar-tarjeta-hoy-cotiza-domingo-26-enero_0_ToJ88kLNpa.html
Clarín,2025-01-26,Dólar MEP hoy: a cuánto cotiza este domingo 26 de enero,"La cotización deldólar MEPes de$1153,40para la compra y de$1157,70para la venta, estedomingo 26 de enero de 2025.
Eldólar MEPbaja1%respecto al mismo día de la semana anterior.
En lo que va deenero de 2025, el dólar MEPsuberespecto al mes anterior: la diferencia es de14%.
En comparación con el año pasado, el dólar MEPbajaun2.77%. A esta altura del año anterior, el MEP cotizaba a$1186.2.
El valor del dólar MEP tiene una diferencia con el dólar blue. Mientras que el primero está a$1153,40, el blue cotiza hoy a$1205, lo que marca una brecha de4.28%.
Eldólar MEPes un tipo de cambio mayor al dólar oficial, que se muestra como la opción más barata para comprar a modo de atesoramiento.
El dólar MEP consiste en la compra de un bono en pesos y su venta en dólares. Este tipo de cambio se calcula a partir de la división entre el precio en pesos y la cotización en dólares.
La cotización del dólar MEP funciona en el mismo horario del mercado de cotizaciones: hasta las 16:30 horas, de lunes a viernes.
Su nombre deriva de la sigla 'MEP', que significa Mercado Electrónico de Pagos. Es una variante al dólar ahorro, ya que presenta menos restricciones como se mencionó anteriormente.
Newsletter Clarín
Recibí en tu email todas las noticias, coberturas, historias y análisis de la mano de nuestros periodistas especializados",https://www.clarin.com/economia/dolar-mep-hoy-cotiza-domingo-26-enero_0_WJv23L9pEK.html
Clarín,2025-01-26,Euro hoy: a cuánto cotiza este domingo 26 de enero,"Eleurocotiza estedomingo 26 de eneroa $1.028,58 para la compra y $1.029,77 para la venta, por lo que se mantiene estable respecto a la última cotización.
En cuanto a la divisa en el mercado paralelo, eleuro blue hoycotiza a 1261.88 para la compra y 1282.82 para la venta. De este modo, su precio sube en relación al último informado.
Con estos valores, labrechaentre el euro blue y el euro oficial​ es de 122651%.
Elvalor del euro bluetiene una diferencia sustancial más alta con el euro oficial ya que este último es el que se adquiere en los bancos y que posee una cotización establecida.
Al igual que el dólar blue, eleuro bluees el que circula en el mercado negro y suele tener un valor más alto que el oficial. Una explicación sobre su denominación señala que se llama así porque en inglés, ""blue"", además de nombrar al color azul, remite a algo ""oscuro"". De esta manera, se reconoce al cambio de la divisa por fuera del sistema cambiario.
El término euro blue se empezó a utilizar a partir del 2011, como consecuencia de lasrestriccionespara la adquisición de moneda extranjera que comenzaron a aplicar la Administración Federal de Ingresos Públicos (AFIP) y el Banco Central de la República Argentina bajo el gobierno de Cristina Fernández de Kirchner.
Estaslimitacionescobraron un nuevo impulso en diciembre de 2019, luego de los anuncios de presidente Alberto Fernández sobre la Ley de Emergencia económica y que se profundizaron a lo largo del 2020 con el cepo cambiario. Esto genera que los sectores que viajen al exterior opten por la compra de euros en elmercado negro, generando así un aumento en el precio del euro blue.
El nombre del Euro paralelo
El euro se lanzó el 1° de enero de 1999, cuando 10 países fijaron sus tipos de cambio y entregaron las decisiones sobre las tasas de interés al recién creado Banco Central Europeo. Los billetes y monedas de euro entraron en circulación tres años después.
La moneda compartida se vio como una solución a las constantes disputas por los tipos de cambio que habían marcado la política europea después de la Segunda Guerra Mundial y como una extensión lógica de la zona de libre comercio de aranceles de la Unión Europea. Gran Bretaña, en particular, optó por no participar, pero 19 de los 27 países de la UE utilizan el euro como moneda nacional. Quienes componen la zona del euro, también denominada ""eurozona"" son:AustriaBélgicaChipreEstoniaFinlandiaFranciaAlemaniaGreciaIrlandaItaliaLetoniaLituaniaLuxemburgoMaltaPaíses BajosPortugalEslovaquiaEsloveniaEspaña
Newsletter Clarín
Recibí en tu email todas las noticias, coberturas, historias y análisis de la mano de nuestros periodistas especializados",https://www.clarin.com/economia/euro-hoy-cotiza-domingo-26-enero_0_dVgQSWec9W.html
Clarín,2025-01-26,Dólar blue hoy: a cuánto cotiza este domingo 26 de enero,"La cotización deldólar bluees de $1205 para la compra y de $1225 para la venta, estedomingo 26 de enero de 2025.
En lo que va de enero de 2025, el dólar blue sube respecto al mes anterior: la diferencia es de 1%.
En lo que va de este 2025, el dólar blue sube respecto al 2024: la diferencia es de 0.42%.
El valor del dólar blue tiene una diferencia sustancial con el dólar oficial, que se adquiere en los bancos y que posee una cotización establecida. La brecha entre el dólar oficial y el dólar blue es de 17%.
Eldólar bluees el que circula en el mercado negro y suele tener un valor más alto que el oficial. Este dólar no se compra en bancos o casas de cambio oficiales.
La cotización del dólar blue cierra junto con la del dólar oficial: a las 15 horas, de lunes a viernes.
Una explicación sobre su denominación señala que se llama así porque ""blue"", en inglés, además de nombrar al color azul, remite a algo ""oscuro"". Otra teoría lo relaciona con las operaciones de compra a través de bonos o acciones de compañías conocidas como""blue chips"". Y también se lo vincula con el color aproximado que aparece cuando se aplica un fibrón para detectar billetes falsos.
La cotización deldólar oficiales de $1029 para la compra y de $1069 para la venta, este domingo 26 de enero de 2025, según el Banco Nación.
La cotización deldólar bolsaes de $1153,40 para la compra y de $1157,70 para la venta, este domingo 26 de enero de 2025.
La cotización deldólar CCLes de $1163,80 para la compra y de $1168,20 para la venta, este domingo 26 de enero de 2025.
Newsletter Clarín
Recibí en tu email todas las noticias, coberturas, historias y análisis de la mano de nuestros periodistas especializados",https://www.clarin.com/economia/dolar-blue-hoy-cotiza-domingo-26-enero_0_73P6oJPei9.html
Clarín,2025-01-25,Un gobernador patagónico eliminó impuestos al campo tras la baja de retenciones del Gobierno de Milei,"Horas después del anuncio debaja de retenciones que encabezó Luis Caputo, un gobernador de la Patagonia se sumó a los anuncios que benefician al campo. Se trata de Ignacio Torres, que ya se había fotografiado con el ministro de Economía hace una semana y ahora presentó una medida en la misma sintonía que la iniciativa del Gobierno nacional.
Torres anunció que enviará a la Legislatura provincial un proyecto paraeximir de Ingresos Brutos al sector productivo ganadero, así como también delimpuesto inmobiliario rural.
La medida es ""en reconocimiento a las dificultades climáticas enfrentadas el año pasado y en línea con la baja de retenciones del Gobierno nacional"", añadió el gobernador de Chubut, que blanqueó la sintonía fina con el Ministerio de Economía y  la Casa Rosada en materia de beneficios al sector del campo. Añadió que se alinea también con un deseo de ""simplificación tributaria y alivio fiscal"".
Si bien la iniciativa debe ser aprobada por la Legislatura, Torres impulsó a los municipios a adherir a la eximición de impuestos, ""ya que beneficiará a aquellos productores que desarrollen sus actividades dentro del ejido municipal"".
La justificación del proyecto también fue similar a los argumentos que esgrimió Caputo. Esto ""es posible gracias a una administración eficiente de los recursos, que nos permitió alcanzar un escenario de superávit financiero en apenas un año, tras haber recibido una provincia fundida y con los niveles de endeudamiento más altos de la Argentina"", aseguró el mandatario chubutense.
En la conferencia de prensa, de la que también participaron la ministra de Producción de Chubut, Laura Mirantes, y autoridades de entidades rurales, Torres anticipó que buscará la eliminación dela ""tasa del zorro"".
""Un impuesto absurdo que contribuía a que la provincia tenga una matriz fiscal más burocrática y regresiva"", lo describió el gobernador.
Poco después llegó el agradecimiento de la Sociedad Rural. ""Gracias gobernador por escucharnos, recuerdo hace meses nuestra reunión hablando de estos temas. El campo patagónico también necesita alivio fiscal"", expresó Nicolás Pino, presidente de la SRA.
El gobernador de Chubut había encabezado una protesta contra el Gobierno de Milei  en febrero pasado. Aquella vez, Torres amenazó con paralizar la producción de Vaca Muerta. Era por la retención de un tercio de la coparticipación y una deuda de Chubut con Nación de los tiempos del gobernador massista Mariano Arcioni y del mismo Sergio Massa en el Ministerio de Economía.
""Pobrecito, Nachito, no la ve. Es un pobre chico que no puede leer un contrato. Es de una precariedad intelectual muy grande"", le contestó Milei, en una saga de cruces, acusaciones y chicanas que tuvo como escenario actos políticos, la TV y las redes sociales.
Sin embargo, la relación se calmó con el correr de los meses. Y Torres fue uno de los 18 gobernadores que asistieron al demorado Pacto de Mayo en Tucumán.
El 17 de enero, justo antes del viaje de Luis Caputo a Washington junto a Milei, el ministro de Economía y el gobernador de Chubut se fotografiaron por la firma del Régimen de Extinción de Obligaciones Recíprocas, por la que se quita unos 100 millones de dólares de deuda provincial.
Chubut fue la primera provincia en rubricar un acuerdo de ese tipo con Nación.
En el anuncio de baja de retenciones a cultivos y eliminación de retenciones a economías regionales, Caputo había arengado: ""También sería bueno que las exigencias empiecen a concentrarse más a nivel provincia y municipios. Hay una diferencia muy clara del esfuerzo que estamos haciendo a nivel de Nación y del que se está haciendo a través de provincias y municipios"".
Ahora, la provincia patagónica que gobierna Torres se sumó a los beneficios impositivos al campo. Y hasta sirviópara la chicana en otra provincia.
""Teléfono para Llaryora"", escribió en redes el cordobés Rodrigo de Loredo. ""En Chubut Nacho Torres eliminó el impuesto inmobiliario rural que el gobernador aumentó en un 200% (muy por arriba del 117% del 2024 y 8 veces más de la proyectada para 2025). Eliminó también ingresos brutos al campo, impuesto que Llaryora le cobra en un 3.7% a los servicios e insumos agropecuarios"", añadió.
""SÍ SE PUEDE HACER. Lo hizo un gobernador,¿qué excusa nos va a poner ahora el cobrador serial de impuestos?"",dijo el radical De Loredo sobre el gobernador cordobés Llaryora.
Llaryora se había mostrado con otros dos mandatarios provinciales en una conferencia de prensa en la que reclamaron la baja de retenciones al campo, unos días antes de que lo confirmara el Gobierno de Milei. Uno era Maxi Pullaro (Santa Fe). El otro,Rogelio Frigerio(Entre Ríos).
Frigerio también hizo anuncios en las últimas horas. ""Presentamos en la Legislatura un proyecto para bajar ingresos brutos y sellos, y continuaremos en este sendero hasta eliminarlos, como ya hicimos en algunos sectores. Ambos son impuestos regresivos que desalientan la producción, la inversión y la generación de trabajo"", dijo este sábado, en un tuit en el que también destacó la reducción del gasto público.
Newsletter Clarín
Recibí en tu email todas las noticias, coberturas, historias y análisis de la mano de nuestros periodistas especializados",https://www.clarin.com/economia/gobernador-patagonico-elimino-impuestos-campo-baja-retenciones-gobierno-milei_0_aI6l4JozAY.html
