diario,fecha,titulo noticia,contenido,link
Clarín,2025-04-30,"Aerolíneas informó que no pedirá subsidios en 2025, por primera vez desde su estatización","Aerolíneas Argentinas le informó al Ministerio de Economía queno necesitará transferencias del Estado Nacionaldurante 2025. La empresa emitió un comunicado dando cuenta de este hecho, donde subrayó que sería ""inédito"" desde su estatización a mediados de 2008. El comunicado agregó que la empresa tiene previsto cubrir todos sus gastos de este año con fondos propios, ""construyendo la viabilidad necesariapara una eventual privatización"".
A su vez, voceros de Aerolíneas descartaron que la habitual fuente de financiamiento externo (aunque no la única) que ha sido el Tesoro nacional vaya a ser reemplazada poralgún préstamo en los mercados de capitales,como ocurrió con el bono por US$ 100 millones emitido por la anterior conducción .""Sin planes por el momento"", agregaron.
Según informó la empresa, entre 2008 y 2023, el Estado le transfirió ""cerca de8 mil millones de dólaresutilizados principalmente para cubrir sudéficit operativoa nivel EBIT (ganancias antes de intereses e impuestos), siendo este el indicador troncal que utiliza la industria aerocomercial para evaluar la performance de una compañía"". En promedio, en cada uno de los últimos 16 años, ""Aerolíneas registró una pérdida operativa anual de 400 millones de dólares que debió ser saldada por el Tesoro Nacional"", agregó la comunicación.
Según dijo el titular de la empresa,Fabián Lombardo, durante 2024 tampoco hubo pérdidas, si bien a comienzos del año pasado la empresarecibió un subsidio por el equivalente acasi 65 millones de dólarespara financiar un programa de retiros voluntarios.
El funcionario informó que, al finalizar 2024, Aerolíneas tuvo un superávit operativo por el equivalente a20,2 millones de dólares.Según el comunicado, el resultado económico total habría sido de 156.324 millones de pesos (más de US$ 150 millones), si bien se trata de los números de un balance que todavía no fue aprobado y que está siendo auditado por la consultoraKPMG.
""La mejora central en estos resultados se dio en la operación misma, es decir, que por primera vez Aerolíneas Argentinasobtuvo ingresos mayores a los costosrequeridos para su funcionamiento"", agregó la empresa, que hizo una enumeración de las medidas de ajuste de los últimos 15 meses.
Si bien no hay candidatos hasta el momento que hayan mostrado interés en comprar Aerolíneas, desde la empresa resaltaron que el cartel de venta está en el horizonte. ""Este escenario marca un punto de inflexión para Aerolíneas Argentinas: no solo deja atrás más de una década de déficit operativo, sino que proyecta un modelo de gestión autosustentable, con foco en la eficiencia y la productividad, construyendo la viabilidad necesaria para una eventual privatización"", concluyó el comunicado.
Editor del Suplemento Económico y de Pymeslceriotto@clarin.com
Newsletter Clarín
Recibí en tu email todas las noticias, coberturas, historias y análisis de la mano de nuestros periodistas especializados",https://www.clarin.com/economia/aerolineas-informo-pedira-subsidios-2025-primera-vez-estatizacion_0_HiqXlNiU2X.html
Clarín,2025-04-30,"Con dólares del FMI, el Gobierno está a punto de cancelar parte de la deuda con el Banco Central","Dos semanas después del acuerdo con el Fondo Monetario (FMI),el Gobierno se apresta a recomprar el grueso de las Letras Intransferiblesen poder del Banco Central con los US$ 12.000 millones que ya recibió del organismo. Solo restan definir los últimos detalles para que el Tesoro recupere esos""papelitos de colores""emitidos por todas las gestiones en los últimos 20 años, y cancele su deuda con la autoridad monetaria.
Según pudo saber Clarín,el Banco Central podría tratar la operación hoyen su reunión de directorio, un encuentro que se hace los jueves pero que se adelantó por el feriado del Día del Trabajador. En su último balance, la entidad informó un stock de Letras Intransferibles de US$ 23.000 millones, de los cuales US$ 10.500 millones vencen el próximo 1 de julio. ""Parecería que renuevan el 70%"", dijo una fuente con conocimiento.
Por otra parte, la Oficina Nacional de Crédito Público (dependiente de la secretaría de Finanzas, a cargo de Pablo Quirno) debe definir el criterio para valuar las letras. ""El Tesoro le compra letras al valor del mercado con una fórmula que ya se utilizó una vez, de acuerdo a lo que arroje eso y de acuerdo a los dólares que se dispongan del FMI, ahí lo vamos a saber"", dijo una fuente oficial.
La expectativa es que se siga el mismo criterio que el titular del BCRA, Santiago Bausili, cuando en mayo del año pasadomandó a pérdida Letras Intransferiblesy títulos públicos por US$ 46.000 millones. Así, de un valor técnico de casi US$ 70.000 millones, el Central pasó a valuarlas a ""valor recuperable de mercado"" en poco más de US$ 23.000 millones, un tercio del stock a valor nominal.
Pese a la fuerte reducción del déficit fiscal tras el ""mayor ajuste de la historia"", la gestión de JavierMilei tomó un crédito de US$ 20.000 millones a mediados de abril alegando que necesitaba incrementar las reservasdel Banco Central a través de la cancelación de las Letras Intransferibles y pagar deuda al FMI por el préstamo tomado por Alberto Fernández en 2022 para cancelar el que acordó Mauricio Macri en 2018.
Según el DNU enviado al Congreso que aprobó el préstamo del Fondo, la operación ""mejora la posición financiera y la liquidez de las reservas"". En concreto, el Banco Central recibirá los dólares del organismo, en momentos que sigue sin acumular divisas propias tras la salida parcial del cepo. Y estoaumentaría la capacidad de intervención en el mercado cambiario, algo que Caputo dijo que hará cuando el dólar baje a $ 1.000.
El otro objetivo esmostrar una supuesta ""reducción de la deuda"", en este caso, la deuda bajo legislación nacional en moneda extranjera. Pero lo hace contrayendo una deuda con el Fondo, un cambio de acreedor que aumenta la cuenta de intereses con recargos al 7% anual y condiciona la política económica. Las letras, en cambio, rinden a una tasa inferior, no son una deuda exigible ni tienen valor de mercado.
El primero en utilizar las letras intransferibles fueNéstor Kirchner en 2005para pagarle US$ 9.810 millones al FMI de un tirón. Luego, en 2010, Cristina Kirchner autorizó el uso de reservas para pagar deuda con bonistas. Y para 2014, los títulos intransferibles sumaban casi US$ 54.000 millones. La gestión deMauricio Macri redujo su stock con canjes y un recorte de su valuación, lo que llevó el monto a US$ 30.000 millones.
Desde el 2020, el gobierno deAlberto Fernández volvió a emitir papeles intransferiblesy el BCRA las computó a su valor técnico, es decir a un valor superior al de mercado, que elevó el stock a US$ 50.000 millones. Por último,la gestión deMilei emitió en enero del año pasado Letras Intransferiblespor US$ 3.200 millones para pagar con esos dólares la deuda externa y en mayo le aplicó una quita a los papeles.
Ahora, el Gobierno busca ""recapitalizar"" el BCRA, pese a que esta semana lo descapitalizó con elgiro de utilidades por $ 11 billonesal Tesoro para pagar deudas. ""La recompra de letras es mucha cosméticay permite bajar el stock de deuda porque las compra con un descuento importante, pero la confianza en política monetaria no depende de que el Central tenga patrimonio positivo, si no de cómo se maneje"", dijo un exfuncionario de Economía.
""En términos de deuda, es un canje de un pasivo intra-sector público por un pasivo con el FMI. Entonces,aunque la deuda bruta puede bajar por la baja contable del stock de letras, la deuda neta sube: cambiaste un pasivo con el BCRA por uno con un organismo internacional. Y como la cancelación se hace al valor contable que le da el BCRA, la deuda bruta del Tesoro se va a ver reducida, aunque el costo real de cancelación sea mucho menor"", señaló Francisco Ritorto, economista de ACM.
SN
Redactor de la sección Economíajbarca@clarin.com
Newsletter Clarín
Recibí en tu email todas las noticias, coberturas, historias y análisis de la mano de nuestros periodistas especializados",https://www.clarin.com/economia/dolares-fmi-gobierno-busca-cancelar-parte-deuda-banco-central_0_aPvhs4DEc0.html
Clarín,2025-04-30,Pago con QR en el subte: las billeteras virtuales piden más tiempo para poner en marcha el sistema,"Laimplementación del pago con QR en el transporte público, en primer lugar, en el subte, anunciada como una alternativa a la SUBE,generó un nuevo conflicto en el ecosistema de billeteras virtuales.El Banco Central (BCRA) fijó el12 de mayo como fecha límitepara poner en marcha la funcionalidad, pero según el resto de los competidores,solo Mercado Pago está en condiciones de cumplir con esos plazos. El resto del sector pideuna prórroga de 60 días hábilespara adaptar los sistemas.
La empresa de Marcos Galperín no solo actúa como billetera, sino que fue contratada por Emova, la concesionaria del subte, para administrar los pagos con QR. Mercado Pago comenzó a realizar pruebas internas hace semanas y ya habilitó la funcionalidad a algunos usuarios,algo que sus competidores consideran una ventaja desleal.
“Al 12 de mayo solamente llegan ellos"", destacó a Clarín un ejecutivo de una app rival. Y agregó:""Ya están haciendo pruebas entre familiares y amigosporque al estar también del otro lado del mostrador tuvieron definiciones antes que el resto”.
Las app que compiten con MP aseguran que recién este lunes recibieronla versión final del estándar técnico de QR diseñado para el transporte público, lo que impide implementar y testear la tecnología a tiempo para la fecha pactada, que ya había sufrido una prórroga en enero pasado.
La implementación demanda básicamente otro desarrollo al QR de los comercios. El de pago del transporteserá generado por el usuario y leído por la terminal.Además, tienen que prevee que pueda usarte de forma offline.
Además, según los involucrados todavía faltan otras definiciones clave, comola responsabilidad ante fraudesy elesquema de comisiones,lo que complica aún más la operatividad.
Frente a esta situación, algunas billeteras mandaron una carta al BCRA pidiendo la prórroga. Ahora queda en manos del organismo, que aún no tomó una decisión sobre lo solicitado.
""El trabajo que está llevando adelante el BCRA al involucrar y convocar a toda la industria en la definición de los estándares técnicos y las reglas que harán posible el nuevo esquema de pago con QR en el transporte públicoes muy valiosoy, a la vez, de gran complejidad"", afirmó Santiago Eraso Lomáquiz, director de Legales y Asuntos Públicos de MODO
En ese sentido, el ejecutivo agregó: ""Es lógico que esa complejidad termine por estirar los plazos proyectados originalmente,en función de los múltiples aspectos técnicos y operativos que surgen al establecer una nueva forma de pagar con el consenso de la industria. Por eso, creemos que tambiéntiene sentido adaptar la fecha de salida al mercadoen función de los otros elementos clave de la normativa que fueron diferidos, como la publicación del Boletín CIMPRA que establece los estándares técnicos, y que recién se publicó este lunes por la tarde.
Mientras tanto el martes, se sumaron otras 14 líneas de colectivos de la Ciudad a las 13 en las que ya se puede pagar con tarjetas de crédito y débito y prepagas sin contacto.
Se trata de las líneas 7, 25, 26, 42, 65, 76, 84, 90, 99, 106, 109, 115, 132, que se suman a la 4, 6, 12, 23, 34, 39, 44, 50, 61, 62, 68, 102 y 107, que se agregaron el mes pasado. Además, está la 44, que había iniciado el recambio de las validadoras hace dos meses. Con esto, 28 de las 31 líneas porteñas ya ofrecen esa posibilidad.
""Esta modernización del transporte público de pasajeros continuará ampliándose a nuevas localidades de manera paulatina, al igual que la implementación en los trenes, y se irá comunicando a medida que se confirmen las fechas de inicio luego de las actualizaciones necesarias en los sistemas"", reza un comunicado de la Secretaría de Transporte.
SN
Editora de la sección Economía.snavarrotorre@clarin.com
Newsletter Clarín
Recibí en tu email todas las noticias, coberturas, historias y análisis de la mano de nuestros periodistas especializados",https://www.clarin.com/economia/pago-qr-subte-billeteras-virtuales-piden-tiempo-poner-marcha-sistema_0_QTPXLeqwzv.html
Clarín,2025-04-30,Caputo advirtió que tomará medidas contra Stellantis si aumenta los precios de sus vehículos,"El ministro de Economía,Luis Caputo, amenazó este miércoles con utilizar “herramientas” para impedir una suba de preciosque habría anunciado la automotriz Stellantis, una de las principales del sector en Argentina.
Caputo realizó la advertencia en una publicación en la red social X (ex Twitter) donde el periodista Horacio Alonso advertía sobre la decisión de la mencionada compañía deincrementar el valor de sus productos en un 3,5% a partir del 1° de mayo.
“No creo que sea así.Si fuera cierto, sería un cambio en la relación de confianzaconstruida con esta industria”, citó Caputo.
En este sentido, agregó: “Si se rompe esa confianza, que tanto costó construir, nosotrosusaremos nuestras herramientas para defender a los consumidores”.
De esta forma, el titular del Palacio de Hacienda salió al cruce de un posible incremento de precios de una empresa privada. De acuerdo con la información que difundió Alonso en el portal especializadoA Rodar Post,el aumento afectaría a las marcas Peugeot, Fiat y Citroën.
Ante la consulta deClarín, desde Stellantis señalaron quelos aumentos de sus marcas son informados después del 5 de cada mes,por lo que todavía no hay incrementos de precios confirmados para mayo. Pablo García Leyenda, director Comercial del Grupo, lo desmintió y aclaró: ""La lista de mayo aún no está definida. La política de la empresa es siempre esperar al cierre de las ventas del mes y recién después ponernos a pensar en los precios del mes siguiente"", dijo en el lanzamiento del Fiat Cronos. Con más de 450.000 unidades comercializadas en la región desde su lanzamiento en 2018, Fiat presentó oficialmente la de su sedán compacto insignia, que lideró el mercado durante tres años consecutivos. Esta nueva versión MY26 incorpora un rediseño estético —incluyendo una parrilla frontal renovada, ópticas LED, paragolpes actualizados y nuevas llantas de aleación— y amplía su oferta comercial con cuatro versiones y sus precios van de $ 23.055.000 a casi $29.000.000.
Sobre las advertencias del ministro en redes sociales, prefirieron no dar declaraciones.
Días atrás, Luis Caputo había celebrado la decisión de lossupermercadosde negarse a recibir listas de precios con subas por parte de las firmas alimenticias.
Y poco después, destacó en su cuenta de X queVolkswagen retrotrajo la suba de 3 por cientoque había dispuesto tras la salida del cepo cambiario. ""De esta manera, ninguna automotriz subió precios. Como siempre, la competencia favorece a los consumidores"", marcó el ministro.
Luego del anuncio del Gobierno de la liberación del cepo al dólar,las automotrices tomaron diferentes medidas en un marco de incertidumbre generalizadapor la medida y previos rumores de devaluación.
Toyota, Ford o Renaultsiguieron operando sin cambios, mientras que otras suspendieron las operaciones por unos días hasta ver cómo evolucionaba el tipo de cambio, como las marcas delGrupo Stellantis, Nissan y Honda.
Solo una aumentó los precios, como es el caso deVolkswagenque, días después, retrotrajo el incremento de 3,6% que había aplicado.
SN
Newsletter Clarín
Recibí en tu email todas las noticias, coberturas, historias y análisis de la mano de nuestros periodistas especializados",https://www.clarin.com/economia/caputo-advirtio-tomara-medidas-stellantis-aumenta-precios-vehiculos_0_LcNXlkPMfP.html
Clarín,2025-04-30,El Gobierno dispuso la transformación de la Casa de la Moneda en una sociedad anónima unipersonal,"El Gobierno nacionalconvirtió la Casa de la Moneda en una sociedad anónima unipersonaly prorrogó la designación de su interventor,Pedro Daniel Cavagnaro, por 120 días, a través del decreto 295/2025 publicado este miércoles en el Boletín Oficial.
El decreto lleva las firmas del presidenteJavier Mileiy el ministro de Economía,Luis Caputo. La medida forma parte del proceso de adecuación de la Casa de la Moneda como sociedad anónima, luego de que se realizara una asamblea en diciembre del año pasado donde se dispuso su transformación.
A fines de octubre de 2024,el Gobierno confirmó la intervención por 180 días de la Casa de la Moneda. Previamente, había establecido lasuspensión de la impresión de billetes, por lo que el único rol de la empresa estatal seguía siendo laproducción de chapas patentes y otros documentos como pasaportes y cédulas.
En aquel decreto, había designado al interventor Cavagnaro con la tarea de elaborarun informe de estado de situación de la Casa de la Moneday formular un plan de readecuación para su conversión en sociedad anónima.
De acuerdo a lo publicado este miércoles en el Boletín Oficial, el informe relevó quela entidad había estructurado su actividad en cinco unidades de negocios:fabricación de dinero circulante, producción de estampillas fiscales y servicio de trazabilidad, producción de pasaportes, realización de chapa patente y servicios de atesoramiento y destrucción de billetes.
En los últimos meses,se incrementó la cantidad de autos y motos que circulan sin chapa patentey en los registros automotor no tienen fecha estimada para que vuelvan a verse en la calle.
Debido a esto,los vehículos nuevos se entregan sin chapahasta nuevo aviso y con patentes provisorias en papel. Desde el Gobierno ya informaron que para mayo debería solucionarse esta situación.
Desdeel Ministerio de Justicia aseguraron aClarínque realizaron una licitación “que terminó con el monopolio de la Casa de la Moneda”. A fin de mes, comenzarán a llegar las chapas patentes correspondientes. Esto permitirá normalizar el suministro.De ahora en más, la producción estará a cargo de la empresa Tonnjes Sudamericana SA.
Según la normativa vigente, los vehículos pueden circular con la chapa provisoria durante 30 días, con posibilidad de prórroga con otros 30 días más, y en algunos casos hasta 180 días, hasta la espera de la placa metálica. Pero para no obligar a los automovilistas a ir cada mes, se extendieron los plazos.
A esta problemáticase le debe sumar el faltante de los plásticos para las cédulas verdes. Si bien existe la opción digital, esta no puede ser una alternativa para quienes salen del país o están en lugares con poca señal. La cédula azul ya no es obligatoria.
D.D.
Newsletter Clarín
Recibí en tu email todas las noticias, coberturas, historias y análisis de la mano de nuestros periodistas especializados",https://www.clarin.com/economia/gobierno-dispuso-transformacion-casa-moneda-sociedad-anonima-unipersonal_0_C85ONP2b6Z.html
Clarín,2025-04-30,Dólar hoy: a cuánto cotizan el oficial y sus diferentes tipos de cambio este miércoles 30 de abril,"Eldólar oficialcotiza estemiércoles 30 de abrila $1130 para la compra y $1180 para la venta en las entidades bancarias.
En cuanto aldólar blue, esta jornada cotiza a $1180 para la compra y $1200 para la venta. Así, marca una brecha de 4% con respecto al dólar oficial. Elvalor del dólar bluetiene una diferencia sustancial con el dólar oficial, que se adquiere en los bancos y que posee una cotización establecida.
Por otro lado, eldólar turista(también conocido comodólar solidario) cotiza a $1534. Este valor es el que se utiliza al momento de comprar dólar para ahorro o de realizar transacciones en el exterior y surge de la suma de un 30% al valor del dólar oficial del día.
Otro de los tipos de cambio es eldólar mayorista, el cual inicia el día a $1201,10 para la compra y $1205,75 para la venta.
En relación alContado con liqui(CCL), el precio de referencia es de $1186,40. El CCL es la operatoria que permite a las empresas comprar papeles argentinos en el mercado local y venderlos en el exterior para lograr así girar divisas para ""atesoramiento"".
Hoy en Argentina conviven al menos seis tipos de cotizaciones distintas para la moneda estadounidense, algunas más usadas que otras.
Dólar ahorro/tarjeta o dólar turista/solidario: tiene el recargo del 30% dispuesto por el Gobierno sobre las compras realizadas con tarjeta en moneda extranjera y sobre la adquisición de divisas para atesoramiento dentro del circuito oficial.
Dólar blue: es el billete que se vende en el mercado informal, a través de cuevas o “arbolitos” en la calle.
Contado con Liqui: es una operación legal para conseguir dólares en el exterior. Se convirtió en el camino preferido de las empresas. Se compran títulos o acciones argentinas en pesos y luego se venden en el exterior en dólares.
Dólar oficial o minorista: es el precio al que pueden acceder los particulares pero siempre dentro del cerco de US$200 establecido por el cepo.
Dólar mayorista: es el que se usa para el comercio exterior, el pago de deudas dolarizadas y de dividendos. Teóricamente es el que incide en la fijación de los precios de los productos importados.
Dólar para industria y servicios: por el efecto de las retenciones, los exportadores de manufacturas y de servicios reciben en realidad un dólar a un valor más bajo que el oficial, y mucho más bajo que el blue. Dentro de esta categoría, hay distintos valores para quienes exportan carne y lácteos, para trigo, maíz y girasol y para la soja.
Newsletter Clarín
Recibí en tu email todas las noticias, coberturas, historias y análisis de la mano de nuestros periodistas especializados",https://www.clarin.com/economia/dolar-hoy-cotizan-oficial-diferentes-tipos-cambio-miercoles-30-abril_0_9etNFjjjtc.html
Clarín,2025-04-30,"Suben la luz y el gas: oficializaron el aumento de hasta 2,5% en mayo y plan de ajuste por 5 años","El Gobierno confirmó este miércolesaumentos en las tarifas de luz y gas que comenzarán a regir desde el 1° de mayo,a través de una serie de resoluciones publicadas durante en el Boletín Oficial. Además. Las subas serán de hasta 2,5% a partir del mes que comienza este jueves yse activará un esquema de ajustes mensualesque se mantendrá hasta noviembre de 2027, como parte del plan de recomposición tarifaria.
En el caso de la energía eléctrica,se definió una suba del 3% sobre el Costo Propio de Distribución (CPD)respecto a abril. A partir de junio,se aplicará un aumento mensual del 0,36% en términos reales, de forma escalonadaysostenida durante cinco años.
También se aprobaron nuevos cuadros tarifarios para todos los usuarios -tanto residenciales como no residenciales- divididos en tres niveles según su situación socioeconómica (Niveles 1, 2 y 3).
La Resolución 303/2025 contempla bonificaciones especiales para Clubes de Barrio, Entidades de Bien Público y usuarios de Edesur, además de fijar el nuevo Valor Agregado de Distribución Medio (VAD Medio) en $ 42,91.
Por su parte, la Resolución 304/2025, deEdenor, establece el mismo esquema de suba del 3% desde mayoy ajustes mensualesdel 0,42% a partir de junio.
En paralelo, el Ente Nacional Regulador del Gas (ENARGAS) aprobó una Revisión Quinquenal Tarifaria,que establece una suba inicial del 3% en las tarifas de gasdesde mayo,seguida de aumentos mensuales durante los próximos 30 meses.
Además,se introdujo una nueva categoría residencial R-4,queagrupa a los usuarios de mayor consumo, con un cargo fijo ajustado al promedio de consumo y un componente variable que incentive la eficiencia energética.
El plan también contempla un cronograma de inversiones obligatorias para el período 2025–2030, supervisado por el ENARGAS.
Se mantendrán los subsidios para usuarios de los Niveles 2 y 3,bajo las condiciones definidas por la Secretaría de Energía.
Las distribuidoras involucradas incluyen a Metrogas, Naturgy Ban, Litoral Gas, Camuzzi, Gas NEA, entre otras.
Esta nueva etapa de aumentos se enmarca en la política del Gobierno de reducir subsidios y recomponer los ingresos de las empresas distribuidoras, luego del congelamiento aplicado durante la gestión anterior.
El esquema tarifario también responde a los compromisos asumidos con el Fondo Monetario Internacional (FMI) en el marco del acuerdo vigente.
SN
Newsletter Clarín
Recibí en tu email todas las noticias, coberturas, historias y análisis de la mano de nuestros periodistas especializados",https://www.clarin.com/economia/suben-luz-gas-oficializaron-aumento-3-mayo-plan-ajuste-5-anos_0_xtyuAFIF9P.html
