diario,fecha,titulo noticia,contenido,link
Clarín,2025-04-30,"Dólar hoy y dólar blue, EN VIVO: a cuánto cotizó el oficial y cuál fue el precio del paralelo este miércoles 30 de abril, minuto a minuto","Eldólar oficialsubió diez pesos estemiércoles 30 de abril,cotizó a$ 1.190en elBanco Nación (BNA)y por primera vez tiene un precio superior aldólar blue, que bajó $ 15 y cerró a$ 1.185. Seguí las cotizaciones en esta cobertura minuto a minuto deClarín.
Las acciones de empresas argentinas que operan en Wall Street cotizaron a la baja. Lideraron las pérdidas Edenor (-4,7%), YPF (-4,3%) y Central Puerto (-4%).
Los títulos de deuda en moneda extranjera que registraron las mayores bajas fueron: GD46 (-0,9%), AL29 (-0,6%) y AL35 (-0,5%). El riesgo país se ubicó en 726 puntos.
El dólar MEP, cuya cotización surge de la compra-venta de dólares, cerró a $ 1.183, $ 10 más que el martes. En tanto, el dólar CCL, utilizado por las empresas para girar divisas al exterior, subió $ 5 hasta los $ 1.193.
La divisa de Estados Unidos que se consigue en el mercado paralelo bajó $15 este miércoles.
En la última rueda de la semana por los feriados del Día del Trabajador y el puente turístico, la autoridad monetaria mantuvo su regla de no intervención que rige desde que el Gobierno instauró las bandas de flotación cambiarias.
La cotización del dólar en pizarras del Banco Nación subió diez pesos con respecto a ayer.
Buenas tardes, soy Belén Papa Orfano y a partir de este momento te voy a brindar toda la última información respecto a la cotización del dólar.
Mientras el blue se ubica por debajo del oficial, el dólar MEP cotiza con una leve alza a $ 1.181,37. En tanto, el contado con liqui se consigue a $ 1.194.
Cotiza a $ 1.185 para la venta y a $ 1.165 para la compra. El oficial está a $ 1.190 y $ 1.140 en el Banco Nación.
Durante jueves 1 al 4 de mayo de 2025, los bancos no brindarán atención al público en sus sucursales. El jueves 1 de mayo es feriado nacional por el Día del Trabajador, y el viernes 2 de mayo es considerado día no laborable con fines turísticos, según el Decreto 1027/2024. Sábado y domingo, como es habitual, tampoco habrá actividad.Seguir leyendo.
El MEP se vende a $1.179, más barato que el dólar oficial y el blue, mientras que el contado con liqui avanza a $1.198.
La inflación de Estados Unidos cayó en marzo al 2,3% interanual, en línea con las expectativas de los analistas, según el índice PCE oficial publicado este miércoles, en parte gracias a la reducción de los precios de la energía. La tasa fue ligeramente superior a la media de las previsiones de los economistas encuestados por Dow Jones Newswires y The Wall Street Journal, que esperaban un 2,2%.
El Departamento de Comercio estadounidense revisó el PCE interanual de febrero al 2,7%.
La implementación del pago con QR en el transporte público, en primer lugar, en el subte, anunciada como una alternativa a la SUBE, generó un nuevo conflicto en el ecosistema de billeteras virtuales. El Banco Central (BCRA) fijó el 12 de mayo como fecha límite para poner en marcha la funcionalidad, pero según el resto de los competidores, solo Mercado Pago está en condiciones de cumplir con esos plazos. El resto del sector pide una prórroga de 60 días hábiles para adaptar los sistemas.
La empresa de Marcos Galperín no solo actúa como billetera, sino que fue contratada por Emova, la concesionaria del subte, para administrar los pagos con QR. Mercado Pago comenzó a realizar pruebas internas hace semanas y ya habilitó la funcionalidad a algunos usuarios, algo que sus competidores consideran una ventaja desleal.Seguir leyendo.
Dos semanas después del acuerdo con el Fondo Monetario (FMI), el Gobierno se apresta a recomprar el grueso de las Letras Intransferibles en poder del Banco Central con los US$ 12.000 millones que ya recibió del organismo. Solo restan definir los últimos detalles para que el Tesoro recupere esos ""papelitos de colores"" emitidos por todas las gestiones en los últimos 20 años, y cancele su deuda con la autoridad monetaria.
Según pudo saber Clarín, el Banco Central podría tratar la operación hoy en su reunión de directorio, un encuentro que se hace los jueves pero que se adelantó por el feriado del Día del Trabajador. En su último balance, la entidad informó un stock de Letras Intransferibles de US$ 23.000 millones, de los cuales US$ 10.500 millones vencen el próximo 1 de julio. ""Parecería que renuevan el 70%"", dijo una fuente con conocimiento.Seguir leyendo.
Ocurre unos minutos después de que el oficial y el blue quedaran igualados por primera vez en mucho tiempo. Algunas entidades afirman estar haciendo ""tareas de mantenimiento"".
Cotiza a $ 1.190 para la venta, de acuerdo a la pizarra del Banco Nación. El paralelo había bajado diez pesos en su apertura.
Cotiza a $ 1.190 para la venta y queda nuevamente a sólo diez pesos del precio del dólar oficial.
Cotiza a $ 1.173,24 contra los $ 1.180 del que vende el Banco Nación. El contado con liqui, en tanto, está apenas por encima de ambos, a $ 1.188,09.
El Gobierno nacional convirtió la Casa de la Moneda en una sociedad anónima unipersonal y prorrogó la designación de su interventor, Pedro Daniel Cavagnaro, por 120 días, a través del decreto 295/2025 publicado este miércoles en el Boletín Oficial.
El decreto lleva las firmas del presidente Javier Milei y el ministro de Economía, Luis Caputo. La medida forma parte del proceso de adecuación de la Casa de la Moneda como sociedad anónima, luego de que se realizara una asamblea en diciembre del año pasado donde se dispuso su transformación.
A fines de octubre de 2024, el Gobierno confirmó la intervención por 180 días de la Casa de la Moneda. Previamente, había establecido la suspensión de la impresión de billetes, por lo que el único rol de la empresa estatal seguía siendo la producción de chapas patentes y otros documentos como pasaportes y cédulas.Seguir leyendo.
Cotiza a 95.174,07 dólares después de comenzar el día en US$ 94.303,79. Ethereum crece también, alrededor de diez dólares, y se ubica en 1.809,64.
El Gobierno confirmó este miércoles aumentos en las tarifas de luz y gas que comenzarán a regir desde el 1° de mayo, a través de una serie de resoluciones publicadas durante en el Boletín Oficial. Además. Las subas serán de hasta 2,5% a partir del mes que comienza este jueves y se activará un esquema de ajustes mensuales que se mantendrá hasta noviembre de 2027, como parte del plan de recomposición tarifaria.Seguir leyendo
Este martes el BCRA no intervino en el mercado de cambios y las reservas registraron una baja de 181 millones de dólares respecto del lunes: se ubicaron en 39.098 millones de dólares.
El dólar blue cotiza a $ 1.200 para la venta, tras haber bajado 5 pesos ayer. En tanto, para la compra su valor fue de $1.180.
La divisa estadounidense en pizarras del Banco Nación bajó diez pesos en la jornada de ayer, en la tercera semana sin cepo.
Editora de la sección Último Momento
Editor de portada del sitio web de Clarínesanmartin@clarin.com
Newsletter Clarín
Recibí en tu email todas las noticias, coberturas, historias y análisis de la mano de nuestros periodistas especializados",https://www.clarin.com/economia/dolar-hoy-dolar-blue-vivo-cotizo-oficial-precio-paralelo-miercoles-30-abril-minuto-minuto_0_q0U9rCBaVi.html
Clarín,2025-04-30,Dólar tarjeta hoy: a cuánto cotiza este miércoles 30 de abril,"La cotización deldólar tarjetaes de$1534, este miércoles 30 de abril de 2025.
El dólar tarjeta sube1%respecto al mismo día de la semana anterior.
En lo que va de abril de 2025, el dólar tarjeta sube respecto al mes anterior: la diferencia es de8%.
En comparación con el año pasado, el dólar tarjeta sube un7%. A esta altura del año anterior, el dólar tarjeta cotizaba a$1433.6.
El valor deldólar tarjetatiene una diferencia con eldólar blue. Mientras que el primero está$1534, el blue cotiza hoy a$1180, lo que marca una brecha de30%.
Eldólar tarjetaes el tipo de cambio que se emplea para el pago de consumos con tarjeta de débito y crédito en el exterior así como para la compra, también en dólares, de pasajes y paquetes turísticos hacia destinos fuera de la Argentina.
El valor deldólar tarjetase conforma de la siguiente manera: al dólar oficial se le añade un 30% de impuesto país y un 30% de ganancias. Se trata de una carga impositiva total del 60%, frente al 155% que existía en la gestión anterior.
La cotización del dólar tarjeta funciona en el mismo horario del mercado de cotizaciones:hasta las 16:30 horas, de lunes a viernes.
Newsletter Clarín
Recibí en tu email todas las noticias, coberturas, historias y análisis de la mano de nuestros periodistas especializados",https://www.clarin.com/economia/dolar-tarjeta-hoy-cotiza-miercoles-30-abril_0_1cX8cXkoL3.html
Clarín,2025-04-30,Dólar ahorro hoy: a cuánto cotiza este miércoles 30 de abril,"La cotización deldólar ahorroes de$1534para la venta este miércoles 30 de abril de 2025.
El dólar ahorro sube1%respecto al mismo día de la semana anterior.
En lo que va de abril de 2025, el dólar ahorro sube respecto al mes anterior: la diferencia es de8%.
En comparación con el año pasado, el dólar ahorro sube un7%. A esta altura del año anterior, el ahorro cotizaba a$1433.6.
El valor deldólar ahorrotiene una diferencia con eldólar MEP. Mientras que el primero está$1534, el MEP cotiza hoy a$1167,70, lo que marca una brecha de31%.
Eldólar ahorroes un tipo de cambio mayor al dólar oficial, que se muestra como la opción más barata para comprar a modo de atesoramiento.
La compra deldólar ahorrohoy en Argentina se maneja bajo la siguiente cotización: el 30% del impuesto país se mantiene y el 35% del impuesto a las ganancias pasa a ser de un 45%, igualando la cotización del dólar tarjeta.
La cotización del dólar ahorro funciona en el mismo horario del mercado de cotizaciones:hasta las 16:30 horas, de lunes a viernes.
Estas operaciones reciben el nombre de “operaciones de liquidación con cable”. Para identificarlas se agrega una C al final del código de negociación de la especie. Así se diferencian de aquellas que se liquidan en pesos o dólares en cuentas radicadas en el mercado local.
Newsletter Clarín
Recibí en tu email todas las noticias, coberturas, historias y análisis de la mano de nuestros periodistas especializados",https://www.clarin.com/economia/dolar-ahorro-hoy-cotiza-miercoles-30-abril_0_278iBzB15q.html
Clarín,2025-04-30,Dólar CCL hoy: a cuánto cotiza este miércoles 30 de abril,"La cotización deldólar CCLes de$1186,40para la compra y de$1193,10para la venta, este miércoles 30 de abril de 2025.
El dólar CCL sube0%respecto al mismo día de la semana anterior.
En lo que va de abril de 2025, el dólar CCL baja respecto al mes anterior: la diferencia es de10%.
En comparación con el año pasado, el dólar CCL sube un7%. A esta altura del año anterior, el CCL cotizaba a$1105.
El valor deldólar CCLtiene una diferencia con eldólar MEP. Mientras que el primero está$1186,40, el MEP cotiza hoy a$1167,70, lo que marca una brecha de1%.
Eldólar CCL o dólar contado con liquidaciónes uno de los tipos de cambio financieros más usados en el país, junto con el dólar MEP (o dólar bolsa). Se trata de una herramienta financiera que permite cambiar pesos por dólares en el exterior. Muchas empresas e inversionistas usan este método para adquirir divisas y sacarlas del país legalmente.
Eldólar CCL o dólar contado con liquidaciónconsiste en la compra de un bono en pesos (AL30) o en dólares (AL30D) para venderlo en especie C (AL30C). Mediante estas 2 simples operaciones podés ingresar dinero a cuentas de inversión en Estados Unidos.
La cotización del dólar CCL funciona en el mismo horario del mercado de cotizaciones:hasta las 16:30 horas, de lunes a viernes.
Estas operaciones reciben el nombre de “operaciones de liquidación con cable”. Para identificarlas se agrega una C al final del código de negociación de la especie. Así se diferencian de aquellas que se liquidan en pesos o dólares en cuentas radicadas en el mercado local.
Newsletter Clarín
Recibí en tu email todas las noticias, coberturas, historias y análisis de la mano de nuestros periodistas especializados",https://www.clarin.com/economia/dolar-ccl-hoy-cotiza-miercoles-30-abril_0_HzPGJyKAmU.html
Clarín,2025-04-30,Dólar cripto hoy: a cuánto cotiza este miércoles 30 de abril,"La cotización deldólar criptoes de$1200para la compra y de$1206para la venta, estemiércoles 30 de abril.
El dólar criptose mantiene estable0%respecto al mismo día de la semana anterior.
En lo que va deabril 2025, el dólar criptobajarespecto al mes anterior: la diferencia es de10%.
En comparación con el año pasado, el dólar criptosubeun18%. A esta altura del año anterior, el dólar cripto cotizaba a$1020.
El valor deldólar criptotiene una diferencia con eldólar blue. Mientras que el primero está a$1200, el blue cotiza hoy a$1180, lo que marca una brecha de2%.
Eldólar criptoes una cotización que se define en función de la compraventa de “stablecoins”, es decir, criptomonedas atadas a un activo estable, en este caso al dólar estadounidense.
Para operar con eldólar criptoes necesario tener una cuenta en alguna billetera virtual o una exchange. Se define su cotización en función de la compra y venta de criptomonedas ancladas al dólar estadounidense.
Newsletter Clarín
Recibí en tu email todas las noticias, coberturas, historias y análisis de la mano de nuestros periodistas especializados",https://www.clarin.com/economia/dolar-cripto-hoy-cotiza-miercoles-30-abril_0_7Nk0ETZ2yV.html
Clarín,2025-04-30,Dólar MEP hoy: a cuánto cotiza este miércoles 30 de abril,"La cotización deldólar MEPes de$1167,70para la compra y de$1173,90para la venta, estemiércoles 30 de abril de 2025.
Eldólar MEPsube1%respecto al mismo día de la semana anterior.
En lo que va deabril de 2025, el dólar MEPbajarespecto al mes anterior: la diferencia es de11%.
En comparación con el año pasado, el dólar MEPsubeun13%. A esta altura del año anterior, el MEP cotizaba a$1036.7.
El valor del dólar MEP tiene una diferencia con el dólar blue. Mientras que el primero está a$1167,70, el blue cotiza hoy a$1180, lo que marca una brecha de1.04%.
Eldólar MEPes un tipo de cambio mayor al dólar oficial, que se muestra como la opción más barata para comprar a modo de atesoramiento.
El dólar MEP consiste en la compra de un bono en pesos y su venta en dólares. Este tipo de cambio se calcula a partir de la división entre el precio en pesos y la cotización en dólares.
La cotización del dólar MEP funciona en el mismo horario del mercado de cotizaciones: hasta las 16:30 horas, de lunes a viernes.
Su nombre deriva de la sigla 'MEP', que significa Mercado Electrónico de Pagos. Es una variante al dólar ahorro, ya que presenta menos restricciones como se mencionó anteriormente.
Newsletter Clarín
Recibí en tu email todas las noticias, coberturas, historias y análisis de la mano de nuestros periodistas especializados",https://www.clarin.com/economia/dolar-mep-hoy-cotiza-miercoles-30-abril_0_7qvTz93uYT.html
Clarín,2025-04-30,Euro hoy: a cuánto cotiza este miércoles 30 de abril,"Eleurocotiza estemiércoles 30 de abrila $1.323,70 para la compra y $1.326,56 para la venta, por lo que se mantiene estable respecto a la última cotización.
En cuanto a la divisa en el mercado paralelo, eleuro blue hoycotiza a 1342.01 para la compra y 1364.76 para la venta. De este modo, su precio sube en relación al último informado.
Con estos valores, labrechaentre el euro blue y el euro oficial​ es de 101337%.
Elvalor del euro bluetiene una diferencia sustancial más alta con el euro oficial ya que este último es el que se adquiere en los bancos y que posee una cotización establecida.
Al igual que el dólar blue, eleuro bluees el que circula en el mercado negro y suele tener un valor más alto que el oficial. Una explicación sobre su denominación señala que se llama así porque en inglés, ""blue"", además de nombrar al color azul, remite a algo ""oscuro"". De esta manera, se reconoce al cambio de la divisa por fuera del sistema cambiario.
El término euro blue se empezó a utilizar a partir del 2011, como consecuencia de lasrestriccionespara la adquisición de moneda extranjera que comenzaron a aplicar la Administración Federal de Ingresos Públicos (AFIP) y el Banco Central de la República Argentina bajo el gobierno de Cristina Fernández de Kirchner.
Estaslimitacionescobraron un nuevo impulso en diciembre de 2019, luego de los anuncios de presidente Alberto Fernández sobre la Ley de Emergencia económica y que se profundizaron a lo largo del 2020 con el cepo cambiario. Esto genera que los sectores que viajen al exterior opten por la compra de euros en elmercado negro, generando así un aumento en el precio del euro blue.
El nombre del Euro paralelo
El euro se lanzó el 1° de enero de 1999, cuando 10 países fijaron sus tipos de cambio y entregaron las decisiones sobre las tasas de interés al recién creado Banco Central Europeo. Los billetes y monedas de euro entraron en circulación tres años después.
La moneda compartida se vio como una solución a las constantes disputas por los tipos de cambio que habían marcado la política europea después de la Segunda Guerra Mundial y como una extensión lógica de la zona de libre comercio de aranceles de la Unión Europea. Gran Bretaña, en particular, optó por no participar, pero 19 de los 27 países de la UE utilizan el euro como moneda nacional. Quienes componen la zona del euro, también denominada ""eurozona"" son:AustriaBélgicaChipreEstoniaFinlandiaFranciaAlemaniaGreciaIrlandaItaliaLetoniaLituaniaLuxemburgoMaltaPaíses BajosPortugalEslovaquiaEsloveniaEspaña
Newsletter Clarín
Recibí en tu email todas las noticias, coberturas, historias y análisis de la mano de nuestros periodistas especializados",https://www.clarin.com/economia/euro-hoy-cotiza-miercoles-30-abril_0_cneSIJnRDo.html
Clarín,2025-04-30,Real hoy y real blue hoy: a cuánto cotiza y cuál es el precio de la moneda brasileña este miércoles 30 de abril,"Elrealcotiza a $207,08 para lacompray a $207,47 para laventaeste miércoles 30 de abril de 2025, de acuerdo con la información que proporciona el sitio del Banco Nación.
Con respecto a la divisa en el mercado paralelo, elreal blue hoytiene un precio de $192,75 para la compra y de $211,75 para la venta, una información que muchos argentinos consultan antes de viajar aBrasilpor turismo o negocios.
De este modo,la brecha entre el real blue y el real oficiales de 7%.
De acuerdo con la variación de la divisa brasileña en el mercado informal, un dólar equivale a R$6.12 reales, por lo quecon 100 dólares se pueden comprar R$612.19 reales.
El real es la moneda de curso legal deBrasildesde 1994, cuando reemplazó al cruzeiro real. Es la vigésima moneda más negociada en el mundo y la primera en Sudamérica. Su símbolo esR$y cuenta conbilletesde hasta 200 reales de denominación.
Eldólar oficialcotiza este miércoles 30 de abril de 2025 a $1130 para la compra y $1180 para la venta en las entidades bancarias.
En tanto, eldólar bluese consigue a $1180 y se vende a $1200 en el mercado paralelo.
Newsletter Clarín
Recibí en tu email todas las noticias, coberturas, historias y análisis de la mano de nuestros periodistas especializados",https://www.clarin.com/economia/real-hoy-real-blue-hoy-cotiza-precio-moneda-brasilena-miercoles-30-abril_0_YmGg7JVQyA.html
Clarín,2025-04-30,Dólar blue hoy: a cuánto cotiza este miércoles 30 de abril,"La cotización deldólar bluees de $1180 para la compra y de $1200 para la venta, estemiércoles 30 de abril de 2025.
En lo que va de abril de 2025, el dólar blue baja respecto al mes anterior: la diferencia es de 10%.
En lo que va de este 2025, el dólar blue sube respecto al 2024: la diferencia es de 16%.
El valor del dólar blue tiene una diferencia sustancial con el dólar oficial, que se adquiere en los bancos y que posee una cotización establecida. La brecha entre el dólar oficial y el dólar blue es de 4%.
Eldólar bluees el que circula en el mercado negro y suele tener un valor más alto que el oficial. Este dólar no se compra en bancos o casas de cambio oficiales.
La cotización del dólar blue cierra junto con la del dólar oficial: a las 15 horas, de lunes a viernes.
Una explicación sobre su denominación señala que se llama así porque ""blue"", en inglés, además de nombrar al color azul, remite a algo ""oscuro"". Otra teoría lo relaciona con las operaciones de compra a través de bonos o acciones de compañías conocidas como""blue chips"". Y también se lo vincula con el color aproximado que aparece cuando se aplica un fibrón para detectar billetes falsos.
La cotización deldólar oficiales de $1130 para la compra y de $1180 para la venta, este miércoles 30 de abril de 2025, según el Banco Nación.
La cotización deldólar bolsaes de $1167,70 para la compra y de $1173,90 para la venta, este miércoles 30 de abril de 2025.
La cotización deldólar CCLes de $1186,40 para la compra y de $1193,10 para la venta, este miércoles 30 de abril de 2025.
Newsletter Clarín
Recibí en tu email todas las noticias, coberturas, historias y análisis de la mano de nuestros periodistas especializados",https://www.clarin.com/economia/dolar-blue-hoy-cotiza-miercoles-30-abril_0_WBP10rHjMC.html
Clarín,2025-04-30,Dólar blue hoy: a cuánto cotiza este miércoles 30 de abril,"La cotización deldólar bluees de $1180 para la compra y de $1200 para la venta, estemiércoles 30 de abril de 2025.
En lo que va de abril de 2025, el dólar blue baja respecto al mes anterior: la diferencia es de 10%.
En lo que va de este 2025, el dólar blue sube respecto al 2024: la diferencia es de 16%.
El valor del dólar blue tiene una diferencia sustancial con el dólar oficial, que se adquiere en los bancos y que posee una cotización establecida. La brecha entre el dólar oficial y el dólar blue es de 4%.
Eldólar bluees el que circula en el mercado negro y suele tener un valor más alto que el oficial. Este dólar no se compra en bancos o casas de cambio oficiales.
La cotización del dólar blue cierra junto con la del dólar oficial: a las 15 horas, de lunes a viernes.
Una explicación sobre su denominación señala que se llama así porque ""blue"", en inglés, además de nombrar al color azul, remite a algo ""oscuro"". Otra teoría lo relaciona con las operaciones de compra a través de bonos o acciones de compañías conocidas como""blue chips"". Y también se lo vincula con el color aproximado que aparece cuando se aplica un fibrón para detectar billetes falsos.
La cotización deldólar oficiales de $1130 para la compra y de $1180 para la venta, este miércoles 30 de abril de 2025, según el Banco Nación.
La cotización deldólar bolsaes de $1167,70 para la compra y de $1173,90 para la venta, este miércoles 30 de abril de 2025.
La cotización deldólar CCLes de $1186,40 para la compra y de $1193,10 para la venta, este miércoles 30 de abril de 2025.
Newsletter Clarín
Recibí en tu email todas las noticias, coberturas, historias y análisis de la mano de nuestros periodistas especializados",https://www.clarin.com/economia/dolar-blue-hoy-cotiza-miercoles-30-abril_0_ZyCbfjgXCD.html
Clarín,2025-04-29,Paro de colectivos: la UTA define este miércoles si hay huelga de choferes en Buenos Aires,"La Unión Tranviaria Automotor (UTA) decidirá mañana miércoles 30 de abril,a partir de las 11 horas,si habrá un nuevo paro de colectivosen elÁrea Metropolitana de Buenos Aires (AMBA), ante los pocos avances que tienen las negociaciones paritarias desde el 7 de marzo, cuando el Estado dictó la conciliación obligatoria.
El origen de la crisis tiene lugar en la ya crónica falta de fondos que tiene el sistema de colectivos, producto de las tarifas y los subsidios que define el Gobierno nacional.
Las cámaras que agrupan a los empresarios ofrecieron un bono extraordinario, de carácter no regular ni habitual,de $ 40.000 a pagarse el 26 de mayo;$ 50.000 el 16 de junio; yotros $ 70.000 el 15 de julio, conun nuevo salario básico de $ 1.270.000 para cada chofer.
Las empresas aseguran que tienen un déficit de 40% en sus costoscontra lo que reciben de los pasajeros y del Estado.
La propuesta de las cámaras empresariales, que no llega al 1% mensual de incremento-contra una inflación que ronda el 3% a 4%-fue calificada como un ""avasallamiento a la dignidad""por parte de la UTA.
De acuerdo a los datos del Índice Bondi, que elabora la Asociación Argentina de Empresarios del Transporte Automotor (AAETA, integrada por el grupo Metropol), el precio real del boleto sin subsidios era de $ 1.596,40 en marzo, pero los usuarios pagaron un mínimo de $ 371,13 -y un promedio menor, por efecto de las bonificaciones cuando se acumulan varios viajes-, mientras que las empresas recibían un total de $ 973,76.
SN
Redactor de la sección Economíasspaltro@clarin.com
Newsletter Clarín
Recibí en tu email todas las noticias, coberturas, historias y análisis de la mano de nuestros periodistas especializados",https://www.clarin.com/economia/paro-colectivos-uta-define-miercoles-huelga-choferes-buenos-aires_0_Ql4uA3x9R9.html
