diario,fecha,titulo noticia,contenido,link
Clarín,2025-02-12,Luis Caputo le contó al Gordo Dan cómo conoció a Javier Milei y por qué no quería volver a la función pública,"El ministro de Economía,Luis “Toto” Caputo, brindó una entrevista al canal de streaming libertarioCarajodonde reveló cómo conoció a Javier Milei ypor qué se convenció de volver a la función públicaluego de su paso con sabor amargo por la administración de Mauricio Macri.
Caputo reveló que el enlace con el Presidente fue a través de su sobrino, el asesor estrella y miembro del tridente de hierro de Javier Milei,Santiago Caputo.
“Santi, mi sobrino, me llamó un día y me dice‘todo el mundo me dice que tenemos que hablar’. Él estaba consultando economistas. ‘Somos familia y nunca hablamos’, a lo que le digo que sí, que ningún problema”, comenzó su relato en la extensa entrevista brindada desde su despacho.
En la entrevistacon el Gordo Dan-prometida para este lunes pero pospuesta al martes pordemoras en su edición-, Caputo reveló que le comentó a su pariente todo lo que pensaba sobre la economía argentina y lo que se debía hacer a su criterio. Cuando terminó la conversación,el asesor estrella le pidió permiso para charlar con Mileilo abordado a lo que esto accedió.
“Un día me llamó y me dijo si me podía juntarcon el Presidente, no presidente en ese momento obviamente, ylo fui a ver a Javier. Y así lo conocí”, añadió a su relato. Ese primer encuentro se dioentre julio y agosto de 2023, en plena campaña electoral.
“Estuvimos más o menos dos horas,pagamos onda económica y personal en seguida.¿Viste que el presidente siempre dice quetenemos simbiosis? Es totalmente cierto,vemos la economíaexactamentede la misma manera”, concedió Caputo sobre ese primer encuentro con Milei y el vínculo que los une ahora.
Para ese entonces, reveló el ministro, “no había ninguna posibilidad” de volver a la función pública.“No solo por mi, sino por la gente que trabajaba conmigo.Por supuesto que estaba el tema familiar,pero también estábamos en un momento muy bueno en la consultora”, añadió.
Caputo contó que junto a sus colegas de la firma de consultoría donde trabajaba con muchos de los que hoy son sus colaboradores como el presidente del Banco Central, Santiago Bausili, la habían ""remado muchos años” para estar en un buen momento. Sin embargo, cedió:“Siempre tuvimos vocación de servicio, teníamos vocación de ayudar, pero nunca no había imaginamos en la función pública de vuelta”.
“Más allá de quees ingrato– continuó sobre su paso por la función pública antes de la administración Milei -habíamos vivido en el pasado infinitas operaciones,una mentira atrás de la otra, pero de eso vive la política. Trata de desgastarte para que vos no vuelvas”.
En tanto, se deshizo en elogios para Javier Milei. “Tiene todo el conocimiento académico, peroa diferencia de los académicosquesuelen ser cabezadura, Javiernada que ver,es absolutamente pragmático.Combina lo mejor de las dos cosas. Una persona que toma decisiones sin dudar, tremendamente inteligente, culto”, comentó.
Pero Luis Caputo no sólo se refirió a su relación con el Presidente, sino que también conversó en Carajo acerca de las relaciones del Gobierno conel FMI, con el gobierno de Donald Trump -y la idea de buscar ellibre comerciocon Estados Unidos- y también pusoreparos sobre los beneficios que traeel Mercosural país.
Más temprano este martes, Caputo había conversado conRadio Rivadaviay adelantó que el acuerdo con el Fondo Monetario Internacional está estipuladodentro del marco del primer trimestre, por un nuevo desembolso. En la entrevista con el Gordo Dan, explicó la finalidad del acuerdo al que se intenta llegar con el organismo de financiamiento internacional.
""Un nuevo acuerdo con el Fondo va a implicar un nuevo ingreso de fondos. Si se materializara este acuerdo, va a implicar el ingreso defondos frescosque nos va a permitir recapitalizar de vuelta al Banco Central.El acuerdo marcha viento en popa.El Fondo está muyimpresionado con todos los logros. Obviamente, quieren que a Argentina le vaya bien y comparten lo que nosotros pretendemos de cómo seguir en el programa. Así que diría que estamos en los detalles finos”, adelantó.
A su vez, también se refirió a otro aspecto que tanto a nivel económico como geopolítico representa un tema importante para el Gobierno: las relaciones con Estados Unidos, máxime con una administración (la deTrump) en apariencia afín a las políticas de Javier Milei. ""Para el paíssería importantísimo llegar a un acuerdo con Estados Unidos. Imagínatepara todas las empresas argentinastener esa posibilidad de exportarle a un país tan grande y tan rico como Estados Unidos es una cosa absolutamente favorable"".
Claro, algunas de las políticas económicas conjuntas entre ambos países, como un acuerdo de libre comercio, podrían colisionar con otra política de peso para la Argentina, que es la del Mercosur.
""Nosotros tenemos un acuerdo que esel Mercosur, pero queno ha sido muy beneficioso para Argentina. Nuestra idea con respecto al Mercosur es justamente plantear ciertaflexibilización para que se puedan hacer acuerdos bilateralesentre países.No implica rompercon el Mercosur"", explicó el titular del Palacio de Hacienda.
DS
Newsletter Clarín
Recibí en tu email todas las noticias, coberturas, historias y análisis de la mano de nuestros periodistas especializados",https://www.clarin.com/politica/luis-caputo-conto-gordo-dan-conocio-javier-milei-queria-volver-funcion-publica_0_JZuZaXecVe.html
Clarín,2025-02-11,Hidrovía: la Procuraduría de Investigaciones Administrativas dictaminó que hay “serias y evidentes irregularidades” en la licitación,"La Procuraduría de Investigaciones Administrativas emitió un dictamen de úlltima hora este martes en el que advierte que tras el análisis de las denuncias presentadas contra el proceso de licitación para el dragado de la parte argentina de la llamada Hidrovía Paraguay-Paraná presenta""serias y evidentes irregularidades en la redacción de los pliegos del procedimiento"".
En su dictamen, el fiscal nacional de Investigaciones Administrativas, Sergio Leonardo Rodríguez y el auxiliar fiscal de la Procuraduría de Investigaciones Administrativas advirtieron que estas irregularidades pueden tener""consecuencia"", y que el procedimiento y posible adjudicación a las empresas que compiten son ""pasibles de reproches administrativos y/o penales"".
El dictamen se conoció a menos de 24 horas de que comience a definirse el rumbo de un negocio que puedesuperar los 20.000 millones de dólaresy que es clave para el comercio exterior de la Argentina.
Ocurre que a las 13 horas de este miércoles 12 se vence el plazo para la presentación de las ofertas, se espera que al menos dos empresas compitan:la belga Jan de Nul -que hace el dragado de la Hidrovía desde 1995,cuando este curso de agua fue privatizado y comenzaron las primeras obras de modernización- y laneerlandesa Van Oord,según cuentan fuentes del mercado.
Dirigido al director ejecutivo de la recientemente creada Agencia Nacional de Puertos y Navegación, Iñaki Arreseygorel dictamen no es vinculante, y son las autoridades incluyendo al ministro de Economía, Luis Caputo quienes determinará qué hacer y que no. Pero su dureza deja en claro que pueden sersujetos de acciones legalespor sus decisiones en esta histórica licitación, que concederá por 30 años el dragado de la Hidrovía a una empresa extranjera.
""En virtud de todo lo expuesto, correspondería que esa Agencia Nacional de Puertos y Navegaciónadecúe los plexos licitatorios a lasobservaciones efectuadas a fin de que el Estado Nacional contrate en consonancia con los principios que deben regir todos los procedimientos de selección a cargo de un órgano, u organismo, que tenga a su cargo el ejercicio de la función administrativa para la consecución del bien común"", indica el documento presentado este martes a la tarde e informa también que la Procuraduría hará presentaciones similares en otras dependencias involucradas en esta licitación que ha sufrido numerosas denuncias, de las empresas, y de diferentes cámaras ligadas al proceso integral de la Hidrovía. Aunque esta fue postergada una vez, la mayoría consideró que el 12 de febreroera un plazo demasiado corto para competir en condiciones de igualdad.
Según comentaron fuentes del sector, en el Gobierno estarían dispuestos a declarardesierta la licitaciónsi no son al menos tres compañías las que se presenten este miércoles, aunque no hubo una confirmación oficial.
Hasta el cierre de esta edición habíadudas acerca de la participación de la también belga Dregding International NV (DEME), quien cuestionó desde un principio los términos técnicos y denunció un presunto direccionamiento de la licitación. La Justicia y el Gobierno, a través de la Agencia Nacional de Puertos y Navegación, descartaron sus reclamos.
Mientras tanto,la firma china CCCC Shanghai Dredging Company quedó excluida del procesoporque el pliego dejó explícitamente afuera a todas las empresas que tuvieran a un Estado soberano como controlante.
En silencio,China activó contactos diplomáticos de primer nivel para cuestionar la licitacióny hay quienes indican que esta decisión podría afectar la relación con la Argentina. A mediados de año el Banco Central (BCRA) tiene que renovar por segunda vez durante la presidencia de Javier Milei elswapde monedas -un préstamo- por un equivalente a los US$ 17.700 millones.
Redactora especialista en política exteriornatashan@clarin.com
Newsletter Clarín
Recibí en tu email todas las noticias, coberturas, historias y análisis de la mano de nuestros periodistas especializados",https://www.clarin.com/economia/hidrovia-procuraduria-investigaciones-administrativas-dictamino-evidentes-irregularidades-licitacion_0_oOS36gGJbc.html
Clarín,2025-02-11,Los economistas de Morgan Stanley pasaron por Buenos Aires y también hablan de atraso cambiario,"En medio de los esfuerzos del gobierno por despejar el fantasma de la devaluación y mostrar avances con el Fondo Monetario, Wall Street sigue viendo ""riesgos"" en torno a la política cambiaria. Esa fue una de las conclusiones que sacó el Morgan Stanley tras enviar la semana pasada unamisión con inversores a Buenos Airespara reunirse con funcionarios, políticos y empresarios.
""Regresamos de Argentina más optimistas sobre la continuidad de las políticas. La economía repuntó más rápido y con más fuerza de lo previsto"", señaló el banco de Estados Unidos. Y en el mismo reporte advirtió: ""La apertura de la cuenta de capital sigue siendo un riesgo clave. Un Big Mac en Buenos Aires tiene un precio cercano al de Nueva York, solucionarlo no está resultando fácil"".
De esa manera, la entidad reflotó la discusión sobre el atraso cambiario. En la medición de enero del índice Big Mac,Argentina apareció como el país con la hamburguesa más cara de América Latina y la segunda en el mundo, detrás de Suiza. Según The Economist, esto refleja que el peso argentino está sobrevaluado un 20%.
El índice fue objeto decruces recientes entre Axel Kicillof y Javier Milei. El gobernador lo citó como prueba del ""atraso"" del dólar y dijo que si el tipo de cambio no estuviera apreciado, Milei podría sacar el cepo y dejar de intervenir en el mercado. El Presidente respondió que dólar ""no está atrasado"", que no va a devaluar y que dichas críticas son una ""imbecilidad""
El líder libertario viene manteniendo un tono cada vez más duro con los economistas.El lunes dijo que Domingo Cavallo era un ""impresentable"". El exministro venía advirtiendo que el peso está apreciado ""exageradamente"" en alrededor del 20% y la semana pasada sostuvo que un posible desembolso del Fondo Monetario no sería suficiente para levantar el cepo.
En ese contexto, el Morgan Stanley publicó el lunes el informe al que accedió Clarín titulado ""Conclusiones del Viaje a Argentina: Mayormente Positivas, Aunque con Algunos Desafíos"". El mismo empezó a rebotar en el mercado en las últimas horas, en medio del desplome del 5% del Merval, la caída de los bonos en dólares de hasta el 2,3% y lasuba del riesgo paísa 710 puntos.
La comitiva encabezada por el economista jefe del banco, Fernando Sedano, se reunió el miércoles pasado con el jefe de Gabinete, Guillermo Francos, y habría hecho lo propio con el equipo de Luis Caputo. La visita coincidió con un aparentecambio de ánimo en Wall Street, donde ya no se ve con tanta claridad que haya un acuerdo con el Fondo y una salida del cepo en el corto plazo.
Si bien el gigante financiero de Nueva York pronosticó un 2025 ""prometedor"" dado que ""muchos líderes empresariales creen que el crecimiento podría sorprender al alza, especialmente en lo que respecta al crédito bancario y el consumo"", advirtió que ""es difícil evaluar el costo que los responsables de políticas deberán pagar por la política cambiaria"".
""Argentina necesita inversión más que consumo. El exceso de gasto fue el problema en primer lugar. Resulta difícil fomentar la inversión cuando el tipo de cambio sigue siendo un factor de riesgo"", sostuvo. ""También podría haber un precio a pagar más adelante si la devaluación se convierte en la solución. El costo podría ser tanto monetario como político, en términos de apoyo"", concluyó.
El documento se conoce después delenojo del ministro de Economía, Luis Caputo﻿, con un reporte del Bank of Américaque publicó este diario. El paper desmentido por el funcionario sugería que la Argentina se encamina a un acuerdo ""puente"" en abril, con un fuerte desembolso al inicio y un salto del dólar a $ 1.400 después de las elecciones.
Los bancos de Wall Streetaguardan desde el año pasado una flexibilización del cepoy la unificación cambiaria. Ahora, el Morgan Stanley espera queel blend sea eliminado en el segundo trimestrey queun desembolso inicial de US$ 5.000 millones del FMIayude a compensar el déficit en cuenta corriente por la apreciación del peso y la reanudación del pago de importaciones.
Redactor de la sección Economíajbarca@clarin.com
Newsletter Clarín
Recibí en tu email todas las noticias, coberturas, historias y análisis de la mano de nuestros periodistas especializados",https://www.clarin.com/economia/informe-wall-street-advierte-tema-momento-morgan-stanley-habla-riesgos-dolar_0_uej1fTYThf.html
Clarín,2025-02-11,Economistas de todas las corrientes salieron a repudiar la crítica de Alejandro Fantino a ex profesores de Javier Milei,"El periodistaAlejandro Fantinoacusó en su programa que los economistas Roberto Frenkel, José María Fanelli, Martín Rapetti y Sebastián Katz, integrantes delCentro de Estudios de Estado y Sociedad (CEDES)piden una devaluaciónporque su ""principal entrada de guita"" es la venta de informes y ""cobran en dólares"".
""Sus informes son en dólares y con 3 informes mensuales se alquilan un yateen Rimini (Italia) y ponen a 4 odaliscas a bailar (... entonces) estos tipos necesitan la devaluación"", acusó Fantino, cercano al presidente Javier Milei, en el canal de streaming Neura.
""¿Vieron cuando habla de 'econochantas' Javier? Habla de estos"", asumió el argumento oficial el comunicador. ""Cobran en dólares, no les sirve este peso y juegan para el gran empresariado argentino"", continuó.
Dos de los apuntados, Frenkel y Fanelli, fueron profesores de Milei en el curso del IDES que más tarde le abriría las puertas a HSBC de la mano de economistas del CEDES. Milei publicó un trabajo Regulación por Tasa de Retorno y Valor de Mercado por los juicios del CIADI.
El ataque de Fantino generó polémica en la redes con economistas que incluso tienen miradas positivas del Gobierno, en un contexto en el que Milei acaba de acusar al ex ministro de Economía Domingo Cavallo de ""impresentable"" por señalar que el dólar está barato o atrasado.
Cavallo era considerado por el presidente como ""el mejor ministro de Economía de la historia"" y había nombrado por eso a su hija, Sonia Cavallo, como embajadora ante la Organización de los Estados Americanos (OAE), cargo al que la hizo renunciar esta semana.
Martín Rapetti, uno de los acusados por Fantino, respondió: ""El tipo de cambio real es un precio relativo; cuando está bajo (atrasado) conviene ir a Brasil, Miami o Punta del Este, ¡o incluso a Rimini con odaliscas!; cuando está alto, ir a Mendoza, Bariloche o Mar del Plata"".Rapetti criticó recientemente la política cambiaria del Gobierno.
Otras reacciones de economistas fueron:
Federico Moll:""La persecución al que piensa distinto es lo que caracterizó a 6, 7, 8 y al aparato de comunicación kirchnerista. Lo de Milei, hoy representado por Fantino y el CEDES, es uno de los muchos puntos de contacto entre las dos fuerzas. No tan distintos"".
Andrés López, director del Instituto Interdisciplinario de Economía Política (IIEP) de la UBA y el Conicet, sostuvo:""Repudiable operación, porque es una operación, es muy burdo, contra queridos colegas del CEDES. Además de repudiable berreta, con una argumentación delirante y un retraso de la información de varios años. Estoy entre quienes creen que hacía falta disciplina fiscal y desregular la economía. Pero esos objetivos no requerían modales desagradables, ideas retrógradas, persecuciones, amenazas y desacreditaciones al que piensa distinto. El gobierno cada vez es más peligroso"".
Lucas Llach, ex vicepresidente del Banco Central (BCRA) junto a Federico Sturzenegger en el gobierno de Mauricio Macri, escribió:""Lo de Fantino diciendo que economistas del CEDES quieren un tipo de cambio alto para ganar más guita es de las mayores berretadas que he escuchado últimamente. He discutido con varios de ellos durante décadas, especialmente porque no les disgusta el cepo y porque defendían el tipo de cambio inflacionario de Néstor (Kirchner), pero es su posición de toda la vida, no es por guita. Tienen papers teóricos sobre el tema"".
Fernando Marull:""Aclaracion para millenials. Si escuchan que ahora un tal Frenkel y Fanelli son malos. Nada que ver, están en otra. Casi retirados y -dicen- ya ni se meten en temas coyunturales. No es por ahí. No sé dónde sacan la data"".
Matías Surt:""Volvió 678, ahora por streaming. Operaciones contra economistas prestigiosos como en los peores momentos de Néstor Kirchner. ¿Algo más lejos del liberalismo que esto?"".
Nicolás Gadano:""El ataque de Fantino al CEDES y sus economistas es una operación burda y siniestra. Toda mi solidaridad con mis colegas"".
Emilio Ocampo:""Los tuve a Roberto Frenkel y José María Fanelli de profesores en un curso de macro allá por 1984 en el que enseñaban Keynes 101. Seguramente crean que fui unos de sus peores alumnos pero los respeto como profesores y economistas. Además, siempre admitieron y respetaron el disenso en clase. También conozco a Martín Rapetti y, más allá de las diferencias que hemos tenido, siempre pudimos tener un diálogo fructífero y de mutuo respeto. No lo conozco a Sebastián Katz pero tengo entendido que al igual que Martín también es un economista serio y profesional. Basta con la demonización y las teorías conspirativas. Por suerte no vivimos en un régimen donde rige el pensamiento único.Celebremos la libertad de opinión y la posibilidad de disenso"".
Newsletter Clarín
Recibí en tu email todas las noticias, coberturas, historias y análisis de la mano de nuestros periodistas especializados",https://www.clarin.com/economia/fuerte-repudio-amplio-abanico-economistas-ataque-think-tank-estudio-javier-milei_0_Pz06LIKSPp.html
Clarín,2025-02-11,El año pasado el ecommerce se salvó de la caída del consumo,"A diferencia del consumo que, en 2024, tuvo una caída feroz por la pérdida del poder adquisitivo y la recomposición de los precios, elcomercio electrónicono sólo mantuvo el vigor que cobró después de la pandemia, sino quesigue creciendo.
Un estudio que hace todos los años, la Cámara Argentina de Comercio Electrónico (CACE) mostróun crecimiento en la facturación del 181%que corresponde a $22.025.462 millones. Esto implica un aumento de 64 puntos por encima de la inflación interanual (117,7%).¿Qué móviles encuentran los consumidores para seguir comprando en la web?
Gustavo Sambucetti, director institucional de CACE piensa que el crecimiento en la facturación está impulsado porla digitalización y la confianza de los consumidores. ""Además observamos un aumento en la cantidad de empresas para las cuales el comercio electrónico representa más del 10% de sus ventas, que pasó de 50% en 2023 a 54%. en 2024. La capacidad de adaptación y la conveniencia de este canal han sido fundamentales para su evolución”, explicó sobre las estadísticas.
El informe anual de la entidad mostró, entre otros datos, que las órdenes de compra registraron un crecimiento del 5% en el último año y elticket promedio tuvo un aumento de 176%, situándose en $92.341.
En cuanto a la facturación por regiones, al igual que el año pasado, estuvo liderada por el AMBA, que concentró el 42%. Le siguieron Buenos Aires, con el  17%, el Litoral (13%), el  Sur (8%), el Centro (8%), el  NOA (7%)  Cuyo (5%).
Un cambio relevante, este año, es que,por primera vez, la cantidad de personas que tienen billeteras virtuales superó a las que tienen tarjetas de débito y también a las que tienen tarjeta de crédito. El aumento en el uso de billeteras virtuales se explica por la implementación del código QR dual que permite iniciar el pago de tarjeta de crédito a través de ellas. Sin embargo, la tarjeta de crédito sigue siendo el medio de pago con mayor participación en las compras con un 74%.
La categoría con mayor facturación fue la dePasajes y Turismo,seguida por Alimentos, Bebidas y por Equipos de audio, imagen, consolas y telefonía. El ranking de categorías con mayor facturación se completa con: artículos para el hogar (muebles, decoración); electrodomésticos (línea blanca y marrón), deportes, cosmética perfumería, indumentaria, accesorios para autos y motos, infantiles, materiales y herramientas de construcción.
Respecto de las compras en el exterior, según la CACE, no se observaron cambios significativos en comparación con 2023. Sin embargo,cinco de cada 10 entrevistados dijo que compró por primera vez productos del exterior en los últimos 6 meses.Las plataformas más utilizadas para comprar en el exterior son: Ali Express, Alibaba, Mercado Libre, Amazon, Tiendamia, Ebay y tiendas online. Otro incentivo para la demanda son las fechas como el Hot Sale y el Cyber Monday que siguen resultando clave para dinamizar aún más las ventas virtuales.
Al ser consultada sobreporqué crece el comercio electrónico,Julieta Dejean, directora comercial de Kantar Insights Argentina, dice que, desde el 2019 esta modalidad de compra sigue sumando nuevos compradores porque -año tras año- crece el hábito yno sólo se suma más gente, sino que esa gente compra con mayor frecuencia"", dice.
También, ""porque el canal online fue construyendo una experiencia de compra cada vez mejor, en particular en lo que es logística de entrega y además, se fueron ampliando las formas de comprar online. Creció la modalidad de retiro en tienda/punto de venta (como opción para aquellos que no quieren envío a domicilio, para evitar el costo de envío, o para poder verificar o probar el producto en el local al retirarlo)"", continuó la analista.
En particular, este año ""estamos viendo que los consumidores registranmayores opciones de financiamiento. Y éste es un factor clave para el shopper. Para cerca del 50% este es un factor que influye mucho en su decisión de comprar on line"", asegura Dejean.
Otro aspecto que influye en la masificación de las compras online,  según los retailers, es la variedad de productos que pueden encontrarse en la nube, la posibilidad de comparar los precios, el aprovechamiento de las promociones y descuentos que se ofrecen y finalmente,la penetración de internet y de smartphonesalcanzadas por el país.
Redactora de la sección Economía/Pyme.nmuscatelli@clarin.com
Newsletter Clarín
Recibí en tu email todas las noticias, coberturas, historias y análisis de la mano de nuestros periodistas especializados",https://www.clarin.com/economia/ano-pasado-ecommerce-salvo-caida-consumo_0_Ph1CifUZtj.html
