diario,fecha,titulo noticia,contenido,link
Clarín,2025-02-12,Financiamiento en alza: cuál es el mecanismo que se viene expandiendo y marca un récord desde 2017,"El salto que el crédito y las distintas formas definanciamientotuvieron en los últimos meses se extendió al leasing, el sistema que permite alquilar un bien, pagar el cuotas y, una vez finalizado el contrato, comprarlo.El sector consiguió sus mejores resultados desde el 2017.
La industria del leasing cerró el segundo semestre de 2024 conun crecimiento del 121% al cubrir 19.438 bienes. A su vez, el saldo de cartera de leasing de las empresas del sector trepó a$540.000 millonesa fines de diciembre, lo que representóun crecimiento del 59% en términos reales respecto de junio.
“Durante el año pasado se han visto señales claras de recuperación por lamayor demanda de financiamiento a largo plazo para la adquisición de equipos de transporte y logística.Además, en este escenario, se dinamiza el empleo y el crecimiento, con un rol central de las PyMEs”, afirmó Ramiro Baré, presidente de Leasing Argentina, reforzando la tendencia del sector.
“El fuerte crecimiento del leasing en 2024 se explica en gran parte por las condiciones de estabilidad,baja de inflación, mejores expectativasy, simultáneamente, más oferta de los dadores en una nueva Argentina que posibilita a las empresas invertir en bienes de capital sin afectar su liquidez"", señaló Nicolás Scioli, vicepresidente de Leasing Argentina.
Esta expansión también impulsó la generación de aproximadamente10.100 puestos de trabajo directos.
El crecimiento del leasing estuvo impulsado principalmente por la demanda de lasPyMEs, que representaron el46,22%del saldo total de cartera del sector. Sin embargo, las grandes empresas también tuvieron una participación significativa (46,18%), mientras que la demanda del sector público y de individuos se mantuvo en niveles más moderados.
En cuanto a la distribución de los fondos,el 64% del saldo de cartera se destinó al financiamiento de equipos de transporte y logística, el 15% a bienes de tecnología y telecomunicaciones, el 11% a maquinaria de construcción, y otro 8% a industria y maquinaria agrícola.
Las expectativas para este año son positivas. Nicolás Scioli apunta que ""en 2025, el saldo de leasing podría crece un 73% nominal a 930.000 millones de pesos. Esto implicaría un crecimiento del 44% ajustado por inflación. Este fuerte crecimiento reflejaría el dinamismo que vino mostrando en el segundo semestre de 2024, cuando creció casi un 60% ajustado por inflación"".
La razón principal para estimular la expansión del leasing este año  se vincula a la estabilidad de la macroeconomía. Para este año se prevéun crecimiento de la actividad del 5%, con una baja persistente de la inflación que cerraría el año en torno al 25%.
Entre los sectores que impulsarían el crecimiento este año figuranmaquinaria de transporte, tecnología, maquinaria de la construcción, equipo industrial, y maquinaria agrícola.
Redactora de la sección Economía, especializada en negociosaquiroga@clarin.com
Newsletter Clarín
Recibí en tu email todas las noticias, coberturas, historias y análisis de la mano de nuestros periodistas especializados",https://www.clarin.com/economia/financiamiento-alza-mecanismo-viene-expandiendo-marca-record-2017_0_lmdkpaySFF.html
Clarín,2025-02-12,La presión tributaria de las provincias subió 50% en los últimos 25 años,"El ministro de Economía, Luis Caputo, encabeza una cruzada para que provincias y municipios bajen los impuestos y tasas, para acompañar la meta de baja de la presión fiscal que busca el Gobierno como alternativa de baja de costos para las empresas.
Por caso, el martes, el funcionarioles dijo a los representantes de la Unión Industrial Argentina (UIA)que presionen a los gobiernos locales para que reduzcan la carga fiscal como respuesta al pedido decompetitividad de los empresarios ante la apertura de importaciones y un tipo de cambio controlado.
La cruzada también se vio en septiembre pasado, conla prohibición de incluir tasas municipales en facturas de servicios públicos, lo cual hizo que se visibilicen los cargos tributarios locales.
Es que lapresión fiscal provincial creció un 50% en los últimos 25 años y marcó un 5,1% del PBI en 2024, según un relevamiento que hizo IERAL.
La presión fiscal es el peso que tienen los impuestos en el PBI, o dicho de otra manera, es la proporción del PBI que los residentes dedican a pagar impuestos. Se mide dividiendo la recaudación impositiva sobre el PBI.
A lo largo de los años, se puede ver una suba lenta pero persistente de estos gravámenes: entre 2003 y 2011 la presión fiscal de las provincias pasó de 3,4% a 4,3%, y pegó un salto brusco de 4,3% a 5,2% del PBI en los años 2012-2013. El récord se produjo en 2017 (5,4%), luego con el Consenso Fiscal que rigió desde 2018 baja hasta 4,8% en 2019, para finalmente subir hasta 5,1% en los años subsiguientes, explica el think tank de la Fundación Mediterránea.
El año pasado,la recaudación de tributos provinciales acumulada desde enero hasta septiembre fue de $ 20.068.007 millones y el PBI consolidado de provincias fue de $ 395.842.368 millones de pesospara ese mismo período de tiempo, explica Marcelo Capello, economista de IERAL-Fundación Mediterránea.
Las provincias con mayor presión tributaria efectiva al tercer trimestre del 2024 fueronMisiones, con un 7,9% de su Producto Bruto Geográfico (PBG), Ciudad Autónoma de Buenos Aires, con 6,5% y Tucumán, con 6,1%.
Por el otro lado,las provincias con la menor presión fueron La Rioja y San Juan, con un 2,9%, Formosa tiene un 2,8% y Santiago del Estero apenas alcanza el 1,9%.Estas provincias son altamente dependientes de las transferencias nacionales, lo cual probablemente desincentiva un mayor esfuerzo recaudador local, de acuerdo con IERAL.
El 28 de enero pasado, Caputo hizo mención a la baja de impuestos en su cuenta de la red social X en un largo posteo en el que llamó a las provincias y municipios a hacer lo propio: ""Quiero remarcarla importancia de reducir el déficit vía reducción de gastos, y no vía aumento de impuestos como están haciendo algunas provincias y municipios(tasas en este caso) de manera injustificada, ya que todos están recibiendo mayores ingresos por el aumento en la recaudación"".
Y luego hizo hincapié en la importancia de bajar el impuesto más relevante para las provincias,IIBB: ""Sería muy importante para el país que provincias y municipios, aprovechando este aumento en sus ingresos, se sumaran al esfuerzo que están haciendo todos los argentinos y redujeran Ingresos Brutos y tasas municipales"".
Redujimos a cero, y en tan solo un año, 15 puntos de PIB de déficit consolidado (Tesoro + Banco Central), bajando un 30 por ciento el nivel de gasto del Estado y terminando con la emisión monetaria. Estas medidas permitieron la baja fenomenal de la inflación (y con ella, el nivel…
El impuesto de mayor relevancia para las provincias esIIBB, que representa en promedio un 82,3% de la recaudación de las provincias.Lo sigue Sellos, con un 7,1%, y el impuesto Inmobiliario, de alrededor del 5,3%, que en algunas provincias es de aplicación municipal, de acuerdo con IERAL.
El experto tributarista César Litvin refuerza la idea de que IIBB distorsiona la economía en general: ""Las provincias tienen que ser más eficientes en el gasto público. IIBB es el peor de todos los impuestos. Si representa el 82,3% es una mala noticia porque es un impuesto que hace mucho daño a la actividad económica, y que se traslada y aumenta los precios"", recomienda.
Y agrega que las provincias deberían ""reformularlo como un impuesto a la venta en la última etapa parasacar el efecto cascadaque se acumula. Y en el mediano plazo desaparecer, ya que IIBB, IVA y tasa de seguridad e higiene en conjunto graban la misma venta"".
En relación con las tasas municipales, Litvin suma: ""los municipios han desnaturalizado el concepto de tasa, que es el precio de la contraprestación de un servicio y el valor tiene que estar relacionado con el costo prestacional y no con el ingreso del contribuyente, con lo cuallos municipios están disfrazando verdaderos impuestos de tasas"".
Aunque el gobierno nacional busque llevar la atención de la presión fiscal a las provincias, una baja de impuestos a nivel local es de difícil implementación ya que requeriría un ajuste fiscal importante para los distritos.
Redactora de la sección Economía.
Newsletter Clarín
Recibí en tu email todas las noticias, coberturas, historias y análisis de la mano de nuestros periodistas especializados",https://www.clarin.com/economia/presion-tributaria-provincias-subio-50-ultimos-25-anos_0_fUrkWUWNcD.html
Clarín,2025-02-12,Empezó a volar una nueva aerolínea argentina que fundaron jóvenes de 20 años y conectará ciudades del Interior,"Empezó a volar una nueva aerolínea argentina. Se llamaHumming Airwaysy conectará ciudades del Interior en dos rutas inéditas, por ahora, con un avión chico.
Si bien el vuelo inaugural fue en diciembre, este martes lanzó los servicios regulares comerciales queunirán Aeroparque con Venado Tuerto(Santa Fe) yVilla María(Córdoba) los martes a la mañana y los miércoles por la tarde, en trayectos de apenas 45 minutos.
Asimismo, antes de fin de febrero,tiene previsto sumar vuelos desde Aeroparque a Tandil y Olavarríacon salidas los miércoles por la mañana y los viernes por la tarde.
A diferencia de intentos fallidos en el pasado de aerolíneas comoSolyLaer, en este caso la idea de ofrecer una triangulación es paraasegurarse una ocupación alta permanente, que estiman que a lo largo de 2025 se mantendría entre60%y70%. Y la ventaja de volar desde Aeroparque −al comienzo se barajó hacerlo desde San Fernando− es el tránsito de autos y tiempo de viaje que se evita.
La compañía nació en abril de 2024 con la nueva política aerocomercial que impulsa el Gobierno. Detrás, estántres emprendedores de poco más de 20 años. Uno de ellos esFrancisco Simón Errecart, que como CEO y piloto privado, lidera un equipo de 22 integrantes, de los cuales 13 son jóvenes
Humming Airways busca llenar el vacío que deja la desconexión aéreaentre ciudades clave del Interior con escasa infraestructura aeronáutica, volando a destinos a donde las aerolíneas convencionales no llegan y con precios competitivos.
En la preventa que ya finalizó,colocó un 60% de los pasajesplanificados para el primer año de operaciones. El tramo costaba desdeUS$ 150 más IVAyahora se consigue desdeUS$ 225 más IVAen adelante, aunque a empresas o clientes que quieran contratar en cantidad les hace descuento.
La aéreaempezó ofreciendo vuelos privadosa la par que se preparó paraeste lanzamiento de vuelos comerciales. “La idea surgió en enero del año pasado, cuando un amigo me comentó que se tomaba vuelos privados todas las semanas desde San Fernando a Venado Tuerto por trabajo porUS$ 3.000. Me consultó si existía la chance de hacerle precio para un grupo de 10 personas y así fue que nos dimos cuenta de quehay una demanda insatisfecha”, repasó Errecart los inicios del negocio.
La apuesta porVenado TuertoyOlavarríaconsidera la oportunidad que presentan ambospolos agroindustrialescon el público corporativo que suele trasladarse por vía terrestre, en tanto queVilla MaríayTandilsondos centros turísticos bonaerenses en crecimiento. Según Errecart, un remise hasta allí puede sale más de$ 500.000.
Por el momento, Humming Airwaysusará solo un aviónque le alquila a la compañía de vuelos charterRoyal Class, modelo Fairchild Swearingen SA 227 Metroliner 23 concapacidad para 19 pasajeros, con contrato por un año; aunque tiene otro de repuesto por cualquier inconveniente. No descarta en el futuro ampliar la flota de acuerdo a la demanda y un potencial aumento de frecuencias.
NE
Redactora de la sección Economíaagdevincenzi@clarin.com
Newsletter Clarín
Recibí en tu email todas las noticias, coberturas, historias y análisis de la mano de nuestros periodistas especializados",https://www.clarin.com/economia/empezo-volar-nueva-aerolinea-argentina-fundaron-jovenes-20-anos-conectara-ciudades-interior_0_Ijn3WyJTVw.html
Clarín,2025-02-12,Real hoy y real blue hoy: a cuánto cotiza y cuál es el precio de la moneda brasileña este miércoles 12 de febrero,"Elrealcotiza a $170,96 para lacompray a $171,17 para laventaeste miércoles 12 de febrero de 2025, de acuerdo con la información que proporciona el sitio del Banco Nación.
Con respecto a la divisa en el mercado paralelo, elreal blue hoytiene un precio de $213,75 para la compra y de $195,75 para la venta, una información que muchos argentinos consultan antes de viajar aBrasilpor turismo o negocios.
De este modo,la brecha entre el real blue y el real oficiales de 20.02%.
De acuerdo con la variación de la divisa brasileña en el mercado informal, un dólar equivale a R$5.59 reales, por lo quecon 100 dólares se pueden comprar R$559.06 reales.
El real es la moneda de curso legal deBrasildesde 1994, cuando reemplazó al cruzeiro real. Es la vigésima moneda más negociada en el mundo y la primera en Sudamérica. Su símbolo esR$y cuenta conbilletesde hasta 200 reales de denominación.
Eldólar oficialcotiza este miércoles 12 de febrero de 2025 a $1036 para la compra y $1076 para la venta en las entidades bancarias.
En tanto, eldólar bluese consigue a $1195 y se vende a $1215 en el mercado paralelo.
Newsletter Clarín
Recibí en tu email todas las noticias, coberturas, historias y análisis de la mano de nuestros periodistas especializados",https://www.clarin.com/economia/real-hoy-real-blue-hoy-cotiza-precio-moneda-brasilena-miercoles-12-febrero_0_ibcZWJvNFq.html
Clarín,2025-02-12,Dólar hoy: a cuánto cotizan el oficial y sus diferentes tipos de cambio este miércoles 12 de febrero,"Eldólar oficialcotiza estemiércoles 12 de febreroa $1036 para la compra y $1076 para la venta en las entidades bancarias.
En cuanto aldólar blue, esta jornada cotiza a $1195 para la compra y $1215 para la venta. Así, marca una brecha de 15% con respecto al dólar oficial. Elvalor del dólar bluetiene una diferencia sustancial con el dólar oficial, que se adquiere en los bancos y que posee una cotización establecida.
Por otro lado, eldólar turista(también conocido comodólar solidario) cotiza a $1398,80. Este valor es el que se utiliza al momento de comprar dólar para ahorro o de realizar transacciones en el exterior y surge de la suma de un 30% al valor del dólar oficial del día.
Otro de los tipos de cambio es eldólar mayorista, el cual inicia el día a $1204,50 para la compra y $1209 para la venta.
En relación alContado con liqui(CCL), el precio de referencia es de $1190,30. El CCL es la operatoria que permite a las empresas comprar papeles argentinos en el mercado local y venderlos en el exterior para lograr así girar divisas para ""atesoramiento"".
Hoy en Argentina conviven al menos seis tipos de cotizaciones distintas para la moneda estadounidense, algunas más usadas que otras.
Dólar ahorro/tarjeta o dólar turista/solidario: tiene el recargo del 30% dispuesto por el Gobierno sobre las compras realizadas con tarjeta en moneda extranjera y sobre la adquisición de divisas para atesoramiento dentro del circuito oficial.
Dólar blue: es el billete que se vende en el mercado informal, a través de cuevas o “arbolitos” en la calle.
Contado con Liqui: es una operación legal para conseguir dólares en el exterior. Se convirtió en el camino preferido de las empresas. Se compran títulos o acciones argentinas en pesos y luego se venden en el exterior en dólares.
Dólar oficial o minorista: es el precio al que pueden acceder los particulares pero siempre dentro del cerco de US$200 establecido por el cepo.
Dólar mayorista: es el que se usa para el comercio exterior, el pago de deudas dolarizadas y de dividendos. Teóricamente es el que incide en la fijación de los precios de los productos importados.
Dólar para industria y servicios: por el efecto de las retenciones, los exportadores de manufacturas y de servicios reciben en realidad un dólar a un valor más bajo que el oficial, y mucho más bajo que el blue. Dentro de esta categoría, hay distintos valores para quienes exportan carne y lácteos, para trigo, maíz y girasol y para la soja.
Newsletter Clarín
Recibí en tu email todas las noticias, coberturas, historias y análisis de la mano de nuestros periodistas especializados",https://www.clarin.com/economia/dolar-hoy-cotizan-oficial-diferentes-tipos-cambio-miercoles-12-febrero_0_hEGFwN0wHx.html
Clarín,2025-02-12,"Es productor de sandias, le mandó un mail a un ministro por las trabas que sufría e impulsó un histórico cambio que impacta en todas las provincias de país","Walter Detzelnació, creció en Juan José Castelli, donde lleva adelante la producción de sandías, una actividad que comenzó su padre. Pero esta semana trascendió y fue noticia esta semana tras la desregulación del mercado de frutas que impulsó el gobierno deJavier Milei.
""Todo arrancó cuando me escribióWalter Javier Detzel(@WDetzel) contándome quele pedían envases para sus sandías que su cliente externo no aceptaba. La solución: cargaba el barco y cuando salía desarmaba los paquetes exigidos y los reemplazaba por los que sí servían. (¡Gracias Walter por escribirnos!). Lo cierto es que lo de Walter resultó la punta del témpano, abajo pululaba una maraña de resoluciones y obligaciones típicas de un estado militar-kafkiano"", posteóFederico Sturzenegger, ministro de Desregulación y Transformación del Estado.
“Desde que el Dr.Federico Sturzeneggerme nombró con nombre y apellido en un programa de televisión, no paran de llamarme. La noticia nos pone muy contentos porquese desreguló el mercado de la fruta”, dijo a Clarín Rural el productor de sandias.
“Esto no solo beneficia a nuestra economía regional en el Chaco, en la producción de lasandía, melón y zapallo,sino que alcanza a todo el país porque se desregula una economía regional de cada provincia. Lacebolla en Santiago, elajo en Mendoza, elcitrus en Entre Ríos, laaceituna de Córdoba, o sea que para cada sector que produce fruta se desregula y se simplifica la operativa de SENASA y Aduana.Se han quitado miles de trabas burocráticasque nos complicaban las ventas al exterior o a un país vecino”, contó..
Para poner en contexto, recordó que en el año 2018 contactó un comprador en Asunción, Paraguay, que vendía sandía en ese país. “El hombre estaba interesado en comprar producción nuestra porque estamos a 400 km, y él compraba en Goiás Brasil a 2.000 km. Entonces, exportamos 4 equipos, (28 tn cada uno). El 5to equipo quedó bloqueado en aduana debido a una reglamentación de 1983, por la cual se exigía que la mercadería debíasalir embolsada o enrejillada. Nos dejaron pasar ese camión como única vez”, contó.
""En realidad, el cliente comprabaa granel como en cualquier país del mundo. La sandía embolsada se raya, se golpea, además aparece el costo adicional de la bolsa y el personal para descoser la bolsa. Además, la primera fruta sale bien y las otras se golpean y se manchan. “En ese momentoninguna autoridad pudo ayudarnos, perdimos el cliente”. Por ello cuando hace unos días vi a Sturzzeneger en un programa de televisión, sugiriendo a la gente le escriba y le trasladen su problemática me animó a escribirle un e mail con esta problemática”, agregó a su amarga experiencia.
Walter, además de ser productor, conoce a fondo la problemática de todos sus colegas porque desde su local les suministra semillas e insumos para la producción. La cuestión es que a las 72 horas de enviar su e mail, se llevó una grata sorpresa con la respuesta del Ministro. ""Leí tu email, quédate tranquilo que estamos trabajando en ello”. Eran 100 páginas en estudio pero dos meses después se logró la desregulación del mercado de la fruta que fue la gran noticia.
La sandía se hace en gran parte del territorio nacional pero en Chaco, Formosa y Salta arrancan antes con la siembra debido a cuestiones climáticas. “Entonces, al sembrar primero hacemos lasprimiciasa nivel nacional y esa condición nos permite acceder a los mejores precios. En esta zona la siembra arranca del 20 al 28 de julio, luego dependiendo del clima, en los primeros días de noviembre se cosechan manualmente entre25 y 30 tn /ha de sandía”.
Lasiembra es de precisióna 2 metros de distancia entre hileras a razón de5.000 semilllas hibridas por hectárea. El cultivo aranca con tratamientos para pulgones, trips y plagas en general. Luego tratamientos de aminoácidos, enrraizadores, fertilizantes y luego productos para la floración y luego fertilizante con mucho potasio para el crecimiento de la fruta y que sea de alta calidad.
El costo de una hectárea con todos esos insumos es500 mil pesos. El valor de la producción es de350 $/kg al productor,lo cual es muy variable a labaja en pocos días. Lo importante para logar el mejor resultado es llegar temprano al mercado.En cosecha tempranacon un rinde de28 tn/hael productor esta con una venta bruta a cosecha de unos 9,5 millones de pesos.
En su momento, en Chaco se llegaron a producir 3.000 ha de sandía que luego por cuestiones económicas se redujeron a las1.000 haactuales. “Como es una fruta de estación el precio esta muy atado al hecho de que cuando hacemos primicia y llegamos al mercado cuando hay muy poca producción a nivel nacional, los precios son muy buenos”. Cuando hay sobre producción porque llegan al mercado las otras provincias competidoras como del litoral y Santiago del Estero, los precios se desploman, como pasa en todos los rubros.
“Por ello mi idea esbuscar mercados externoscomoParaguay, Uruguay, Chile, lugares donde existe interés en nuestra producción y donde no podíamos acceder por estas cuestiones regulatorias que hora están resueltas” cierra Walter Detzel.

Newsletter Clarín
Recibí en tu email todas las noticias, coberturas, historias y análisis de la mano de nuestros periodistas especializados",https://www.clarin.com/rural/productor-sandias-mando-mail-ministro-trabas-sufria-impulso-historico-cambio-impacta-todas-provincias-pais_0_s6JSrdCgpC.html
Clarín,2025-02-12,Dólar ahorro hoy: a cuánto cotiza este miércoles 12 de febrero,"La cotización deldólar ahorroes de$1398,80para la venta este miércoles 12 de febrero de 2025.
El dólar ahorro sube0%respecto al mismo día de la semana anterior.
En lo que va de febrero de 2025, el dólar ahorro sube respecto al mes anterior: la diferencia es de2%.
En comparación con el año pasado, el dólar ahorro sube un3%. A esta altura del año anterior, el ahorro cotizaba a$1360.
El valor deldólar ahorrotiene una diferencia con eldólar MEP. Mientras que el primero está$1398,80, el MEP cotiza hoy a$1180,70, lo que marca una brecha de18%.
Eldólar ahorroes un tipo de cambio mayor al dólar oficial, que se muestra como la opción más barata para comprar a modo de atesoramiento.
La compra deldólar ahorrohoy en Argentina se maneja bajo la siguiente cotización: el 30% del impuesto país se mantiene y el 35% del impuesto a las ganancias pasa a ser de un 45%, igualando la cotización del dólar tarjeta.
La cotización del dólar ahorro funciona en el mismo horario del mercado de cotizaciones:hasta las 16:30 horas, de lunes a viernes.
Estas operaciones reciben el nombre de “operaciones de liquidación con cable”. Para identificarlas se agrega una C al final del código de negociación de la especie. Así se diferencian de aquellas que se liquidan en pesos o dólares en cuentas radicadas en el mercado local.
Newsletter Clarín
Recibí en tu email todas las noticias, coberturas, historias y análisis de la mano de nuestros periodistas especializados",https://www.clarin.com/economia/dolar-ahorro-hoy-cotiza-miercoles-12-febrero_0_4xaXw7whGT.html
