diario,fecha,titulo noticia,contenido,link
Clarín,2025-01-27,Dólar cripto hoy: a cuánto cotiza este lunes 27 de enero,"La cotización deldólar criptoes de$1198para la compra y de$1204,17para la venta, estelunes 27 de enero.
El dólar criptobaja2%respecto al mismo día de la semana anterior.
En lo que va deenero 2025, el dólar criptosuberespecto al mes anterior: la diferencia es de2%.
En comparación con el año pasado, el dólar criptobajaun0.17%. A esta altura del año anterior, el dólar cripto cotizaba a$1200.
El valor deldólar criptotiene una diferencia con eldólar blue. Mientras que el primero está a$1198, el blue cotiza hoy a$1205, lo que marca una brecha de0.58%.
Eldólar criptoes una cotización que se define en función de la compraventa de “stablecoins”, es decir, criptomonedas atadas a un activo estable, en este caso al dólar estadounidense.
Para operar con eldólar criptoes necesario tener una cuenta en alguna billetera virtual o una exchange. Se define su cotización en función de la compra y venta de criptomonedas ancladas al dólar estadounidense.
Newsletter Clarín
Recibí en tu email todas las noticias, coberturas, historias y análisis de la mano de nuestros periodistas especializados",https://www.clarin.com/economia/dolar-cripto-hoy-cotiza-lunes-27-enero_0_ED6OYkmsNE.html
Clarín,2025-01-27,"Dólar hoy y dólar blue hoy, EN VIVO: a cuánto cotizó y cuál fue su precio este lunes 27 de enero, minuto a minuto","Eldólar bluesubió 5 pesos este lunes 27 de enero y cerró a$ 1.230 para la venta.En tanto, eldólar oficialarrancó la semana con una cotización de$ 1.069para la venta en la pizarra del Banco Nación. Seguí todas las instancias de la jornada cambiaria en la cobertura minuto a minuto deClarín.
El tembladero que se originó en Wall Street por la irrupción de una compañía china en el segmento de la inteligencia artificial golpeó también a los activos argentinos. En el arranque de semana, el índice Merval cerró con una caída de más de 6% medido en dólares. El mal humor global afectó a los bonos soberanos en dólares y el riesgo país subió a los 642 puntos.
Durante el fin de semana se conoció la noticia de que “DeepSeek”, una startup China, presentó un modelo de IA avanzado y altamente eficiente en costos, que compite directamente con los modelos de las grandes tecnológicas, llegando a ser la APP más descargada del fin de semana, superando a Chat GPT y teniendo la particularidad que puede utilizarse sin conexión a internet.Leer más
La cotización paralela terminó la jornada con una suba de 5 pesos con respecto al cierre del viernes.
Pese a que quedó fuera del listado de empresas públicas a privatizar, el Banco nación avanza en el proceso para transformarse en una sociedad anónima.
A través de un comunicado, se informó que el banco ""ya cerró su balance especial de transformación al 31/12/2024 y la nueva Sociedad Anónima tendrá activos por $ 48 billones, depósitos y otras obligaciones por $ 33 billones. En tanto, el Patrimonio Neto (PN) de la SA ascendería a $ 15 billones"".Leer más
El plazo fijo bancario en dólares es una de las opciones más conocidas, sencillas y conservadoras para quienes sacaron sus ahorros del colchón en el último tiempo y ahora desean que ese dinero empiece a generar rendimientos.
Aunque en los últimos años esta inversión -considerada de muy bajo riesgo- venía arrojando ganancias ínfimas, recientemente sus tasas crecieron en varios de los principales bancos.Seguir leyendo
Mientras que el dólar contado con liquidación se negocia a $1.169, el dólar MEP o bolsa sube a $1.157.
La divisa terminó la jornada con una subida de un peso, que dejó la cotización final en $1.070 para la venta y $1.030 para la compra en la pizarra oficial.
Quienes en las últimas semanas se fueron de vacaciones al exterior, reservaron servicios turísticos en webs de afuera o usaron el sistema de compras internacionales ""puerta a puerta"" ahora tienen que pagar la cuenta por todos los gastos en moneda extranjera realizados con la tarjeta de crédito.
Como el cepo cambiario sigue vigente, saldar esa deuda de la manera tradicional resultaría un mal negocio porque el banco liquidará los consumos según la cotización ""turista"" o ""tarjeta"".Seguir leyendo
La flexibilización del régimen cambiario sigue siendo un punto sensible en la discusión con el Fondo Monetario. Por estas horas, las miradas están puestas en la hoja de ruta que seguirá el presidente Javier Milei para salir de un régimen fijo y pasar a uno de flotación ""libre"", sin cepo. El tema resurgió en los últimos días en medio de la visita de una misión del organismo y los rumores sobre la posibilidad de resucitar el esquema de bandas de flotación, un experimento que ya aplicó Luis Caputo durante el macrismo.
Las bandas son un mecanismo por el cual el Banco Central se compromete a mantener el tipo de cambio dentro de una franja amplia estableciendo un piso y un techo. Dentro de esa zona, la autoridad monetaria no interviene, mientras que sí supera el techo o perfora el piso, el Central tiene manos libres para hacer volver al precio del dólar al interior de las bandas. ""Se habla de las bandas de flotación, es un paso intermedio a la liberación cambiaria"", dijo un exfuncionario del Banco Central que sigue de cerca las conversaciones.Seguir leyendo
Con esta nueva subida, el billete se negocia a $1.230 para la venta, 5 pesos por encima de su cierre previo.
El billete ganó otros 10 pesos y recuperó el nivel con el que había cerrado la sesión previa, por lo que ahora se negocía a $1.225 para la venta en el mercado informal.
El riesgo país argentino. medido por el índice EMBI que elabora el banco de inversión JP Morgan, sube este lunes 11 puntos básicos, o un 1,74%, a 642 unidades.
El billete recuperó 5 pesos y se negocia este lunes cerca del mediodía a $1.215 en el mercado informal.
Aunque el año comenzó en un clima de aparente calma en el frente cambiario, en las últimas ruedas se encendieron algunas luces amarillas en el mercado. Los operadores de la City detectaron primero, y el Banco Central confirmó después, una creciente presencia oficial en el mercado de bonos para contener la brecha; y el organismo cortó su racha positiva por sus intervenciones en el segmento mayorista y vendió más de US$ 120 millones en las últimas cuatro ruedas.
Sin embargo, la decisión del Ministerio de Economía de avanzar con una baja temporal de las retenciones al agro y la expectativa por un próximo acuerdo con el Fondo podrían servir para acelerar las compras del Central y fortalecer las reservas, clave para el escenario de calma cambiaria que busca extender el Gobierno este año.Seguir leyendo
En las primeras operaciones del lunes, el billete cayó 15 pesos y se negocia a $1.210 para la venta en el mercado informal porteño.
Una empresa china irrumpió en el hipe competitivo mundo de la Inteligencia Artificial y desató un terremoto en Wall Street. Este lunes, en las horas previas a la apertura formal de las operaciones en la Bolsa de Nueva York, las acciones de Nvidia, hasta el viernes la empresa de mayor valor de mercado del mundo, se desplomaba cerca del 14%. Esto significa que la firma, que estaba valorizada en 3,5 billones de dólares, hoy vale casi 490.000 millones de dólares menos. Todo en cuestión de minutos.
A las 10, hora argentina, las acciones de la china Deep Seek achica la caída y pierde 11,92%. Los futuros de Wall Street siguen en rojo, pero mas acotados, el índice Nasdaq que refleja el comportamiento bursátil del sector tecnológico cede 0,58% desde el 4% inicial. En tanto el S&P 500 retrocedía 2,5% y el Dow Jones casi 1%. Las acciones de Meta (Facebook) y Microsoft retrocedían casi 6% en el pre mercado.Seguir leyendo
En el comienzo de otra semana, la divisa mantiene la cotización con la que terminó la previa en la apertura de la rueda, a $1.069 para la venta y $1.029 para la compra en la pizarra oficial.
El Gobierno publicó este lunes el decreto con el detalle de la baja temporal de retenciones para los principales productos que exporta el campo. Se trata de una medida que fue anunciada oficialmente el jueves y que causó sorpresa porque dos días antes el ministro de Economía, Luis Caputo, había afirmado que aún no estaban dadas las condiciones para implementarla.
La normativa, firmada por Javier Milei, Guillermo Francos y Luis Caputo, fue incluida en la última edición del Boletín Oficial con el número 38/2025.Seguir leyendo
La producción industrial cerró el 2024 con una caída del 6,2% respecto de 2023, aunque con una suba del 4,5% en diciembre contra el mismo mes del año anterior. Así lo indico el Estudio Orlando Ferreres en la presentación de su último IPI-OJF, en el que se reflejó un crecimiento del cuarto trimestre del 1,92% en relación con el tercero.
El informe señala que las comparaciones con noviembre y el trimestre previo estarían mostrando un repunte que permite prever que en este año ""se afiance la recuperación de la industria, principalmente de la mano de la mejora que esperamos para el consumo privado, apoyado por un contexto macroeconómico más ordenado"".Seguir leyendo
El día después del anuncio de la baja de las retenciones al agro, los dólares financieros mostraron caídas marcadas, en torno al 2%. También las acciones se movieron a la baja, lo que llevó al índice Merval a retroceder 2,2%.
En los últimos días las acciones se venían sosteniendo mejor que los bonos, que acumularon más de una semana de pérdidas. Pero en esta rueda abrieron a la baja, con una caída al comienzo de la jornada del 3% que pasado el mediodía se extendió al 5,7% para luego reacomodarse en 2,5%. En la versión en dólares el índice de la bolsa porteña perdió 0,1%, aunque en lo que va de enero muestra una mejora de 3,4%.Seguir leyendo
Tras un descenso de 15 pesos en la última rueda de la semana, el billete terminó negociándose a $1.225 para la venta en el mercado informal porteño.
Newsletter Clarín
Recibí en tu email todas las noticias, coberturas, historias y análisis de la mano de nuestros periodistas especializados",https://www.clarin.com/economia/dolar-hoy-dolar-blue-hoy-vivo-cotiza-precio-lunes-27-enero-minuto-minuto_0_tVvVJL3ek8.html
Clarín,2025-01-27,Euro hoy: a cuánto cotiza este lunes 27 de enero,"Eleurocotiza estelunes 27 de eneroa $1.028,58 para la compra y $1.029,77 para la venta, por lo que se mantiene estable respecto a la última cotización.
En cuanto a la divisa en el mercado paralelo, eleuro blue hoycotiza a 1261.88 para la compra y 1282.82 para la venta. De este modo, su precio sube en relación al último informado.
Con estos valores, labrechaentre el euro blue y el euro oficial​ es de 122651%.
Elvalor del euro bluetiene una diferencia sustancial más alta con el euro oficial ya que este último es el que se adquiere en los bancos y que posee una cotización establecida.
Al igual que el dólar blue, eleuro bluees el que circula en el mercado negro y suele tener un valor más alto que el oficial. Una explicación sobre su denominación señala que se llama así porque en inglés, ""blue"", además de nombrar al color azul, remite a algo ""oscuro"". De esta manera, se reconoce al cambio de la divisa por fuera del sistema cambiario.
El término euro blue se empezó a utilizar a partir del 2011, como consecuencia de lasrestriccionespara la adquisición de moneda extranjera que comenzaron a aplicar la Administración Federal de Ingresos Públicos (AFIP) y el Banco Central de la República Argentina bajo el gobierno de Cristina Fernández de Kirchner.
Estaslimitacionescobraron un nuevo impulso en diciembre de 2019, luego de los anuncios de presidente Alberto Fernández sobre la Ley de Emergencia económica y que se profundizaron a lo largo del 2020 con el cepo cambiario. Esto genera que los sectores que viajen al exterior opten por la compra de euros en elmercado negro, generando así un aumento en el precio del euro blue.
El nombre del Euro paralelo
El euro se lanzó el 1° de enero de 1999, cuando 10 países fijaron sus tipos de cambio y entregaron las decisiones sobre las tasas de interés al recién creado Banco Central Europeo. Los billetes y monedas de euro entraron en circulación tres años después.
La moneda compartida se vio como una solución a las constantes disputas por los tipos de cambio que habían marcado la política europea después de la Segunda Guerra Mundial y como una extensión lógica de la zona de libre comercio de aranceles de la Unión Europea. Gran Bretaña, en particular, optó por no participar, pero 19 de los 27 países de la UE utilizan el euro como moneda nacional. Quienes componen la zona del euro, también denominada ""eurozona"" son:AustriaBélgicaChipreEstoniaFinlandiaFranciaAlemaniaGreciaIrlandaItaliaLetoniaLituaniaLuxemburgoMaltaPaíses BajosPortugalEslovaquiaEsloveniaEspaña
Newsletter Clarín
Recibí en tu email todas las noticias, coberturas, historias y análisis de la mano de nuestros periodistas especializados",https://www.clarin.com/economia/euro-hoy-cotiza-lunes-27-enero_0_7H5JkGlFFp.html
Clarín,2025-01-27,Dólar blue hoy: a cuánto cotiza este lunes 27 de enero,"La cotización deldólar bluees de $1205 para la compra y de $1225 para la venta, estelunes 27 de enero de 2025.
En lo que va de enero de 2025, el dólar blue sube respecto al mes anterior: la diferencia es de 1%.
En lo que va de este 2025, el dólar blue sube respecto al 2024: la diferencia es de 0.42%.
El valor del dólar blue tiene una diferencia sustancial con el dólar oficial, que se adquiere en los bancos y que posee una cotización establecida. La brecha entre el dólar oficial y el dólar blue es de 17%.
Eldólar bluees el que circula en el mercado negro y suele tener un valor más alto que el oficial. Este dólar no se compra en bancos o casas de cambio oficiales.
La cotización del dólar blue cierra junto con la del dólar oficial: a las 15 horas, de lunes a viernes.
Una explicación sobre su denominación señala que se llama así porque ""blue"", en inglés, además de nombrar al color azul, remite a algo ""oscuro"". Otra teoría lo relaciona con las operaciones de compra a través de bonos o acciones de compañías conocidas como""blue chips"". Y también se lo vincula con el color aproximado que aparece cuando se aplica un fibrón para detectar billetes falsos.
La cotización deldólar oficiales de $1029 para la compra y de $1069 para la venta, este lunes 27 de enero de 2025, según el Banco Nación.
La cotización deldólar bolsaes de $1153,40 para la compra y de $1157,70 para la venta, este lunes 27 de enero de 2025.
La cotización deldólar CCLes de $1163,80 para la compra y de $1168,20 para la venta, este lunes 27 de enero de 2025.
Newsletter Clarín
Recibí en tu email todas las noticias, coberturas, historias y análisis de la mano de nuestros periodistas especializados",https://www.clarin.com/economia/dolar-blue-hoy-cotiza-lunes-27-enero_0_lBX0yFCLMj.html
Clarín,2025-01-27,Baja de las retenciones al campo: la condición clave que puso el Gobierno para acceder,"El Gobierno publicó este lunes el decreto con el detalle de labaja temporal de retencionespara losprincipales productos que exporta el campo. Se trata de una medida que fue anunciada oficialmente el jueves y que causó sorpresa porque dos días antes el ministro de Economía, Luis Caputo, había afirmado que aún no estaban dadas las condiciones para implementarla.
El Decreto 38/2025, que lleva las firmas de Javier Milei, Guillermo Francos y Luis Caputo, pone una condición sustancial para que el campo pueda acceder al alivio, que se extiende hasta el 30 de junio,hay que liquidar el 95% de lo que se declaró en 15 días hábiles.Hasta la entrada en vigencia de la decisión anunciada el jueves pasado, la liquidación del 100% era a 30 días.
“Uno de losobjetivos de la gestión es potenciar la inserción internacional de la Argentina,acompañada de un incremento de las exportaciones agroindustriales que hoy representan más del 60% del total exportado por el país y que en el año 2024 han mostrado una performance positiva con un crecimiento en valor superior al 25% respecto del año anterior”, dice la norma.
El otro motivo importante esacelerar el ingreso de divisas que permitirá más compras del Banco Central para fortalecer las reservas, clave para el escenario de calma cambiaria que busca extender el Gobierno este año, y uno de los detalles más importantes sobre el acuerdo con el Fondo.
""Los sujetos que exporten las mercaderías que se encuentren comprendidas en las previsiones de la Ley N° 21.453 y sus modificacionespodrán acceder a la alícuota establecidaen los términos del párrafo precedente en la medida que, adhiriendo a dicho beneficio a través de los mecanismos que a tal efecto establezca la AGENCIA DE RECAUDACIÓN Y CONTROL ADUANERO (ARCA),liquiden al menos el NOVENTA Y CINCO POR CIENTO (95 %) de las divisasrespecto de esas mercaderías en un plazo comprendido entre la entrada en vigencia de la presente medida yhasta QUINCE (15) días hábiles de efectuada la Declaración Jurada de Venta al Exterior (DJVE)correspondiente, ya sea por cobros de exportaciones, anticipos de liquidación y/o supuestos de prefinanciación y/o postfinanciación externa"", detalla la medida.
Según consta en ese texto, las nuevas alícuotas de pago de retencionesentran en vigencia este lunese impactarán, almenos, hasta el 30 de junio, en los principales cultivos como lasoja(poroto), que pasará del 33 al 26% y sus derivados que bajarán del 31 al 24,5%.
También se reducirán los derechos para la exportación para eltrigo(12 a 9,5%), lacebada(12 a 9,5%), elmaíz(12 a 9,5%), el girasol (7 a 5,5%) y elsorgo(12 a 9,5%).
Para laseconomías regionales, las retenciones serán llevadas a cerode forma permanente para productos como azúcar, algodón, cuero bovino, tabaco, foresto industria y arroz.
En específico, se estableció que “los sujetos que exporten las mercaderías que se encuentren comprendidas en las previsiones de la Ley N° 21.453 y sus modificaciones” deberánliquidar “al menos el 95% de las divisas respecto de esas mercaderías” en un plazo de “hasta quince días hábilesde efectuada la Declaración Jurada de Venta al Exterior (DJVE) correspondiente”.
Además, se apuntó que “vencido el plazo al que se refiere el primer párrafo de este artículo o de no cumplimentarse lo previsto en el párrafo anterior, deberá tributarse la alícuota del derecho de exportación que corresponda a la posición arancelaria de que se trate, vigente el día anterior al de la entrada en vigencia de la presente medida”.
La Agencia de Recaudación y Control Aduanero (ARCA) y el Banco Central se encargarán de supervisar los plazos de liquidación.
El jueves por la tarde, Caputo y el vocero presidencial Manuel Adorni aseguraron que elsuperávit fiscal daba margen para aplicar esta baja de retencionesde inmediato.
Con esta decisión, el Gobierno busca atender las demandas del campo, que venía reclamando fuerte a través de sus dirigentes y también con los gobernadores de tres de las cuatro principales provincias del sector que se aplicara la baja.
En paralelo, existe también la necesidad por parte del Ejecutivo de estimular la liquidación de divisas en un contexto en el que la administración necesita dólares para aumentar las reservas y mantener vigente su política cambiaria.
“Queremos darle una señal al campo, que tanto apoya al país, y explicarles que estamos pendientes de su situación. Estas medidas vienen a avalar las promesas presidenciales”, afirmó Caputo.
Desde el campo consideraron que esta no debe ser una medida transitoria. “Este impuesto ha sido históricamente un freno para el desarrollo del sector productivo. No es sostenible pedirle al productor que pague impuestos cuando ni siquiera logra cubrir los costos de producción"", advirtieron los presidentes de CRA, Coninagro, Federación Agraria y Sociedad Rural.
ES/SN
Newsletter Clarín
Recibí en tu email todas las noticias, coberturas, historias y análisis de la mano de nuestros periodistas especializados",https://www.clarin.com/economia/publican-decreto-detalle-baja-retenciones-campo_0_p4rfxFJCHQ.html
Clarín,2025-01-27,"Por la baja de las retenciones, esperan que el BCRA vuelva a comprar dólares para las reservas","Aunque el año comenzó en unclima de aparente calma en el frente cambiario,en las últimas ruedas se encendieron algunasluces amarillas en el mercado.Los operadores de la City detectaron primero, y el Banco Central confirmó después, una creciente presencia oficial en el mercado de bonospara contener la brecha; y el organismocortó su racha positiva por sus intervenciones en el segmento mayorista y vendió más de US$ 120 millones en las últimas cuatro ruedas.
Sin embargo, la decisión del Ministerio de Economía de avanzar conuna baja temporal de las retenciones al agroy la expectativa por un próximo acuerdo con el Fondo podrían servir paraacelerar las compras del Central y fortalecer las reservas, clave para el escenario de calma cambiaria que busca extender el Gobierno este año.
El organismo que preside Santiago Bausulihabia logrado acumular más de US$ 1.500 millones en la primera quincena de enero,pero a partir de la semana pasada no consiguió extender esa tendencia.
El economista Fernando Marull, de FM y Asociados, explicó que las ventas de los últimos días ""se debieron a lasmayores expectativas de devaluación (a su vez producto de los rumores de un nuevo acuerdo con el FMI y de las especulaciones en torno al lanzamiento del canje),que frenaron la liquidación del agro (U$S 70 millones diarios en promedio, versus U$S 100 millones la semana pasada) y el otorgamiento de préstamos en dólares, dos de los factores que venían explicando las compras elevadas del BCRA; también subieron los pagos de importaciones"".
En total, desde que empezó el año,el Central acumula compras por US$ 1.398 millones.Marull anticipó: ""Estos ruidos son transitorios y el BCRA volverá a comprar en los próximos días"". La tesis de Marull es compartida por otros analistas de la City, que ven en la jugada de Caputo de bajar las retencionesmucho más que un guiño al campo: sino la posibilidad de garantizar la continuidad delstatuo quoen el mercado cambiario mientras se cierra un nuevo acuerdo con el Fondo.
La quita de retenciones se transforma en unamejora del tipo de cambio final para los exportadores,que podría en parte contrarrestrar los efectos de una pequeña tormenta perfecta que comenzaba a gestarse en el frente agrícola. ""La baja de retenciones es una forma de mejorar el tipo de cambio del agroexportador. Esta mejora del tipo de cambiosumada a la capacidad prestable en dólares del sistema financiero y el eventual carry de tasa en pesos deberían contribuir a mejorar el ingreso de divisas"",adelantó Pablo Repetto de Aurum Valores.
""Esta medida equivale a un ajuste cambiario para el sector,mejorando la competitividad, y en el caso de los productos principales, cuyo carácter es temporal hasta junio, busca evitar un posible acopio anticipado antes de las elecciones, ante la expectativa de un ajuste del tipo de cambio. En medio de las negociaciones con el FMI, esto demuestra que elgobierno está tomando todas las medidas posibles para evitar presiones cambiarias, al menos hasta las elecciones"",dijo Alejo Costa, de Max Capital.
En esa misma línea, en PPI señalaron: ""Tal como ocurrió con los diversos Programas de Incremento Exportador, esperamos que la suba del tipo de cambio efectivo tenga un traslado a precios en el mercado local, aunque resta dilucidar en qué grado. Igualmente, esto serviría para mejorar los márgenes de los productores, que en muchas zonas estaban quedando en “cero” o negativo antes de implementarse la medida. En base a fuentes del sector, los márgenes para los productores de soja aumentarían en 10,9%, mientras que los del maíz y trigo en 3%""
""Consideramos quelos productores tendrían más incentivos a vender sus stocks a los exportadores, lo que redundaría en una aceleración de la liquidación.Vale recalcar que este efecto se monta sobre el ya existente carry de los exportadores (tasa de devaluación de 1% mensual a partir de febrero versus tasas en pesos de 2,6/2,8% en la parte corta de la curva de tasa fija y de 2,2% en la parte larga). La combinación de ambos efectos redundaría en unafuerte suba de la oferta en el MULC que, a su vez, permitiría una aceleración de las compras del BCRA"", explicaron en PPI.
El viernes ya se vieron los primeros efectos de esta medida, cuando los tipos de cambio financieros bajaron 2% en el caso del CCL y 1% en el del dólar MEP.  Los operadores se anticipan a una mayor oferta en el CCL si aumenta la liquidación del agro y se sostiene la dinámica del dólar blend, que permite liquidar el 20% de las exportaciones vía contado con liqui.
Una menor presión en el dólar financiero también podría ayudar a los bonos en dólares y la percepción de riesgo de los inversores. En Aurum Valores señalaron: ""Hemos visto que la dinámica de reservas impacta en el riesgo país. Con una caída deUS$ 1.200 millonesen dos semanas no debe extrañar la suba desde los 580 puntos del 10/01 a los 631 con los que cerró el viernes"".
Redactora de la sección Economía/Pyme.apedotti@clarin.com
Newsletter Clarín
Recibí en tu email todas las noticias, coberturas, historias y análisis de la mano de nuestros periodistas especializados",https://www.clarin.com/economia/baja-retenciones-esperan-bcra-vuelva-comprar-dolares-reservas_0_7SgWZWK2ff.html
