diario,fecha,titulo noticia,contenido,link
Clarín,2025-01-27,Impuesto a las Ganancias: cuánto pagarán los empleados desde este mes,"Los trabajadoressolteros sin hijos en relación de dependencia pagarán Ganancias si ganan más de $ 2.280.557 de sueldo brutoo más de$ 1.892.862 de sueldo neto o en mano(o sea, sueldo bruto menos descuentos 17% por jubilación y Salud con el tope de base imponible de enero de 2025).
Con 2 hijos y sin cónyuge, esos pisos son de $ 2.654.060 bruto y neto de $ 2.202.870.Y casado con 2 hijos, son de $ 3.005.029 (bruto) y $ 2.510.231(neto).
Los cálculos son del especialista Sebastian Domínguez, CEO de SDC Asesores Tributarios, en base a las tablas publicadas por ARCA ( ex-AFIP) para el primer semestre de 2025. Por encima de esos valores, las alícuotas del impuesto van del 5% al 35%.
En tanto, los empleados alcanzarán la alícuota del 35% cuando las remuneraciones de los empleados superen aproximadamente los siguientes valores:
“En años anteriores, con los esquemas de liquidación vigentes, los empleados que superaban el piso del impuesto a las ganancias rápidamente comenzaban a tributar en la escala del 35%”, dice Dominguez. Pero en 2021 se fijó un piso salarial superior al mínimo no imponible, que se fue ajustando hasta el equivalente a 15 SMVM ( salario mínimo, vital y móvil): hoy en torno de los $ 4.300.000. En consecuencia, menos empleados pagaban ganancias, y los que superaban ese piso pagaban más.
Ahora,más empleados quedan alcanzados por Ganancias y ""para que una parte del sueldo quede alcanzada por la alícuota del 35%,se requiere una remuneración significativamente más alta""..
Si convertimos esos valores a un Dólar MEP de $ 1.170, los sueldos netos aproximados para tributar al 35% serían, según los cálculos de Dominguez.
Es fundamental que los empleados informen en el Formulario F572Web, a través del servicio Siradig Trabajador, las cargas de familia para el Período Fiscal 2025 como también todas las deducciones que los pueden beneficiar para reducir al máximo el impuesto a las ganancias, advierte Dominguez..
Las deducciones son importes que disminuyen la base imponible sobre la cual se calculará el impuesto a pagar. Son otorgados mediante ley y tienen un valor o tope determinado. Entre las deducciones de Ganancias permitidas están: alquileres con porcentajes diferentes para propietarios o inquilinos ,gastos por educación (por las cargas de familia o por hijos mayores de edad, hasta 24 años), Salud: (por pagos a medicina prepaga o aportes complementarios a obras sociales, incluida carga de familia. El importe a deducir por dichos conceptos no podrá superar el 5% de la ganancia neta del ejercicio acumulada).
En relación al año pasado,el piso salarial sube un 11,78% correspondiente a la inflación de septiembre a diciembre 2024.Con la inflación del segundo semestre 2024, el ajuste debería hacer sido del 21,1%
Si bien la ley 27.743 fijó que el Impuesto a las Ganancias se actualiza 2 veces por año, en enero y julio, según la inflación del semestre calendario, a traves del decreto 652/2024 fijó que la actualización de Ganancias de enero de 2025 “se realizará, excepcionalmente, tomando en consideración el coeficiente que surja de la variación del indicado índice, correspondiente a los meses de septiembre a diciembre de 2024, inclusive”.
SN
Redactor de la sección Economíaibermudez@clarin.com
Newsletter Clarín
Recibí en tu email todas las noticias, coberturas, historias y análisis de la mano de nuestros periodistas especializados",https://www.clarin.com/economia/impuesto-ganancias-pagaran-empleados-mes_0_ShCUIxrYGz.html
Clarín,2025-01-27,"Cautela en el mercado de granos, a la espera de más precisiones sobre las nuevas retenciones","Los operadores del mercado de granos todavía dudan sobre cómo funcionará el nuevo esquema de retenciones, que fue anunciado el jueves y este lunes se publicó como decreto 38/2025 en el Boletín Oficial.
Si bien los trazos gruesos de la medida fueron ratificados, como la reducción de alícuotas en un 20% para los 6 granos principales hasta el 30 de junio y la eliminación definitiva del tributo para otras economías regionales, advierten que a la normativa le faltarían “detalles de reglamentación”.
Las dudas de los operadores son una cara de la misma moneda que deja sin certezas oportunas al periodismo, para que pueda comunicarse fehacientemente la nueva situación, de manera que el Gobierno puedan empezar a obtener las divisas lo antes posible. En la Secretaría de Agricultura hay personal de vacaciones y no fue posible comunicarse con algún vocero oficial ante las consultas de Clarín.
Se espera que esta semana se avance en reuniones del Banco Central, la Agencia de Recaudación y Control Aduanero (ARCA) y representantes de Economía y Agricultura con el sector agroindustrial.
En ese contexto, el nuevo titular de ARCA, Juan Pazo, que hasta diciembre fue el principal interlocutor del Gobierno con el campo, desde su entonces rol como Secretario de Producción, se reuniría este miércoles con la Mesa de Enlace, con el objetivo de aceitar convencimientos de manera que los productores vendan lo granos que todavía tienen de la cosecha anterior.
Mientras tanto, “habrá que esperar a que eso suceda para poder evaluar e iniciar el régimen en términos prácticos”, dicen los representantes de la actividad agroindustrial, principal fuente de dólares de la economía argentina, y por estos días el sector que miran el (Fondo Monetario Internacional (FMI) y el gobierno en sus negociaciones sobre reservas y el eventual levantamiento del cepo cambiario.
El decreto 38/2025 con la baja temporal de retenciones para los principales productos que exporta el campo fue firmado por Javier Milei, Guillermo Francos y Luis Caputo. En la normativa se indica que las nuevas alícuotas de pago de retenciones entran en vigencia este lunes e impactarán, al menos, hasta el 30 de junio, en los principales cultivos como la soja, que si se exporta como grano pasará del 33 al 26% y en el caso de los embarques de sus derivados, harina, aceite y biodiesel, bajarán del 31 al 24,5%.
También se redujeron los derechos para la exportación para el trigo (12 a 9,5%), la cebada (12 a 9,5%), el maíz (12 a 9,5%), el girasol (7 a 5,5%) y el sorgo (12 a 9,5%).
Para las economías regionales, las retenciones quedaron en cero de forma permanente. Incluye a productos como azúcar, algodón, cuero bovino, tabaco, foresto industria y arroz.
Entre los aspectos que los operadores privados esperan precisar más, se estableció que “los sujetos que exporten las mercaderías que se encuentren comprendidas en las previsiones de la Ley N° 21.453 y sus modificaciones” deberán liquidar “al menos el 95% de las divisas respecto de esas mercaderías” en un plazo de “hasta quince días hábiles de efectuada la Declaración Jurada de Venta al Exterior (DJVE) correspondiente”. Hasta ahora el plazo era de 30 días, y al acortamiento a la mitad del tiempo se compensaría con el 5% remanente que no quedaría como obligatorio.
En la normativa se advierte que si no se cumplen las nuevas exigencias, “deberá tributarse la alícuota del derecho de exportación que corresponda a la posición arancelaria de que se trate; o sea, por ejemplo en el caso de la soja en grano la retención volvería a ser del 33%.
En ese sentido, el decreto estableció que “la Agencia de Recaudación y Control Aduanero (ARCA) y el Banco Central se encargarán de supervisar los plazos de liquidación”. Esos aspectos, como también la posibilidad de liquidar con las retenciones más bajas a las importaciones temporarias de soja de otros países (la más común es la paraguaya) son los aspectos que los privados esperan coordinar con mayores detalles con los equipos del secretario de Comercio, Pablo Lavigne, de Pazo, y de Santiago Bausili, titular del BCRA.
Editor jefe de Clarín Ruralmbartoli@clarin.com
Newsletter Clarín
Recibí en tu email todas las noticias, coberturas, historias y análisis de la mano de nuestros periodistas especializados",https://www.clarin.com/rural/cautela-mercado-granos-espera-precisiones-nuevas-retenciones_0_Tl4xd13YUQ.html
Clarín,2025-01-27,Dólar hoy: a cuánto cotizan el oficial y sus diferentes tipos de cambio este lunes 27 de enero,"Eldólar oficialcotiza estelunes 27 de eneroa $1029 para la compra y $1069 para la venta en las entidades bancarias.
En cuanto aldólar blue, esta jornada cotiza a $1205 para la compra y $1225 para la venta. Así, marca una brecha de 17% con respecto al dólar oficial. Elvalor del dólar bluetiene una diferencia sustancial con el dólar oficial, que se adquiere en los bancos y que posee una cotización establecida.
Por otro lado, eldólar turista(también conocido comodólar solidario) cotiza a $1389,70. Este valor es el que se utiliza al momento de comprar dólar para ahorro o de realizar transacciones en el exterior y surge de la suma de un 30% al valor del dólar oficial del día.
Otro de los tipos de cambio es eldólar mayorista, el cual inicia el día a $1200 para la compra y $1202,10 para la venta.
En relación alContado con liqui(CCL), el precio de referencia es de $1163,80. El CCL es la operatoria que permite a las empresas comprar papeles argentinos en el mercado local y venderlos en el exterior para lograr así girar divisas para ""atesoramiento"".
Hoy en Argentina conviven al menos seis tipos de cotizaciones distintas para la moneda estadounidense, algunas más usadas que otras.
Dólar ahorro/tarjeta o dólar turista/solidario: tiene el recargo del 30% dispuesto por el Gobierno sobre las compras realizadas con tarjeta en moneda extranjera y sobre la adquisición de divisas para atesoramiento dentro del circuito oficial.
Dólar blue: es el billete que se vende en el mercado informal, a través de cuevas o “arbolitos” en la calle.
Contado con Liqui: es una operación legal para conseguir dólares en el exterior. Se convirtió en el camino preferido de las empresas. Se compran títulos o acciones argentinas en pesos y luego se venden en el exterior en dólares.
Dólar oficial o minorista: es el precio al que pueden acceder los particulares pero siempre dentro del cerco de US$200 establecido por el cepo.
Dólar mayorista: es el que se usa para el comercio exterior, el pago de deudas dolarizadas y de dividendos. Teóricamente es el que incide en la fijación de los precios de los productos importados.
Dólar para industria y servicios: por el efecto de las retenciones, los exportadores de manufacturas y de servicios reciben en realidad un dólar a un valor más bajo que el oficial, y mucho más bajo que el blue. Dentro de esta categoría, hay distintos valores para quienes exportan carne y lácteos, para trigo, maíz y girasol y para la soja.
Newsletter Clarín
Recibí en tu email todas las noticias, coberturas, historias y análisis de la mano de nuestros periodistas especializados",https://www.clarin.com/economia/dolar-hoy-cotizan-oficial-diferentes-tipos-cambio-lunes-27-enero_0_ExVxL8hMUk.html
Clarín,2025-01-27,Terremoto en Wall Street: se desploman las acciones tecnológicas y arrastran al Merval,"Una empresa china irrumpió en el hiper competitivo mundo de la Inteligencia Artificial ydesató un terremoto en Wall Street. Este lunes, en las horas previas a la apertura formal de las operaciones en la Bolsa de Nueva York, las acciones deNvidia, hasta el viernes la empresa de mayor valor de mercado del mundo,se desplomaba cerca del 14%.Esto significa que la firma, que estaba valorizada en 3,5 billones de dólares,hoy vale casi 490.000 millones de dólares menos.Todo en cuestión de minutos.
Pasado el mediodía, el papel de Nvidia se hundía más de 17,5% y arrastraba a todo el tecnológico Nasdaq que llegaba a caer 3,2%. En sintonía, el S&P 500 perdía 1,9%; mientras que el industrial Dow Jones cedía 0,1%.
Con este mal clima global, el Merval no consigue levantar cabeza y caía más de 4% pasado el mediodía.
La explicación de este terremoto hay que buscarla en la start up china de inteligencia artificialDeep Seek.Se dice que esta empresa desarrolló una aplicación de IA a un costo ínfimo en comparación con los miles de millones de dólares que vienen invirtiendo compañías comoNvidia, Meta, Google.
Su potente irrupción, que la ha convertido en la aplicación gratuita más descargada por los iPhone en Estados Unidos y otros países, por delante de ChatGPT. Es un sacudón para el mundo tech. Deep Seek necesita de chips menos potentes para funcionar, lo cual pone en entredicho el modelo de negocio de Nvidia.
La gran liquidación de acciones de Nvidia y otras empresas del sector tecnológico se produjo cuando Silicon Valley elogió el nuevo modelo R1 de la compañía china DeepSeek , que parece funcionar a un nivel similar al de rivales como ChatGPT de OpenAI,aunque aparentemente se desarrolló a una fracción del costo.
DeepSeek afirmó que había gastado solo 5,6 millones de dólares en entrenar a R1. Aunque esa cifra principal excluye los gastos de investigación y desarrollo, es insignificante en comparación con las decenas de miles de millones de dólares que las grandes empresas tecnológicas estadounidenses están invirtiendo en desarrollar sus propios modelos de IA.
El hecho de que DeepSeek esté desarrollando su chatbot a bajo preciopone en duda que las ganancias de Nvidia sigan aumentando a un ritmo tan rápido. Las acciones de la compañía se han disparado más del 900% desde finales de octubre de 2022, impulsadas por la altísima demanda de sus chips en medio de un auge del gasto en inteligencia artificial.
Nvidia fabrica chips que se usan en centros de datos y el desarrollo de chatbots como ChatGPT. Su CEO, Jensen Huang –de 61 años y la undécima fortuna personal más grande del mundo, según Forbes, con una fortuna de US$ 117.000 millones– definió semanas atrás al fenómeno como “el comienzo de una nueva revolución industrial” y anticipó que “es el primer año de un ciclo de una década de difusión de esta tecnología en todas las industrias”. “Nadie fabricó nunca super ordenadores en serie”, señaló en relación a su oferta de chips que se usan también para gaming –el puntapié de la firma– y autos autónomos como los de Tesla.
El boom de la inteligencia artificial empujó a la compañía con sede en Santa Clara, California, a pasar los 3 billones de valuación en el mercado y convertirse en la más valiosa del mercado, por encima de Apple y Microsoft. Y, sin embargo, pocos tienen claro por qué una empresa que se fundó en 1993 y se dedicó principalmente al mercado de los videojuegos y los gráficos en 3D, integra ahora el selecto grupo de Microsoft, Amazon, Apple y Alphabet (Google). Y por qué muchos estiman que podría incluso llegar a pasarlas.
“Nvidia empieza como un fabricante más de placas 3D para computadoras.A mediados de los 90, el 3D estaba súper de moda, recién empezaba. De hecho, no era muy bueno lo que había ahí en cuanto a placas comerciales. Pero de a poco fueron mejorando con el tiempo y, en ese sentido, Nvidia le pasó el trapo a todas, incluso 3DFX que era la que hacía una de las más populares en cuanto al retail, las Voodoo”, explica a Clarín Nicolás Wolovick, Doctor en Ciencias de la Computación por la Universidad Nacional de Córdoba.
“Todos los jueguitos de gráficos 3D están calculando números de punto flotante.Esto implica un montón de cálculos muy específicos que ocurren de una forma muy, pero muy rápida. La gente del rubro empezó a mirar con mucho cariño a las placas de video porque podían realizar mucho cómputo a un precio relativamente bajo. Ahí empieza, a principios de 2002, una historia interesante: esas placas comenzaron a tener mucho poder de cómputo no sólo en el ámbito de hacer gráficos 3D”, complementa.
DeepSeek, respaldada por la firma cuantitativa china High-Flyer, lanzó la semana pasada su modelo de lenguaje R1 (LLM) como código abierto. Además, publicó un informe técnico que sostiene que los sistemas avanzados de IA pueden desarrollarse con presupuestos significativamente más bajos.
Lo que destaca es la capacidad de DeepSeek para obtener resultados competitivos con menos recursos financieros y tecnológicos en comparación con líderes del sector como OpenAI, Meta Platforms, Microsoft y Alphabet.
Durante el fin de semana, el modelo R1 de DeepSeek se volvió viral en redes sociales, generando reacciones de varios expertos en tecnología.Estas son algunas de las opiniones destacadas:
El inversor multimillonario Chamath Palihapitiya comentó en X y destacó un informe escrito por Jeffrey Emanuel, fundador de un optimizador de transcripciones de YouTube. Palihapitiya señaló una parte del informe que detalla cómo DeepSeekresolvió esencialmente uno de los desafíos más importantes de la IA: el razonamiento paso a paso sin grandes conjuntos de datos.
Alexandr Wang, CEO de Scale AI y el multimillonario más joven del mundo con 28 años, también escribió en X: “DeepSeek es una llamada de atención para Estados Unidos”.
Wang afirmó que Estados Unidos debe centrarse en innovar y acelerar el progreso, mientras refuerza los controles de exportación de chips para mantener su liderazgo.
El ingeniero de IA Shubham Sahoo destacó que el modelo R1 deDeepSeek es de código abierto y un 96,4% más asequible que el modelo o1 de OpenAI, ofreciendo un rendimiento comparable.
Aravind Srinivas, CEO de Perplexity, felicitó a DeepSeek por alcanzar el puesto 1 en la App Store. “Por un tiempo, no estaba claro quién superaría a ChatGPT por primera vez.Lo mejor que logramos fue el puesto 8, hace un año”, publicó en X.
Con información de Market Watch y Yahoo Finance.
Editor jefe de la sección Economía.gbazzan@clarin.com
Newsletter Clarín
Recibí en tu email todas las noticias, coberturas, historias y análisis de la mano de nuestros periodistas especializados",https://www.clarin.com/economia/terremoto-wall-street-irrupcion-start-up-china-provoca-desplome-acciones-tecnologicas_0_jz3JG5e0FQ.html
Clarín,2025-01-27,Dólar CCL hoy: a cuánto cotiza este lunes 27 de enero,"La cotización deldólar CCLes de$1163,80para la compra y de$1168,20para la venta, este lunes 27 de enero de 2025.
El dólar CCL baja2%respecto al mismo día de la semana anterior.
En lo que va de enero de 2025, el dólar CCL sube respecto al mes anterior: la diferencia es de0%.
En comparación con el año pasado, el dólar CCL baja un3%. A esta altura del año anterior, el CCL cotizaba a$1202.1.
El valor deldólar CCLtiene una diferencia con eldólar MEP. Mientras que el primero está$1163,80, el MEP cotiza hoy a$1153,40, lo que marca una brecha de3%.
Eldólar CCL o dólar contado con liquidaciónes uno de los tipos de cambio financieros más usados en el país, junto con el dólar MEP (o dólar bolsa). Se trata de una herramienta financiera que permite cambiar pesos por dólares en el exterior. Muchas empresas e inversionistas usan este método para adquirir divisas y sacarlas del país legalmente.
Eldólar CCL o dólar contado con liquidaciónconsiste en la compra de un bono en pesos (AL30) o en dólares (AL30D) para venderlo en especie C (AL30C). Mediante estas 2 simples operaciones podés ingresar dinero a cuentas de inversión en Estados Unidos.
La cotización del dólar CCL funciona en el mismo horario del mercado de cotizaciones:hasta las 16:30 horas, de lunes a viernes.
Estas operaciones reciben el nombre de “operaciones de liquidación con cable”. Para identificarlas se agrega una C al final del código de negociación de la especie. Así se diferencian de aquellas que se liquidan en pesos o dólares en cuentas radicadas en el mercado local.
Newsletter Clarín
Recibí en tu email todas las noticias, coberturas, historias y análisis de la mano de nuestros periodistas especializados",https://www.clarin.com/economia/dolar-ccl-hoy-cotiza-lunes-27-enero_0_2pc1uxy3js.html
Clarín,2025-01-27,Dólar tarjeta hoy: a cuánto cotiza este lunes 27 de enero,"La cotización deldólar tarjetaes de$1389,70, este lunes 27 de enero de 2025.
El dólar tarjeta sube0%respecto al mismo día de la semana anterior.
En lo que va de enero de 2025, el dólar tarjeta sube respecto al mes anterior: la diferencia es de14%.
En comparación con el año pasado, el dólar tarjeta sube un3%. A esta altura del año anterior, el dólar tarjeta cotizaba a$1348.4.
El valor deldólar tarjetatiene una diferencia con eldólar blue. Mientras que el primero está$1389,70, el blue cotiza hoy a$1205, lo que marca una brecha de15%.
Eldólar tarjetaes el tipo de cambio que se emplea para el pago de consumos con tarjeta de débito y crédito en el exterior así como para la compra, también en dólares, de pasajes y paquetes turísticos hacia destinos fuera de la Argentina.
El valor deldólar tarjetase conforma de la siguiente manera: al dólar oficial se le añade un 30% de impuesto país y un 30% de ganancias. Se trata de una carga impositiva total del 60%, frente al 155% que existía en la gestión anterior.
La cotización del dólar tarjeta funciona en el mismo horario del mercado de cotizaciones:hasta las 16:30 horas, de lunes a viernes.
Newsletter Clarín
Recibí en tu email todas las noticias, coberturas, historias y análisis de la mano de nuestros periodistas especializados",https://www.clarin.com/economia/dolar-tarjeta-hoy-cotiza-lunes-27-enero_0_yUcZ5EKx7s.html
Clarín,2025-01-27,Dólar ahorro hoy: a cuánto cotiza este lunes 27 de enero,"La cotización deldólar ahorroes de$1389,70para la venta este lunes 27 de enero de 2025.
El dólar ahorro sube0%respecto al mismo día de la semana anterior.
En lo que va de enero de 2025, el dólar ahorro sube respecto al mes anterior: la diferencia es de14%.
En comparación con el año pasado, el dólar ahorro sube un3%. A esta altura del año anterior, el ahorro cotizaba a$1348.4.
El valor deldólar ahorrotiene una diferencia con eldólar MEP. Mientras que el primero está$1389,70, el MEP cotiza hoy a$1153,40, lo que marca una brecha de20%.
Eldólar ahorroes un tipo de cambio mayor al dólar oficial, que se muestra como la opción más barata para comprar a modo de atesoramiento.
La compra deldólar ahorrohoy en Argentina se maneja bajo la siguiente cotización: el 30% del impuesto país se mantiene y el 35% del impuesto a las ganancias pasa a ser de un 45%, igualando la cotización del dólar tarjeta.
La cotización del dólar ahorro funciona en el mismo horario del mercado de cotizaciones:hasta las 16:30 horas, de lunes a viernes.
Estas operaciones reciben el nombre de “operaciones de liquidación con cable”. Para identificarlas se agrega una C al final del código de negociación de la especie. Así se diferencian de aquellas que se liquidan en pesos o dólares en cuentas radicadas en el mercado local.
Newsletter Clarín
Recibí en tu email todas las noticias, coberturas, historias y análisis de la mano de nuestros periodistas especializados",https://www.clarin.com/economia/dolar-ahorro-hoy-cotiza-lunes-27-enero_0_c0Sykmyhv4.html
Clarín,2025-01-27,Dólar MEP hoy: a cuánto cotiza este lunes 27 de enero,"La cotización deldólar MEPes de$1153,40para la compra y de$1157,70para la venta, estelunes 27 de enero de 2025.
Eldólar MEPbaja1%respecto al mismo día de la semana anterior.
En lo que va deenero de 2025, el dólar MEPsuberespecto al mes anterior: la diferencia es de14%.
En comparación con el año pasado, el dólar MEPbajaun2.77%. A esta altura del año anterior, el MEP cotizaba a$1186.2.
El valor del dólar MEP tiene una diferencia con el dólar blue. Mientras que el primero está a$1153,40, el blue cotiza hoy a$1205, lo que marca una brecha de4.28%.
Eldólar MEPes un tipo de cambio mayor al dólar oficial, que se muestra como la opción más barata para comprar a modo de atesoramiento.
El dólar MEP consiste en la compra de un bono en pesos y su venta en dólares. Este tipo de cambio se calcula a partir de la división entre el precio en pesos y la cotización en dólares.
La cotización del dólar MEP funciona en el mismo horario del mercado de cotizaciones: hasta las 16:30 horas, de lunes a viernes.
Su nombre deriva de la sigla 'MEP', que significa Mercado Electrónico de Pagos. Es una variante al dólar ahorro, ya que presenta menos restricciones como se mencionó anteriormente.
Newsletter Clarín
Recibí en tu email todas las noticias, coberturas, historias y análisis de la mano de nuestros periodistas especializados",https://www.clarin.com/economia/dolar-mep-hoy-cotiza-lunes-27-enero_0_23HSBr0dnn.html
