diario,fecha,titulo noticia,contenido,link
Clarín,2025-02-12,Dólar CCL hoy: a cuánto cotiza este miércoles 12 de febrero,"La cotización deldólar CCLes de$1190,30para la compra y de$1193,40para la venta, este miércoles 12 de febrero de 2025.
El dólar CCL baja0%respecto al mismo día de la semana anterior.
En lo que va de febrero de 2025, el dólar CCL baja respecto al mes anterior: la diferencia es de2%.
En comparación con el año pasado, el dólar CCL baja un2%. A esta altura del año anterior, el CCL cotizaba a$1215.
El valor deldólar CCLtiene una diferencia con eldólar MEP. Mientras que el primero está$1190,30, el MEP cotiza hoy a$1180,70, lo que marca una brecha de0%.
Eldólar CCL o dólar contado con liquidaciónes uno de los tipos de cambio financieros más usados en el país, junto con el dólar MEP (o dólar bolsa). Se trata de una herramienta financiera que permite cambiar pesos por dólares en el exterior. Muchas empresas e inversionistas usan este método para adquirir divisas y sacarlas del país legalmente.
Eldólar CCL o dólar contado con liquidaciónconsiste en la compra de un bono en pesos (AL30) o en dólares (AL30D) para venderlo en especie C (AL30C). Mediante estas 2 simples operaciones podés ingresar dinero a cuentas de inversión en Estados Unidos.
La cotización del dólar CCL funciona en el mismo horario del mercado de cotizaciones:hasta las 16:30 horas, de lunes a viernes.
Estas operaciones reciben el nombre de “operaciones de liquidación con cable”. Para identificarlas se agrega una C al final del código de negociación de la especie. Así se diferencian de aquellas que se liquidan en pesos o dólares en cuentas radicadas en el mercado local.
Newsletter Clarín
Recibí en tu email todas las noticias, coberturas, historias y análisis de la mano de nuestros periodistas especializados",https://www.clarin.com/economia/dolar-ccl-hoy-cotiza-miercoles-12-febrero_0_X02suAQ6yV.html
Clarín,2025-02-12,Dólar tarjeta hoy: a cuánto cotiza este miércoles 12 de febrero,"La cotización deldólar tarjetaes de$1398,80, este miércoles 12 de febrero de 2025.
El dólar tarjeta sube0%respecto al mismo día de la semana anterior.
En lo que va de febrero de 2025, el dólar tarjeta sube respecto al mes anterior: la diferencia es de2%.
En comparación con el año pasado, el dólar tarjeta sube un3%. A esta altura del año anterior, el dólar tarjeta cotizaba a$1360.
El valor deldólar tarjetatiene una diferencia con eldólar blue. Mientras que el primero está$1398,80, el blue cotiza hoy a$1195, lo que marca una brecha de17%.
Eldólar tarjetaes el tipo de cambio que se emplea para el pago de consumos con tarjeta de débito y crédito en el exterior así como para la compra, también en dólares, de pasajes y paquetes turísticos hacia destinos fuera de la Argentina.
El valor deldólar tarjetase conforma de la siguiente manera: al dólar oficial se le añade un 30% de impuesto país y un 30% de ganancias. Se trata de una carga impositiva total del 60%, frente al 155% que existía en la gestión anterior.
La cotización del dólar tarjeta funciona en el mismo horario del mercado de cotizaciones:hasta las 16:30 horas, de lunes a viernes.
Newsletter Clarín
Recibí en tu email todas las noticias, coberturas, historias y análisis de la mano de nuestros periodistas especializados",https://www.clarin.com/economia/dolar-tarjeta-hoy-cotiza-miercoles-12-febrero_0_TOoGciKTh9.html
Clarín,2025-02-12,"Dólar hoy y dólar blue hoy, EN VIVO: a cuánto cotizó y cuál fue su precio este miércoles 12 de febrero, minuto a minuto","Eldólar bluesubió 5 pesos y cerró estemiércoles 12 de febreroa$ 1.220, luego de sufrir una suba de $10 en la jornada previa. En tanto, eldólar oficialcotizó a$ 1.076,25para la venta en la pizarra del Banco Nación. Seguí todas las instancias de la jornada cambiaria en la cobertura minuto a minuto deClarín.
Este miércoles 12 de febrero, la cotización de la moneda estadounidense para la compra fue de $1.200. Registró una suba de $15 en lo que va de la semana.
El ministro viaja a Sudáfrica el 20 de febrero y se espera otra reunión con el Fondo. A pesar de que en el Congreso advierten un riesgo de judicialización, el Gobierno evalúa tomar deuda con el organismo por decreto.Leer más.
#DataBCRA|#VariablesCambiariasEncontrá la lista de#PrincipalesVariablesen:https://t.co/g9kLlo93Ed#ReservasBCRApic.twitter.com/SN7fHba7AN
Aluar es la empresa más afectada en el país de las que alcanzan los aranceles que impone Donald Trump a las importaciones de acero y aluminio. Se acaba de conocer un comunicado de la firma de la familia Madanes Quintanilla en el que apuesta a que la relación entre EE.UU. y Argentina y el vínculo de ambos presidentes puedan llevar a una solución.
El arancel de 25% implica que la empresa pone en riesgo el 55% de sus exportaciones por US$ 600 millones.Leer más.
La minera canadiense McEwen Copper pidió que su millonario proyecto de cobre Los Azules, ubicado en la provincia de San Juan, sea beneficiado por el Régimen de Incentivos a las Grandes Inversiones (RIGI), puesto en marcha en 2024. Según indicó la empresa, el proyecto implicará una inversión de US$ 2.700 millones.Leer más.
Tras cuatro días de alzas, el índice que elabora JP Morgan muestra una pequeña mejora de la posición argentina.
Con los ojos de los mercados globales puestos en el dato de inflación de Estados Unidos, que superó el 3% anual por encima de las expectativas, los bonos argentinos vuelven a mostrarse golpeados este miércoles. Sin embargo, la bolsa porteña ensaya una recuperación, luego de haber caído más de 5% en la previa.
Por cuarto mes consecutivo, la inflación en Estados Unidos volvió a mostrarse al alza en enero último. Esto da la pauta que la Reserva Federal deberá retrasar su baja de tasas de interés, lo que pega en las expectativas del mercado de acciones y deuda, sobre todo de países emergentes. En Wall Street los principales índices bursátiles reaccionaron con caídas de hasta 0,7%.Leer más.
La Argentina tiene el café más caro de América Latina, según una comparación que hizo el diario español El País. Tomarse un pocillo en un bar céntrico de la Ciudad de Buenos Aires cuesta US$ 3,5 contra US$ 2,8 en Santiago de Chile, US$ 2,5 en Ciudad de México y US$ 1,5 en San Pablo y Bogotá.
Es consecuencia de la apreciación del peso, como parte de la política macroeconómica que impulsa el Gobierno de fortalecer la moneda local, lo que produjo un encarecimiento del país en términos relativos.Leer más.
Baja apenas un 0,15% con respecto al precio con el que cerró la jornada del martes.
Se vende a $ 1.220 en casas de cambio. Para la compra cotiza a $ 1.200.
l presidente estadounidense, Donald Trump, ratificó que impondrá la suba del 25% de aranceles sobre el acero y el aluminio a la Argentina, que anhela ser incluido en una lista de excepciones a esa medida, y dijo que Estados Unidos tiene “un poco de déficit” con el país.
Las palabras de Trump llegan en momentos en que Javier Milei alista un viaje a Washington la semana próxima y, confiado en su buena relación con el presidente estadounidense, buscará negociar en persona que el país quede excluido del aumento de tarifas.Leer más.
Es el mismo precio con el que cerró la jornada del martes. Para la compra cotiza a $ 1.195.
El jueves 13, a las 16, el INDEC dará a conocer el dato de inflación del primer mes del año. Aunque 2025 había comenzado con aumentos en alimentos y bebidas, hacia el final del mes se desaceleró la suba. Así el Indice de Precios al Consumidor (IPC) del mes pasado habría terminado entre 2% y 2,3%, estiman consultoras privadas, tras el 2,7% de diciembre.
Si el número se confirma, sería el valor más bajo en lo que va de la gestión de este Gobierno, luego del 2,4% en noviembre.Leer más.
A 48 horas de la decisión presidencial de echar a la embajadora argentina ante la Organización de Estados Americanos, Sonia Cavallo, a raíz de las declaraciones de su padre sobre el nivel del tipo de cambio y el cepo los operadores financieros no terminan de asimilar el impacto y las consecuencias.
El Presidente Javier Milei calificó de ""impresentable"" a Domingo Cavallo. Fue luego de que el ex ministro de Economía opinara en su blog personal que el peso está sobrevaluado y que el gobierno tendría que anticipar la unificación cambiaria y la salida del cepo.Leer más.
Aumenta 25 centavos con respecto a la cotización del martes.
En medio de los esfuerzos del gobierno por despejar el fantasma de la devaluación y mostrar avances con el Fondo Monetario, Wall Street sigue viendo ""riesgos"" en torno a la política cambiaria. Esa fue una de las conclusiones que sacó el Morgan Stanley tras enviar la semana pasada una misión con inversores a Buenos Aires para reunirse con funcionarios, políticos y empresarios.
""Regresamos de Argentina más optimistas sobre la continuidad de las políticas. La economía repuntó más rápido y con más fuerza de lo previsto"", señaló el banco de Estados Unidos. Y en el mismo reporte advirtió: ""La apertura de la cuenta de capital sigue siendo un riesgo clave. Un Big Mac en Buenos Aires tiene un precio cercano al de Nueva York, solucionarlo no está resultando fácil"".Leer más.
Mañana el Gobierno hará alarde del dato de inflación (enero) más bajo desde julio de 2020. Si se tiene en cuenta que en ese momento la economía atravesaba la cuarentena con una deflación ficticia, quizá haya que retroceder a febrero de 2020 o incluso 2017 para encontrar un índice de inflación más bajo (el relevamiento de expectativas del Banco Central espera 2,3%, aunque en el Gobierno se ilusionan con una cifra cercana a 2%).Leer más acá.
La divisa cotiza a $ 1.076 para la venta y $ 1.036 para la compra en la pizarra oficial, luego de no sufrir alteraciones en la jornada de ayer.
La divisa de Estados Unidos que se comercializa en el mercado paralelo subió 10 pesos en la jornada de ayer por lo que cotiza a $ 1.215 para la venta y $ 1.195 para la compra.
Newsletter Clarín
Recibí en tu email todas las noticias, coberturas, historias y análisis de la mano de nuestros periodistas especializados",https://www.clarin.com/economia/dolar-hoy-dolar-blue-hoy-vivo-cotiza-precio-miercoles-12-febrero-minuto-minuto_0_ci0jO0d4VN.html
Clarín,2025-02-12,Dólar MEP hoy: a cuánto cotiza este miércoles 12 de febrero,"La cotización deldólar MEPes de$1180,70para la compra y de$1182,90para la venta, estemiércoles 12 de febrero de 2025.
Eldólar MEPbaja1%respecto al mismo día de la semana anterior.
En lo que va defebrero de 2025, el dólar MEPsuberespecto al mes anterior: la diferencia es de2%.
En comparación con el año pasado, el dólar MEPsubeun2%. A esta altura del año anterior, el MEP cotizaba a$1160.7.
El valor del dólar MEP tiene una diferencia con el dólar blue. Mientras que el primero está a$1180,70, el blue cotiza hoy a$1195, lo que marca una brecha de1.20%.
Eldólar MEPes un tipo de cambio mayor al dólar oficial, que se muestra como la opción más barata para comprar a modo de atesoramiento.
El dólar MEP consiste en la compra de un bono en pesos y su venta en dólares. Este tipo de cambio se calcula a partir de la división entre el precio en pesos y la cotización en dólares.
La cotización del dólar MEP funciona en el mismo horario del mercado de cotizaciones: hasta las 16:30 horas, de lunes a viernes.
Su nombre deriva de la sigla 'MEP', que significa Mercado Electrónico de Pagos. Es una variante al dólar ahorro, ya que presenta menos restricciones como se mencionó anteriormente.
Newsletter Clarín
Recibí en tu email todas las noticias, coberturas, historias y análisis de la mano de nuestros periodistas especializados",https://www.clarin.com/economia/dolar-mep-hoy-cotiza-miercoles-12-febrero_0_41iqIMXe4P.html
Clarín,2025-02-12,Dólar cripto hoy: a cuánto cotiza este miércoles 12 de febrero,"La cotización deldólar criptoes de$1205para la compra y de$1209,87para la venta, estemiércoles 12 de febrero.
El dólar criptobaja0%respecto al mismo día de la semana anterior.
En lo que va defebrero 2025, el dólar criptobajarespecto al mes anterior: la diferencia es de1%.
En comparación con el año pasado, el dólar criptosubeun7%. A esta altura del año anterior, el dólar cripto cotizaba a$1125.
El valor deldólar criptotiene una diferencia con eldólar blue. Mientras que el primero está a$1205, el blue cotiza hoy a$1195, lo que marca una brecha de0.84%.
Eldólar criptoes una cotización que se define en función de la compraventa de “stablecoins”, es decir, criptomonedas atadas a un activo estable, en este caso al dólar estadounidense.
Para operar con eldólar criptoes necesario tener una cuenta en alguna billetera virtual o una exchange. Se define su cotización en función de la compra y venta de criptomonedas ancladas al dólar estadounidense.
Newsletter Clarín
Recibí en tu email todas las noticias, coberturas, historias y análisis de la mano de nuestros periodistas especializados",https://www.clarin.com/economia/dolar-cripto-hoy-cotiza-miercoles-12-febrero_0_AQx6D48FTQ.html
Clarín,2025-02-12,Euro hoy: a cuánto cotiza este miércoles 12 de febrero,"Eleurocotiza estemiércoles 12 de febreroa $1.028,58 para la compra y $1.029,77 para la venta, por lo que se mantiene estable respecto a la última cotización.
En cuanto a la divisa en el mercado paralelo, eleuro blue hoycotiza a 1228.56 para la compra y 1249.20 para la venta. De este modo, su precio sube en relación al último informado.
Con estos valores, labrechaentre el euro blue y el euro oficial​ es de 119410%.
Elvalor del euro bluetiene una diferencia sustancial más alta con el euro oficial ya que este último es el que se adquiere en los bancos y que posee una cotización establecida.
Al igual que el dólar blue, eleuro bluees el que circula en el mercado negro y suele tener un valor más alto que el oficial. Una explicación sobre su denominación señala que se llama así porque en inglés, ""blue"", además de nombrar al color azul, remite a algo ""oscuro"". De esta manera, se reconoce al cambio de la divisa por fuera del sistema cambiario.
El término euro blue se empezó a utilizar a partir del 2011, como consecuencia de lasrestriccionespara la adquisición de moneda extranjera que comenzaron a aplicar la Administración Federal de Ingresos Públicos (AFIP) y el Banco Central de la República Argentina bajo el gobierno de Cristina Fernández de Kirchner.
Estaslimitacionescobraron un nuevo impulso en diciembre de 2019, luego de los anuncios de presidente Alberto Fernández sobre la Ley de Emergencia económica y que se profundizaron a lo largo del 2020 con el cepo cambiario. Esto genera que los sectores que viajen al exterior opten por la compra de euros en elmercado negro, generando así un aumento en el precio del euro blue.
El nombre del Euro paralelo
El euro se lanzó el 1° de enero de 1999, cuando 10 países fijaron sus tipos de cambio y entregaron las decisiones sobre las tasas de interés al recién creado Banco Central Europeo. Los billetes y monedas de euro entraron en circulación tres años después.
La moneda compartida se vio como una solución a las constantes disputas por los tipos de cambio que habían marcado la política europea después de la Segunda Guerra Mundial y como una extensión lógica de la zona de libre comercio de aranceles de la Unión Europea. Gran Bretaña, en particular, optó por no participar, pero 19 de los 27 países de la UE utilizan el euro como moneda nacional. Quienes componen la zona del euro, también denominada ""eurozona"" son:AustriaBélgicaChipreEstoniaFinlandiaFranciaAlemaniaGreciaIrlandaItaliaLetoniaLituaniaLuxemburgoMaltaPaíses BajosPortugalEslovaquiaEsloveniaEspaña
Newsletter Clarín
Recibí en tu email todas las noticias, coberturas, historias y análisis de la mano de nuestros periodistas especializados",https://www.clarin.com/economia/euro-hoy-cotiza-miercoles-12-febrero_0_4wxcZU2JAJ.html
Clarín,2025-02-12,Dólar blue hoy: a cuánto cotiza este miércoles 12 de febrero,"La cotización deldólar bluees de $1195 para la compra y de $1215 para la venta, estemiércoles 12 de febrero de 2025.
En lo que va de febrero de 2025, el dólar blue baja respecto al mes anterior: la diferencia es de 3%.
En lo que va de este 2025, el dólar blue sube respecto al 2024: la diferencia es de 6%.
El valor del dólar blue tiene una diferencia sustancial con el dólar oficial, que se adquiere en los bancos y que posee una cotización establecida. La brecha entre el dólar oficial y el dólar blue es de 15%.
Eldólar bluees el que circula en el mercado negro y suele tener un valor más alto que el oficial. Este dólar no se compra en bancos o casas de cambio oficiales.
La cotización del dólar blue cierra junto con la del dólar oficial: a las 15 horas, de lunes a viernes.
Una explicación sobre su denominación señala que se llama así porque ""blue"", en inglés, además de nombrar al color azul, remite a algo ""oscuro"". Otra teoría lo relaciona con las operaciones de compra a través de bonos o acciones de compañías conocidas como""blue chips"". Y también se lo vincula con el color aproximado que aparece cuando se aplica un fibrón para detectar billetes falsos.
La cotización deldólar oficiales de $1036 para la compra y de $1076 para la venta, este miércoles 12 de febrero de 2025, según el Banco Nación.
La cotización deldólar bolsaes de $1180,70 para la compra y de $1182,90 para la venta, este miércoles 12 de febrero de 2025.
La cotización deldólar CCLes de $1190,30 para la compra y de $1193,40 para la venta, este miércoles 12 de febrero de 2025.
Newsletter Clarín
Recibí en tu email todas las noticias, coberturas, historias y análisis de la mano de nuestros periodistas especializados",https://www.clarin.com/economia/dolar-blue-hoy-cotiza-miercoles-12-febrero_0_nXw5SjC6KG.html
Clarín,2025-02-12,El mercado se quedó sin noticias y hoy solo ve peleas,"Mañana el Gobierno hará alarde del dato de inflación (enero) más bajo desde julio de 2020. Si se tiene en cuenta que en ese momento la economía atravesaba la cuarentena con una deflación ficticia, quizá haya que retroceder a febrero de 2020 o incluso 2017 para encontrar un índice de inflación más bajo (el relevamiento de expectativas del Banco Central espera 2,3%, aunque en el Gobierno se ilusionan con una cifra cercana a 2%).
Sin embargo, la inflación no ha ocupado el tema central de las intervenciones de los funcionarios en estos días. No han siquiera paladeado ese éxito. Porque está claro que el balance de la gestión de Javier Milei no se hará en función de su mirada sobre la cuestión de género o la batalla cultural.Su gobierno enfrenta todavía el desafío de estabilizar la economía, y esa tarea está lejos de haber finalizadocomo por ejemplo se verá en febrero cuando la inflación suba como consecuencia del precio de la carne. Como dijo el economista Guillermo Calvo hace poco sobre el primer año del Plan Milei“el engolosamiento frente a resultados positivos es para tener cuidado”.
Como si fuera poco con todo esto, el Gobierno se metió en un lanzamiento de lleno contra todos aquellos economistas que critican un aspecto puntual de su política económica: el cambiario-monetario, diciendo que el dólar está atrasado.
Un caso de esto último sucedió con Domingo Cavallo. El ex ministro aclaró que no critica la orientación del Plan Milei ni su principal herramienta-el ajuste fiscal como ancla de la economía-, sino que su comentario de la semana pasada se centróen un aspecto técnico de la calibración del tipo de cambio de cara a las elecciones, algo que para muchos economistas no debería ser un drama sino más bien un detalle.
Pero es año de elecciones y vísperas de una negociación con el Fondo Monetario Internacional. Los nervios se acumulan y no es la primera vez que un gobierno responde con el látigo a las críticas.
El propio Cavallo solía molestarse con quienes lo atacaban por el dólar barato durante la convertibilidad en los 90. De hecho el ministro de Economía, Luis Caputo, cargó días atrás contra los economistas que fallaron en sus pronósticos (por ejemplo el propio Cavallo).
La Argentina se quedó sin noticias en el arranque de 2025 a la espera de lo del FMI y parece que una telenovela digna de LAM reemplazó a los análisis macroeconómicos.Valen los chismes y las peleas.
El mercado se adelantó tanto el año pasado que en el comienzo de este año quedó rezagado. Los índices bursátiles ETF de Brasil suben 14,6% en 2025 y en la región 13,3%. El Merval cae 10,8% en términos de CCL. El riesgo país de la Argentina en el año subió 7% y en Brasil cayó 10%.
El Gobierno en esto de no generar noticias sino peleasllegó al colmo de alentar una crítica contra economistas académicos de trayectoria (Roberto Frenkel, José María Fanelli, entre otros)a lo que Emilio Ocampo o Lucas Llach, defensores de este gobierno, han salido a defender.
“A Schumpeter no le importaba lo que pensáramos… mientras pensáramos”, contó una vez Paul Sweezy, un economista marxista alumno de Schumpeter en Harvard.
Pensar está bueno. Y más cuando la desinflación que logró el Gobierno da margen para hacerlo.Esa es su única pelea.
Editor jefe de la sección Economíaeburgo@clarin.com
Newsletter Clarín
Recibí en tu email todas las noticias, coberturas, historias y análisis de la mano de nuestros periodistas especializados",https://www.clarin.com/economia/mercado-quedo-noticias-hoy-solo-ve-peleas_0_Z1cQxYQILv.html
