diario,fecha,titulo noticia,contenido,link
Clarín,2025-02-11,"Mientras Trump castiga exportaciones argentinas, EE.UU. invita a los empresarios locales a invertir en su país","Tal vez porque una cosa no quita la otra y en lo que podría parecer surrealista, justo cuando Donald Trump lanzó unsúper arancel del 25%al acero y al aluminio, castigando esas exportaciones industriales locales, esta mañana seinvitó a los argentinos a invertir en Estados Unidos.
Organizado por la embajada de EE.UU. y el estudio Vivanco&Vivanco, experto en allanar el camino en el país del Norte, se colmó de inversores el principal salón del Four Season's.
Durante un generoso y extenso desayuno muchos se sorprendieron por la cantidad de iniciativas que ofrece Washington para los que dispongan de al menosUS$ 800.000 y se comprometan a crear unos diez empleospara que puedan radicarse con sus familias.
Lo asombroso es que uno de los panelistas invitados, el economista Claudio Zuchowicki, fue tan optimista con lo que viene para la Argentina, que pareciócontradecir la intención de los organizadores.
Según su razonamiento, este 2025 es el año de la economía real con crecimiento y baja de impuestos. “Tenemos a bombita Darín como presidente”,arrancó Zuchovicki describir un Milei que se plantó y está ganando el combate a la inflación con el ancla fiscal. Claro que admitió que habrá una transferencia entre sectores y llamó a adaptarse.
El ex embajador en EE.UU. y China, Diego Guelar explicó la estrategia comercial tan agresiva de Trump en que arrancó muy de abajo, en un país que está perdiendo la batalla tecnológica.
Andres Echevarria, del estudio Vivanco también contó su propia perplejidad en 2015 cuando viviendo en Washington Donald Trump iba a ser candidato. Lo mismo le pasó con Javier Milei en 2023, ya en Buenos Aires.
Cabeza en el país de un estudio fundado en 1902 en Ecuador y que hoy atiende en Miami, se explayó sobre las visas especiales para los inversores. Y se ofreció como guía para lallamada visa gold, la EB 5 de residencia permanente para inversores. Argentina tiene una ventaja, no figura en la lista de espera para esas visas como sucede con China y la India.
Pero fue Jonas Tizabi, un ex Accenture, hoy consejero comercial de EE.UU. en Argentina y presentado como representante de un país con 388 premios Nobel. Tizabi definió su función como alguien quecrea vínculos con el empresariado, cuya misión es captar inversiones a Estados Unidos.
Llamó la atención el poder que despliega Washington para captar inversiones con siete agencias específicas para el financiamiento, los recursos legales que dispone  y la asistencia técnica.
Ese servicio comercial tiene presencia en70 países y 106 ciudades de EE.UU.para ayudar a las empresas a radicarse allá y crear empleo. Tizabi promocionó el programa Select USA que con sentido de oportunidad, el ahora ex embajador Marc Stanley anticipó el año pasado con una selección de empresas.
La versión 2025 se llevará a cabo en Maryland a pocos kilómetros de Washington. Se desarrolla entre el 11 y el 14 de mayo próximo. Tizabi se animó a recomendar que a ese evento se lleve unaagenda sólida, saber inglés, que se considere que el tiempo es dinero y ser transparente y claro. El programa ya logró para Estados Unidos, inversiones quecrearon 85.000 empleos.
Llegado especialmente desde California, Chris Foulger, de la desarrolladora inmobiliaria Homefelt, con sus pies en San Diego y mega proyectos inmobiliarios aprobados por los estados, contó que arrancaron en 1998 y cotizan en Wall Street. Dijo, para tranquilizar y dar garantías, que les gusta el bajo apalancamiento con deuda. Y en consecuenciano prometen rentas fabulosas.
Con casi5 trillones de dólares, Estados Unidos es el principal inversor directo del mundo.Con Argentina existe un tratado detratado de protección de inversiones y se contabilizan aquí 400 empresas norteamericanasy US$ 12,5 billones desembolsados son también el principal inversor directo del país.
En el cierre del evento, Clemente Vivanco, cuarta generación de un estudio de abogados que nació en Ecuador y hoy está radicado en Miami con oficinas en la región,  se refirió a la importancia de las certezas globales. Sonó extraño cuando desde la principal economía del mundo,parecen estar cambiando las reglas del comercio global.
Consultado acerca de los aranceles, remarcó que ""EE.UU. ha sido un país muy abierto, como aplica el arancel es a todos los países, hay que jugar con estas reglas generalizadas queno discriminan a los países.Hay países más cercanos a EE.UU. que otros y es probable que esos países tengan acceso a algún beneficio"". No aventuró si Argentina figuraba en esa lista.
Editora de la sección Economíasnaishtat@clarin.com
Newsletter Clarín
Recibí en tu email todas las noticias, coberturas, historias y análisis de la mano de nuestros periodistas especializados",https://www.clarin.com/economia/trump-castiga-exportaciones-argentinas-eeuu-invita-argentinos-invertir-pais_0_NwF0SQ9wLY.html
Clarín,2025-02-11,Por qué le exigimos a las ONGs ser pobres,"Como patrono de Fundación Éxit,veo a diario las dificultades que afrontan las organizaciones sociales para justificar su trabajo y demostrar su impacto. Muchas de estas barreras vienen de cómo entendemos ayudar al prójimo, algo queDan Pallotta, activista humanitario reconocido por cuestionar las prácticas tradicionales del sector sin fines de lucro, explica con claridad. Él plantea quela filantropía no es un lujo ni un complemento del sistema económico; es su contraparte imprescindible. Es un “mercado de amor”que atiende necesidades que no se pueden monetizar como la compasión.
Sin embargo,seguimos tratando al sector social con desconfianza, restricciones absurdas y una herencia cultural que parece empeñada en que, si haces el bien, al menos no que te cueste caro. Según Pallotta, la filantropía cubre necesidades humanas y emocionales que el negocio tradicional no puede y por eso es maravilloso.
El sector social no vende productos ni persigue beneficios económicos. Trabaja con amor, compasión y dignidad,valores sin precio, pero esenciales para el tejido social. En la Fundación Éxit lo vemos claro: ayudamos a jóvenes en riesgo de vulnerabilidad por abandono escolar temprano. Aunque suene cursi,este impacto no se mide en euros, pero transforma vidas. Y no, no se logra con abrazos ni buenas intenciones:se necesita financiación, infraestructura y libertad para operar con la misma ambición que cualquier organización empresarial.
El problema está en las barreras que afrontan las ONGs. Sueldos bajos, rechazo a que puedan hacer marketing porque eso es “tirar el dinero”, baja inclinación al riesgo porque no toca arriesgar, falta de escala y poco acceso al capital. Otro gran obstáculo es el estigma sobre ganar dinero haciendo el bien. Es aceptable lucrarse vendiendo videojuegos donde asesinas gente, pero, pero, pero no liderando proyectos para curar enfermedades o educar niños. Al parecer,la bondad está bien, pero la prosperidad...mmm….demasiado sospechosa ¿no? A esto se suma un peso histórico difícil de ignorar: el dogma puritano. Durante siglos, el puritanismo asocia la caridad con sacrificio, expiación y todo eso… Según esta visión,hacer el bien debe doler, no puede oler a triunfo. Pues amigo, a otro perro con ese hueso.
Las ONGs no necesitan penitencia; necesitan ambición, innovación y libertad para crecer. Y no, soñar en grande, no es pecado. Así que por favor, midamos a las ONGs no por lo barato que trabajan, sino por la magnitud de sus sueños. Vergüenza nos tendría que dar no si tienen ambición, sino que no la tengan. Lo que importa es que hagan acciones de impacto y no que mendiguen el impacto de sus acciones. Lo importante no es cuánto cuesta hacerlo, sino cuánto impacto genera.
Columnista de la sección Economía
Newsletter Clarín
Recibí en tu email todas las noticias, coberturas, historias y análisis de la mano de nuestros periodistas especializados",https://www.clarin.com/economia/exigimos-ongs-pobres_0_wdwPC8GO9L.html
Clarín,2025-02-11,"Por la “guerra de promos” en los super, en 2024 explotaron los pagos con QR","La""guerra de promos""que impulsaron las principales billeteras digitales durante el año pasado sirvieron para quelos pagos con QR exploten, sobre todo en los supermercados.
Según datos de la procesadora de pagos COELSA, en diciembre último este tipo de operaciones creció un 200% impulsada por los descuentos que los bancos y fintech presentaron para apuntalar el consumo de las Fiestas de fin de año.
Sin embargo, no se trató de una tendencia aislada. De septiembre a diciembre pasados se procesaron157 millones de operaciones hechas a partir de un código QR, lo que representa un incremento de 212%respecto a lo que había ocurrido en el último trimestre de 2023. Según explicó la compañía, se trata de""el método de pago más elegido por los usuarios para envío de dinero, cobros y pagos"".
""Esta metodología de pago sigue demostrando un vertiginoso avance, con un crecimiento sostenido, además de una constante generación de mayor inclusión y confianza desde su puesta en marcha"", detalló el informe. Los Milennials son los mayores usuarios, con el 62%, seguidos por la generación X, con 25% y el lugar donde más se paga de esta forma son lossupermercados y los almacenes.
Los bancos y las billeteras virtuales, con Mercado Pago a la cabeza, lanzaron sobre la segunda mitad del año pasado fuertes promociones y descuentos,algunos sin tope de reintegro, para las compras en supermercados en días determinados, como una forma de apuntalar las alicaídas ventas.
El efecto se vio en un cambio en la forma de pagar los consumos de los clientes, que según COELSA, priorizaron las apps por encima de los plásticos o el efectivo para poder disfrutar de estos beneficios.En el último cuatrimestre del año pasado, el 32% de los pagos QR se hizo en un super, lo que representa un incremento del 15% respecto al periodo anterior.El monto promedio de las operaciones fue de $ 17.535.
En las Fiestas de fin de año, el pago con QR creció un 197% respecto de 2023.Durante esas dos semanas, COELSA procesó 71 millones de transacciones en medios de pagos digitales.
Esta tendencia se explica en parte por el incremento que tuvieron las cuentas digitales en este mismo periodo. Entre diciembre de 2024 y diciembre de 2023, laapertura de cuentas bancarias y no bancarias creció en un 48%. Los más jóvenes, pertenecientes a la Generación Z, lideraron la apertura de nuevas cuentas, que según COELSA ya superan los 262 millones, tanto bancarias como no bancarias. Esto significa que por persona se manejan, en promedio entre 4 cuentas bancarias y 3,5 no bancarias.
De la mano de este fenómeno tambiénaumentaron las transferencias inmediatascomo forma de envío de dinero entre cuentas, tanto de bancos como de fintech: subieron un 47% respecto a lo que se había reportado en el último cuatrimestre del año pasado.
Todos estos datos presentan uncostado negativo: el incremento de los casos deciberfraude. Según la compañía, el 90% de las alertas que se emitieron al sistema financiero lograron detectar un caso de engaños o estafas.
""Gracias a nuestro servicio de monitoreo 24/7, detectamos comportamientos inusuales en las operaciones de los clientes de las entidades emitiendo las alertas para accionar y prevenir así el fraude informático. Esto permite advertir al ecosistema sobre cuentas utilizadas o transacciones realizadas que sean sospechosas, tanto de personas como de empresas"", explicaron.
NE
Redactora de la sección Economía/Pyme.apedotti@clarin.com
Newsletter Clarín
Recibí en tu email todas las noticias, coberturas, historias y análisis de la mano de nuestros periodistas especializados",https://www.clarin.com/economia/guerra-promos-super-2024-explotaron-pagos-qr_0_A7wajJwa1U.html
Clarín,2025-02-11,Cómo los nuevos aranceles de Trump al acero complican el plan de Milei para firmar un acuerdo de libre comercio con EE.UU.,"La orden ejecutiva de Donald Trump de imponeraranceles del 25% a todas las importaciones de acero y aluminioque entren a los Estados Unidos es también ungolpe a los planes de Javier Mileide firmar un acuerdo de libre comercio tradicional a nivel bilateral con su aliado.
No es solo un asunto filosófico si se compara el proteccionismo de Trump -expuesto en la llamadaAmerican First Trade Policy, publicada el mismo 20 de enero-, con el aperturismo de Milei, quevuelve a viajar a Estados Unidos el 19 de febrero próximo.Está invitado nuevamente a participar de una Conferencia de Acción Política Conservadora (CPAC). Hasta el momento, Milei ha conseguido dos cálidos pero breves encuentros con Trump -uno siendo este candidato y otra, electo presidente-,pero ahora el canciller Gerardo Werthein tiene el desafío de conseguir una bilateral siendo ambos ya presidentes.
Si Trump no hace excepciones con los países amigos o aliados -""los que respetan las leyes"", afirman en Washington-, no habría mecanismo alguno por el que Argentina pueda firmar un TLC con Estados Unidos como el que busca Javier Milei. Podría haber otros acuerdos. Pero especialistas consultados también especulan con que el costado pragmático de Milei podría en realidad estar siendo un guiño alo que en realidad necesita su gobierno: un nuevo acuerdo con el Fondo Monetario que le represente al fisco argentino dinero fresco.


A diferencia de losempresarios argentinos que tomaron la noticia con alarmay estudian cómo será el impacto de la orden ejecutiva emitida el lunes 10 por Trump -la que impone aranceles en el mercado estadounidense-,Milei se mostró despreocupadopor el anuncio de Trump de que restringirá con recargos la entrada de esos dos productos centrales a su país. Si bien su objetivo es enfrentar la competencia global de China,afecta a Canadá, Brasil y Méxicoprimero y en la Argentinagolpea a exportadoras de aluminio como Aluar, y de acuerdo, como Techint.
Para el caso, en una de las entrevistas que concedió el lunes, Milei reiteró que su prioridad era la de acordar con Estados Unidos y que por eso le estabareclamando al Mercosur que cada país “pueda ir y negociar tratados de libre comercio”. Ello no se puede hacer y ya se le ha dicho al mandatario. Argentina no se puede ir del Mercosur por orden del Presidente. Al bloquese entró con ratificación del Congreso y se sale también con aprobación parlamentaria.
Lo que sí puede ocurrir, como está ocurriendo ahora, es que el Gobierno decida no acompañar obajar el nivel de actividad en el bloquepara seguir presionando en favor de cambiar la normativa vigente, la decisión 32/00 por la que, para firmar un acuerdo de libre comercio, deben aprobarlotodos o ninguno.Lo intentó Uruguay para firmar acuerdos con otros países y no lo apoyaron.
Ahora, traido a Buenos Aires por pedido la secretaria general de la PresidenciaKarina Milei,para que le dé ""una mano"" a Werthein, el embajador Luis Kreckler -cuyo cargo formal es el de cónsul general en San Pablo- está abocado a ""contener"" el peleadísimo ámbito diplomático y pensar cómo se puede firmar un TLC con Estados Unidos. Secretario de Comercio Internacional ""temporal"", Kreckler -más especializado en vender la Argentina al mundo que en acuerdos y tratados- tiene un verdadero desafío por delante.
Al momento, Estados Unidos negocia con Argentina un acuerdo de minerales, aunque hay otros problemas comerciales pendientes con Washington, como el comercio de limones y el biodiésel. En 2024 se firmó un memorándum de entendimiento sobre los llamados minerales críticos, que incluyen al litio y al cobre, con el que EE.UU. busca neutralizar la competencia en la Argentina de China. Esa agenda la negoció en el último año la ex canciller Diana Mondino con su ex secretario de Comercio Internacional, Marcelo Cima. Venían pidiendo, como hizo la administración de Mauricio Macri el levantamiento de los aranceles que se le impusieron a varios productos argentinos.
Dijo Milei el lunes luego de considerar que las dificultades para la Argentina frente a la suba de aranceles para el aluminio y el acero en los Estados Unidos eran “interpretaciones” periodísticas:“Trump no es un proteccionista.Trump utiliza la política comercial como instrumento de geopolítica. Después a usted le puede gustar o no, pero utiliza la política comercial de Estados Unidos como herramienta de negociación”. El Libertario puso como ejemplo las presiones arancelarias nuevas de la administración republicana sobre México, Canadá, Colombia, y China.
“El segundo punto, en lo que estamos haciendo nosotros, hay dos líneas de acción. Una es lo que pasa con el Mercosur. A mí me tocó ser el presidente pro tempore ahora. ¿Qué cosas propuse? Una era el tema de la lucha contra el narcotráfico y el terrorismo, de avanzar en una solución conjunta de esos problemas. Otra cosa que pedí es que puertas adentro empecemos a bajar barreras para-arancelarias. Además, digamos, propongo bajar el arancel externo común. Y que cada país por separado pueda ir y negociar tratados de libre comercio. Donde nosotros estamos trabajando para ir a un tratado de libre comercio con Estados Unidos, y esa es mi prioridad.Mi prioridad es el tratado de libre comercio con Estados Unidos”.
De acuerdo a lo que pudo saberClarín,la presidencia argentina de Mercosur -que empezó a principios de enero y termina a mediados de año cuando se la traspase a Brasil-  no expuso formalmente sus objetivos y tampoco propuso reunión alguna.
Redactora especialista en política exteriornatashan@clarin.com
Newsletter Clarín
Recibí en tu email todas las noticias, coberturas, historias y análisis de la mano de nuestros periodistas especializados",https://www.clarin.com/economia/nuevos-aranceles-trump-complican-plan-milei-firmar-acuerdo-libre-comercio-eeuu_0_Jth6TcISZM.html
Clarín,2025-02-11,“Que sea justo”: una asamblea de productores rechazó el fuerte aumento de un impuesto en Córdoba,"Este lunes se llevó a cabo la asamblea de productores agropecuarios en la Rural de Río Cuarto en protesta por la fuerte suba del inmobiliario rural aplicado por el gobierno de Córdoba.
El motivo que reunió a los 400 productores fue la determinación por discutir la problemática que genera elaumento del inmobiliario ruralque excede en mucho, no solamente a la inflación anual que hubo en el país, que rondó el 118% según el Indec, sino y sobre todo, supera lo estipulado por el propio gobierno provincial que fijó el incremento en 172,5%.
Uno de los productores presentes detalló como ejemplo que el año pasado había pagado $1.276.000, mientras que el cedulón de este año llegó con la cifra de $3.880.000, lo que da un incremento de cerca del 210%, aún cuando en ambos períodos tuvo los mismos beneficios, por pago de cuota única y por pago online. Desmintiendo de esa manera lo planteado por los funcionarios provinciales que aseguran que se dan aumentos mayores en los casos, en que en un período ha habido beneficios impositivos y en el otro no.
Por otro lado y ante la ausencia tanto del gobernadorMartín Llaryoray del ministro de Bioagroindustria de Córdoba,Sergio Busso, ambos invitados formalmente al encuentro de productores,Heraldo Moyetta, presidente de la entidad anfitriona, lamentó que “hayan desaprovechado la oportunidad para tener contacto directo con la realidad sobre la que gobiernan”, y en cuanto a la discusión sobre los importes que están llegando en los cedulones, Heraldo fue contundente: “entendemos lo que nos vienen explicando desde el gobierno provincial estos días sobre lo bien calculado que está el impuesto, pero lo cierto es que lo que tenemos que pagar está muy por encima de lo que ellos plantearon que tenemos que pagar”. Por eso, Moyetta declara determinado: “queremos un impuesto que sea justo, claro y que permita tener previsibilidad en la actividad que desarrollamos”.
Inmediatamente surgió el apoyo unánime por parte de los productores que hicieron uso de la palabra durante las casi más de tres horas que duró la Asamblea y el planteo coincidente respecto de que lo que buscan fue no eximirse de pagar, sino “pagar lo que corresponde, que sea un impuesto razonable y que haya transparencia en el retorno de esa recaudación en obras de infraestructura en los campos”, coincidieron.
Otro de los planteos que surgió recurrentemente tuvo que ver con la desprolijidad en el funcionamiento de Rentas y la falta de información clara por parte del organismo. Por ejemplo, mientras desde el gobierno provincial se asegura que habrá plazo para abonar la cuota única hasta el mes de mayo, en la página del organismo sólo existe la posibilidad de hacerlo en febrero. “Si un productor agropecuario trabajara con la desprolijidad como lo hace Rentas, habría que ver cuánto duraría en la actividad”, graficó uno de los presentes a modo de comparación.
También hubo una exigencia compartida respecto de que se vean las obras en las que el gobierno invierte lo que recauda del campo. Como sintetizó una productora de Villa Huidobro: “somos la caja más fácil pero, y en contrapartida, somos el sur olvidado, no tenemos obras de infraestructura, las escuelas rurales no paran de cerrar, tenemos que poner la plata para el combustible para que se arreglen los caminos y hasta nos vemos imposibilitados de agregar valor a nuestras producciones por las condiciones en las que nos vemos obligados a trabajar”.
Hubo también un fuerte llamado a avanzar de manera mancomunada, otro de los productores presente exhortó: “creemos que nos salvamos solos pero esa es una actitud que no nos sirve, si vamos a hacer algo tiene que ser unidos, trabajando con las instituciones que ponen el pecho y con una Mesa de enlace que vaya hacia donde los productores le digamos que vaya”.
Finalmente y luego de numerosas alocuciones acaloradas, Heraldo Moyetta llamó a pronunciarse respecto de los principales puntos sobre los que expresar el reclamo. En ese sentido, se acordó redactar un documento en el que se plantee claramente los siguientes ítems:
-Rechazo del aumento del 172,5% en el inmobiliario rural aprobado por la Legislatura provincial y exigir que el mismo no exceda el 118% de inflación anual que marcó el INDEC.
-Que se quite el cobro de la diferencia entre lo que determinó de aumento el gobierno provincial y lo que finalmente terminó aprobando la Legislatura y cuyo pago se exige de manera diferida en 2026.
-Que se explique el motivo por el cual se quitó el beneficio de 10% de descuento por pago de cuota única.
-Que se eficientice el funcionamiento de Rentas, en particular en la manera en que se ofrece la información sobre plazos y maneras de proceder respecto de los pagos.
-Que se transparente el uso que se hace del dinero que se recauda a partir de los impuestos que pagan los productores agropecuarios que debería traducirse en obras de infraestructura.

Newsletter Clarín
Recibí en tu email todas las noticias, coberturas, historias y análisis de la mano de nuestros periodistas especializados",https://www.clarin.com/rural/justo-asamblea-productores-rechazo-fuerte-aumento-impuesto-cordoba_0_gj2lCIJfQQ.html
