diario,fecha,titulo noticia,contenido,link
Clarín,2025-01-27,El Banco Nación acelera su transformación en sociedad anónima,"Pese a que quedó fuera del listado de empresas públicas a privatizar, el Banco nación avanza en el proceso para transformarse en una sociedad anónima.
A través de un comunicado, se informó que el banco ""ya cerró su balance especial de transformación al 31/12/2024 y la nueva Sociedad Anónima tendrá activos por$ 48 billones, depósitos y otras obligaciones por$ 33 billones. En tanto, el Patrimonio Neto (PN) de la SA ascendería a$ 15 billones"".
Al arranque de la gestión, el gobierno de Javier Milei había incluido al banco Nación en el listado de empresas a privatizar. Finalmente, la entidad fue excluida de ese listado por el Congreso. Desde allí, la intención del equipo que preside Daniel Tillard es avanzar en la transformación del banco en una sociedad anónima, al estilo de lo que ocurre con el Banco do Brasil en el país vecino.
En ese camino, el comunicado detalla que están preparando el terreno para el lanzamiento. Así se establece que ""el capital social será un valor nominal determinado en el estatuto y el valor de la acción resultará de dividir el PN por el capital social"".
""La Sociedad Anónima tendrá una cartera de préstamos de$ 15 billonesal 1/01/2025 conla mejor tasa de cobrabilidad de la historia reciente,ya que los desembolsos del Banco tuvieron un crecimiento extraordinario en 2024 (más de 600%)"".
Además. ""la entidad aumentó su participación de mercado por más de 600 puntos básicos,alcanzando el 17,5% del total. De esta manera, el BNA reafirma su liderazgo en el sistema financiero cualquiera sea la medición: activos, depósitos, préstamos y patrimonio"".
El comunicado apunta que ""la transformación en SA es imprescindible para que el Banco continúe aumentando los préstamos a favor de las PyMEs y las familias. Para sostener ese crecimiento, la institución necesitará ampliar su fondeo, lo que podrá hacer abriendo su capital, para lo cuales esencial que se convierta en Sociedad Anónima y que tenga la aprobación del Congreso"".
De este modo, ""el Banco Nación cumple plenamenteel mandato del Gobierno del Presidente Javier Milei:la promesa de inflación cero viene acompañada de abundancia de créditos y la rápida transformación del Banco en Sociedad Anónima"".

Newsletter Clarín
Recibí en tu email todas las noticias, coberturas, historias y análisis de la mano de nuestros periodistas especializados",https://www.clarin.com/economia/banco-nacion-acelera-transformacion-sociedad-anonima_0_cLsE1XAQAK.html
Clarín,2025-01-27,"Murió Enrique Eskenazi, presidente del Grupo Petersen","A los 99 años murió el empresarioEnrique Eskenazi, fundador del Grupo Petersen.Así lo informaron fuentes del grupo empresario, un conglomerado que reúne a bancos, compañías de ingeniería y construcción.
""Co mucho pesar informamos quefalleció en su hogar a los 99 años el ingeniero Enrique Eskenazi. Sus hijos Esteban, Ezequiel, Sebastián, Matías y Valeria, sus 14 nietos y sus 9 bisnietos lo despidieron en una ceremonia íntima, cumpliendo con un pedido expreso de quien fuera su padre, abuelo y bisabuelo. Sus restos descansarán ahora junto a los de su esposa y madre de sus hijos, Hazel Sylvia Toni Storey de Eskenazi"", señaló el comunicado.
En el texto que difundió la empresa esta tarde agregan que “su trayectoria no pasó inadvertida en el país ni en el exterior. En efecto,fue reconocido en diversos ámbitos como un empresario inspirador, de espíritu innovador y excepcional capacidad de liderazgo”.
El ingeniero Eskenazi había nacido el4 de agosto de 1925en la ciudad de Santa Fe. Se graduó como ingeniero químico en la Universidad Nacional del Litoral y se especializó en ingeniería de alimentos en el Research Department of Continental Can Corp. y en el Illinois Institute of Technology, ambos en Estados Unidos.
Eskenazi inició su actividad en el grupo Bunge y Born. En la década de 1980 ingresó como gerente general en la constructora Petersen, Thiele & Cruz SA. A partir de la década de 1990 lideró el proceso de transformación y expansión de los negocios de la compañía, incursionando en otros sectores estratégicos de la economía argentina, como el de losservicios urbanos, la agroindustria, la energía y el financiero, lo que derivó en la conformación del actual Grupo Petersen.
Ejerció la presidencia, entre otras empresas, de Petersen, Thiele & Cruz; de los bancos San Juan, Santa Cruz, Santa Fe y Entre Ríos. Además, fue vicepresidente deYPFS.A y de su Fundación.
En los 90 el Grupo Petersenparticipó del proceso de privatización de los bancos provincialesy se quedó con el Banco de San Juan, el Banco de Santa Cruz, el Nuevo Banco de Santa Fe y el Nuevo Banco de Entre Ríos.
En 2008 el grupo le compró a la española Repsol parte de YPF, que había sido privatizada en la década previa. Ese año, Petersen Energía -una sociedad conformada en España- recibió un préstamo de US$ 1.018 millones de un grupo de bancos integrado por Credit Suisse, Goldman Sachs, BNP Paribas y Banco Itaú Europa, y otro de 1.015 millones de Repsol para adquirir 14.9% de YPF. La operación resultó polémica, ya que para pagar ese préstamo,Repsol le permitió que usara las utilidades de la petrolera.
En 2011, la familia Eskenazi tomó otrosUS$ 670 millonesde un consorcio formado por Banco Itaú, Standard Bank, Credit Suisse y Citi, y una suma igual de Repsol para adquirir otro 10% de la petrolera. En todos los casos, los créditos se pagarían con las utilidades generadas por YPF.
Después de la estatización deYPFdurante el kirchnerismo,Petersen Energía pidió la quiebra en España.Allí apareció el fondo Burford Capital, que compró los derechos para litigar en15 millones de euros. Finalmente Burford le hizo juicio al estado argentino por la estatización y en 2023 consiguió una sentencia favorable que obliga al país a pagarleUS$ 16.100 millones.
Noticia en desarrollo
Newsletter Clarín
Recibí en tu email todas las noticias, coberturas, historias y análisis de la mano de nuestros periodistas especializados",https://www.clarin.com/economia/murio-enrique-eskenazi-presidente-grupo-petersen_0_fPcp5hgQ9r.html
Clarín,2025-01-27,“Basta de Ingresos Brutos”: el reclamo de Mercado Libre por la suba de impuestos provinciales que apoyaron fintech y bancos,"En medio dela pelea de distintos sectores por la suba de impuestos provinciales,Mercado Libreemitió un comunicado titulado “¡Basta de Ingresos Brutos!”, en el quecuestionó el aumento de Ingresos Brutosen distritos comoSanta Fe, calificándolo de “injusto”y“perjudicial”.
El gigante que fundó y lideraMarcos Galperinse sumó a las críticas que hizola industria fintech a través de su cámaray recibió el respaldo deejecutivos de la competencia.Los bancos también hicieron su reclamo, al igual que laCámara de Comercio.
Mercado Libresostuvo que estas medidas“afectan a consumidores y pymes,encareciendo productos y servicios,yponiendo en riesgo miles de negociosque sostienen la economía local”.
“El impuesto es injusto: grava el total facturado, no las ganancias, y genera un efecto cascada que aumenta los precios. Además, su gestión impone costos administrativos innecesarios que frenan el crecimiento del comercio”, apuntó.
Y agregó: “En lugar de avanzar hacia un sistema impositivo más simple y justo,perjudican a quienes producen, comercian y consumen”. “Es hora de reducir la carga impositiva para impulsar el desarrollo económico”, concluyó.
Por su parte,los bancos reclamaron que se revea la política tributaria: “La alta carga de impuestos distorsivosque soporta la actividad financiera es uno de los elementos que explican, pese al repunte observado en el último año, el bajo y decreciente nivel de préstamos/PBI que muestra la economía en los últimos 25 años”.
Así lo explicaron en un comunicado conjunto entidades nucleadas en laAsociación de Bancos de la Argentina (ABA), que reúne a las de capitales extranjeros; laAsociación de Bancos Argentinos (Adeba), que nuclea a las de capitales nacionales; laAsociación de Bancos Públicos y Provinciales (Abappra) y laAsociación de Banca Especializada (ABE).
En las redes,ejecutivos del ecosistema fintech respaldaron el reclamo. El fundador y CEO deUalá,Pierpaolo Barbieri, reposteó el tuit de Galperin en X con el mensaje “banco”. Y la firma emitió un comunicado.
“La creciente presión impositivaestá ahogando el acceso al crédito y al consumo. En lugar de fomentar el crecimiento y la competitividad, incrementa los costos de producción y servicios, lo que impacta negativamente tanto en consumidores como en negocios locales”, alertó.
“Ingresos Brutos se aplica sobre la facturación total, sin tener en cuenta las ganancias reales, generando que ese costo se traslade a todas las etapas de producción y comercialización. Como resultado,las personas sufren precios más elevados y se desincentiva la inversión. Además, cuando el impuesto provincial es aplicado al crédito, encarece el financiamiento, afectando especialmente a consumidores, emprendedores y pymes”, coincidió con Mercado Libre.
Banco.
“Apelamos al compromiso de los gobiernos provinciales de rever su política impositivaen pos del desarrollo de las personas, las empresas y el crecimiento de sus provincias.Ingresos Brutos es un castigopara el desarrollo de la Argentina”, resaltó.
También se hizo ecoSebastián Serrano, CEO deRipio, que escribió en X: “La verdadera solución pasa por una reforma fiscal profundaque permita depender menos de la coparticipación y diseñar impuestos quepromuevan desarrollo económico en lugar de espantarlo”, argumentó.
En tanto, la semana pasada, laCámara Argentina Fintechresaltó“su preocupación” por la suba de impuestos provinciales. “La decisión de ciertas provincias y áreas técnicas de la Administración Nacional deincrementar impuestos distorsivos, comoIngresos Brutosolos Débitos y Créditos,sobre flujos de fondos de terceros, representa un cepo para el desarrollo”, remarcó.
“El único freno a la digitalización de la economía es el peso fiscal que se aplica. Las herramientas existentes, disponibles por múltiples actores del sistema financiero tecnológico, han demostrado ser accesibles, de uso sencillo y de adopción masiva. No es un tema de disponibilidad ni capacidad de uso, sino deviabilidad ante la carga tributaria”, destacó.
También laCámara de Comercio y Servicios (CAC)consideró “excesivo el nivel de los tributos, que perjudican severamente a empresas y consumidores”. “Engrosan la carga impositiva a todas luces desmesurada, perjudicando las posibilidades de crecimiento y la formalización de la actividad económica. Existe una presión tributaria excesiva, por encima de las que históricamente registró el país y de las que se observan en naciones comparables”, apuntó.
“Existe una enorme carga tributaria subnacional, tanto en lo que respecta a las provincias (destacándoseIngresos Brutos) como en lo que refiere a municipios (sobresaliendo lasTasa de Seguridad e Higiene)”, se refirió, y repudió la suba de Ingresos Brutos que grava a las billeteras virtuales.
Desde este enero,Santa Fe elevó Ingresos Brutos del 5% al 9% en servicios financieros, lo que generó críticas de diversos sectores. Por caso,La Pampa fijó una alícuota del 15% para préstamoshipotecarios, prendarios o personales, mientras que actividades como los casinos pagan un porcentaje menor, del10%.
Pero el contexto refleja asimetrías entre las provincias. El gobernador de Entre Ríos, RogelioFrigerio, prometióeliminar gradualmente Ingresos Brutos; mientras que el mandatario de Córdoba,Martín Llaryora, yaeliminó el cobro del impuesto a la produccióny otras cargas impositivas, como el Impuesto a la Mera Compra. Asimismo, el gobernador de Chubut,Ignacio Torres, anunció laexención de Ingresos Brutosal sector ganadero y opinó quela medida fue posible gracias a una administración eficienteque permitió alcanzar un superávit financiero.
SN
Newsletter Clarín
Recibí en tu email todas las noticias, coberturas, historias y análisis de la mano de nuestros periodistas especializados",https://www.clarin.com/economia/basta-ingresos-brutos-duro-reclamo-mercado-libre-suba-impuestos-provinciales_0_eye7n2qsp6.html
Clarín,2025-01-27,La Corte Suprema de EE.UU. rechazó una apelación y autorizó a embargar activos argentinos por US$ 310 millones,"La Corte Suprema de Estados Unidos rechazó la apelación que hizo la Argentina, a fines de diciembre pasado, en el juicio por la deuda soberana que entró en default luego de la crisis de 2001. Y,de esa manera, habilitó a embargar unos US$ 310 millonesdepositados en cuentas de la Reserva Federal (Fed), en Nueva York, Suiza y Alemania.
La orden a la que tuvo acceso Clarín fue publicada este lunes por el máximo tribunal dentro de una lista con los reclamos rechazados. Allí aparece ""Argentina contra Attestor Master Value y otros"".
El revés se conocióen medio del vacío provocado por el despido del titular de la Procuración del Tesoro, Rodolfo Barra, por supuestas ""graves irregularidades”. El organismo es el encargado de defender los intereses de la Argentina en el exterior. Pero desde esa área informaron que aún no tienen información para brindar. ""El tema es que están sin Procurador por momento, por ahora nadie habla sobre el asunto del fallo"", dijo una fuente oficial.
Esta es la segunda derrota del país ante una Corte Suprema en los últimos 3 meses.En octubre, el Reino Unido falló en contra del país en el caso Cupón PBI.
Los abogados que representan a la Argentina buscan que la Corte de EE.UU. impida a los beneficiarios del fallo ir por los activos argentinos en la causa iniciada por fondos de inversión que nunca cobraron los títulos argentinos al momento de la crisis. Según fuentes al tanto de la causa, el Gobierno podría seguir eludiendo el pago.
Quien lleva el caso es el estudio jurídico Cleary, Gottlieb, Steen & Hamilton. Hasta el 2014, Argentina le pagó cerca de 400 millones de dólares al estudio jurídico de Nueva York para defenderse de los fondos buitre desde el 2002 en adelante.
""Los acreedores pronto tomarán posesión de US$310 millones depositados en cuentas de la Reserva Federal de Nueva York en los EE.UU., Alemania y Suiza. Esta es la segunda derrota de la República Argentina ante una Corte Suprema en los últimos tres meses. En octubre, la Corte Suprema del Reino Unido falló en contra del país en el caso Cupón PBI”, indicó Sebastián Maril, consultor de Latam Advisors y especialista en los juicios que la Argentina enfrenta en el exterior, quién bien temprano por la mañana advertía que estaba por salir esa resolución y que a su entender sería adversa.
Se trata de los fondos Attestor Master Value, Trinity Investments, White Hawthorne, Bison Bee LLC y Bybrook Capital Master que compraron deuda argentina en default desde 2001 a tenedores que nunca ingresaron a ninguno de los tres canjes que emitió el país, en 2005 (con Néstor Kirchner), 2010 (con Cristina Kirchner) y 2016 (con Mauricio Macri).
Los fondos buitre hicieron juicio y obtuvieron una sentencia favorable en primera instancia, en la que la jueza Loretta Preska -que lleva varios reclamos contra la Argentina- obligó al país a pagar en total US$ 477 millones.
La condena fue ratificada en agosto del 2022 por la Cámara de Apelaciones de Nueva York,y como Argentina no pagó en ambas instancias los holdouts quedaron habilitados a avanzar con los embargos. Luego, el caso llegó a la Corte, donde este lunes se conoció el rechazo del máximo tribunal.
En las primeras instancias no se sabía que se trataba de los bonos Brady, emitidos a principios de 1990, que vencieron el 31 de marzo de 2023. Hasta esa fecha, estuvieron depositados en la sucursal Nueva York de la Reserva Federal de Estados Unidos. Luego del vencimiento, se supone que la Argentina los trasladó al Banco Central (BCRA).
A mediados de diciembre de 2024, por primera vez desde el 2018,la Argentina volvió a la Corte Suprema de Estados Unidos en busca de evitar el embargo de US$ 310 millonestras una condena con sentencia firme contra el default de la deuda en 2001.
Tal como informóClarín,las autoridades determinaron en julio pasado que los activos argentinos en el exterior no corrían riesgos de embargo. Esa fue la conclusión del estudio que realizó la Procuración del Tesoro y otras áreas tras analizar posibles acciones judiciales contra el oro girado al exterior, los fondos enviados a Nueva York para cancelar el pago a los bonistas en enero pasado y la Fragata Libertad, que ya fue embargada en 2012.
El argumento oficial es que el Tesoro y el Banco Central son entidades independientes, lo que eximiría los activos de la autoridad monetaria de ser utilizados para el pago de deudas soberanas, según la Ley de Inmunidades Soberanas Extranjeras de los Estados Unidos.
Estos bonos nacieron como parte del Plan Brady, propuesto en 1989 por Nicholas Brady, secretario del Tesoro de EE.UU. en ese momento. Fue cuando los países de América latina vivían una crisis de deuda por los préstamos que tenían con bancos comerciales estadounidenses. Entonces, los gobiernos usaban esa vía para financiarse en lugar de acudir al mercado de deuda soberana.
A nivel local, el caso remonta a la década de 1990, cuando Argentina emitió esos bonos garantizados como parte de un plan de alivio de deuda soberano. El plan implicaba un intercambio de casi US$ 30.000 millones en bonos comerciales no garantizados por otros con garantía, con vencimiento en 2023 (""Bonos Brady"").
Esos bonos vencieron el 31 de marzo de 2023 y hasta esa fecha, estuvieron depositados en la sucursal Nueva York de la Reserva Federal de Estados Unidos. Luego del vencimiento, se supone que la Argentina los trasladó al Banco Central (BCRA).
Los beneficiarios del fallo intentarán repatriar esos títulos si es que logran confirmar que están en la Argentina, para cobrarse una parte de la sentencia. La defensa argentina, en tanto, apunta a que la Corte desestime el reclamo.
Newsletter Clarín
Recibí en tu email todas las noticias, coberturas, historias y análisis de la mano de nuestros periodistas especializados",https://www.clarin.com/economia/corte-suprema-eeuu-rechazo-apelacion-argentina-acreedores-ahora-podran-embargar-us-310-millones_0_LZoumSRYU0.html
Clarín,2025-01-27,Trump versus Petro: el peso colombiano abrió la semana con una fuerte caída tras la tensión diplomática,"Elpeso colombianoabrió la última semana de enero con unacaída de 1,89%ycotiza a 4.255 unidades por dólar.La divisa había cerrado el viernes en4.176 unidades por dólar.
La baja tiene lugar en medio dela tensión diplomática y comercial entre los gobiernos de los Estados Unidos y Colombiapor la negativa del presidenteGustavo Petrode recibir migrantes deportados en vuelos militares.
Sin embargo, este domingo por la noche, los Estados Unidos y Colombia superaron la controversia diplomática que llevó a Washington a amenazar conaumentar en un 25% los aranceles a las exportacionesdel país sudamericano ysuspender visas de altos funcionariosdel gobierno de Bogotá.
La medida podría afectar a11.500 productosque Colombia exporta a los Estados Unidos, entre ellos café, flores y otros productos agrícolas que son parte esencial de la economía sudamericana.
La polémicaamenazaba con desatar una guerra comercialentre ambos países y dejar sus relaciones diplomáticas sumidas en una crisis.
La Casa Blanca informó queColombia aceptó recibir a sus connacionales, aunque aclaró que el acuerdo incluye su regreso en condiciones dignas y puso a disposición el avión presidencial para realizar su traslado.
Las tensiones entre los Estados Unidos y Colombia podrían serun indicio de cambios estructuralesen la relación comercial entre ambos países.
A medida que las políticas comerciales se endurezcan,es probable que Colombia busque diversificar sus mercadosde exportación y fortalecer relaciones con otras naciones.
Sin embargo, mientraslos Estados Unidos siga siendo el principal socio comercialde Colombia, las repercusiones económicas de este conflicto no desaparecerán fácilmente.
Por delante, se presenta un panorama desafiante para el país sudamericano. Si bien las medidas adoptadas por ambos presidentes están impulsadas por diferencias políticas,los efectos económicos podrían ser de alto impacto, especialmente en términos de competitividad de las exportaciones colombianas, el valor del dólar y la estabilidad económica del país.
SN
Newsletter Clarín
Recibí en tu email todas las noticias, coberturas, historias y análisis de la mano de nuestros periodistas especializados",https://www.clarin.com/economia/trump-versus-petro-peso-colombiano-abrio-semana-fuerte-caida-tension-diplomatica_0_1yWkewpVu6.html
Clarín,2025-01-27,Aumento del agua: la suba será del 1% a partir de febrero,"A través de la Resolución 11/2025, publicada este lunes en el Boletín Oficial, el Gobierno formalizó un aumento de 1% en las tarifas del servicio de agua corriente en el Área Metropolitana de Buenos Aires (AMBA), prestado por la empresa estatal Aguas y Saneamientos Argentinos (AySA).
La Secretaría de Obras Públicas, dependiente del Ministerio de Economía, confirmó que las tarifas de agua en el Área Metropolitana de Buenos Aires (AMBA) para el mes de febrero. La subaquedó por debajo del 3,29% que habría correspondido según la fórmula de actualizaciónque utiliza la empresa estatal para calcular las boletas de agua y cloacas.
Es el segundo mes consecutivo en el que el Gobierno decide limitar el aumento de las tarifas de agua.
La decisión del gobierno de Javier Milei se basa, según la resolución, en que la concesionaria logró mantener el equilibrio económico-operativo,gracias a una tendencia decreciente en la inflación y la optimización de costos durante 2024. Esto permitió que la limitación excepcional al aumento tarifario no comprometa la calidad ni la eficiencia del servicio.
“No se han producido hechos de relevancia que pudieran alterar la tendencia planteada hasta el presente,” señala el documento oficial, lo que hace viable mantener el“Coeficiente de Modificación K” en un 1%mensual hasta que se realice una revisión integral de las tarifas en el transcurso del 2025.
En junio de 2024 se había diseñado un cronograma de ajustes mensuales para el servicio de agua corriente, pero Obras Públicas destacó que desde entonces “se ha producido una notable desaceleración del proceso inflacionario” que obligó a revisar el esquema.
Con esta medida, el Gobierno buscaaliviar la situación económica de los usuariosen medio de la desaceleración inflacionaria.
Entre las decisiones tomadas en la resolución, se destaca:
“Esta medida contribuye a la normalización de la economía y facilita a los usuarios el seguimiento de sus consumos y facturación, sin comprometer los estándares de calidad en el servicio,” indica el comunicado oficial.
Ese esquema de 1% de aumento en lugar del 3% ya había sido usado por el Gobierno en enero pasado. Así lo estableció la Resolución 299/2024 del ministerio de Economía, publicada en el Boletín Oficial el 30 de diciembre pasado.
De esta forma, Aysa se sumó al listado de empresas de servicios que ""pisan"" los aumentos para bajar la presión sobre el Índice de Precios al Consumidor (IPC).
De esta manera, el Ministerio de Economía busca continuar con el proceso de baja de la inflación y anclar la evolución de los precios de la economía a una cifra mensual que esté por debajo del 2%.
SN
Newsletter Clarín
Recibí en tu email todas las noticias, coberturas, historias y análisis de la mano de nuestros periodistas especializados",https://www.clarin.com/economia/aumento-agua-suba-1-partir-febrero_0_P6L3ouzrdH.html
Clarín,2025-01-27,Real hoy y real blue hoy: a cuánto cotiza y cuál es el precio de la moneda brasileña este lunes 27 de enero,"Elrealcotiza a $170,96 para lacompray a $171,17 para laventaeste lunes 27 de enero de 2025, de acuerdo con la información que proporciona el sitio del Banco Nación.
Con respecto a la divisa en el mercado paralelo, elreal blue hoytiene un precio de $196,75 para la compra y de $216,75 para la venta, una información que muchos argentinos consultan antes de viajar aBrasilpor turismo o negocios.
De este modo,la brecha entre el real blue y el real oficiales de 13.11%.
De acuerdo con la variación de la divisa brasileña en el mercado informal, un dólar equivale a R$6.12 reales, por lo quecon 100 dólares se pueden comprar R$612.45 reales.
El real es la moneda de curso legal deBrasildesde 1994, cuando reemplazó al cruzeiro real. Es la vigésima moneda más negociada en el mundo y la primera en Sudamérica. Su símbolo esR$y cuenta conbilletesde hasta 200 reales de denominación.
Eldólar oficialcotiza este lunes 27 de enero de 2025 a $1029 para la compra y $1069 para la venta en las entidades bancarias.
En tanto, el dólar blue se consigue a $1205 y se vende a $1225 en el mercado paralelo.
Newsletter Clarín
Recibí en tu email todas las noticias, coberturas, historias y análisis de la mano de nuestros periodistas especializados",https://www.clarin.com/economia/real-hoy-real-blue-hoy-cotiza-precio-moneda-brasilena-lunes-27-enero_0_nTzuyRQiKY.html
