diario,fecha,titulo noticia,contenido,link
Pagina 12,2025-01-04,Cierra una planta de Dass: se profundiza la crisis del sector de calzado,"La empresa de calzados e indumentaria Dassdespidió a 300 trabajadores y anunció su cierrea través de los telegramas con los que echó a casi la totalidad de sus empleados. La compañía fabrica para grandes marcas, como Adidas, Asics, Umbro, Fila, y anteriormente lo hizo para Reebok. La firma, de capitales brasileños, aduce caídas en las ventas y advierte mayoresproblemas por la ola importadora. Unificarán la producción en Misiones, donde tienen otra planta.
En la localidad de Coronel Suárez, al centro sur de la provincia de Buenos Aires, el segundo día del año no fue de festejos sino todo lo contrario. 300 de los 42.200 habitantes que hay en todo el distrito se habían quedado sin trabajo. El telegrama que les empezó a llegar a sus domicilios el 2 de enero era categórico: ""Nos dirijimos a usted a fin de notificarle que,como consecuencia del cierre del establecimiento, prescindimos de sus serviciosa partir del 20/01/2025"".
""Ayer (por el jueves)repartieron 50 telegramas y hoy 50 más. Nos vamos llamando entre laburantes, contanto a quién ya le llegó y a quién aún no, esperando que lo que estamos viviendo no sea real, pero es tan real"", contó aPágina 12Marcelo Melchor, delegado de Unión de Trabajadores de la Industria del Calzado (Uticra) en la fábrica.
Dass era hasta este comienzo de 2025 una de las tres principales empleadoras de la zona, junto con el agro y la papelera Smurfit. Además,otros talleres y pequeñas fábricas familiares de hasta ocho trabajadores abastecían a la firma de calzadosy ahora se encuentran en riesgo ante la incertidumbre que produce la baja de persianas inminente de la compañía en manos de industriales cariocas.
Una maniobra habitual de la firma era otorgar vacaciones durante las fiestas para evitar abonar los feriadosy eso volvió a suceder el pasado diciembre. Sin embargo, antes de que terminara el receso llegó la noticia: perdían su fuente de ingreso.
Marcelo Melchor tiene 58 años y dice ""es difícil reinsertarse"", como él es delegado todavía no recibió telegrama. Trabajó por 18 años en la ex Gaticc y hace otros 17 que es empleado en Dass: ""vaciaron la nave de depósitos antes que saliéramos de vacacionesy eso jamás ocurrió. Nunca vi algo igual. Solo quedó la maquinaria y lo que hay para producir"".
Para poder dejar la planta sin stocks, pagaron horas extras y luego adelantaron vacaciones completas a todo el personal.""Siento bronca"", con la voz quebrada repite ""bronca"". Habla de sus compañeros, cuenta que las empresas de calzado eligen en distintos momentos del país invertir en Suárez porque ""es muy buena la mano de obra"", que se transmite de generación en generación, en las casas.
""La planta está parada totalmente porvacaciones de todo su personal"", sostuvieron desde la Uticra nacional y adelantaron que el miércoles próximo habrá una reunión en La Plata entre el gobierno bonaerense, el intendente local, Dass y el sindicato.
Desde el municipio intentaron comunicarse conGuillermo Francos, jefe de Gabinete de Ministros, y conDaniel Scioli, titular de la Secretaría de Turismo de la Nación, ya que habían mantenido algún tipo de vínculo más cercano en otro momento, pero no recibieron respuestas. Hasta el cierre de esta edición, ningún funcionario nacional se había contactado para interiorizarse en el conflicto.
""La situación es preocupante, la caída de la producción en el sector es del 15 por ciento, las ventas disminuyeron 20 por ciento ylas importaciones de calzado terminado crecieron 50 por ciento"", advirtió aPágina/12Horacio Moschetto, presidente de laCámara de la Industria del Calzado(CIC). En este sentido, también agregó otros problemas, como la diferencia de precios con productos que vienen de Oriente y la presión tributaria, ""que sigue siendo muy alta para la producción nacional"".
Según se anunció,Dass va a relocalizar la fábrica en Eldorado, Misiones, donde tienen otra en funcionamiento. Sin embargo, sobre esta maniobra los trabajadores tienen otra sospecha: que trasladen la maquinaria hasta la provincia mesopotámica y ya más cerca de Brasilmigren todo a su paísde origen, aumentando el tendal de desocupados.
""Adidas internacional es el principal responsable, no Dass, porque la multinacional elige producir en los lugares donde puede achicar los llamados costos laborales y reduce los pedidos"", opinaron desde Uticra nacional y agregaron que no saben las causas de la decisión pero ""podemos inferir que se debe a la apertura total del comercio de importaciones impulsada por el gobierno"".
En un comunicado, el Grupo Dass explicó que “la medida se enmarca en la necesidad deadaptar las operaciones a la nueva dinámica del mercado en la Argentina, que plantea un cambio de ciclo económico, caracterizado por nuevas condiciones comerciales”. En 2024 registró una producción de 7,8 millones de pares de zapatillas. El gremio y los empresarios mantendrán una reunión esta misma noche de viernes.
""La tendencia de las empresas, sobre todo las de calzado deportivo, es dejar de producir a nivel local para empezar aimportar más fácilmente. Hay un mayor crecimiento de las importaciones de calzado terminado, con menos controles aduaneros y tanto en Dass como en sus competidores incrementaron los volúmenes de compras al exterior"", aseguró Moschetto.
La compañía Gatic, de la familia Bakchellian, creó Dass en 1978 y logró convertirla en elmayor fabricante de calzado e indumentaria deportiva de Argentina, con 5.000 trabajadores. Pero la empresa quebró con la crisis de la convertibilidad. En 2003 hubo 2.000 despidos y ""gracias a una gestión de Néstor Kirchner, se consiguió un nuevo dueño"", aseguró Miguel Desch, concejal de Unión por la Patria en el distrito. El Estado sostuvo el fondo de desempleo hasta que fueron reincorporados en su totalidad y llegó a tener 4000 trabajadores. Casi como en el auge.
En 2018, con la presidencia de Mauricio Macri, Dass despidió a más de 800 trabajadores; en 2021 y 2022 reactivó líneas de producción e incorporó 100 empleados. A comienzos de 2024 tenía 900 trabajadores que fue despidiendo en distintas oportunidades. 2025, por las consecuencias de la política económica libertaria, todo parece indicar que la decisión de cierre es irreversible ""Está matando a la industria nacional. Los productos que llegan de Asia son 50 por ciento más baratos que producirlos acá"", denuncia Melchor.
Bicontinentar, también ubicada en territorio bonaerense, mantuvo su planta tomada por los trabajadores ante un posible cierre. Los pedidos de fabricación para terceros se redujeron un 80 por ciento. Funciona en Chivilcoy, está gestionada por brasileños y la trayectoria histórica es melliza a la de Dass.
Topper Tucumánparalizó la producción en distintas oportunidades por exceso de stock.
La firmaGrimoldi, destacada en el mercado de calzado y accesorios en Argentina, sufrió el9 por ciento de la caída interanualde ventas durante los primeros nueve meses del año 2024.
Según el Índice de Producción Industrial Manufacturero que elabora el Indec,la producción de calzado, sólo en octubre2024,tuvo una retracción de 13,5por ciento y los datos de la Cámara Argentina de la Mediana Empresa (Came) sobrecalzado y la marroquinería mostraron una reducción de 7 por cientode ventas en el acumulado del año pasado.
Respecto a lasventas de indumentaria, los números tampoco fueron mejores. De acuerdo con la Cámara Industrial Argentina de la Indumentaria (Ciai), lacaída interanual fue de 11,5 por cientopara el bimestre septiembre-octubre.",https://www.pagina12.com.ar/794564-cierra-una-planta-de-dass-se-profundiza-la-crisis-del-sector
