diario,fecha,titulo noticia,contenido,link
Pagina 12,2025-03-14,La industria tomatera en alerta,"Laindustria del tomate en Cuyoatraviesa una fuerte crisis a raíz de las importaciones en gran escala de pasta de tomate provenientes China y Chile, y tomate fresco desde Paraguay. Las compras se realizan en condiciones perjudiciales para el productor local: a precios significativamente más bajos que los costos internos, lo cual pone en jaque a la industria, de peso en La Rioja, Mendoza y San Juan principalmente.",https://www.pagina12.com.ar/810533-la-industria-tomatera-en-alerta
Pagina 12,2025-03-14,Rechazan su cambio a S.A.,"El Juzgado federal número 2 de La Plata hizo lugar al pedido de amparo presentado por trabajadores del Banco Nación contra la resolución del Poder Ejecutivo de convertir ese ente autárquico en sociedad anónima, y dispuso la suspensión de los efectos del Decreto 116/2025.
Dicho decreto, del 19 de febrero pasado, disponía la transformación del BNA en una sociedad anónima bajo el régimen de la Ley General de Sociedades N° 19.550, aprobaba el Estatuto Social de esa nueva sociedad e instruía al Directorio a tomar las medidas necesarias para llevar a cabo esa transformación y su inscripción ante la IGJ.
En su parte resolutiva, el fallo señala que ""los antecedentes legales expuestos confirman que la modificación de la Carta Orgánica del Banco de la Nación Argentina debe realizarse a través de un proceso legislativo en el Congreso de la Nación, máxime si éste implica una modificación sustancial, como es en el caso la pretensión de transformar su naturaleza jurídica"".
El magistrado considera ""acreditado que el Banco de la Nación Argentina no puede ser modificado en su estructura jurídica a través del decreto  116/2025, conforme el texto de la ley 27.742 (arts. 1 y 3, invocados en los fundamentos de su dictado)"".
",https://www.pagina12.com.ar/810665-rechazan-su-cambio-a-s-a
Pagina 12,2025-03-14,Se levantó la huelga nacional de aceiteros,"Luego de la nueva conciliación obligatoria dictada este jueves por el Gobierno nacional, el Sindicato de Obreros y Empleados Aceiteros Departamento San Lorenzo (SOEA) y la Federación de Trabajadores del Complejo Industrial Oleaginoso, Desmotadores de Algodón y Afines de la República Argentina (FTCIODyARA), levantaron el paro nacional previsto en todos los complejos industriales vinculados al sector.
La medida de fuerza en todo el país había sido anunciadaluego de la represión que sufrieron los trabajadores de la empresa Explora cuando reclamaban la reincorporación de los despedidos.
La audiencia entre los gremios y la agroexportadora Explora con fecha dellunes 17 de marzo a las 14:00en la Secretaría de Trabajo nacional pretende retomar el diálogo de las partes en una mesa de negociación. ""A partir de este momento se levanta la medida de fuerza en todos los complejos industriales, atento que la cartera laboral ha tomado el asunto entre sus prioridades"", afirmaron en un comunicado conjunto SOEA y (FTCIODyARA).
En ese marco, también reiteraron que rechazan ""todo tipo de represión"" y que continúan con el pedido dereincorporación de los trabajadores""ilegítimamente despedidos"".
Este jueves, el puerto de Rosario, punto estratégico para la exportación de cereales argentinos, permaneció paralizado por medidas de fuerza gremiales. Fue luego de quelos trabajadores denunciaran que habían sido reprimidos por la Prefectura Naval Argentina en las instalaciones de la planta de biodiéselde la compañía Explora SA de Puerto San Martín.
El freno de la actividad, en medio de una conciliación obligatoria que regía desde la noche anterior, llevó a las entidades que agrupan al sector a denunciar el paro ante la Secretaría de Trabajo de la Nación.
El titular de la Cámara de la Industria Aceitera de la República Argentina (Ciara) y del Centro Exportador de Cereales (CEC), Gustavo Idigoras, rechazó la iniciativa, aseguró que los sindicatos “buscaron crear el conflicto” y comentó un video filmado en la puerta de la compañía cuestionada donde se escucha a gremialistas pedir: “Vamos, empujemos que paramos los puertos”.
Sin embargo, los sindicatos sostienen que quien incumplió con la decisión de la cartera laboral fue la patronal porqueno retrotrajo los despidos. En este contexto, advirtieron que un supervisor “orquestó una provocación tirándole el vehículo encima a varios obreros, quienes le reclamaron por esta situación. A partir de ahí la Prefectura Naval Argentina tomó la absurda decisión de movilizar 60 efectivos para reprimir a los 25 trabajadores de la planta”.
Los empresarios del rubro aseguran que ""ningún salario perderá frente a la inflación"" en 2025 y que buscan destrabar el problema ""a través del consenso"" para evitar mayores perjuicios. Explora S.A de Puerto San Martín está asociada a la Cámara Argentina de Biocombustibles (Carbio), signataria de los Convenios Colectivos Aceiteros junto a Ciara.",https://www.pagina12.com.ar/810631-se-levanto-la-huelga-nacional-de-aceiteros
Pagina 12,2025-03-14,YPF sólo estará en Vaca Muerta,"El presidente y director ejecutivo (CEO, por su sigla en inglés) de YPF, Horacio Marín, confirmó este jueves en Houston que la empresa aspiura a desprenderse este año de todos los yacimientos maduros de explotación convencional, para concentrar todas sus inversiones a partir de 2026 en Vaca Muerta. La decisión supone un cambio histórico de paradigma productivo de la petrolera estatal, ya que significa el abandono de su actividad de extracción en todo el territorio nacional, con excepción de Neuquén, para el desarrollo de los proyectos de producción no convencional de gas y petróleo.
Los medios acreditados en el encuentro convocado por IAPG Houston, al que concurrieron decenas de ejecutivos de compañías petroleras internacionales, dieron cuenta de las definiciones del titular de YPF. Según informa el portal Econojournal, el ejecutivo argentino informó que este año YPF avanzó en la desinversión en 55 campos maduros, es decir de explotación primaria semiagotada por método convencional de extracción.
Lo propio se logró a través del denominado Proyecto Andes, el plan de negocios a través del cual se pusieron en venta los bloques productivos que tenía concesionados YPF en Mendoza (donde ya completó su salida), Neuquén, Río Negro y Chubut, según señala el mencionado portal, citando las referencias dadas por Marín.
En Chubut, en particular, ya se habría puesto en conocimiento de autoridades y directivos de la provincia la intención de la puesta en venta en lo inmediato del bloque Manantiales Behr, perteneciente al Golfo de San Jorge. Se aseguró que ya existen varias empresas privadas interesadas.
En cambio, las áreas productivas en manos de YPF en las provincias de Santa Cruz y Tierra del Fuego no serán transferidas directamente a otras empresas, sino que se ""reversionarán"" (serán devueltas) a las administraciones provinciales, probablemente para ser reconcesionadas.
""A partir de 2026, queremos concentrarnos únicamente en Vaca Muerta"", expresó Marín este jueves en Houston. La prioridad de la empresa estará puesta en aumentar la rentabilidad, para lo cual no sólo se desprenderá de las áreas menos productivas (extracción convencional) sino que además buscará bajar los costos que le cobran las empresas de servicios a YPF en Vaca Muerta.
""En Argentina, esos costos son entre 30 y 50 por ciento más altos que en Estados Unidos"", señaló Marín en la sede de Houston del Instituto Argentino del Petróleo y el Gas (IAPG).
Por otra parte, según reveló la agencia internacionalReuters, Horacio Marín aseguró que YPF busca acelerar su plan de desinversión, que ""incluye vender participaciones en proyectos de exploración offshore en Argentina y Uruguay"". Esto abarcaría seis bloques en el Mar Argentino y un séptimo en aguas jurisdiccionales uruguayas, en la denominada Cuenca Punta del Este.
Aunque esto último no fue confirmado por fuentes locales, la orientación que Marín le está dando s su gestión significa el abandono de una de las premisas de un paradigma en la historia de YPF que aun hoy sigue expresada en su página de presentación en la web: ""Los proyectos de exploración son parte esencial de la cultura de YPF"".

",https://www.pagina12.com.ar/810624-ypf-solo-estara-en-vaca-muerta
