diario,fecha,titulo noticia,contenido,link
Pagina 12,2025-01-08,Tendencia positiva en títulos públicos y acciones,"Los mercados continúan apostando a favor del gobierno, con subas de acciones y bonos. Mientras tanto, el dólar blue registró este martes su primera alza del año, a $1.195 para la compra y $1.215 para la venta. Fue consecuencia de una mayor demanda de divisas en medio de las vacaciones de verano. Elspreadcon el mayorista se ubica en 17,3%.
El Banco Central compró este martes u$s 33 millones en el mercado oficial de cambios y las reservas internacionales brutas anotaron un incremento diario de u$s 100 millones, hasta ubicarse en u$s 32.904 millones.
Vale recordar que esta semana los saldos en moneda internacional sufrirán una caída importante por el pago de amortización e intereses de los bonos de deuda en dólares.
Con las compras de este martes, la autoridad monetaria acumula un saldo positivo de u$s 338 millones, luego de los u$s 904 millones que sumó en el mes previo.
El billete paralelo viene de cerrar el 2024 con una suba de 20% (+$205) frente a una inflación que sería del 120% en el total anual, según las estimaciones. Pero solo en diciembre dio un salto de 9,8%, el más alto desde junio. En la primera semana de 2025, este tipo de cambio anotó una baja de $10 (-0,8%).
En el mercado oficial de cambios, el dólar mayorista subió 50 centavos a $1.036. El dólar MEP baja a $1.164,50, por lo que la brecha con el oficial se ubica en el 12,4%. En tanto, el Contado con Liquidación (CCL) cede a $1.184,22 y el spread con el oficial se posiciona en el 13,9%.
El dólar tarjeta o turista, y el dólar ahorro (o solidario) operó a $1.372,15.Y el dólar cripto o Bitcoin cotiza a $1.201.
Las acciones operaron subas de hasta casi 4%, encabezadas por Transportadora Gas del Sur (+3,6%), seguida de BBVA (+2,9%), Grupo Financiero Galicia (+1,7%) e YPF (+1,4%). Mientras que, las que más bajan son las de Edenor (-2,3%), Central Puerto (-1%) y Banco Macro (-0,9%).
En tanto, los papeles que cotizan en Nueva York escalan hasta 7%, de la mano de Bioceres. Luego aparecen los avances de BBVA (+5,3%), Telecom (+5,3%), Vista (+5%), Supervielle (+4,8%), e YPF (+4,4%).
Por su parte, el valor del riesgo país generó confusión y desconcierto en el mercado, al registrar una fuerte baja desde el comienzo de la jornada, hasta tocar un mínimo desde mayo de 2018. El Ministerio de Economía aclaró que se había tratado de un error.
Este indicador del banco JP Morgan llegó a bajar hasta los 444 puntos básicos, un día después de haber perforado la barrera de los 600 puntos.Sin embargo, esta caída abrupta de más de 20% respondió a un ""error"" en la medición técnica. De acuerdo con Felipe Núñez, funcionario del Ministerio de Economía, estos valores del riesgo país respondieron a un ""descalce"" en el precio por el pago de cupones y amortización de los bonos.
Sin embargo, la tendencia a la baja de este indicador continúa, y luego de que JP Morgan enmendó el error, el riesgo país mostraba hacia el cierre de la rueda una baja de 1,4% a 561 puntos básicos, nuevo mínimo desde 2018.
Los bonos en dólares suben hasta 0,6% encabezado por el Global 2035, seguido por el Bonar 2035 (+0,4%), el Global 2038 y 2041 (+0,3%).En tanto ceden hasta 0,5% el el Bonar 2029, el Global 2029 (-0,4%) y el Bonar 2038 (-0,3%).
""La profundización en la caída del riesgo país se da en la semana del pago de cupones y amortizaciones de (bonos) Globales y Bonares el jueves, tras la cual creemos que parte del flujo podría ser reinvertido en los mismos bonos, impulsando aún más la compresión de spreads "", dijo el economista jefe del Grupo SBS, Juan Franco.",https://www.pagina12.com.ar/795312-tendencia-positiva-en-titulos-publicos-y-acciones
Pagina 12,2025-01-08,"""Habrá fondos del FMI para salir del cepo""","El ex director del Fondo Monetario Internacional Claudio Loser estimó que entre este mes y el próximo habría nuevos créditos del organismo para la Argentina para mejorar los niveles de reservas y ""empezar a hablar seriamente de salir del cepo"".
""Sigo convencido que entre este mes y el que viene vamos a tener nuevos fondos, no tanto como el Gobierno quisiera para salir del cepo, pero ya con el riesgo país reducido y alguna gente mirando esta diferencia pequeña entre el tipo de cambio oficial y el blue, yo creo que el Fondo va a poner plata para mejorar las reservas y que se podrá empezar a hablar seriamente de salir del cepo"", afirmó el economista que estuvo a cargo del caso argentino en la crisis de 2001.
""Ahora se van a sentar a negociar y creo que habrá una pronta visita del FMI"", indicó, al tiempo que afirmó: ""Estoy seguro que va a haber un nuevo programa y que Trump puede ayudar"".
En su evaluación, aclaró que ""si no se cumplieron las metas de reservas, yo creo que de todas maneras la plata que queda por desembolsar va a desembolsarse y que habrá un nuevo programa"".
Loser dijo, de todos modos, que ""no va a dar mucho dinero porque los otros socios, que son los que realmente tienen que poner dinero, van a decir que la Argentina ya nos debe mucho"".
Consultado sobre el riesgo de tomar deuda externa, dijo que ""esto desde que tengo memoria se ha dado, en este caso la diferencia es que no hay deficit fiscal"". ""Pienso que por la consolidacion fiscal, la consolidación monetaria y a pesar de que las reservas crecieron menos de lo que se pensaba, esto le da un fuerte apoyo a la Argentina. No ha entrado tanto capital como en la época de (Mauricio) Macri o en los años 90, así que en ese sentido creo que es menor el riesgo"", consideró.",https://www.pagina12.com.ar/795356-habra-fondos-del-fmi-para-salir-del-cepo
Pagina 12,2025-01-07,"Dólar blue, dólar hoy: a cuánto cotizan el martes 7 de enero de 2025","Seguí en vivo las cotizaciones de todos los tipos de dólar para este martes.


Las ventas de juegos y juguetes para el Día de Reyes mostraron un aumento del 3,5 por ciento en comparación con 2024, luego de dos años consecutivos de caídas, según informó la Cámara Argentina de la Industria del Juguete.
Los costos del transporte de cargas aumentaron 1,7 por ciento en diciembre, cerrando 2024 con un incremento acumulado del 85 por ciento, según reveló un informe de la Federación Argentina de Entidades Empresarias del Autotransporte de Cargas (FADEEAC).
La caída de lasventas minoristas de las pymes habría alcanzado al 10 por ciento al comparar el total de 2024 con el año 2023,según una estimación realizada por la Confederación Argentina de la Mediana Empresa (CAME). Según el mismo relevamiento, en diciembre las ventas repuntaron pero no como para amortiguar la caída anterior. El sector Alimentos y bebidas fue el que mostró mayores dificultades para afrontar los sueldos durante el último mes del año, según los resultados de la encuesta.
Por Mara Pedrazzoli
El número de trabajadores monotributistas creció 61 por ciento, mientras que la cantidad de trabajadores con empleo asalariado registrado solo se expandió 3 por ciento en los últimos doce años. Es un cambio de modalidad vinculado sin duda a la digitalización laboral. El algoritmo se lleva las ganancias mientras el trabajador pierde derechos, lo cual reclama una agenda urgente y moderna que ataque a la precariedad y heterogeneidad productiva que caracterizan al país.
En diciembre, la producción nacional de vehículos alcanzó las 38.018 unidades, lo que representa una disminución del 29,2 por ciento en comparación con noviembre, mientras que hubo un aumento del 2,8 por ciento frente a diciembre de 2023. Durante todo2024, se produjeron 506.571 vehículos, lo que marcauna caída del 17,1 por cientorespecto a 2023. Los datos fueron publicados este lunes por Adefa, la entidad que agrupa a los fabricantes de autos, y muestran que el año pasado el sector automotor fue una más de las industrias golpeadas por las políticas de ajuste.
Por Bernarda Tinetti
El Ejecutivo nacional disolvió tres fondos fiduciarios vinculados a la vivienda social, la agricultura familiar y las comunicaciones, que se suman a otros 15 por los que ya habían pasado la motosierra libertaria bajo el slogan de ""irregularidades en el manejo de los fondos y el incumplimiento de objetivos"" sin reparar en las comunidades beneficiarias y los fines de integración y desarrollo territorial de esas políticas públicas.

La venta de insumos para la construcción cerró 2024 cayó en diciembre 6,6% en forma interanual y 1,2% con relación a noviembre en forma desestacionalizada, según el Índice Construya (IC).
Este indicador mide la evolución de los volúmenes vendidos al sector privado de los productos para la construcción que fabrican las empresas que lo conforman.
""Durante 2024 se vio una reducción de las ventas de materiales para la construcción con algunos meses de repunte. Creemos que el proceso de recuperación será lento y estará asociado a la reactivación de las obras privadas, traccionado principalmente por la expansión del crédito hipotecario y la búsqueda de inversión en ladrillos"", señalaron desde Construya.
De esta forma, el acumulado de enero-diciembre de 2024 cerró 27,2% por debajo del mismo período del año anterior.
La merma está impactada por la eliminación de la obra pública y por un aumento de los costos en dólares que ralentiza los nuevos proyectos.
El Riesgo País de la Argentina cayó este martes a 454 puntos básicos, el más bajo desde mayo de 2018, según cita la agencia de noticias Reuters.
Es una disminución de 100 puntos con relación a la víspera, rueda en que había perforado el piso de 600 puntos.
Este escenario acerca al país al retorno a los mercados voluntarios de deuda pública lo cual facilitará el manejo de los próximos vencimientos.
El jueves Argentina pagará US$4.341 millones en capital e intereses de bonos soberanos.
El dólar abrió a $1015 para la compra y $1055 para la venta.
El índice Merval de la bolsa porteña marcó un nuevo récord medido en dólares tras aumentar un 2,4 por ciento, mientras que el riesgo país terminó debajo de los 600 puntos. El indicador elaborado por el JP Morgan terminó en 569 unidades y alcanzó los niveles más bajos desde 2018. El Banco Central compró divisas en el mercado de cambios y los dólares financieros se mantuvieron estables. La plaza especulativa le dio una alegría, en el comienzo de esta primera semana del año, al ministro Luis Caputo.",https://www.pagina12.com.ar/795171-dolar-blue-dolar-hoy-a-cuanto-cotizan-el-martes-7-de-enero-d
