diario,fecha,titulo noticia,contenido,link
Pagina 12,2025-03-25,Carne vacuna para pocos,"El consumo de carne vacuna en Argentina alcanzó otro mínimo histórico desde que gobierna Javier Milei. Mientras los cortes continúan aumentando en mostrador, febrero mostró una caída per cápita del 5,4 por ciento interanual, el equivalente a2,8 kilos menos por persona. El dato mete presión a uno de los pilares de la gestión libertaria: la baja de la inflación.
La recuperación del poder adquisitivo no llega. Entre los productos tradicionales de la canasta de alimentos argentina que las familias debieron restringir se destacan las carnes rojas. Mientras en el segmento caen los números de producción, consumo interno e incluso exportación crecen como opción la demanda de pollo y cerdo.
El período febrero 2024-enero 2025 registróel consumo más bajo en las últimas tres décadas: 47,8 kilos per cápita al año.
Consumo
De acuerdo con el último reporte de la Cámara de la Industria y el Comercio de Carnes y Derivados de la República Argentina (Ciccra), en febrero el promedio anual por habitante quedó en 48,8 kilos:una retracción de 5,4 por cientorespecto al mismo mes del año anterior. De esta manera, en los últimos doce meses cada persona dejó de comer 2,8 kilos de cortes vacunos.
En la comparación bimestral respecto a 2024, cuando apenas iniciada la administración libertaria decidió devaluar el peso 50 por ciento y se desconocía el rumbo de la nueva gestión por “falta de experiencia de los funcionarios”, los números dan mejor.
El consumo aparente de carne vacuna habría ascendido en los meses enero y febrero a 392,7 mil toneladas res con hueso (tn r/c/h): 13,1 por ciento encima de igual período del año anterior. En términos absolutos, el consumo aparente habría sido 45,5 mil tn r/c/h superior en la misma relación, según el informe de Ciccra.
Producción
El leve repunte en las ventas de carne vacuna -sobre indicadores muy negativos de los primeros meses de Milei como presidente de la Nación- está lejos de equipararse a los números habituales del consumo de estos alimentos yse mantiene en mínimos históricos.
Entre febrero de 2024 y enero de 2025 el consumo interno del producto quedó en 47,8 kilos per cápita. El más bajo en tres décadas.
La retracción de las ventas y algunos temas estacionales provocaron unavariación negativa en la producción: cayó 1,7 por ciento en primer bimestre de 2025, es decir 499 mil tn r/c/h menos. Estas estimaciones concluyeron que en términos absolutos, la cantidad ofrecida de carne vacunase redujo en 8.500tn r/c/h con relación a un año atrás.
Como contracara, la faena de cerdo aumentó 4 por ciento en el mismo período y el pollo quedó por primera vez arriba de la carne vacuna en el ranking de consumo a nivel nacional, durante el último año.
Otro factor de impacto en la reducción de la producción fueeldesplome de las exportaciones a China, con caídas de 33,7 por ciento interanual en el primer bimestre: se enviaron 54 mil toneladas menos hacia los mercados internacionales.
Precios
La mejora parcial de las ventas de carnes rojas en carnicerías ocurre en un contexto de aumento de precios en todos los cortes: solo en febrerosubieron entre 7,6 por ciento y 13,6 por ciento. Y en marzo volvieron a sufrir remarcaciones.
""En la comparación mensual el proceso de desaceleración se interrumpió, principalmente debido a la suba de 12,1% del precio promedio de los cortes vacunos y a su elevada importancia en la estructura de ponderaciones del índice, lo que generó un aporte de 0,6% a la variación mensual"", explicaron desde Ciccra sobre el peso de los precios minoristas de la carne en la canasta de inflación.
El análisis de la cámara, detalló además que en febrerola nalga fue la que más aumentó(13,6%). Le siguieron el cuadril (13,1%), la paleta (12,6%), la carne picada común (11,3%), el asado (9,9%) y la caja de hamburguesas congeladas (3,5%). En cambio, el pollo entero registró un incremento de sólo 0,4 por ciento mensual.
La gestión de Milei sostiene como una de sus principales políticas económicas la reducción de la inflación. El febrero, el Índice de Precios que elabora el Indec mostró en “Alimentos y bebidas no alcohólicas” uncrecimiento de 3,2 por ciento intermensualempujado principalmente por el valor de las carnes rojas.",https://www.pagina12.com.ar/813180-carne-vacuna-para-pocos
Pagina 12,2025-03-25,Reunión clave del FMI y qué pasará con el dólar,"Los días previos a la aprobación en la Cámara de Diputados del DNU que autoriza el acuerdo con el FMI, los mercados reaccionaron con volatilidad: los dólares financieros aceleraron el alza, mientras cayeron los bonos globales, reflejando la incertidumbre sobre una posible transformación del régimen cambiario antes o después de las elecciones de medio término.PáginaI12consultó a economistas sobre el tenor de estos movimientos y la fragilidad económica que advierten en el actual modelo. Este martes habrá una reunión clave del directorio del Fondo Monetario Internacional para tratar el caso argentino de manera informal, paso previo a su aprobación definitiva.
“Está por verse si será una devaluación controlada o descontrolada”, afirmaRoberto Feletti,ex diputado nacional y ex Secretario de Comercio. Unadevaluación controlada“dependerá exclusivamente del acuerdo con el FMI y del monto involucrado, los rumores llegan a una cifra similar a lo que faltó desembolsar en el préstamo de Macri, es decir unos 11.000 millones de dólares, pero otros hablan de 20.000 millones”, en tanto unadevaluación descontrolada“es realizada por los mercados si se impacientan por la firma del acuerdo con el FMI”.
En esa dirección,Haroldo Montagú, director de la consultora Vectorial, señala que hay dos grandes dudas: “Primero, el monto total del préctamoy qué opina el mercado de este monto, si es más o menos de lo que el Gobierno dejó trascender, y en segundo lugar resta ver cómo serán los desembolsos, con qué frecuencia y las condicionalidades que exijan en materia de política económica”, esta falta de certezas augura la fragilidad financiera que vimos la semana pasada se mantendrá hasta concretar el acuerdo.
Pablo Moldovan, director de CP Consultora, pone el acento en el cambio de ciclo que anticipan las últimas ruedas en el mercado cambiario. “El Gobierno fracasó en conseguir los dólares faltantes en el mercado, y recordemos que hasta diciembre pasado las autoridades aseguraban que no firmarían ningún acuerdo con el FMI salvo que este aceptara a sus condiciones”, aclara, pero ahora la situación es la inversa y “no está claro que la firma de un acuerdo permita calmar las expectativas de los inversores o termine aumentando el problema del faltante de dólares como pasó en 2019”.
Esto ocurre, además, “en un mercado del dólar que es bastante complejo, que está dominado por los flujos financieros: el Gobierno controla los dólares paralelos con el saldo en divisas que deja el intercambio comercial de bienes y compra en el mercado oficial dólares por el flujo de deuda privada para hacer carry trade”. Pero con el anuncio del acuerdo con el Fondo empezaron a desarmarse posiciones de carry “posiblemente de exportadores e importadores en un número importante –el Central vendió 1.200 millones de dólares en las últimas seis ruedas- de modo que hasta el momento, con anuncios y sin precisiones,vemos que el salvataje del Fondo solo rompió el ciclo financiero”.
En este punto “el modelo depende muchísimo de lo que pase en el sistema bancario, de que la gente no retire los depósitos”, coincide en señalarMartín Burgos, director del Departamento de Economía del Centro Cultural de la Cooperación. También plantea que existe un riesgo a volver a esta misma situación en menos de un año “si ingresa el préstamo del FMI y se recomponen las reservas con una devaluación, pero al tiempo se deja otra vez el tipo de cambio fijo y no se realizan políticas productivas”.
ParaBianca Roldán, asesora financiera e investigadora en el CIHESRI, FCE-UBA, el Gobierno enfrenta el desafío de “mantener el actual esquema cambiario en un año electoral” y en este contexto lo que se conoció del anuncio tampoco lleva tranquilidad. “Se confirmó que la tasa del préstamo con el FMI sería superior a la de la deuda con el Banco Central, lo que eleva la carga del servicio de deuda y plantea un interrogante fundamental:¿cómo se garantizará el repago de estos compromisos sin agravar el deterioro de las reservas ni generar mayor presión sobre el tipo de cambio?”.
“El programa económico del Gobierno entró en una crisis clásica de sector externo, que estuvo retrasada por el éxito del blanqueo por 23.000 millones de dólares y el superávit comercial de 18.600 millones”, analiza Roberto Feletti. Pero el Gobierno con esos dólares “hizo lo mismo que en  2018: le pagó un diferencial importante a los agentes externos para que inviertan sus excedentes en pesos, y con un tipo de cambio anclado las ganancias en dólares llegaron a un 70 por ciento, eso le permitió al Central acumular reservas”. Pero ese ciclo se terminó porque “hoy las reservas del Banco Central están en 26.500 millones: apenas por arriba del peor registro que tuvimos durante la sequía de 2023”.

“El modelo económico no genera divisas sino que las gasta y cada vez más”, agrega Burgos. “La suba de precios del 2,4 por ciento en febrero es también un aumento de costos en dólares y pérdida de competitividad, lo cual alienta las importaciones y a gastar dólares afuera e irse de viaje”. En este sentido, también desde CP Consultora vienen señalando que el programa cambiario de 2025 es muy distinto del de 2024 y que “el anuncio del acuerdo con FMI revela de alguna manera esto”.",https://www.pagina12.com.ar/813065-reunion-clave-del-fmi-y-que-pasara-con-el-dolar
Pagina 12,2025-03-25,Cese de tareas en el sector de neumáticos,"El sindicato del neumático anunció el cese de actividades, con movilización  a la Secretaría de Trabajo de la Nación, para el miércoles 26 de marzo en rechazo a los despidos ""ilegales"" en el sector y en protesta por la falta de propuestas salariales de las empresas del sector.
La medida de fuerza, que se extenderá desde las 13:30 del miércoles hasta las 14:00 del jueves 27, se formalizó ante la negativa de las compañías del rubro a presentar un plan para el incremento de sueldos que incluya los meses de enero y febrero de 2025.
Bridgestone, Pirelli y FATE, además, no quisieron discutir el aumento del bono extraordinario luego de que fueran publicadas las estimaciones de inflación por parte del Indec.
Desde Sindicato Unido de Trabajadores del Neumático de la Argentina (Sutna) también denunciaron despidos ""ilegales"" en Bridgestone cuando no obtuvo la autorización para extender el Procedimiento Preventivo de Crisis.
En el caso de Pirelli el gremio informó que la firma se retiró de una audiencia en el Ministerio de Trabajo de la Provincia de Buenos Aires sin firmar el acta, donde se le instó a cumplir con el convenio 190 contra la violencia y acoso en el mundo laboral, de la Organización Internacional del Trabajo (OIT).
Por su parte, FATE fue intimada por la misma cartera laboral bonaerense a presentarse con sus directivos en la sede de Tigre para dar explicaciones sobre presuntas irregularidades en la concesión de vacaciones a los empleados.
El Sutna criticó, en el mismo comunicado, la posición de las empresas que privilegian la  importación de neumáticos por sobre la producción nacional.",https://www.pagina12.com.ar/813175-cese-de-tareas-en-el-sector-de-neumaticos
