diario,fecha,titulo noticia,contenido,link
Pagina 12,2025-01-23,"Sin recuperación en V, el consumo no repunta","Mientras el Gobierno nacional continúa transmitiendo mensajes optimistas sobre el rumbo de la economía,el consumo no repuntay así lo demuestran los datos oficiales del mes de noviembre que coinciden con los que anticipaban las consultoras privadas: fuerte retracción interanual de las ventas en supermercados y mayoristas, con una leve recuperación respecto al mes anterior. En shoppings, por el contrario, las compras crecieron 3,8 en términos constantes en comparación con el mismo mes del año anterior.
De acuerdo con los informes delIndec, las ventas en lossupermercados registraron una caída de  7,6por ciento en noviembre con relación a igual mes de 2023 y acumularon un retroceso de 11,9 por ciento respecto a enero-noviembre del año anterior. En relación a octubre, el indicador creció 1,8 por ciento. En el caso de losmayoristas,las ventas se desplomaron 15 por ciento interanualy en comparación al mes anterior aumentaron 1,3 por ciento.
Las señales de recuperación mensual son las que toma el Ejecutivo para defender su modelo económico mientras desde el sector privado son cada vez más los dirigentes que en voz baja o públicamente cuestionan las iniciativas que provocan laretracción del mercado interno y la caída del consumo. Desde el rubro se mostraron aliviados con la estabilización de los precios pero no están tan confiados en que el ingreso de productos importados, principalmente alimentos, mejore la capacidad de compra de bolsillos reducidos.
“Los supermercados deben analizar los precios y conseguir un importador que asegure afinidad y continuidad. Todo depende de las condiciones y del precio final del artículo puesto en la góndola. Queremos que haya opciones de precios para el consumidor, pero siempre apuntamos a apoyar a la industria nacional”, aseguró Víctor Palpacelli, presidente de la Federación Argentina de Supermercados y Autoservicios (Fasa).
Otro de los datos que marca el clima crítico de época esel aumento de los pagos en supermercados con tarjeta de crédito: abarcó al47,5 por ciento de las transacciones.El restante se distribuyó 25,1 con débito; 16,3 por ciento con efectivo y 11,1 por ciento con otros medios de pago.
En relación a las ventas totales de supermercados a precios corrientes, durante noviembre los grupos con los aumentos más significativos en la  variación interanual fueron artículos de limpieza y perfumería, con 174,5 por ciento; lácteos, con 171,3; panadería, con 158,6, y alimentos preparados y rotisería, con 157,1por ciento.
Respecto a losshoppings, las ventas totales a precios corrientes ese mismo mes subieron 134,8 por ciento interanual y a precios constantes se incrementaron 3,8 por ciento. Entre los productos más elegidos se destacan los de indumentaria, calzado y marroquinería.
Según el últimorelevamiento de la consultora Scentia, que adelantó los números de  diciembre, en el último mes del 2024 el consumo masivo cayó 18 por ciento interanual y cerró el primer año de la gestión libertaria con una reducción total de 13,9 por ciento.
Sobre el comportamiento del gasto, un documento reciente de la Cámara Argentina de Comercio (CAC) argumenta que ""para el consumo masivo se está monitoreando su recuperación, mientras que el consumo de bienes durables sí se incrementa con fuerza. Esta dinámica representa un cambio en la estructura de consumos del hogar,orientándose más a bienes durables facilitados por el crédito que a bienes de consumo diario.Con un ingreso disponible que mejorará en 2025, el cambio en la estructura de consumo se profundizará. El modelo económico actual no se ve orientado a generar booms de consumo sino, más bien, a crear un fuerte incremento de la inversión y condiciones de estabilidad macroeconómica que sostengan el crecimiento a mediano y largo plazo"".",https://www.pagina12.com.ar/798836-sin-recuperacion-en-v-el-consumo-no-repunta
Pagina 12,2025-01-23,Puntapié inicial a la negociación,"El ministro de Economía, Luis Caputo, encabeza esta semana las negociaciones con el Fondo Monetario Internacional para cerrar un acuerdo que permita recibir dólares frescos para abrir los controles cambiarios. El ministro no viajó a Davos y se quedó en Argentina, donde llegó esta semana una comitiva técnica del FMI. El gobierno apuesta por recibir más de 11 mil millones de dólares.
El nuevo acuerdo con el Fondo tiene entre sus objetivos refinanciar los 44.000 millones de dólares que Argentina aún adeuda al organismos y obtener un nuevo crédito para recomprar deuda del Banco Central. Según explicó el presidente Javier Milei, este mecanismo no implicará un aumento de la deuda consolidada, sino un cambio de acreedor: el Tesoro Nacional asumirá el compromiso con el FMI en lugar de mantenerlo con el Banco Central.
Si bien el mercado considera que la llegada de Donald Trump a la presidencia de Estados Unidos permitirá acelerar el acuerdo entre Argentina y el Fondo, el organismo de crédito tiene ciertos reparos con el país. El FMI insiste en que la liberación de los controles cambiarios y la flotación del peso son claves de un programa económico. Se busca atar la entrega de nuevos fondos a que se cumplan estas condiciones.
En el equipo económico tienen un manejo de las intervenciones en los dólares financieros que no cierra con las lógicas del Fondo. En los primeros quince días de diciembre, el Banco Central utilizó 619 millones de dólares para contener el precio del dólar, según reveló el vicepresidente de la entidad, Vladimir Werning, durante una disertación en Londres.
Cristian Buteler, economista especializado en política monetaria, advirtió que ""la intervención del Banco Central se utiliza principalmente para bajar el dólar y no para mantener la base monetaria estable"". Según su análisis, el nivel actual de intervención es el más alto desde el relanzamiento del programa de estabilización.
El levantamiento de los controles es una promesa central del gobierno de Javier Milei, pero depende en gran medida de la capacidad de cerrar un acuerdo sólido con el FMI. Mientras tanto, el equipo económico apunta a sostener el tipo de cambio, que entre los inversores empieza a plantearse que se encuentra ultra apreciado.
Caputo y su decisión de permanecer en Buenos Aires priorizando las negociaciones con el FMI en lugar de asistir al Foro Económico Mundial en Davos, apunta a mostrar al mercado que estas negociaciones son prioridad del gobierno.",https://www.pagina12.com.ar/798817-puntapie-inicial-a-la-negociacion
Pagina 12,2025-01-23,"""Soy libertario, no libertarado""","En una entrevista con el editor jefe de Bloomberg News, John Micklethwait, en Davos, Javier Milei aseguró que la eliminación de los controles a la salida de capitales (vulgarmente llamado ""cepo"") se va a dar ""de todos modos, el tema es la velocidad, porque cuanto más financiamiento (en dólares) consigamos, más rápido vamos a salir"". ""Estamos comprometidos a eliminar los controles de capitales; nosotros creemos que el cepo es una herramienta de expropiación por parte del sector público. Pero yo soy liberal libertario,no soy liberal libertarado. Entonces nosotros determinamos cuáles son las condiciones para sacar el cepo"", advirtió el presidente de la Nación este miércoles.
Las tres condiciones a las que se refirió Milei están referidas a la inflación, a la base monetaria ""ampliada"" y, en tercer lugar, al financiamiento que consiga.
""Una condición es que la inflación inducida converja con la inflación observada. Ahora pasamos a uncrawling peg(tasa de devaluación mensual del dólar oficial) del uno por ciento. Si en tres meses se va dando que la inflación cae al 1,5 por ciento, quiere decir que se estaría convergiendo en materia inflacionaria y tendríamos que ya sacar elcrawling peg"". Si se toma literalmente los dichos del presidente, podría signficar que el dólar oficial quedaría a un precio fijo desde ese momento (tasa de devaluación cero), para inducir a la inflación a que converja a cero.
""Otra cosa que nosotros pusimos como condición es que la base monetaria observada coincida con la base monetaria amplia, de modo tal que cuando se abra el cepono haya una corrida. Y el tercer elemento, tiene que ver con la posibilidad de conseguir financiamiento"", completó Milei ante su entrevistador.
Si no hubiera financiamiento, aclaró, ""nosotros vamos a salir igual del cepo en algún momento, cuando logremos reconstituir el equilibrio de stocks en el Banco Central. La diferencia es que si nosotros conseguimos financiamiento, la salida es más rápida"".
Entre las alternativas de financiamiento, Milei sostuvo que puede ser tanto del FMI como de fuente privada. Con respecto a un préstamo de dicho organismo, señaló que ""la velocidad va a depender de cuánto sea el monto de esa de esa operación y cómo esté estructurada: es decir, no es lo mismo si recibo todo el dinerocashque si lo recibo en cuotas. Yo necesito calzar un flujo de fondos.Obvio: si hay fondos frescos"".
E hizo una aclaración que obliga a una reflexión adicional: ""Esos fondos nuevosno van a incrementar la deudatotal de Argentina, porque van a ser utilizados para cancelar deuda (del Tesoro nacional) que está en manos del Banco Central"". Las dos cuestiones relacionadas a esta afirmación de Milei ante el canal Bloomberg es si, por un lado, debe entenderse que si no hay incremento de deuda el presidente considerará que no está obligado a pedirautorización al Congreso Nacionalpara endeudarse. Y la otra, si habrá restricciones al uso de esos fondos (que incrementarían las Reservas líquidas) por parte del Banco Central, en un eventual nuevo acuerdo con el FMI.
Ante una pregunta del periodista del medio financiero sobre la posibilidad de abordar untratado de libre comercio con Estados Unidos,  Milei respondió: ""Nosotros estamos trabajando muy fuertemente en el tema"". Y en referencia a una probable contradicción con los compromisos del país como miembro del Mercosur, señaló que ""es más simple avanzar en reducir el arancel externo común pero, justamente, si pudiéramos avanzarde manera independientecada uno de los países, tener independencia para trabajar sobre acuerdos comerciales, sería mejor"".
Aseguró que, como actual presidente pro tempore del acuerdo regional, ya planteó la cuestión ante los demás integrantes: ""Argentina quiere recuperar su parte dorada de la historia, cuando era un actor importante en el mundo y para eso hay que avanzar en tratados de libre comercio, hay que abrir la economía y el Mercosur no puede constituir una traba a ello"".
Se refirió también a las políticas comerciales que anticipa el gobierno de Donald Trump y opinó que ""no es que él seaproteccionista, sino que sabe el rol que tiene Estados Unidos en el mundo y, consecuentemente, su política comercial es parte de su estrategia geopolítica. Sin lugar a dudas, los lineamientos que está planteando nos van a traer un mundo mucho mejor, seguro.""
Y en referencia a la relación con China, Milei hizo referencia a que tuvo “algunas reuniones muy positivas” con gente de la embajada china y con el presidente Xi Jinping, en las que “consideramos que somos economías complementarias y que tenemos mucho que hacer juntos. Songrandes socios comerciales”.",https://www.pagina12.com.ar/798802-soy-libertario-no-libertarado
