diario,fecha,titulo noticia,contenido,link
Pagina 12,2025-01-14,El Gobierno agita el fantasma de los cortes,"La Compañía Administradora del Mercado Mayorista Eléctrico (Cammesa) advirtió que debido a laola de calorque atraviesan esta semana varias zonas del países posible que se superen losrécordsde demanda y potencia, por lo que se analiza la posibilidad deimportar energía desde Chile, Uruguay, Bolivia o Brasil. En caso de que dichas operaciones fueran insuficientes, podría haber cortes de servicio.
Se trata de un capítulo más en la cadena de advertencias que lanzó el Gobierno a lo largo del año pasado, durante el cual también hubobrutales tarifazos y ganancias récord para todo el abanico de empresas del sector energético.Desde Casa Rosada se atajan diciendo que los problemas se arrastran de forma estructural. Según especialistas, también hay responsabilidades directas de esta gestión.
""La demanda tiene alta probabilidad de alcanzar o superar losrécordsvigentes de energía y potencia (597.7GWhy 29.653 MW)"", señaló Cammesa en un informe que envió a distribuidoras de todo el país. La empresa realizó esta proyección con ""los pronósticos disponibles que indican queentre el 11 y el 17 de enero se presentarán temperaturas máximas de 36°y mínimas de 25° en CABA, resultando medias entre 30° y 31°"" ysituaciones más exigentes aún en el centro y el Norte del país, alcanzando entre 32° y 34°"".
De acuerdo a las previsiones,la peor situación se espera para el jueves 16, cuando se estima unpico de demanda de 29.662 MWanticipando un nuevorécord por encima del máximo histórico de 29.653 MWdel 1 de febrero de 2024.
Los sistemas de transporte y distribución, en tanto, se encuentran funcionando en condiciones ""normales"", aclaró Cammesa. Sin embargo, ante la posible insuficiencia en términos de generaciónse prevé la posibilidad de importación de energíadesde Chile, Uruguay, Bolivia y Brasil, lo que dependerá de la disponibilidad que tenga cada uno de estos países. En caso de no lograr importar lo suficiente, anticipan,podrían generarse cortes de luz en algunas zonas, adelantó la Compañía.
A mediados de 2024, Cammesa había advertido que la generación de energía eléctrica en el verano podríaresultar insuficiente para satisfacer los picos de demanda, lo que podría derivar enposibles cortes en el servicio. ""De no contar con la importación considerada y agotando las reservas operativas, será necesario realizar cortes a la demanda"", decía la compañía en julio, que indicaba que entre diciembre y marzo de 2025 la demanda de potencia máxima sería entre 30.500 y 30.700 MW.
En septiembre pasado, el jefe de Gabinete, Guillermo Francos, y el (eyectado) secretario de Energía, Eduardo Rodríguez Chirillo, dijeron que dada la situación del sistema energético, habríacortes de luz programadosque iban aafectar a las industrias para poder ""alivianar la red"".
""Me parece que la insuficiencia de generación eléctrica se da en parte por la salida de Atucha II, por razones de mantenimiento. Además, la falta de lluvias hace que las hidroeléctricas produzcan menos. Sin embargo,no son temas que generen un déficit tan complicado como el que se viene anunciando desde mediados del 2024, sobre todo teniendo en cuenta queen enero hay mucha gente de vacaciones en el AMBA y la actividad industrial está en baja"", indicó a este diario Walter Martello, interventor del ENRE durante el gobierno anterior.
Martello agregó que ""la real crisis de energía tiene que ver con la disputa de los negocios, todos los planes de contingencia, los barcos turcos, las baterías. Por un lado, hay una fuerte disputa al interior del gobierno porquién tiene el control de los negocios de la energía. Esto hizo que se pierda mucho tiempo a la hora de tratar de resolver problemas. Entre otras cosas, se anularon los contratos de las dos centrales térmicas que se habían dejado listos en la gestión anterior"".
En tanto, Víctor Bronstein, Director Centro de Estudios de Energía, Política y Sociedad (CEEPYS), considera que ""es extraña la advertencia de Cammesa y en principio no tiene mucho sustento porque con la baja de la actividad industrial es difícil que haya problemas de generación. Y si los hay es culpa de queel gobierno suspendió la construcción de dos centrales térmicas que había licitado el gobierno anterior"".
""Los problemas en los últimos años fueron fundamentalmente de distribución y a veces de transporte.Mi hipótesis conspirativa es que como dieron un tarifazo tremendo, ahora tienen que disimular que los problemas en distribución y transporte siguen. Así le echan la culpa a la generación que son muchos actores, la gente no los conoce y zafan de echarle la culpa a Edesur y Edenor. También es importante decir que Milei suspendió también los contratos del AMBA 1 con los chinos que eran obras de transporte fundamentales para darle solidez al sistema en el conurbano y capital"", continúa Bronstein.
De acuerdo a Juan José Carbajales, titular de la consultora Paspartú, ""a raíz de factores asociados tanto a generación como a transporte y distribución,hoy el sistema se acerca a niveles de criticidad, por eso la advertencia de Cammesa. Este verano va a ser complejo y dependeremos de la temperatura media y del consumo domiciliario"".",https://www.pagina12.com.ar/796573-el-gobierno-agita-el-fantasma-de-los-cortes
Pagina 12,2025-01-14,El dólar se puso en modo verano,"En detalle, el índice S&P Merval registró una caída del 5,9 por ciento medido en dólares, con bajas en acciones de hasta 9,4 por ciento en el panel líder. Los bonos en dólares también sufrieron descensos generalizados, y el riesgo país volvió a rondar los 600 puntos. Esta situación ocurre a partir de la influencia negativa de Wall Street, una toma de ganancias de los inversores, y las dudas que generó el FMI sobre Argentina.
La bolsa porteña en pesos cayó 5,3 por ciento, mientras que medido en dólares bajó 5,9. Se trata de su mínimo nivele desde el 30 de diciembre. Las acciones que lideraron las bajas fueron Edenor (-9,4 por ciento), Loma Negra (-8,2 por ciento), Banco BBVA (-7,9 por ciento) y Transportadora de Gas del Sur (-7,6 por ciento).
Los bonos en dólares también cerraron con fuertes bajas generalizadas, destacándose el Global 2029 (-2,9 por ciento), seguido por el Bonar 2041 (-2,2 por ciento), el Global 2038 (-1,9 por ciento), y el Bonar 2038 (-1,4 por ciento). El riesgo país, medido por el índice JP Morgan, subió 9 unidades (+1,6 por ciento), ubicándose en 589 puntos básicos.
En las agencias de inversión recomentaron, más allá de la volatilidad, mirar de cerca los bonos largos como los Globales GD38, GD41 y GD46. “La parte media de la curva, particularmente GD35, GD38 y GD41, presenta oportunidades interesantes, con un potencial de suba de entre 13 y 14 por ciento en caso de que se comprima el riesgo país en 200 puntos básicos”, señalaron informes del mercado.
Se agregó que ""por el monto y por cómo están los precios de todos los activos, vemos que puede haber interés en ir más largo en la curva de esos instrumentos, sobre todo considerando que algunas obligaciones negociables se colocan a tasas más bajas”. Sin embargo, las dudas de los inversores empiezan a aparecer debido a la contexto global y las presiones con las reservas internacionales a nivel local.
En tanto, en el plano interno los inversores estarán atentos esta semana al dato de inflación de diciembre. El presidente Javier Milei anticipó que si la suba de precios se mantiene por debajo del 2,5 por ciento, el Banco Central comenzaría a reducir el ajuste del dólar oficial a 1 por ciento mensual, para que converja con la inflación del Índice de Precios al Consumidor (IPC).
El IPC de la Ciudad de Buenos Aires (CABA) se ubicó en 3,3 por ciento mensual en diciembre, una leve aceleración de 0,1 puntos respecto de noviembre. Según el Relevamiento de Expectativas del Mercado del BCRA, la inflación del último mes de 2024 será del 2,7 por ciento.
El mercado también está atento a cuál será el resultado de la primera licitación de deuda en pesos del año para el Tesoro, que podría dar nuevas señales para la tasa de interés. Y a los datos de actividad y fiscales que se publicarán en los próximos días. El Indec dará a conocer esta semana el informe sobre la Utilización de la capacidad instalada en la industria (UCII) de noviembre, el Índice del costo de la construcción (ICC), y el Sistema de índices de precios mayoristas (SIPM) de diciembre. Además, el Ministerio de Economía publicará el resultado fiscal de diciembre.",https://www.pagina12.com.ar/796636-el-dolar-se-puso-en-modo-verano
Pagina 12,2025-01-14,El crecimiento de Vaca Muerta en 2024,"Vaca Muerta cerró el 2024 con uncrecimiento del 20% en etapas de fractura y alcanzó 17,796 operaciones, según la consultora NCS Multistage, que anticipó que ""la eficiencia operativa y las nuevas inversiones podrían llevar al sector a un nuevo nivel en 2025, pese a desafíos estructurales y regulatorios"".
Según Luciano Fucello, country manager de NCS Multistage, diciembre pasado marcó un pico histórico con 1,227 etapas de fractura, llevando el total anual a 17,796, un 20% más que en 2023. El crecimiento de Vaca Muerta en 2024 ""consolida a la formación como el motor energético de Argentinay un jugador clave en el mercado internacional de hidrocarburos"", indicó.
En el desglose de inversiones por empresa, YPF se mantuvo como líder indiscutido, con 8.732 etapas acumuladas en el año. Sin embargo, el crecimiento de empresas como Tecpetrol (1,453 etapas) y VISTA (2,396 etapas) evidencia la diversificación y el dinamismo del sector. Empresas como PAE, Shell y Pluspetrol también dejaron su marca en esta expansión.
La contracara es lacuestión ambiental.La extracción mediante fractura hidráulica requiere grandes volúmenes de agua dulce que está siendo inyectadasin control ni tratamiento en pozos sumiderosy el manejo adecuado de residuos peligrosos que genera preocupación ante el aumento sostenido de la actividad.
""La Secretaría de Ambiente de la provincia del Neuquén no parece estar considerando la urgencia de políticas que permitan que se aumente la capacidad de tratamiento de los residuos peligrosos de la industria facilitando la llegada de nuevas empresas o la ampliación de la capacidad de las ya instaladas.La relación aumento de residuos y capacidad de tratamiento ha quedado desfasada desde hace bastante tiempo y parece seguir en aumento"", advierte el informe.",https://www.pagina12.com.ar/796580-el-crecimiento-de-vaca-muerta-en-2024
