diario,fecha,titulo noticia,contenido,link
Pagina 12,2025-03-28,Rebota la actividad económica,"La actividad económicacreció 6,5 por ciento interanual en eneroy 0,6 por ciento respecto a diciembre en la medición desestacionalizada, de acuerdo al  informe de Estimación Mensual de Actividad Económica (Emae) difundido este jueves por el Instituto Nacional de Estadísticas y Censos (Indec).
El dato resulta de la comparación con el segundo mes de gobierno de Javier Mileien la presidencia de la Nación, cuando los indicadores relacionados al sector se desplomaban por la devaluación de la moneda de más del 50 por ciento y la incertidumbre que provocaba la nueva gestión.
En 2024,durante los primeros 12 meses de la administración libertaria, la actividad económica se contrajo 1,8 por ciento.Según la medición del Emae, en enero 2025 repuntó 6,5 por ciento interanual y0,6 por ciento respecto a diciembre.
Sobre la comparación con igual mes del año anterior, entre lossegmentos que empujaron la variación al alzasobresalieron Intermediación financiera (+25,7 por ciento), Impuestos netos de subsidios (+13 por ciento) y Comercio mayorista, minorista y reparaciones (+11,3 por ciento). Tanto el rubro de las finanzas como de servicios llevan la delantera y lideran la recuperación económica.
Más abajo le siguieron Explotación de minas y canteras (+8,3 por ciento), Electricidad, gas y agua (+6,6 por ciento), Industria manufacturera (6 por ciento) y Actividades inmobiliarias, empresariales y de alquiler (3,9 por ciento).
Y finalmente, Transporte y comunicaciones (+3 por ciento), Construcción (+1,9 por ciento), Agricultura, ganadería, caza y silvicultura (+0,8 por ciento) y Enseñanza (+0,8 por ciento).
A contramano de las buenas noticias,los cinco rubros que registraron bajasen el período analizado son Pesca (-3,8 por ciento), Hoteles y restaurantes (-2,8 por ciento), Otras actividades de servicios comunitarios, sociales y personales (-2,6 por ciento) y Administración pública y defensa, planes de seguridad social de afiliación obligatoria (-1,7 por ciento).
El presidente celebró el dato en sus redes sociales: ""DOLOR INFINITO EN MANDRILANDIA. La economía subiendo muy fuerte...CIAO MANDRILES...!!!"".  Además, el mandatario compartió opiniones de economistas y de otras figuras con ironías como “la recesión más loca de la historia” y“la economía crece y lloran”.
El Emae se expandió en enero por tercer mes consecutivo. En diciembre de 2024 había crecido 6 por ciento en diciembre y en noviembre 0,7 por ciento. Sin embargo, a lo largo de todo el 2024 el indicador mostró una contracción de 1,8 por ciento.
Al respecto, elFondo Monetario Internacionalestimó un crecimiento de 5,5 por ciento para Argentina para este año.
En este contexto, según el Centro de Estudios de la Unión Industrial Argentina (UIA):
*El 42,3 por ciento de las industrias reporta caídas en la producción.
*El  44,8 por ciento registra bajas en ventas.
*Solo el 11,5 por ciento está ampliando su plantilla de trabajadores.
La principal preocupación del sector es elaumento de los costos de producción, principalmente el dólares, que collevan problemas de rentabilidad y competitividad en el marco de apertura importadora. Otro de los temas que mantienen en alerta al ambiente productivo y del trabajo es la contracción del mercado interno.
En relación al tema de las importaciones, la UIA advirtió que ""el sector industrial enfrenta un panorama desafiante sumado a una mayor competencia frente a la importación de bienes terminados. Se registra un aumento de la amenaza importadora y la pérdida de mercado frente a productos importados (China y Brasil como principales países de origen, pero también de otros países según la preocupación de algunos sectores). Frente al contexto de apreciación, en 2024 el 18% de las PyME sustituyó insumos locales por importados y un 7% reemplazó producción propia por importada"".",https://www.pagina12.com.ar/813927-rebota-la-actividad-economica
Pagina 12,2025-03-28,"El IVA, discriminado en las facturas","El Gobierno nacional dispuso la obligatoriedad de detallar el Impuesto al Valor Agregado (IVA) en todas las facturas de bienes y servicios a partir del 1° de abril.   Lo hizo a través de una disposición de la Agencia de Recaudación y Control Aduanero (ARCA) anunciada este jueves.   Según se informó, desde esa fecha, todos los vendedores de bienes y servicios debieron incluir en un apartado específico de sus tickets el monto correspondiente al IVA.   Esta medida, que se extiende a ""todo el universo de contribuyentes"", forma parte del cronograma dispuesto por ARCA para la implementación del régimen de transparencia fiscal.
Previamente, desde enero, esta obligación había estado vigente únicamente para las grandes empresas, no obstante, aquellos contribuyentes que emitían comprobantes mediante facturación electrónica utilizando sistemas del organismo como Facturador Móvil o Comprobantes en Línea, ya contaban con la opción de discriminar el IVA en sus comprobantes de compra.
Con la entrada en vigor de esta nueva disposición, ""la obligación se extendió a todo el universo de comercializadores de cualquier tipo de bien o servicio"".   De esta manera, los consumidores podrán visualizar de forma clara y transparente ""la presión fiscal que incide sobre el precio final de los productos"".   Se especificó que los comprobantes deberán mostrar en un apartado del ticket el desglose del IVA y los impuestos internos en el campo ""Otros impuestos nacionales indirectos"".   ARCA aclaró que ""el consumidor final no debe hacer ninguna operación"".
Se indicó que en la factura o ticket de compra se debe leer la leyenda ""Régimen de Transparencia Fiscal al Consumidor Ley 27.743), donde estarán discriminados los impuestos anteriormente detallados"".",https://www.pagina12.com.ar/813939-el-iva-discriminado-en-las-facturas
Pagina 12,2025-03-28,"""Se lo fuman en seis meses""","La expresidenta Cristina Kirchner advirtió que el gobierno de Javier Milei se va a “fumar de acá a las elecciones de este año” los 20 mil millones de dólares que negocia con el Fondo Monetario Internacional (FMI) y calificó al ministro de Economía, Luis Caputo, como “denominador común” de la deuda argentina. El presidente Milei le respondió diciendo que “Cristina Kirchner está nerviosa porque sabe que va a ir presa, entonces ahora quema las naves”. Pero el que parece estar nervioso es el gobierno en medio de una escalada de las expectativas de devaluación.
A través de una nueva edición de los denominados posteos “Che Milei”, CFK acusó al presidente Milei de “mentiroso” por haberse contradicho en sus promesas de campaña de no endeudarse y cerrar el Banco Central, y puso en duda su mote de “experto en crecimiento con dinero o sin dinero”.
“Se ve que tuexpertisesin dólares no camina”, ironizó la exmandataria. “¿Me podés explicar cómo es que el Fondo Monetario le dio 45 mil millones de dólares a Macri en el 2018, de los que los argentinos no vieron nada, y ahora te va a dar a vos 20 mil millones de dólares más, de los que los argentinos tampoco van a ver nada?”
Cristina Kirchner puntualizó que el nuevo endeudamiento en ciernes tiene una estrecha vinculación con el que tomó Mauricio Macri: “Ustedes recibieron 65 mil millones de dólares, que Macri se los patinó en un año y medio de gobierno y vos te los vas fumar de acá a las elecciones de este año, y los chorros somos nosotros, que en lugar de pedirle dólares le pagamos toda la deuda!”
También cuestionó al titular del Palacio de Hacienda, a quien calificó como “gran patinador serial de dólares ajenos”. ""¿Cuál es el denominador común de los 65 mil millones de dólares del FMI?”, preguntó la exmandataria y respondió: “Toto Caputo, el gran patinador serial de dólares ajenos que van a terminar pagando todos los argentinos, sus hijos, y los hijos de sus hijos”, escribió la titular del principal partido de oposición.",https://www.pagina12.com.ar/814040-se-lo-fuman-en-seis-meses
Pagina 12,2025-03-28,El que se quemó con dólares ve un Caputo y llora,"En una jornada que se preveía caliente, Luis Caputo intentó anticiparse a la apertura del mercado con un mensaje optimista: antes de las 10 de la mañana de este jueves, anunció que el acuerdo que se negociaba con el FMI suponía un desembolso de 20.000 millones de dólares. Los que, además, sumados a otros préstamos en trámite con otros organismos financieros internacionales por 5000 millones, equivaldrían a un respaldo extra para las reservas internacionales de 25.000 millones. Indicó que, sumado este aporte al nivel actual de reservas, las llevaría a 50.000 millones de dólares. ""Con esto vamos a terminar con el stress del dólar en la Argentina"", aseguró el ministro en tono celebratorio. Pero la extraña alquimia que describió Caputo para multiplicar por dos las reservas en pocos días, quedó rápidamente descalificada, y nada menos que por el propio FMI.
Su vocera, Julie Kozack, apenas un par de horas después de los dichos de Caputo, en conferencia de prensa informó desde Washington que la cifra total del acuerdo aún no estaba definida y que, además, los desembolsos serían en etapas ""a lo largo de programa"", que tendrá una duración de diez años. Conclusión: Caputo no recibirá 20.000 millones ""en unos días"" como él dijo. El intento del ministro sirvió de poco y no logró detener, ni siquiera durante la jornada, la sangría de dólares (pérdida de reservas) que viene sufriendo el Banco Central desde el 14 de marzo en forma ininterrumpida. s.
El falaz razonamiento del ministro consiste en sumar como fondos disponibles, el total del crédito que le otorgaría el FMI, incluso la parte que deberá aplicar al pago de los vencimientos de la deuda anterior con el propio Fondo entre 2026 y 2029. Eso suman unos 14 mil millones, que seguramente recibirá apenas semanas antes de cada vencimiento. No se sumarán a las reservas, aunque aliviarán a éstas de hacer frente a tales vencimientos.
Quedarán otros 6000 millones del préstamo del FMI, que tampoco está claro que ingresen de inmediato una vez firmado el acuerdo. Su vocera indicó ayer que ese punto está por verse. Y por otra parte, los créditos para respaldo de reservas que le otorgaría el BID, la CAF y el Banco Mundial, difícilmente puedan concretarse en pocos días. Todo lo cual convierte la proyección de llevar las reservas internacionales del Banco Central ""en unos días"" en una falacia para calmar al mercado, que no le rindió.
A pesar de ello, el presidente Javier Milei trató de respaldar al titular del Palacio de Hacienda, asegurando que con semejante nivel de reservas que conseguiría, quedaría descartada la necesidad de devaluar.
“Hablar del tipo de cambio es irrelevante, porque voy a tener tantos dólares que respaldan la base monetaria, que me podrían sacar toda la base monetaria al tipo de cambio oficial y me sobrarían US$24.000 millones”, sostuvo en una entrevista este jueves, en la que además aseguró que no piensa en devaluar, porque ""lo que faltarán en la Argentina serán pesos y no dólares"".
En su intervención en un seminario en la Bolsa de Comercio, Luis Caputo aseguró que había conversado el miércoles con Kristalina Georgieva, directora gerente del FMI, con quien acordó dar a conocer la cifra el acuerdo que se negocia, ""porque aún restan varios pasos  burocráticos que pueden demandar varias semanas"" para que se firme.
""Sumando BID, BM y CAF vamos a estar en torno a los 50.000 millones de dólares de reservas brutas. La base monetaria es de 25.000 millones al dólar oficial y al cambio libre es de 20.000 millones. Entonces, vamos a tener más del doble de reservas que de base monetaria"", fue la insólita explicación que dio Caputo para convencer sobre la solidez del programa que se negocia.
Argumento que reforzó afirmando: ""El nivel de respaldo que en unos días tendrán los pasivos del Banco Central no lo hemos tenido nunca. Ni siquiera en la convertibilidad y además con superávit fiscal (...). Con esto vamos a terminar con el estrés del dólar en la Argentina, porque no vamos a volver al déficit fiscal"".
Bajo esta misma lógica, fue que Milei refirió que hablar hoy del tipo de cambio ""es irrelevante"", no hay razones para devaluar. ¿El mensaje es que el que apuesta al dólar pierde?
Tanto Milei como Caputo apuntaron, en sus intervenciones públicas, a culpar a la oposición de querer desestabilizar al Gobierno. ""Cuando veo hablar de corrida cambiaria o crisis me sorprendo. Desde que nosotros llegamos en 14 meses el tipo de cambio se movió 15%. Me parece un poco raro que sea una corrida"", indicó el ministro. Enfatizó que ""hay una intención de desestabilizar al Gobierno de Milei. Hay una necesidad y urgencia de desestabilizar. La oposición lo hace organizando cosas como lo que hicieron en las últimas dos semanas"", dijo, atribuyendo a una organización siniestra la secuencia de marchas por los jubilados, la resistencia a tratar el DNU que pretendió habilitar el nuevo préstamo del FMI, la carta a las autoridades del Fondo descalificando la legalidad del nuevo acuerdo. ""Y el cuarto punto, es lo que se dice sobre lo que está pasando"", se quejó el ministro.
El Fondo Monetario Internacional aclaró que los fondos que incluirá el nuevo acuerdo con la Argentina serán desembolsados en etapas y evitó precisar la cifra total. ""El tamaño del paquete será determinado en última instancia por nuestro Directorio"", indicó la vocera Julie Kozack durante su conferencia de prensa.
La portavoz señaló que ""las discusiones sobre un nuevo programa apoyado por el FMI están muy avanzadas y esto incluye conversaciones por un monto considerable"", afirmó Kozack eludiendo la respuesta sobre la cifra de 20.000 millones de dolares que anunció Caputo. Según Kozack, los desembolsos serán en etapas ""a lo largo de programa"" y los montos y los plazos aún son materia de discusión.
Un último episodio también pareció parte de la conjura contra Caputo: Federico Sturzeneggersubió en sus redes sociales una foto de él y la titular del FMI, Kristalina Georgieva, en una reunión del Consejo Asesor sobre Emprendimiento y Crecimiento del FMI, mostrándose dispuesto a jugar otro rol si se le diera la oportunidad.Página/12ya informó acerca de trascendidos que indican que Sturzenegger rompió el pacto de caballeros con Caputo y comenzó a dejar correr sus recomendaciones sobre economía en el despacho presidencial. En medio de la sangría de divisas del Banco Central para frenar el dólar la suba del dólar, el ministro desregulador le pidió al presidente Javier Milei""levantar el cepo ya""para frenar la pérdida de reservas. ""Es un riesgo que no podemos tomar hoy"", le respondió Milei, que por ahora mantiene al ""Messi de las finanzas"" en el cargo.
""El Consejo reúne a un grupo de destacados pensadores y profesionales de los negocios, las finanzas, el mundo académico y la formulación de políticas para compartir sus puntos de vista"", dice el sugerente texto que acompaña la foto que publicó Sturzenegger en sus redes.





",https://www.pagina12.com.ar/814031-caputo-el-que-apueste-al-estres-del-dolar-pierde
